
T:  Bus=01 Lev=00 Prnt=00 Port=00 Cnt=00 Dev#=  1 Spd=12   MxCh=12
D:  Ver= 1.10 Cls=09(hub  ) Sub=00 Prot=00 MxPS=64 #Cfgs=  1
P:  Vendor=1d6b ProdID=0001 Rev=06.17
S:  Manufacturer=Linux 6.17.0-20-generic ohci_hcd
S:  Product=OHCI PCI host controller
S:  SerialNumber=0000:00:06.0
C:  #Ifs= 1 Cfg#= 1 Atr=e0 MxPwr=0mA
I:  If#= 0 Alt= 0 #EPs= 1 Cls=09(hub  ) Sub=00 Prot=00 Driver=hub
E:  Ad=81(I) Atr=03(Int.) MxPS=   2 Ivl=255ms

T:  Bus=01 Lev=01 Prnt=01 Port=00 Cnt=01 Dev#=  2 Spd=12   MxCh= 0
D:  Ver= 1.10 Cls=00(>ifc ) Sub=00 Prot=00 MxPS= 8 #Cfgs=  1
P:  Vendor=80ee ProdID=0021 Rev=01.00
S:  Manufacturer=VirtualBox
S:  Product=USB Tablet
C:  #Ifs= 1 Cfg#= 1 Atr=80 MxPwr=100mA
I:  If#= 0 Alt= 0 #EPs= 1 Cls=03(HID  ) Sub=00 Prot=00 Driver=usbhid
E:  Ad=81(I) Atr=03(Int.) MxPS=   8 Ivl=10ms

T:  Bus=01 Lev=01 Prnt=02 Port=01 Cnt=01 Dev#=  3 Spd=12   MxCh= 0
D:  Ver= 1.10 Cls=00(>ifc ) Sub=00 Prot=00 MxPS=64 #Cfgs=  1
P:  Vendor=057e ProdID=2009 Rev=01.43
S:  Product=Pro Controller
C:  #Ifs= 1 Cfg#= 1 Atr=80 MxPwr=500mA
I:  If#= 0 Alt= 0 #EPs= 2 Cls=03(HID  ) Sub=00 Prot=00 Driver=usbhid
E:  Ad=02(O) Atr=03(Int.) MxPS=  64 Ivl=10ms
E:  Ad=82(I) Atr=03(Int.) MxPS=  64 Ivl=10ms

T:  Bus=02 Lev=00 Prnt=00 Port=00 Cnt=00 Dev#=  1 Spd=480  MxCh=12
D:  Ver= 2.00 Cls=09(hub  ) Sub=00 Prot=00 MxPS=64 #Cfgs=  1
P:  Vendor=1d6b ProdID=0002 Rev=06.17
S:  Manufacturer=Linux 6.17.0-20-generic ehci_hcd
S:  Product=EHCI Host Controller
S:  SerialNumber=0000:00:0b.0
C:  #Ifs= 1 Cfg#= 1 Atr=e0 MxPwr=0mA
I:  If#= 0 Alt= 0 #EPs= 1 Cls=09(hub  ) Sub=00 Prot=00 Driver=hub
E:  Ad=81(I) Atr=03(Int.) MxPS=   4 Ivl=256ms
