ffff89f7af1bd000 3622240787 C Ii:1:004:2 0:8 64 = 30ee8000 80000008 80000880 0c230798 fe180d00 00e6ff01 00220796 fe180d00
ffff89f7af1bd000 3622240826 S Ii:1:004:2 -115:8 64 <
ffff89f7af1bd000 3622263458 C Ii:1:004:2 0:8 64 = 30f18000 80000008 80000880 0c160797 fe140dff ffe6ff02 001d0798 fe160dff
ffff89f7af1bd000 3622263498 S Ii:1:004:2 -115:8 64 <
ffff89f7af1bd000 3622279381 C Ii:1:004:2 0:8 64 = 30f68000 80000008 80000880 0c3f078f fe1b0dfe ffe5ff00 00360793 fe1f0dff
ffff89f7af1bd000 3622279427 S Ii:1:004:2 -115:8 64 <
ffff89f7af1bd000 3622289086 C Ii:1:004:2 0:8 64 = 30f98000 80000008 80000880 0c240798 fe130dfd ffe9ff02 00300791 fe140dfd
ffff89f7af1bd000 3622289131 S Ii:1:004:2 -115:8 64 <
ffff89f7af1bd000 3622314137 C Ii:1:004:2 0:8 64 = 30fb8000 80000008 80000880 0c16079d fe120dfe ffe9ff04 00240798 fe130dfd
ffff89f7af1bd000 3622314182 S Ii:1:004:2 -115:8 64 <
ffff89f7af1bd000 3622321235 C Ii:1:004:2 0:8 64 = 30008000 80000008 80000880 0c310788 fe170d02 00e7ff02 00310788 fe170d02
ffff89f7af1bd000 3622321272 S Ii:1:004:2 -115:8 64 <
ffff89f7af1bd000 3622343410 C Ii:1:004:2 0:8 64 = 30018000 80000008 80000880 0c33078a fe1b0d01 00e8ff01 00310788 fe170d02
ffff89f7af1bd000 3622343451 S Ii:1:004:2 -115:8 64 <
ffff89f7af1bd000 3622359467 C Ii:1:004:2 0:8 64 = 30068000 80000008 80000880 0c1c07a2 fe1e0dff ffe8ff02 001a07a1 fe230dfe
ffff89f7af1bd000 3622359514 S Ii:1:004:2 -115:8 64 <
ffff89f7af1bd000 3622368358 C Ii:1:004:2 0:8 64 = 30098000 80000008 80000880 0c25078c fe150dff ffe8ff01 00220794 fe160dff
ffff89f7af1bd000 3622368394 S Ii:1:004:2 -115:8 64 <
ffff89f7af1bd000 3622394434 C Ii:1:004:2 0:8 64 = 300b8000 80000008 80000880 0c1e078d fe1b0dff ffe8ff01 0025078c fe150dff
ffff89f7af1bd000 3622394494 S Ii:1:004:2 -115:8 64 <
ffff89f7af1bd000 3622407303 C Ii:1:004:2 0:8 64 = 30108000 80000008 80000880 0c1c0794 fe1f0dff ffe7ff01 001c0794 fe1f0dff
ffff89f7af1bd000 3622407344 S Ii:1:004:2 -115:8 64 <
ffff89f7af1bd000 3622423374 C Ii:1:004:2 0:8 64 = 30138000 80000008 80000880 0c2c077d fe0c0dfe ffe8ff01 00280784 fe160dff
ffff89f7af1bd000 3622423421 S Ii:1:004:2 -115:8 64 <
ffff89f7af1bd000 3622439511 C Ii:1:004:2 0:8 64 = 30168000 80000008 80000880 0c1e078f fe120dff ffe6ff02 00260782 fe0b0dfe
ffff89f7af1bd000 3622439551 S Ii:1:004:2 -115:8 64 <
ffff89f7af1bd000 3622455494 C Ii:1:004:2 0:8 64 = 30198000 80000008 80000880 0c2b0794 fe1d0dff ffe6ff02 00200796 fe1a0d00
ffff89f7af1bd000 3622455542 S Ii:1:004:2 -115:8 64 <
ffff89f7af1bd000 3622471308 C Ii:1:004:2 0:8 64 = 301c8000 80000008 80000880 0c2b078b fe110dfe ffe8ff00 0030078d fe160dfe
ffff89f7af1bd000 3622471355 S Ii:1:004:2 -115:8 64 <
ffff89f7af1bd000 3622479397 C Ii:1:004:2 0:8 64 = 30208000 80000008 80000880 0c1b0799 fe180dff ffe7ff01 001b0799 fe180dff
ffff89f7af1bd000 3622479439 S Ii:1:004:2 -115:8 64 <
ffff89f7af1bd000 3622495389 C Ii:1:004:2 0:8 64 = 30218000 80000008 80000880 0c20079e fe1b0dff ffe7ff01 001b0799 fe180dff
ffff89f7af1bd000 3622495442 S Ii:1:004:2 -115:8 64 <
ffff89f7af1bd000 3622512719 C Ii:1:004:2 0:8 64 = 30248000 80000008 80000880 0c2d0795 fe170dff ffe5ff02 00270799 fe180d00
ffff89f7af1bd000 3622512772 S Ii:1:004:2 -115:8 64 <
ffff89f7af1bd000 3622535360 C Ii:1:004:2 0:8 64 = 30288000 80000008 80000880 0c200794 fe1a0dfd ffe6ff02 00200794 fe1a0dfd
ffff89f7af1bd000 3622535402 S Ii:1:004:2 -115:8 64 <
ffff89f7af1bd000 3622554245 C Ii:1:004:2 0:8 64 = 302c8000 80000008 80000880 0c270789 fe160dff ffe7ff01 0022078e fe170dff
ffff89f7af1bd000 3622554292 S Ii:1:004:2 -115:8 64 <
ffff89f7af1bd000 3622567402 C Ii:1:004:2 0:8 64 = 30308000 80000008 80000880 0c270791 fe1d0dfe ffe8ff01 00270791 fe1d0dfe
ffff89f7af1bd000 3622567443 S Ii:1:004:2 -115:8 64 <
ffff89f7af1bd000 3622583524 C Ii:1:004:2 0:8 64 = 30338000 80000008 80000880 0c260797 fe1a0dfe ffe6ff02 00260797 fe1d0dfe
ffff89f7af1bd000 3622583564 S Ii:1:004:2 -115:8 64 <
ffff89f7af1bd000 3622599496 C Ii:1:004:2 0:8 64 = 30368000 80000008 80000880 0c2b0793 fe140dfe ffe8ff02 00290793 fe150dfe
ffff89f7af1bd000 3622599553 S Ii:1:004:2 -115:8 64 <
ffff89f7af1bd000 3622615369 C Ii:1:004:2 0:8 64 = 30398000 80000008 80000880 0c1d079c fe190dff ffe7ff01 00240796 fe140dff
ffff89f7af1bd000 3622615412 S Ii:1:004:2 -115:8 64 <
ffff89f7af1bd000 3622631361 C Ii:1:004:2 0:8 64 = 303c8000 80000008 80000880 0c24079b fe1b0dff ffe7ff00 001e079f fe1c0dff
ffff89f7af1bd000 3622631405 S Ii:1:004:2 -115:8 64 <
ffff89f7af1bd000 3622647517 C Ii:1:004:2 0:8 64 = 30408000 80000008 80000880 0c200790 fe110dff ffe8ff01 00200790 fe110dff
ffff89f7af1bd000 3622647553 S Ii:1:004:2 -115:8 64 <
ffff89f7af1bd000 3622663380 C Ii:1:004:2 0:8 64 = 30438000 80000008 80000880 0c160790 fe160dff ffe8ff02 0019078f fe130dff
ffff89f7af1bd000 3622663427 S Ii:1:004:2 -115:8 64 <
ffff89f7af1bd000 3622681290 C Ii:1:004:2 0:8 64 = 30468000 80000008 80000880 0c1f078c fe1b0dff ffe6ff01 0019078e fe190dff
ffff89f7af1bd000 3622681338 S Ii:1:004:2 -115:8 64 <
ffff89f7af1bd000 3622695427 C Ii:1:004:2 0:8 64 = 30498000 80000008 80000880 0c26078e fe1c0d00 00e7ff01 0026078c fe1d0dff
ffff89f7af1bd000 3622695473 S Ii:1:004:2 -115:8 64 <
ffff89f7af1bd000 3622714125 C Ii:1:004:2 0:8 64 = 304c8000 80000008 80000880 0c210794 fe1a0d00 00e7ff02 00230790 fe1a0d00
ffff89f7af1bd000 3622714167 S Ii:1:004:2 -115:8 64 <
ffff89f7af1bd000 3622727360 C Ii:1:004:2 0:8 64 = 30508000 80000008 80000880 0c250799 fe130dfe ffe7ff02 00250799 fe130dfe
ffff89f7af1bd000 3622727403 S Ii:1:004:2 -115:8 64 <
ffff89f7af1bd000 3622744247 C Ii:1:004:2 0:8 64 = 30538000 80000008 80000880 0c28079c fe120dff ffe8ff02 0028079a fe100dfe
ffff89f7af1bd000 3622744297 S Ii:1:004:2 -115:8 64 <
ffff89f7af1bd000 3622760887 C Ii:1:004:2 0:8 64 = 30568000 80000008 80000880 0c25079d fe190dff ffe7ff01 0026079e fe170d00
ffff89f7af1bd000 3622760935 S Ii:1:004:2 -115:8 64 <
ffff89f7af1bd000 3622776415 C Ii:1:004:2 0:8 64 = 30598000 80000008 80000880 0c250794 fe190dfd ffe7ff02 00250798 fe1a0dfe
ffff89f7af1bd000 3622776454 S Ii:1:004:2 -115:8 64 <
ffff89f7af1bd000 3622793004 C Ii:1:004:2 0:8 64 = 305c8000 80000008 80000880 0c1d0790 fe190dfd ffe7ff01 00210791 fe190dfd
ffff89f7af1bd000 3622793061 S Ii:1:004:2 -115:8 64 <
ffff89f7af1bd000 3622807476 C Ii:1:004:2 0:8 64 = 30608000 80000008 80000880 0c1b078d fe1a0dff ffe8ff01 001b078d fe1a0dff
ffff89f7af1bd000 3622807522 S Ii:1:004:2 -115:8 64 <
ffff89f7af1bd000 3622823971 C Ii:1:004:2 0:8 64 = 30638000 80000008 80000880 0c22078a fe190dff ffe6ff02 001e078b fe1b0dff
ffff89f7af1bd000 3622824019 S Ii:1:004:2 -115:8 64 <
ffff89f7af1bd000 3622839332 C Ii:1:004:2 0:8 64 = 30668000 80000008 80000880 0c24078f fe140dfe ffe7ff01 0024078c fe160dfe
ffff89f7af1bd000 3622839375 S Ii:1:004:2 -115:8 64 <
ffff89f7af1bd000 3622855311 C Ii:1:004:2 0:8 64 = 30698000 80000008 80000880 0c250795 fe150dfe ffe7ff02 00250792 fe140dfe
ffff89f7af1bd000 3622855354 S Ii:1:004:2 -115:8 64 <
ffff89f7af1bd000 3622872762 C Ii:1:004:2 0:8 64 = 306c8000 80000008 80000880 0c2a079a fe190dfe ffe8ff00 00270798 fe180dfe
ffff89f7af1bd000 3622872808 S Ii:1:004:2 -115:8 64 <
ffff89f7af1bd000 3622888349 C Ii:1:004:2 0:8 64 = 30708000 80000008 80000880 0c260797 fe150dff ffe6ff00 00260797 fe150dff
ffff89f7af1bd000 3622888399 S Ii:1:004:2 -115:8 64 <
ffff89f7af1bd000 3622903498 C Ii:1:004:2 0:8 64 = 30738000 80000008 80000880 0c210793 fe150dff ffe7ff02 00230795 fe130dff
ffff89f7af1bd000 3622903540 S Ii:1:004:2 -115:8 64 <
ffff89f7af1bd000 3622919396 C Ii:1:004:2 0:8 64 = 30768000 80000008 80000880 0c1f0791 fe1d0dfe ffe6ff02 00200792 fe1a0dff
ffff89f7af1bd000 3622919454 S Ii:1:004:2 -115:8 64 <
ffff89f7af1bd000 3622935281 C Ii:1:004:2 0:8 64 = 30798000 80000008 80000880 0c20078a fe1c0dfd ffe8ff01 0020078d fe1e0dfd
ffff89f7af1bd000 3622935329 S Ii:1:004:2 -115:8 64 <
ffff89f7af1bd000 3622954063 C Ii:1:004:2 0:8 64 = 307c8000 80000008 80000880 0c20078c fe140dff ffe6ff03 0021078a fe170dfe
ffff89f7af1bd000 3622954121 S Ii:1:004:2 -115:8 64 <
ffff89f7af1bd000 3622968941 C Ii:1:004:2 0:8 64 = 30808000 80000008 80000880 0c220794 fe160dff ffe4ff02 00220794 fe160dff
ffff89f7af1bd000 3622968987 S Ii:1:004:2 -115:8 64 <
ffff89f7af1bd000 3622983412 C Ii:1:004:2 0:8 64 = 30838000 80000008 80000880 0c260797 fe160dfe ffe7ff01 00240796 fe170dff
ffff89f7af1bd000 3622983451 S Ii:1:004:2 -115:8 64 <
ffff89f7af1bd000 3622999388 C Ii:1:004:2 0:8 64 = 30868000 80000008 80000880 0c290797 fe170dff ffe6ff01 00270797 fe160dfe
ffff89f7af1bd000 3622999432 S Ii:1:004:2 -115:8 64 <
ffff89f7af1bd000 3623015259 C Ii:1:004:2 0:8 64 = 30898000 80000008 80000880 0c270795 fe170d00 00e7ff02 00290795 fe170d00
ffff89f7af1bd000 3623015298 S Ii:1:004:2 -115:8 64 <
ffff89f7af1bd000 3623032817 C Ii:1:004:2 0:8 64 = 308c8000 80000008 80000880 0c240792 fe160dff ffe7ff01 00250794 fe170dff
ffff89f7af1bd000 3623032871 S Ii:1:004:2 -115:8 64 <
ffff89f7af1bd000 3623047348 C Ii:1:004:2 0:8 64 = 30908000 80000008 80000880 0c250791 fe190d00 00e8ff01 00250791 fe190d00
ffff89f7af1bd000 3623047386 S Ii:1:004:2 -115:8 64 <
ffff89f7af1bd000 3623064215 C Ii:1:004:2 0:8 64 = 30938000 80000008 80000880 0c240793 fe1a0dff ffe7ff01 00250793 fe1b0d00
ffff89f7af1bd000 3623064257 S Ii:1:004:2 -115:8 64 <
ffff89f7af1bd000 3623079325 C Ii:1:004:2 0:8 64 = 30968000 80000008 80000880 0c20078d fe160dff ffe7ff03 00220790 fe180dff
ffff89f7af1bd000 3623079365 S Ii:1:004:2 -115:8 64 <
ffff89f7af1bd000 3623095396 C Ii:1:004:2 0:8 64 = 30998000 80000008 80000880 0c230790 fe150dff ffe6ff01 0021078d fe140dff
ffff89f7af1bd000 3623095441 S Ii:1:004:2 -115:8 64 <
ffff89f7af1bd000 3623111384 C Ii:1:004:2 0:8 64 = 309c8000 80000008 80000880 0c270797 fe170dff ffe7ff01 00250795 fe170dff
ffff89f7af1bd000 3623111421 S Ii:1:004:2 -115:8 64 <
ffff89f7af1bd000 3623129255 C Ii:1:004:2 0:8 64 = 30a08000 80000008 80000880 0c250796 fe170dff ffe7ff03 00250796 fe170dff
ffff89f7af1bd000 3623129296 S Ii:1:004:2 -115:8 64 <
ffff89f7af1bd000 3623143449 C Ii:1:004:2 0:8 64 = 30a38000 80000008 80000880 0c250792 fe1b0dfe ffe6ffff ff230793 fe190dff
ffff89f7af1bd000 3623143493 S Ii:1:004:2 -115:8 64 <
ffff89f7af1bd000 3623161150 C Ii:1:004:2 0:8 64 = 30a68000 80000008 80000880 0c230790 fe1b0dfe ffe8ff01 00250790 fe1b0dfe
ffff89f7af1bd000 3623161203 S Ii:1:004:2 -115:8 64 <
ffff89f7af1bd000 3623183371 C Ii:1:004:2 0:8 64 = 30a98000 80000008 80000880 0c230790 fe180dff ffe7ff03 00230790 fe190dfe
ffff89f7af1bd000 3623183419 S Ii:1:004:2 -115:8 64 <
ffff89f7af1bd000 3623199283 C Ii:1:004:2 0:8 64 = 30ae8000 80000008 80000880 0c260794 fe180dff ffe7ff02 00250792 fe180dff
ffff89f7af1bd000 3623199326 S Ii:1:004:2 -115:8 64 <
ffff89f7af1bd000 3623217968 C Ii:1:004:2 0:8 64 = 30b18000 80000008 80000880 0c240794 fe170d00 00e7ff01 00250795 fe180dff
ffff89f7af1bd000 3623218024 S Ii:1:004:2 -115:8 64 <
ffff89f7af1bd000 3623233430 C Ii:1:004:2 0:8 64 = 30b48000 80000008 80000880 0c270794 fe140d00 00e7ff03 00250794 fe150d00
ffff89f7af1bd000 3623233477 S Ii:1:004:2 -115:8 64 <
ffff89f7af1bd000 3623249461 C Ii:1:004:2 0:8 64 = 30b88000 80000008 80000880 0c260794 fe170d00 00e7ff02 00260794 fe170d00
ffff89f7af1bd000 3623249500 S Ii:1:004:2 -115:8 64 <
ffff89f7af1bd000 3623264327 C Ii:1:004:2 0:8 64 = 30bb8000 80000008 80000880 0c270792 fe1b0d00 00e7ff01 00270792 fe1a0d00
ffff89f7af1bd000 3623264372 S Ii:1:004:2 -115:8 64 <
ffff89f7af1bd000 3623280731 C Ii:1:004:2 0:8 64 = 30be8000 80000008 80000880 0c230790 fe190dff ffe7ff01 00250790 fe1a0d00
ffff89f7af1bd000 3623280777 S Ii:1:004:2 -115:8 64 <
ffff89f7af1bd000 3623297291 C Ii:1:004:2 0:8 64 = 30c18000 80000008 80000880 0c200790 fe1a0dfe ffe6ff02 00210790 fe1a0dff
ffff89f7af1bd000 3623297337 S Ii:1:004:2 -115:8 64 <
ffff89f7af1bd000 3623311439 C Ii:1:004:2 0:8 64 = 30c48000 80000008 80000880 0c200793 fe140dff ffe6ff02 00200791 fe170dfe
ffff89f7af1bd000 3623311505 S Ii:1:004:2 -115:8 64 <
ffff89f7af1bd000 3623327279 C Ii:1:004:2 0:8 64 = 30c88000 80000008 80000880 0c260795 fe150d00 00e7ff01 00260795 fe150d00
ffff89f7af1bd000 3623327321 S Ii:1:004:2 -115:8 64 <
ffff89f7af1bd000 3623344223 C Ii:1:004:2 0:8 64 = 30cb8000 80000008 80000880 0c250794 fe150dff ffe8ff02 00270794 fe150d00
ffff89f7af1bd000 3623344270 S Ii:1:004:2 -115:8 64 <
ffff89f7af1bd000 3623361572 C Ii:1:004:2 0:8 64 = 30ce8000 80000008 80000880 0c220796 fe190dff ffe7ff02 00220795 fe160dff
ffff89f7af1bd000 3623361614 S Ii:1:004:2 -115:8 64 <
ffff89f7af1bd000 3623375357 C Ii:1:004:2 0:8 64 = 30d18000 80000008 80000880 0c240794 fe1a0dff ffe7ff01 00230796 fe1a0d00
ffff89f7af1bd000 3623375414 S Ii:1:004:2 -115:8 64 <
ffff89f7af1bd000 3623399393 C Ii:1:004:2 0:8 64 = 30d48000 80000008 80000880 0c230791 fe1b0dfe ffe8ff01 00250791 fe1a0dfe
ffff89f7af1bd000 3623399436 S Ii:1:004:2 -115:8 64 <
ffff89f7af1bd000 3623417072 C Ii:1:004:2 0:8 64 = 30d98000 80000008 80000880 0c230793 fe160d00 00e6ff01 00220793 fe170dff
ffff89f7af1bd000 3623417115 S Ii:1:004:2 -115:8 64 <
ffff89f7af1bd000 3623431325 C Ii:1:004:2 0:8 64 = 30dc8000 80000008 80000880 0c220793 fe180dff ffe8ff01 00230792 fe170dff
ffff89f7af1bd000 3623431367 S Ii:1:004:2 -115:8 64 <
ffff89f7af1bd000 3623439400 C Ii:1:004:2 0:8 64 = 30e08000 80000008 80000880 0c220795 fe160dff ffe7ff02 00220795 fe160dff
ffff89f7af1bd000 3623439465 S Ii:1:004:2 -115:8 64 <
ffff89f7af1bd000 3623456995 C Ii:1:004:2 0:8 64 = 30e18000 80000008 80000880 0c240795 fe150dff ffe8ff02 00220795 fe160dff
ffff89f7af1bd000 3623457036 S Ii:1:004:2 -115:8 64 <
ffff89f7af1bd000 3623479501 C Ii:1:004:2 0:8 64 = 30e48000 80000008 80000880 0c230793 fe160d00 00e7ff02 00250793 fe130dff
ffff89f7af1bd000 3623479549 S Ii:1:004:2 -115:8 64 <
ffff89f7af1bd000 3623495327 C Ii:1:004:2 0:8 64 = 30e98000 80000008 80000880 0c250795 fe1a0dff ffe9ff02 00230796 fe1a0d00
ffff89f7af1bd000 3623495373 S Ii:1:004:2 -115:8 64 <
ffff89f7af1bd000 3623511260 C Ii:1:004:2 0:8 64 = 30ec8000 80000008 80000880 0c250790 fe180dfe ffe5ff04 00260792 fe1a0dfe
ffff89f7af1bd000 3623511305 S Ii:1:004:2 -115:8 64 <
ffff89f7af1bd000 3623521172 C Ii:1:004:2 0:8 64 = 30f08000 80000008 80000880 0c200791 fe130d00 00e8ff03 00200791 fe130d00
ffff89f7af1bd000 3623521218 S Ii:1:004:2 -115:8 64 <
ffff89f7af1bd000 3623544970 C Ii:1:004:2 0:8 64 = 30f18000 80000008 80000880 0c1e0792 fe140d00 00e8ff02 00200791 fe130d00
ffff89f7af1bd000 3623545019 S Ii:1:004:2 -115:8 64 <
ffff89f7af1bd000 3623561350 C Ii:1:004:2 0:8 64 = 30f68000 80000008 80000880 0c240791 fe180d01 00e6ff01 00210790 fe140d01
ffff89f7af1bd000 3623561396 S Ii:1:004:2 -115:8 64 <
ffff89f7af1bd000 3623576078 C Ii:1:004:2 0:8 64 = 30f98000 80000008 80000880 0c240794 fe1d0d00 00e8ff02 00250792 fe1d0d00
ffff89f7af1bd000 3623576120 S Ii:1:004:2 -115:8 64 <
ffff89f7af1bd000 3623591323 C Ii:1:004:2 0:8 64 = 30fc8000 80000008 80000880 0c1e0794 fe1b0dff ffe7ff02 00200795 fe1c0dff
ffff89f7af1bd000 3623591370 S Ii:1:004:2 -115:8 64 <
ffff89f7af1bd000 3623609121 C Ii:1:004:2 0:8 64 = 30008000 80000008 80000880 0c1f0791 fe180dfe ffe7ff00 001f0791 fe180dfe
ffff89f7af1bd000 3623609170 S Ii:1:004:2 -115:8 64 <
ffff89f7af1bd000 3623623265 C Ii:1:004:2 0:8 64 = 30038000 80000008 80000880 0c220793 fe170dff ffe8ff00 00200792 fe160dfe
ffff89f7af1bd000 3623623310 S Ii:1:004:2 -115:8 64 <
ffff89f7af1bd000 3623647448 C Ii:1:004:2 0:8 64 = 30068000 80000008 80000880 0c250795 fe1b0dff ffe8ff02 00240794 fe1a0d00
ffff89f7af1bd000 3623647490 S Ii:1:004:2 -115:8 64 <
ffff89f7af1bd000 3623663440 C Ii:1:004:2 0:8 64 = 300b8000 80000008 80000880 0c260793 fe1c0dfe ffe7ff01 00240795 fe1a0dfd
ffff89f7af1bd000 3623663484 S Ii:1:004:2 -115:8 64 <
ffff89f7af1bd000 3623681157 C Ii:1:004:2 0:8 64 = 300e8000 80000008 80000880 0c250794 fe190dfe ffe5ff01 00260792 fe1b0dff
ffff89f7af1bd000 3623681205 S Ii:1:004:2 -115:8 64 <
ffff89f7af1bd000 3623695229 C Ii:1:004:2 0:8 64 = 30118000 80000008 80000880 0c230795 fe130dfe ffe6ff01 00230795 fe160dfe
ffff89f7af1bd000 3623695274 S Ii:1:004:2 -115:8 64 <
ffff89f7af1bd000 3623703382 C Ii:1:004:2 0:8 64 = 30148000 80000008 80000880 0c260794 fe150dff ffe7ff01 00260794 fe130dff
ffff89f7af1bd000 3623703415 S Ii:1:004:2 -115:8 64 <
ffff89f7af1bd000 3623721272 C Ii:1:004:2 0:8 64 = 30168000 80000008 80000880 0c230792 fe170dff ffe7ff01 00260794 fe150dff
ffff89f7af1bd000 3623721317 S Ii:1:004:2 -115:8 64 <
ffff89f7af1bd000 3623743344 C Ii:1:004:2 0:8 64 = 30198000 80000008 80000880 0c1f0791 fe180dfd ffe8ff01 00200791 fe170dfe
ffff89f7af1bd000 3623743389 S Ii:1:004:2 -115:8 64 <
ffff89f7af1bd000 3623752616 C Ii:1:004:2 0:8 64 = 301e8000 80000008 80000880 0c250792 fe190d00 00e7ff02 00240793 fe180dfe
ffff89f7af1bd000 3623752655 S Ii:1:004:2 -115:8 64 <
ffff89f7af1bd000 3623775348 C Ii:1:004:2 0:8 64 = 30208000 80000008 80000880 0c240790 fe190d00 00e8ff02 00240790 fe190d00
ffff89f7af1bd000 3623775394 S Ii:1:004:2 -115:8 64 <
ffff89f7af1bd000 3623791329 C Ii:1:004:2 0:8 64 = 30248000 80000008 80000880 0c240794 fe160dff ffe5ff01 00230791 fe180d00
ffff89f7af1bd000 3623791387 S Ii:1:004:2 -115:8 64 <
ffff89f7af1bd000 3623801059 C Ii:1:004:2 0:8 64 = 30288000 80000008 80000880 0c240794 fe190dfe ffe7ff02 00240794 fe190dfe
ffff89f7af1bd000 3623801101 S Ii:1:004:2 -115:8 64 <
ffff89f7af1bd000 3623817041 C Ii:1:004:2 0:8 64 = 30298000 80000008 80000880 0c220795 fe1b0dfe ffe6ff03 00240794 fe190dfe
ffff89f7af1bd000 3623817083 S Ii:1:004:2 -115:8 64 <
ffff89f7af1bd000 3623839242 C Ii:1:004:2 0:8 64 = 302c8000 80000008 80000880 0c220794 fe160dfe ffe7ff01 00220795 fe190dfe
ffff89f7af1bd000 3623839284 S Ii:1:004:2 -115:8 64 <
ffff89f7af1bd000 3623855224 C Ii:1:004:2 0:8 64 = 30318000 80000008 80000880 0c260795 fe190dff ffe6ff02 00260794 fe170dff
ffff89f7af1bd000 3623855236 S Ii:1:004:2 -115:8 64 <
ffff89f7af1bd000 3623864112 C Ii:1:004:2 0:8 64 = 30348000 80000008 80000880 0c250794 fe170d00 00e7ff02 00260795 fe190d00
ffff89f7af1bd000 3623864149 S Ii:1:004:2 -115:8 64 <
ffff89f7af1bd000 3623880980 C Ii:1:004:2 0:8 64 = 30368000 80000008 80000880 0c220792 fe130dff ffe7ff02 00250794 fe170d00
ffff89f7af1bd000 3623881026 S Ii:1:004:2 -115:8 64 <
ffff89f7af1bd000 3623903443 C Ii:1:004:2 0:8 64 = 30398000 80000008 80000880 0c1e0790 fe120dfe ffe7ff03 00200791 fe110dff
ffff89f7af1bd000 3623903489 S Ii:1:004:2 -115:8 64 <
ffff89f7af1bd000 3623911191 C Ii:1:004:2 0:8 64 = 303e8000 80000008 80000880 0c220791 fe160d00 00e5ff01 00200790 fe160dff
ffff89f7af1bd000 3623911228 S Ii:1:004:2 -115:8 64 <
ffff89f7af1bd000 3623927313 C Ii:1:004:2 0:8 64 = 30408000 80000008 80000880 0c250793 fe170d00 00e5ff01 00250793 fe170d00
ffff89f7af1bd000 3623927360 S Ii:1:004:2 -115:8 64 <
ffff89f7af1bd000 3623943335 C Ii:1:004:2 0:8 64 = 30438000 80000008 80000880 0c260796 fe170dff ffe8ff00 00260795 fe180dff
ffff89f7af1bd000 3623943379 S Ii:1:004:2 -115:8 64 <
ffff89f7af1bd000 3623960210 C Ii:1:004:2 0:8 64 = 30468000 80000008 80000880 0c250795 fe120dff ffe7ff01 00250795 fe140dff
ffff89f7af1bd000 3623960255 S Ii:1:004:2 -115:8 64 <
ffff89f7af1bd000 3623975323 C Ii:1:004:2 0:8 64 = 30498000 80000008 80000880 0c250796 fe160dff ffe8ff01 00250795 fe130dff
ffff89f7af1bd000 3623975361 S Ii:1:004:2 -115:8 64 <
ffff89f7af1bd000 3623991372 C Ii:1:004:2 0:8 64 = 304c8000 80000008 80000880 0c260794 fe1b0dff ffe7ff01 00260796 fe190dff
ffff89f7af1bd000 3623991411 S Ii:1:004:2 -115:8 64 <
ffff89f7af1bd000 3623999294 C Ii:1:004:2 0:8 64 = 30508000 80000008 80000880 0c240792 fe1a0dff ffe9ff02 00240792 fe1a0dff
ffff89f7af1bd000 3623999333 S Ii:1:004:2 -115:8 64 <
ffff89f7af1bd000 3624024937 C Ii:1:004:2 0:8 64 = 30518000 80000008 80000880 0c220792 fe180dfe ffe8ff01 00240792 fe1a0dff
ffff89f7af1bd000 3624024985 S Ii:1:004:2 -115:8 64 <
ffff89f7af1bd000 3624039311 C Ii:1:004:2 0:8 64 = 30568000 80000008 80000880 0c230791 fe180d00 00e7ff02 00220791 fe170dff
ffff89f7af1bd000 3624039349 S Ii:1:004:2 -115:8 64 <
ffff89f7af1bd000 3624055369 C Ii:1:004:2 0:8 64 = 30598000 80000008 80000880 0c240795 fe1b0dff ffe7ff01 00240793 fe1a0d00
ffff89f7af1bd000 3624055413 S Ii:1:004:2 -115:8 64 <
ffff89f7af1bd000 3624063431 C Ii:1:004:2 0:8 64 = 305c8000 80000008 80000880 0c240792 fe170dfe ffe6ff02 00250795 fe190dfe
ffff89f7af1bd000 3624063467 S Ii:1:004:2 -115:8 64 <
ffff89f7af1bd000 3624081169 C Ii:1:004:2 0:8 64 = 305e8000 80000008 80000880 0c230791 fe160dff ffe6ff03 00240792 fe170dfe
ffff89f7af1bd000 3624081215 S Ii:1:004:2 -115:8 64 <
ffff89f7af1bd000 3624103260 C Ii:1:004:2 0:8 64 = 30618000 80000008 80000880 0c210792 fe180dff ffe5ff00 00220791 fe170dff
ffff89f7af1bd000 3624103305 S Ii:1:004:2 -115:8 64 <
ffff89f7af1bd000 3624111446 C Ii:1:004:2 0:8 64 = 30668000 80000008 80000880 0c240791 fe190dff ffe9ff02 00220794 fe1a0dff
ffff89f7af1bd000 3624111482 S Ii:1:004:2 -115:8 64 <
ffff89f7af1bd000 3624128375 C Ii:1:004:2 0:8 64 = 30688000 80000008 80000880 0c250790 fe180dfe ffe9ff02 00250790 fe180dfe
ffff89f7af1bd000 3624128424 S Ii:1:004:2 -115:8 64 <
ffff89f7af1bd000 3624143879 C Ii:1:004:2 0:8 64 = 306b8000 80000008 80000880 0c210792 fe1a0dfd ffe9ff00 00230791 fe1a0dfd
ffff89f7af1bd000 3624143927 S Ii:1:004:2 -115:8 64 <
ffff89f7af1bd000 3624167198 C Ii:1:004:2 0:8 64 = 306e8000 80000008 80000880 0c220793 fe190dff ffe6ff02 00210792 fe180dfe
ffff89f7af1bd000 3624167241 S Ii:1:004:2 -115:8 64 <
ffff89f7af1bd000 3624177023 C Ii:1:004:2 0:8 64 = 30738000 80000008 80000880 0c240791 fe180d00 00e7ff01 00230792 fe180d00
ffff89f7af1bd000 3624177063 S Ii:1:004:2 -115:8 64 <
ffff89f7af1bd000 3624199281 C Ii:1:004:2 0:8 64 = 30748000 80000008 80000880 0c240792 fe1b0dff ffe8ff02 00240791 fe180d00
ffff89f7af1bd000 3624199326 S Ii:1:004:2 -115:8 64 <
ffff89f7af1bd000 3624215311 C Ii:1:004:2 0:8 64 = 30798000 80000008 80000880 0c260791 fe190dfe ffe8ff04 00260791 fe1b0dfe
ffff89f7af1bd000 3624215357 S Ii:1:004:2 -115:8 64 <
ffff89f7af1bd000 3624224030 C Ii:1:004:2 0:8 64 = 307c8000 80000008 80000880 0c240792 fe180dff ffe6ff02 00250792 fe180dff
ffff89f7af1bd000 3624224071 S Ii:1:004:2 -115:8 64 <
ffff89f7af1bd000 3624239295 C Ii:1:004:2 0:8 64 = 307e8000 80000008 80000880 0c230791 fe190dff ffe6ff02 00240792 fe180dff
ffff89f7af1bd000 3624239336 S Ii:1:004:2 -115:8 64 <
ffff89f7af1bd000 3624256805 C Ii:1:004:2 0:8 64 = 30818000 80000008 80000880 0c230790 fe190dfe ffe7ff01 00230790 fe190dfe
ffff89f7af1bd000 3624256849 S Ii:1:004:2 -115:8 64 <
ffff89f7af1bd000 3624272963 C Ii:1:004:2 0:8 64 = 30848000 80000008 80000880 0c230795 fe1a0dfe ffe7ff01 00220792 fe190dff
ffff89f7af1bd000 3624273024 S Ii:1:004:2 -115:8 64 <
ffff89f7af1bd000 3624289317 C Ii:1:004:2 0:8 64 = 30888000 80000008 80000880 0c220795 fe1a0dfe ffe8ff00 00220795 fe1a0dfe
ffff89f7af1bd000 3624289364 S Ii:1:004:2 -115:8 64 <
ffff89f7af1bd000 3624303384 C Ii:1:004:2 0:8 64 = 308b8000 80000008 80000880 0c250793 fe190dfd ffe8ff01 00240794 fe190dfe
ffff89f7af1bd000 3624303424 S Ii:1:004:2 -115:8 64 <
ffff89f7af1bd000 3624321043 C Ii:1:004:2 0:8 64 = 308e8000 80000008 80000880 0c250794 fe1a0dfd ffe9ff01 00260794 fe1a0dfd
ffff89f7af1bd000 3624321081 S Ii:1:004:2 -115:8 64 <
ffff89f7af1bd000 3624337102 C Ii:1:004:2 0:8 64 = 30918000 80000008 80000880 0c230793 fe190dfe ffe6ff00 00240794 fe1a0dfe
ffff89f7af1bd000 3624337170 S Ii:1:004:2 -115:8 64 <
ffff89f7af1bd000 3624361377 C Ii:1:004:2 0:8 64 = 30948000 80000008 80000880 0c210794 fe160dfe ffe8ff00 00230794 fe170dfe
ffff89f7af1bd000 3624361419 S Ii:1:004:2 -115:8 64 <
ffff89f7af1bd000 3624367628 C Ii:1:004:2 0:8 64 = 30998000 80000008 80000880 0c220793 fe1c0dfe ffe7ff01 00230794 fe1b0dfe
ffff89f7af1bd000 3624367666 S Ii:1:004:2 -115:8 64 <
ffff89f7af1bd000 3624394121 C Ii:1:004:2 0:8 64 = 309b8000 80000008 80000880 0c200791 fe1c0dff ffe6ff02 00220793 fe1c0dfe
ffff89f7af1bd000 3624394164 S Ii:1:004:2 -115:8 64 <
ffff89f7af1bd000 3624407280 C Ii:1:004:2 0:8 64 = 30a08000 80000008 80000880 0c220791 fe180d01 00e6ff02 00220791 fe180d01
ffff89f7af1bd000 3624407326 S Ii:1:004:2 -115:8 64 <
ffff89f7af1bd000 3624424276 C Ii:1:004:2 0:8 64 = 30a38000 80000008 80000880 0c210791 fe150dff ffe8ff01 00220792 fe150d00
ffff89f7af1bd000 3624424321 S Ii:1:004:2 -115:8 64 <
ffff89f7af1bd000 3624449399 C Ii:1:004:2 0:8 64 = 30a68000 80000008 80000880 0c220791 fe180dff ffe6ff01 00210790 fe170dff
ffff89f7af1bd000 3624449447 S Ii:1:004:2 -115:8 64 <
ffff89f7af1bd000 3624463320 C Ii:1:004:2 0:8 64 = 30ab8000 80000008 80000880 0c250793 fe180dfe ffe8ff02 00250794 fe180dfe
ffff89f7af1bd000 3624463365 S Ii:1:004:2 -115:8 64 <
ffff89f7af1bd000 3624479426 C Ii:1:004:2 0:8 64 = 30ae8000 80000008 80000880 0c250793 fe160dfd ffe7ff02 00240793 fe170dfd
ffff89f7af1bd000 3624479490 S Ii:1:004:2 -115:8 64 <
ffff89f7af1bd000 3624498232 C Ii:1:004:2 0:8 64 = 30b18000 80000008 80000880 0c250794 fe170dfd ffe6ff01 00260794 fe160dfd
ffff89f7af1bd000 3624498293 S Ii:1:004:2 -115:8 64 <
ffff89f7af1bd000 3624504122 C Ii:1:004:2 0:8 64 = 30b48000 80000008 80000880 0c240792 fe150dfe ffe7ff02 00240793 fe160dfe
ffff89f7af1bd000 3624504159 S Ii:1:004:2 -115:8 64 <
ffff89f7af1bd000 3624527174 C Ii:1:004:2 0:8 64 = 30b68000 80000008 80000880 0c260792 fe150dff ffe8ff02 00240792 fe150dfe
ffff89f7af1bd000 3624527217 S Ii:1:004:2 -115:8 64 <
ffff89f7af1bd000 3624536868 C Ii:1:004:2 0:8 64 = 30bb8000 80000008 80000880 0c200794 fe160dfe ffe4ff02 00220794 fe130dfe
ffff89f7af1bd000 3624536905 S Ii:1:004:2 -115:8 64 <
ffff89f7af1bd000 3624559367 C Ii:1:004:2 0:8 64 = 30bc8000 80000008 80000880 0c200794 fe1a0dff ffe4ff02 00200794 fe160dfe
ffff89f7af1bd000 3624559413 S Ii:1:004:2 -115:8 64 <
ffff89f7af1bd000 3624575277 C Ii:1:004:2 0:8 64 = 30c18000 80000008 80000880 0c230793 fe140dff ffe8ff02 00230791 fe170dff
ffff89f7af1bd000 3624575321 S Ii:1:004:2 -115:8 64 <
ffff89f7af1bd000 3624593826 C Ii:1:004:2 0:8 64 = 30c48000 80000008 80000880 0c230793 fe1a0dff ffe8ff01 00230794 fe160dff
ffff89f7af1bd000 3624593880 S Ii:1:004:2 -115:8 64 <
ffff89f7af1bd000 3624607351 C Ii:1:004:2 0:8 64 = 30c88000 80000008 80000880 0c210793 fe190dff ffe7ff02 00210793 fe190dff
ffff89f7af1bd000 3624607401 S Ii:1:004:2 -115:8 64 <
ffff89f7af1bd000 3624623295 C Ii:1:004:2 0:8 64 = 30cb8000 80000008 80000880 0c210794 fe140dff ffe7ff02 00210793 fe150dff
ffff89f7af1bd000 3624623336 S Ii:1:004:2 -115:8 64 <
ffff89f7af1bd000 3624631275 C Ii:1:004:2 0:8 64 = 30ce8000 80000008 80000880 0c220795 fe190dff ffe6ff01 00210796 fe150dff
ffff89f7af1bd000 3624631315 S Ii:1:004:2 -115:8 64 <
ffff89f7af1bd000 3624648534 C Ii:1:004:2 0:8 64 = 30d08000 80000008 80000880 0c240793 fe1b0dff ffe6ff01 00240793 fe1b0dff
ffff89f7af1bd000 3624648572 S Ii:1:004:2 -115:8 64 <
ffff89f7af1bd000 3624663252 C Ii:1:004:2 0:8 64 = 30d38000 80000008 80000880 0c230793 fe180dff ffe8ff01 00240792 fe1b0dff
ffff89f7af1bd000 3624663296 S Ii:1:004:2 -115:8 64 <
ffff89f7af1bd000 3624690066 C Ii:1:004:2 0:8 64 = 30d68000 80000008 80000880 0c250796 fe150dff ffe7ff03 00240795 fe160dff
ffff89f7af1bd000 3624690127 S Ii:1:004:2 -115:8 64 <
ffff89f7af1bd000 3624703343 C Ii:1:004:2 0:8 64 = 30db8000 80000008 80000880 0c270792 fe170d00 00e7ff01 00270794 fe150d00
ffff89f7af1bd000 3624703379 S Ii:1:004:2 -115:8 64 <
ffff89f7af1bd000 3624721393 C Ii:1:004:2 0:8 64 = 30de8000 80000008 80000880 0c220793 fe180dff ffe6ff02 00250792 fe170d00
ffff89f7af1bd000 3624721439 S Ii:1:004:2 -115:8 64 <
ffff89f7af1bd000 3624735201 C Ii:1:004:2 0:8 64 = 30e18000 80000008 80000880 0c230793 fe170dfe ffe8ff01 00210794 fe180dfe
ffff89f7af1bd000 3624735247 S Ii:1:004:2 -115:8 64 <
ffff89f7af1bd000 3624743336 C Ii:1:004:2 0:8 64 = 30e48000 80000008 80000880 0c250794 fe190dff ffe8ff01 00250793 fe180dfe
ffff89f7af1bd000 3624743374 S Ii:1:004:2 -115:8 64 <
ffff89f7af1bd000 3624760853 C Ii:1:004:2 0:8 64 = 30e68000 80000008 80000880 0c240793 fe180dff ffe9ff01 00250794 fe190dff
ffff89f7af1bd000 3624760899 S Ii:1:004:2 -115:8 64 <
ffff89f7af1bd000 3624776232 C Ii:1:004:2 0:8 64 = 30e98000 80000008 80000880 0c230792 fe180dfe ffe8ff01 00250792 fe180dfe
ffff89f7af1bd000 3624776269 S Ii:1:004:2 -115:8 64 <
ffff89f7af1bd000 3624792610 C Ii:1:004:2 0:8 64 = 30ec8000 80000008 80000880 0c200793 fe180dff ffe8ff02 00200793 fe180dfe
ffff89f7af1bd000 3624792658 S Ii:1:004:2 -115:8 64 <
ffff89f7af1bd000 3624809034 C Ii:1:004:2 0:8 64 = 30f08000 80000008 80000880 0c250794 fe180dff ffe6ff01 00250794 fe180dff
ffff89f7af1bd000 3624809080 S Ii:1:004:2 -115:8 64 <
ffff89f7af1bd000 3624823222 C Ii:1:004:2 0:8 64 = 30f38000 80000008 80000880 0c270793 fe160dfe ffe7ff01 00260794 fe160dff
ffff89f7af1bd000 3624823263 S Ii:1:004:2 -115:8 64 <
ffff89f7af1bd000 3624841284 C Ii:1:004:2 0:8 64 = 30f68000 80000008 80000880 0c260794 fe1a0dfe ffe8ff01 00270793 fe180dfe
ffff89f7af1bd000 3624841330 S Ii:1:004:2 -115:8 64 <
ffff89f7af1bd000 3624866802 C Ii:1:004:2 0:8 64 = 30f98000 80000008 80000880 0c250793 fe180dfe ffe6ff01 00250794 fe190dfe
ffff89f7af1bd000 3624866844 S Ii:1:004:2 -115:8 64 <
ffff89f7af1bd000 3624879417 C Ii:1:004:2 0:8 64 = 30fe8000 80000008 80000880 0c250793 fe190dff ffe6ff02 00250792 fe180dff
ffff89f7af1bd000 3624879469 S Ii:1:004:2 -115:8 64 <
ffff89f7af1bd000 3624887356 C Ii:1:004:2 0:8 64 = 30018000 80000008 80000880 0c230794 fe180dff ffe7ff02 00250793 fe190d00
ffff89f7af1bd000 3624887406 S Ii:1:004:2 -115:8 64 <
ffff89f7af1bd000 3624903937 C Ii:1:004:2 0:8 64 = 30038000 80000008 80000880 0c220794 fe170dff ffe7ff02 00230794 fe180dff
ffff89f7af1bd000 3624903980 S Ii:1:004:2 -115:8 64 <
ffff89f7af1bd000 3624927190 C Ii:1:004:2 0:8 64 = 30068000 80000008 80000880 0c220793 fe140dfe ffe6ff01 00220794 fe160dfe
ffff89f7af1bd000 3624927232 S Ii:1:004:2 -115:8 64 <
ffff89f7af1bd000 3624943230 C Ii:1:004:2 0:8 64 = 300b8000 80000008 80000880 0c260791 fe180dff ffe8ff01 00240791 fe140dff
ffff89f7af1bd000 3624943274 S Ii:1:004:2 -115:8 64 <
ffff89f7af1bd000 3624953153 C Ii:1:004:2 0:8 64 = 300e8000 80000008 80000880 0c230794 fe1a0dff ffe8ff00 00260792 fe1a0dff
ffff89f7af1bd000 3624953192 S Ii:1:004:2 -115:8 64 <
ffff89f7af1bd000 3624975292 C Ii:1:004:2 0:8 64 = 30108000 80000008 80000880 0c220793 fe180dff ffe9ff01 00220793 fe180dff
ffff89f7af1bd000 3624975343 S Ii:1:004:2 -115:8 64 <
ffff89f7af1bd000 3624984402 C Ii:1:004:2 0:8 64 = 30148000 80000008 80000880 0c240792 fe190dfe ffe8ff02 00230791 fe180dfe
ffff89f7af1bd000 3624984437 S Ii:1:004:2 -115:8 64 <
ffff89f7af1bd000 3625007269 C Ii:1:004:2 0:8 64 = 30168000 80000008 80000880 0c260793 fe1a0dfe ffe7ff01 00240792 fe190dfe
ffff89f7af1bd000 3625007316 S Ii:1:004:2 -115:8 64 <
ffff89f7af1bd000 3625016331 C Ii:1:004:2 0:8 64 = 301b8000 80000008 80000880 0c260790 fe170dff ffe7ff01 00260791 fe170dff
ffff89f7af1bd000 3625016370 S Ii:1:004:2 -115:8 64 <
ffff89f7af1bd000 3625039269 C Ii:1:004:2 0:8 64 = 301c8000 80000008 80000880 0c260791 fe170dfe ffe7ff01 00260790 fe170dff
ffff89f7af1bd000 3625039313 S Ii:1:004:2 -115:8 64 <
ffff89f7af1bd000 3625055277 C Ii:1:004:2 0:8 64 = 30218000 80000008 80000880 0c200792 fe1a0dff ffe7ff02 00220793 fe170dff
ffff89f7af1bd000 3625055322 S Ii:1:004:2 -115:8 64 <
ffff89f7af1bd000 3625074093 C Ii:1:004:2 0:8 64 = 30248000 80000008 80000880 0c220794 fe1d0dfd ffe7ff01 00200793 fe1c0dfe
ffff89f7af1bd000 3625074141 S Ii:1:004:2 -115:8 64 <
ffff89f7af1bd000 3625087247 C Ii:1:004:2 0:8 64 = 30288000 80000008 80000880 0c260797 fe150dfe ffe7ff02 00260797 fe150dfe
ffff89f7af1bd000 3625087291 S Ii:1:004:2 -115:8 64 <
ffff89f7af1bd000 3625103177 C Ii:1:004:2 0:8 64 = 302b8000 80000008 80000880 0c260794 fe170dff ffe8ff01 00260796 fe140dff
ffff89f7af1bd000 3625103220 S Ii:1:004:2 -115:8 64 <
ffff89f7af1bd000 3625111132 C Ii:1:004:2 0:8 64 = 302e8000 80000008 80000880 0c230791 fe180d00 00e7ff00 00240792 fe190dff
ffff89f7af1bd000 3625111166 S Ii:1:004:2 -115:8 64 <
ffff89f7af1bd000 3625127241 C Ii:1:004:2 0:8 64 = 30308000 80000008 80000880 0c210792 fe180d00 00e7ff01 00210792 fe180d00
ffff89f7af1bd000 3625127284 S Ii:1:004:2 -115:8 64 <
ffff89f7af1bd000 3625143379 C Ii:1:004:2 0:8 64 = 30338000 80000008 80000880 0c200792 fe180dfe ffe7ff02 00200793 fe170dff
ffff89f7af1bd000 3625143417 S Ii:1:004:2 -115:8 64 <
ffff89f7af1bd000 3625160111 C Ii:1:004:2 0:8 64 = 30368000 80000008 80000880 0c200793 fe190dfe ffe8ff00 00200791 fe190dfe
ffff89f7af1bd000 3625160156 S Ii:1:004:2 -115:8 64 <
ffff89f7af1bd000 3625175353 C Ii:1:004:2 0:8 64 = 30398000 80000008 80000880 0c260795 fe190dfe ffe6ff01 00240794 fe180dfe
ffff89f7af1bd000 3625175388 S Ii:1:004:2 -115:8 64 <
ffff89f7af1bd000 3625193902 C Ii:1:004:2 0:8 64 = 303c8000 80000008 80000880 0c220792 fe1a0dff ffe6ff00 00250794 fe1a0dff
ffff89f7af1bd000 3625193947 S Ii:1:004:2 -115:8 64 <
ffff89f7af1bd000 3625207374 C Ii:1:004:2 0:8 64 = 30408000 80000008 80000880 0c210794 fe160dfe ffe9ff00 00210794 fe160dfe
ffff89f7af1bd000 3625207412 S Ii:1:004:2 -115:8 64 <
ffff89f7af1bd000 3625223255 C Ii:1:004:2 0:8 64 = 30438000 80000008 80000880 0c210796 fe160dfe ffe7ff01 00220797 fe150dff
ffff89f7af1bd000 3625223299 S Ii:1:004:2 -115:8 64 <
ffff89f7af1bd000 3625240022 C Ii:1:004:2 0:8 64 = 30468000 80000008 80000880 0c240792 fe1a0dfe ffe7ff01 00220793 fe190dfe
ffff89f7af1bd000 3625240059 S Ii:1:004:2 -115:8 64 <
ffff89f7af1bd000 3625255920 C Ii:1:004:2 0:8 64 = 30498000 80000008 80000880 0c260796 fe1a0dff ffe5ff02 00260795 fe1a0dff
ffff89f7af1bd000 3625255957 S Ii:1:004:2 -115:8 64 <
ffff89f7af1bd000 3625271217 C Ii:1:004:2 0:8 64 = 304c8000 80000008 80000880 0c230792 fe1b0dfe ffe8ff01 00250795 fe1a0dff
ffff89f7af1bd000 3625271255 S Ii:1:004:2 -115:8 64 <
ffff89f7af1bd000 3625288704 C Ii:1:004:2 0:8 64 = 30508000 80000008 80000880 0c210790 fe180dfe ffe5ff01 00210790 fe180dfe
ffff89f7af1bd000 3625288746 S Ii:1:004:2 -115:8 64 <
ffff89f7af1bd000 3625303259 C Ii:1:004:2 0:8 64 = 30538000 80000008 80000880 0c260792 fe130dff ffe7ff01 00220790 fe150dff
ffff89f7af1bd000 3625303299 S Ii:1:004:2 -115:8 64 <
ffff89f7af1bd000 3625319220 C Ii:1:004:2 0:8 64 = 30568000 80000008 80000880 0c260793 fe150dfe ffe8ff01 00270792 fe140dff
ffff89f7af1bd000 3625319255 S Ii:1:004:2 -115:8 64 <
ffff89f7af1bd000 3625335218 C Ii:1:004:2 0:8 64 = 30598000 80000008 80000880 0c230795 fe160dff ffe7ff02 00230794 fe160dfe
ffff89f7af1bd000 3625335259 S Ii:1:004:2 -115:8 64 <
ffff89f7af1bd000 3625359361 C Ii:1:004:2 0:8 64 = 305c8000 80000008 80000880 0c240794 fe160d00 00e6ff03 00240794 fe160d00
ffff89f7af1bd000 3625359408 S Ii:1:004:2 -115:8 64 <
ffff89f7af1bd000 3625367315 C Ii:1:004:2 0:8 64 = 30618000 80000008 80000880 0c220796 fe180dfe ffe7ffff 00220796 fe190dff
ffff89f7af1bd000 3625367355 S Ii:1:004:2 -115:8 64 <
ffff89f7af1bd000 3625383355 C Ii:1:004:2 0:8 64 = 30638000 80000008 80000880 0c230793 fe150dfe ffe6ff00 00220796 fe180dfe
ffff89f7af1bd000 3625383390 S Ii:1:004:2 -115:8 64 <
ffff89f7af1bd000 3625399378 C Ii:1:004:2 0:8 64 = 30668000 80000008 80000880 0c230793 fe1a0dff ffe5ff02 00230792 fe150dfe
ffff89f7af1bd000 3625399423 S Ii:1:004:2 -115:8 64 <
ffff89f7af1bd000 3625417102 C Ii:1:004:2 0:8 64 = 30698000 80000008 80000880 0c230794 fe1d0dfe ffe7ff00 00230794 fe1d0dff
ffff89f7af1bd000 3625417139 S Ii:1:004:2 -115:8 64 <
ffff89f7af1bd000 3625423361 C Ii:1:004:2 0:8 64 = 306c8000 80000008 80000880 0c200793 fe190dff ffe5ff01 00210793 fe1a0dfe
ffff89f7af1bd000 3625423399 S Ii:1:004:2 -115:8 64 <
ffff89f7af1bd000 3625440315 C Ii:1:004:2 0:8 64 = 306e8000 80000008 80000880 0c210793 fe170dff ffe6ff02 00200793 fe190dff
ffff89f7af1bd000 3625440368 S Ii:1:004:2 -115:8 64 <
ffff89f7af1bd000 3625455213 C Ii:1:004:2 0:8 64 = 30718000 80000008 80000880 0c210793 fe180dfe ffe7ff04 00210793 fe170dff
ffff89f7af1bd000 3625455256 S Ii:1:004:2 -115:8 64 <
ffff89f7af1bd000 3625472731 C Ii:1:004:2 0:8 64 = 30748000 80000008 80000880 0c220793 fe180dfe ffe7ff01 00220793 fe180dfe
ffff89f7af1bd000 3625472788 S Ii:1:004:2 -115:8 64 <
ffff89f7af1bd000 3625489081 C Ii:1:004:2 0:8 64 = 30788000 80000008 80000880 0c230794 fe140dff ffe8ff02 00230794 fe140dff
ffff89f7af1bd000 3625489118 S Ii:1:004:2 -115:8 64 <
ffff89f7af1bd000 3625503296 C Ii:1:004:2 0:8 64 = 307b8000 80000008 80000880 0c240791 fe180dff ffe8ff01 00250793 fe140dff
ffff89f7af1bd000 3625503335 S Ii:1:004:2 -115:8 64 <
ffff89f7af1bd000 3625520503 C Ii:1:004:2 0:8 64 = 307e8000 80000008 80000880 0c220792 fe1a0dfe ffe8ff01 00230790 fe190dff
ffff89f7af1bd000 3625520545 S Ii:1:004:2 -115:8 64 <
ffff89f7af1bd000 3625536215 C Ii:1:004:2 0:8 64 = 30818000 80000008 80000880 0c210793 fe190dff ffe5ff02 00210793 fe1a0dfe
ffff89f7af1bd000 3625536253 S Ii:1:004:2 -115:8 64 <
ffff89f7af1bd000 3625551211 C Ii:1:004:2 0:8 64 = 30848000 80000008 80000880 0c250793 fe170d00 00e8ff02 00230793 fe180d00
ffff89f7af1bd000 3625551253 S Ii:1:004:2 -115:8 64 <
ffff89f7af1bd000 3625569325 C Ii:1:004:2 0:8 64 = 30888000 80000008 80000880 0c240791 fe1a0dff ffe7ff01 00240791 fe1a0dff
ffff89f7af1bd000 3625569367 S Ii:1:004:2 -115:8 64 <
ffff89f7af1bd000 3625583854 C Ii:1:004:2 0:8 64 = 308b8000 80000008 80000880 0c220794 fe180dff ffe8ff01 00230793 fe1b0dff
ffff89f7af1bd000 3625583893 S Ii:1:004:2 -115:8 64 <
ffff89f7af1bd000 3625601449 C Ii:1:004:2 0:8 64 = 308e8000 80000008 80000880 0c240791 fe160dff ffe6ff01 00240793 fe160dff
ffff89f7af1bd000 3625601495 S Ii:1:004:2 -115:8 64 <
ffff89f7af1bd000 3625624957 C Ii:1:004:2 0:8 64 = 30918000 80000008 80000880 0c230791 fe190dff ffe7ff03 00230790 fe180dff
ffff89f7af1bd000 3625625003 S Ii:1:004:2 -115:8 64 <
ffff89f7af1bd000 3625632633 C Ii:1:004:2 0:8 64 = 30968000 80000008 80000880 0c200791 fe170dfe ffe6ff01 00210792 fe180dfe
ffff89f7af1bd000 3625632683 S Ii:1:004:2 -115:8 64 <
ffff89f7af1bd000 3625647331 C Ii:1:004:2 0:8 64 = 30988000 80000008 80000880 0c200791 fe170dff ffe6ff01 00200791 fe170dff
ffff89f7af1bd000 3625647366 S Ii:1:004:2 -115:8 64 <
ffff89f7af1bd000 3625663122 C Ii:1:004:2 0:8 64 = 309b8000 80000008 80000880 0c210791 fe190dfe ffe7ff01 00200791 fe180dff
ffff89f7af1bd000 3625663168 S Ii:1:004:2 -115:8 64 <
ffff89f7af1bd000 3625687254 C Ii:1:004:2 0:8 64 = 309e8000 80000008 80000880 0c210793 fe180dfd ffe6ff02 00210791 fe180dfd
ffff89f7af1bd000 3625687300 S Ii:1:004:2 -115:8 64 <
ffff89f7af1bd000 3625703331 C Ii:1:004:2 0:8 64 = 30a38000 80000008 80000880 0c250796 fe1b0dff ffe7ff01 00260797 fe1a0dff
ffff89f7af1bd000 3625703376 S Ii:1:004:2 -115:8 64 <
ffff89f7af1bd000 3625719194 C Ii:1:004:2 0:8 64 = 30a68000 80000008 80000880 0c250793 fe170dff ffe8ff03 00240794 fe190dff
ffff89f7af1bd000 3625719235 S Ii:1:004:2 -115:8 64 <
ffff89f7af1bd000 3625737054 C Ii:1:004:2 0:8 64 = 30a98000 80000008 80000880 0c220791 fe190dfd ffe8ff01 00240791 fe170dfe
ffff89f7af1bd000 3625737096 S Ii:1:004:2 -115:8 64 <
ffff89f7af1bd000 3625752123 C Ii:1:004:2 0:8 64 = 30ac8000 80000008 80000880 0c210791 fe190dfe ffe7ff01 00210791 fe1a0dfd
ffff89f7af1bd000 3625752162 S Ii:1:004:2 -115:8 64 <
ffff89f7af1bd000 3625768921 C Ii:1:004:2 0:8 64 = 30b08000 80000008 80000880 0c210791 fe170dfd ffe7ff02 00210791 fe170dfd
ffff89f7af1bd000 3625768963 S Ii:1:004:2 -115:8 64 <
ffff89f7af1bd000 3625783339 C Ii:1:004:2 0:8 64 = 30b38000 80000008 80000880 0c240792 fe190dfe ffe6ff01 00220791 fe180dfd
ffff89f7af1bd000 3625783377 S Ii:1:004:2 -115:8 64 <
ffff89f7af1bd000 3625799259 C Ii:1:004:2 0:8 64 = 30b68000 80000008 80000880 0c260797 fe160dff ffe7ff01 00240795 fe180dfe
ffff89f7af1bd000 3625799303 S Ii:1:004:2 -115:8 64 <
ffff89f7af1bd000 3625817260 C Ii:1:004:2 0:8 64 = 30b98000 80000008 80000880 0c250793 fe170d00 00e7ff01 00270797 fe150dff
ffff89f7af1bd000 3625817299 S Ii:1:004:2 -115:8 64 <
ffff89f7af1bd000 3625833927 C Ii:1:004:2 0:8 64 = 30bc8000 80000008 80000880 0c230791 fe1a0dff ffe7ff01 00230790 fe1a0d00
ffff89f7af1bd000 3625833970 S Ii:1:004:2 -115:8 64 <
ffff89f7af1bd000 3625855148 C Ii:1:004:2 0:8 64 = 30c08000 80000008 80000880 0c240794 fe180dff ffe6ff00 00240794 fe180dff
ffff89f7af1bd000 3625855194 S Ii:1:004:2 -115:8 64 <
ffff89f7af1bd000 3625872906 C Ii:1:004:2 0:8 64 = 30c48000 80000008 80000880 0c270792 fe180dff ffe6ff03 00250795 fe180dff
ffff89f7af1bd000 3625872963 S Ii:1:004:2 -115:8 64 <
ffff89f7af1bd000 3625887348 C Ii:1:004:2 0:8 64 = 30c88000 80000008 80000880 0c260792 fe190dff ffe7ff02 00260792 fe190dff
ffff89f7af1bd000 3625887389 S Ii:1:004:2 -115:8 64 <
ffff89f7af1bd000 3625904372 C Ii:1:004:2 0:8 64 = 30cb8000 80000008 80000880 0c220792 fe1b0d00 00e7ff01 00250792 fe1a0d00
ffff89f7af1bd000 3625904427 S Ii:1:004:2 -115:8 64 <
ffff89f7af1bd000 3625920865 C Ii:1:004:2 0:8 64 = 30ce8000 80000008 80000880 0c1e0793 fe1c0dff ffe7ff03 001f0793 fe1b0dff
ffff89f7af1bd000 3625920910 S Ii:1:004:2 -115:8 64 <
ffff89f7af1bd000 3625937200 C Ii:1:004:2 0:8 64 = 30d18000 80000008 80000880 0c220792 fe1c0dff ffe7ff02 001f0792 fe1e0dff
ffff89f7af1bd000 3625937239 S Ii:1:004:2 -115:8 64 <
ffff89f7af1bd000 3625951377 C Ii:1:004:2 0:8 64 = 30d48000 80000008 80000880 0c250793 fe170dff ffe7ff01 00250792 fe170dff
ffff89f7af1bd000 3625951419 S Ii:1:004:2 -115:8 64 <
ffff89f7af1bd000 3625967316 C Ii:1:004:2 0:8 64 = 30d88000 80000008 80000880 0c230794 fe1b0dff ffe7ff01 00230794 fe1b0dff
ffff89f7af1bd000 3625967358 S Ii:1:004:2 -115:8 64 <
ffff89f7af1bd000 3625983153 C Ii:1:004:2 0:8 64 = 30db8000 80000008 80000880 0c230794 fe190dff ffe5ff01 00220795 fe190dfe
ffff89f7af1bd000 3625983191 S Ii:1:004:2 -115:8 64 <
ffff89f7af1bd000 3626002482 C Ii:1:004:2 0:8 64 = 30de8000 80000008 80000880 0c220792 fe1b0dfe ffe8ff02 00230793 fe1b0dff
ffff89f7af1bd000 3626002522 S Ii:1:004:2 -115:8 64 <
ffff89f7af1bd000 3626017074 C Ii:1:004:2 0:8 64 = 30e18000 80000008 80000880 0c270794 fe180dfe ffe7ff03 00250793 fe190dfe
ffff89f7af1bd000 3626017114 S Ii:1:004:2 -115:8 64 <
ffff89f7af1bd000 3626032350 C Ii:1:004:2 0:8 64 = 30e48000 80000008 80000880 0c240792 fe190dff ffe7ff02 00270794 fe180dff
ffff89f7af1bd000 3626032392 S Ii:1:004:2 -115:8 64 <
ffff89f7af1bd000 3626047292 C Ii:1:004:2 0:8 64 = 30e88000 80000008 80000880 0c220792 fe170dfe ffe6ff02 00220792 fe170dfe
ffff89f7af1bd000 3626047330 S Ii:1:004:2 -115:8 64 <
ffff89f7af1bd000 3626064350 C Ii:1:004:2 0:8 64 = 30eb8000 80000008 80000880 0c240794 fe1b0d00 00e6ff03 00240793 fe1a0dff
ffff89f7af1bd000 3626064390 S Ii:1:004:2 -115:8 64 <
ffff89f7af1bd000 3626079397 C Ii:1:004:2 0:8 64 = 30ee8000 80000008 80000880 0c230793 fe170dfe ffe8ff01 00230793 fe190dff
ffff89f7af1bd000 3626079434 S Ii:1:004:2 -115:8 64 <
ffff89f7af1bd000 3626095202 C Ii:1:004:2 0:8 64 = 30f18000 80000008 80000880 0c230794 fe160dfe ffe6ff01 00230794 fe160dfe
ffff89f7af1bd000 3626095243 S Ii:1:004:2 -115:8 64 <
ffff89f7af1bd000 3626103292 C Ii:1:004:2 0:8 64 = 30f48000 80000008 80000880 0c240793 fe190dfe ffe7ff01 00230793 fe170dff
ffff89f7af1bd000 3626103327 S Ii:1:004:2 -115:8 64 <
ffff89f7af1bd000 3626130160 C Ii:1:004:2 0:8 64 = 30f68000 80000008 80000880 0c230793 fe1b0dfe ffe6ff01 00240793 fe190dfe
ffff89f7af1bd000 3626130205 S Ii:1:004:2 -115:8 64 <
ffff89f7af1bd000 3626143190 C Ii:1:004:2 0:8 64 = 30fb8000 80000008 80000880 0c230792 fe140d00 00e7ff01 00230792 fe150dff
ffff89f7af1bd000 3626143227 S Ii:1:004:2 -115:8 64 <
ffff89f7af1bd000 3626151170 C Ii:1:004:2 0:8 64 = 30fe8000 80000008 80000880 0c230793 fe170dff ffe6ff01 00230793 fe160d00
ffff89f7af1bd000 3626151206 S Ii:1:004:2 -115:8 64 <
ffff89f7af1bd000 3626167215 C Ii:1:004:2 0:8 64 = 30008000 80000008 80000880 0c240791 fe170dfe ffe5ff01 00240791 fe170dfe
ffff89f7af1bd000 3626167264 S Ii:1:004:2 -115:8 64 <
ffff89f7af1bd000 3626183368 C Ii:1:004:2 0:8 64 = 30038000 80000008 80000880 0c240793 fe160dfe ffe7ff02 00250791 fe170dfd
ffff89f7af1bd000 3626183405 S Ii:1:004:2 -115:8 64 <
ffff89f7af1bd000 3626199858 C Ii:1:004:2 0:8 64 = 30068000 80000008 80000880 0c230792 fe170d00 00e7ff02 00240794 fe170d00
ffff89f7af1bd000 3626199903 S Ii:1:004:2 -115:8 64 <
ffff89f7af1bd000 3626215182 C Ii:1:004:2 0:8 64 = 30098000 80000008 80000880 0c220792 fe140dff ffe6ff01 00220791 fe170d00
ffff89f7af1bd000 3626215219 S Ii:1:004:2 -115:8 64 <
ffff89f7af1bd000 3626231338 C Ii:1:004:2 0:8 64 = 300c8000 80000008 80000880 0c220793 fe150dff ffe6ff03 00210793 fe130dff
ffff89f7af1bd000 3626231381 S Ii:1:004:2 -115:8 64 <
ffff89f7af1bd000 3626248161 C Ii:1:004:2 0:8 64 = 30108000 80000008 80000880 0c250791 fe170dff ffe7ff02 00250791 fe170dff
ffff89f7af1bd000 3626248215 S Ii:1:004:2 -115:8 64 <
ffff89f7af1bd000 3626263303 C Ii:1:004:2 0:8 64 = 30138000 80000008 80000880 0c250793 fe140dfe ffe8ff01 00250792 fe150dff
ffff89f7af1bd000 3626263343 S Ii:1:004:2 -115:8 64 <
ffff89f7af1bd000 3626280670 C Ii:1:004:2 0:8 64 = 30168000 80000008 80000880 0c250796 fe150dfe ffe9ff02 00240795 fe140dfe
ffff89f7af1bd000 3626280720 S Ii:1:004:2 -115:8 64 <
ffff89f7af1bd000 3626296086 C Ii:1:004:2 0:8 64 = 30198000 80000008 80000880 0c230794 fe1b0dff ffe7ff01 00250796 fe170dfe
ffff89f7af1bd000 3626296133 S Ii:1:004:2 -115:8 64 <
ffff89f7af1bd000 3626319213 C Ii:1:004:2 0:8 64 = 301c8000 80000008 80000880 0c210794 fe1a0dff ffe6ff01 00210793 fe1c0d00
ffff89f7af1bd000 3626319257 S Ii:1:004:2 -115:8 64 <
ffff89f7af1bd000 3626328467 C Ii:1:004:2 0:8 64 = 30218000 80000008 80000880 0c240792 fe1a0dff ffe7ff02 00240793 fe1a0dfe
ffff89f7af1bd000 3626328505 S Ii:1:004:2 -115:8 64 <
ffff89f7af1bd000 3626354107 C Ii:1:004:2 0:8 64 = 30238000 80000008 80000880 0c230791 fe180d00 00e7ff02 00240792 fe1a0dff
ffff89f7af1bd000 3626354152 S Ii:1:004:2 -115:8 64 <
ffff89f7af1bd000 3626367284 C Ii:1:004:2 0:8 64 = 30288000 80000008 80000880 0c220795 fe150dff ffe6ff00 00220795 fe150dff
ffff89f7af1bd000 3626367321 S Ii:1:004:2 -115:8 64 <
ffff89f7af1bd000 3626377495 C Ii:1:004:2 0:8 64 = 302b8000 80000008 80000880 0c220793 fe160dfe ffe7ff03 00200795 fe150dfe
ffff89f7af1bd000 3626377532 S Ii:1:004:2 -115:8 64 <
ffff89f7af1bd000 3626401562 C Ii:1:004:2 0:8 64 = 302c8000 80000008 80000880 0c250791 fe170dfe ffe8ff02 00220793 fe160dfe
ffff89f7af1bd000 3626401608 S Ii:1:004:2 -115:8 64 <
ffff89f7af1bd000 3626415168 C Ii:1:004:2 0:8 64 = 30318000 80000008 80000880 0c220794 fe160dfe ffe7ff01 00240792 fe160dfe
ffff89f7af1bd000 3626415206 S Ii:1:004:2 -115:8 64 <
ffff89f7af1bd000 3626431300 C Ii:1:004:2 0:8 64 = 30348000 80000008 80000880 0c230794 fe1b0dfe ffe7ff03 00220795 fe180dfe
ffff89f7af1bd000 3626431339 S Ii:1:004:2 -115:8 64 <
ffff89f7af1bd000 3626447310 C Ii:1:004:2 0:8 64 = 30388000 80000008 80000880 0c240794 fe190d00 00e8ff02 00240794 fe190d00
ffff89f7af1bd000 3626447348 S Ii:1:004:2 -115:8 64 <
ffff89f7af1bd000 3626455825 C Ii:1:004:2 0:8 64 = 303b8000 80000008 80000880 0c250794 fe180dff ffe7ff02 00240794 fe170dff
ffff89f7af1bd000 3626455867 S Ii:1:004:2 -115:8 64 <
ffff89f7af1bd000 3626471304 C Ii:1:004:2 0:8 64 = 303c8000 80000008 80000880 0c250795 fe190dfe ffe6ff01 00250794 fe180dff
ffff89f7af1bd000 3626471338 S Ii:1:004:2 -115:8 64 <
ffff89f7af1bd000 3626489142 C Ii:1:004:2 0:8 64 = 30408000 80000008 80000880 0c230794 fe1c0dfe ffe7ff01 00230794 fe1c0dfe
ffff89f7af1bd000 3626489193 S Ii:1:004:2 -115:8 64 <
ffff89f7af1bd000 3626504315 C Ii:1:004:2 0:8 64 = 30438000 80000008 80000880 0c280794 fe190dff ffe7ff01 00250792 fe1c0dfe
ffff89f7af1bd000 3626504359 S Ii:1:004:2 -115:8 64 <
ffff89f7af1bd000 3626519298 C Ii:1:004:2 0:8 64 = 30468000 80000008 80000880 0c26079a fe130dff ffe7ff02 00270799 fe140dff
ffff89f7af1bd000 3626519339 S Ii:1:004:2 -115:8 64 <
ffff89f7af1bd000 3626535326 C Ii:1:004:2 0:8 64 = 30498000 80000008 80000880 0c240793 fe180dff ffe6ff02 00240796 fe160dff
ffff89f7af1bd000 3626535365 S Ii:1:004:2 -115:8 64 <
ffff89f7af1bd000 3626559192 C Ii:1:004:2 0:8 64 = 304c8000 80000008 80000880 0c230793 fe190d00 00e7ff02 00230792 fe190d00
ffff89f7af1bd000 3626559239 S Ii:1:004:2 -115:8 64 <
ffff89f7af1bd000 3626568502 C Ii:1:004:2 0:8 64 = 30518000 80000008 80000880 0c220792 fe190dfd ffe7ff00 00240793 fe1a0dfe
ffff89f7af1bd000 3626568539 S Ii:1:004:2 -115:8 64 <
ffff89f7af1bd000 3626583314 C Ii:1:004:2 0:8 64 = 30538000 80000008 80000880 0c1f0794 fe190dfd ffe7ff01 00220792 fe190dfd
ffff89f7af1bd000 3626583357 S Ii:1:004:2 -115:8 64 <
ffff89f7af1bd000 3626601243 C Ii:1:004:2 0:8 64 = 30568000 80000008 80000880 0c210795 fe160dfe ffe7ff02 001f0795 fe180dfe
ffff89f7af1bd000 3626601288 S Ii:1:004:2 -115:8 64 <
ffff89f7af1bd000 3626624985 C Ii:1:004:2 0:8 64 = 30598000 80000008 80000880 0c240794 fe150dff ffe7ff00 00230795 fe150dff
ffff89f7af1bd000 3626625030 S Ii:1:004:2 -115:8 64 <
ffff89f7af1bd000 3626631257 C Ii:1:004:2 0:8 64 = 305e8000 80000008 80000880 0c210791 fe140dfe ffe7ff02 00220791 fe150dfe
ffff89f7af1bd000 3626631292 S Ii:1:004:2 -115:8 64 <
ffff89f7af1bd000 3626648792 C Ii:1:004:2 0:8 64 = 30608000 80000008 80000880 0c220794 fe160dff ffe7ff01 00220794 fe160dff
ffff89f7af1bd000 3626648830 S Ii:1:004:2 -115:8 64 <
ffff89f7af1bd000 3626664260 C Ii:1:004:2 0:8 64 = 30638000 80000008 80000880 0c260796 fe170dff ffe8ff02 00250795 fe170dff
ffff89f7af1bd000 3626664303 S Ii:1:004:2 -115:8 64 <
ffff89f7af1bd000 3626690527 C Ii:1:004:2 0:8 64 = 30668000 80000008 80000880 0c250793 fe1a0dfe ffe6ff02 00260795 fe180dfe
ffff89f7af1bd000 3626690574 S Ii:1:004:2 -115:8 64 <
ffff89f7af1bd000 3626705975 C Ii:1:004:2 0:8 64 = 306b8000 80000008 80000880 0c200792 fe160dff ffe8fffe ff220791 fe180dff
ffff89f7af1bd000 3626706016 S Ii:1:004:2 -115:8 64 <
ffff89f7af1bd000 3626719067 C Ii:1:004:2 0:8 64 = 306e8000 80000008 80000880 0c230795 fe140dfe ffe6ff01 00210794 fe140dff
ffff89f7af1bd000 3626719109 S Ii:1:004:2 -115:8 64 <
ffff89f7af1bd000 3626737836 C Ii:1:004:2 0:8 64 = 30718000 80000008 80000880 0c240790 fe190dfe ffe7ff03 00240793 fe170dfe
ffff89f7af1bd000 3626737875 S Ii:1:004:2 -115:8 64 <
ffff89f7af1bd000 3626751175 C Ii:1:004:2 0:8 64 = 30748000 80000008 80000880 0c270792 fe1a0dff ffe7ff01 00250790 fe1a0dfe
ffff89f7af1bd000 3626751216 S Ii:1:004:2 -115:8 64 <
ffff89f7af1bd000 3626761118 C Ii:1:004:2 0:8 64 = 30788000 80000008 80000880 0c260796 fe180dff ffe8ff00 00260796 fe180dff
ffff89f7af1bd000 3626761154 S Ii:1:004:2 -115:8 64 <
ffff89f7af1bd000 3626777176 C Ii:1:004:2 0:8 64 = 30798000 80000008 80000880 0c240795 fe180dff ffe7ff00 00260796 fe180dff
ffff89f7af1bd000 3626777211 S Ii:1:004:2 -115:8 64 <
ffff89f7af1bd000 3626791085 C Ii:1:004:2 0:8 64 = 307c8000 80000008 80000880 0c230794 fe150dff ffe7ff03 00230795 fe150d00
ffff89f7af1bd000 3626791125 S Ii:1:004:2 -115:8 64 <
ffff89f7af1bd000 3626815178 C Ii:1:004:2 0:8 64 = 30808000 80000008 80000880 0c200795 fe160dfd ffe6ff01 00200795 fe160dfd
ffff89f7af1bd000 3626815229 S Ii:1:004:2 -115:8 64 <
ffff89f7af1bd000 3626824132 C Ii:1:004:2 0:8 64 = 30848000 80000008 80000880 0c260793 fe160dfe ffe8ff02 00240793 fe180dfe
ffff89f7af1bd000 3626824176 S Ii:1:004:2 -115:8 64 <
ffff89f7af1bd000 3626847161 C Ii:1:004:2 0:8 64 = 30868000 80000008 80000880 0c240793 fe150dff ffe7ff00 00260793 fe160dfe
ffff89f7af1bd000 3626847198 S Ii:1:004:2 -115:8 64 <
ffff89f7af1bd000 3626855220 C Ii:1:004:2 0:8 64 = 308b8000 80000008 80000880 0c240793 fe180d00 00e7ff03 00220792 fe180d00
ffff89f7af1bd000 3626855261 S Ii:1:004:2 -115:8 64 <
ffff89f7af1bd000 3626871771 C Ii:1:004:2 0:8 64 = 308c8000 80000008 80000880 0c260796 fe170d00 00e8ff04 00240793 fe180d00
ffff89f7af1bd000 3626871807 S Ii:1:004:2 -115:8 64 <
ffff89f7af1bd000 3626888125 C Ii:1:004:2 0:8 64 = 30908000 80000008 80000880 0c270795 fe1a0d01 00e8ff02 00270795 fe1a0d01
ffff89f7af1bd000 3626888163 S Ii:1:004:2 -115:8 64 <
ffff89f7af1bd000 3626903277 C Ii:1:004:2 0:8 64 = 30938000 80000008 80000880 0c260794 fe1e0dff ffe7ff01 00270794 fe1e0dff
ffff89f7af1bd000 3626903319 S Ii:1:004:2 -115:8 64 <
ffff89f7af1bd000 3626921153 C Ii:1:004:2 0:8 64 = 30968000 80000008 80000880 0c240792 fe190dff ffe5ff01 00250792 fe1c0dff
ffff89f7af1bd000 3626921196 S Ii:1:004:2 -115:8 64 <
ffff89f7af1bd000 3626943189 C Ii:1:004:2 0:8 64 = 30998000 80000008 80000880 0c210793 fe130dfd ffe9ff02 00230792 fe150dfe
ffff89f7af1bd000 3626943230 S Ii:1:004:2 -115:8 64 <
ffff89f7af1bd000 3626959183 C Ii:1:004:2 0:8 64 = 309e8000 80000008 80000880 0c1f0794 fe140dff ffe8ff00 00210793 fe130dff
ffff89f7af1bd000 3626959225 S Ii:1:004:2 -115:8 64 <
ffff89f7af1bd000 3626978099 C Ii:1:004:2 0:8 64 = 30a18000 80000008 80000880 0c210795 fe170dff ffe6ff01 001d0795 fe170dff
ffff89f7af1bd000 3626978145 S Ii:1:004:2 -115:8 64 <
ffff89f7af1bd000 3626991137 C Ii:1:004:2 0:8 64 = 30a48000 80000008 80000880 0c2c0793 fe1e0dff ffe4ff01 00240793 fe180dff
ffff89f7af1bd000 3626991179 S Ii:1:004:2 -115:8 64 <
ffff89f7af1bd000 3626999195 C Ii:1:004:2 0:8 64 = 30a88000 80000008 80000880 0c300792 fe200dff ffe9ff02 00300792 fe200dff
ffff89f7af1bd000 3626999234 S Ii:1:004:2 -115:8 64 <
ffff89f7af1bd000 3627023289 C Ii:1:004:2 0:8 64 = 30a98000 80000008 80000880 0c2c078e fe170dfd ffeaff03 00300792 fe200dff
ffff89f7af1bd000 3627023333 S Ii:1:004:2 -115:8 64 <
ffff89f7af1bd000 3627031191 C Ii:1:004:2 0:8 64 = 30ae8000 80000008 80000880 0c180799 fe100dff ffe7ff02 001d0795 fe0f0dfd
ffff89f7af1bd000 3627031228 S Ii:1:004:2 -115:8 64 <
ffff89f7af1bd000 3627055116 C Ii:1:004:2 0:8 64 = 30b08000 80000008 80000880 0c1d079a fe140d00 00e4ff01 001d079a fe140d00
ffff89f7af1bd000 3627055168 S Ii:1:004:2 -115:8 64 <
ffff89f7af1bd000 3627063169 C Ii:1:004:2 0:8 64 = 30b48000 80000008 80000880 0c250797 fe1a0dfe ffe8ff02 00280795 fe180dff
ffff89f7af1bd000 3627063207 S Ii:1:004:2 -115:8 64 <
ffff89f7af1bd000 3627087294 C Ii:1:004:2 0:8 64 = 30b68000 80000008 80000880 0c220799 fe1c0dfe ffe8ff02 00250797 fe1a0dfe
ffff89f7af1bd000 3627087339 S Ii:1:004:2 -115:8 64 <
ffff89f7af1bd000 3627104939 C Ii:1:004:2 0:8 64 = 30bb8000 80000008 80000880 0c1e078c fe190dff ffe8ff02 001e0791 fe1b0dff
ffff89f7af1bd000 3627104977 S Ii:1:004:2 -115:8 64 <
ffff89f7af1bd000 3627120792 C Ii:1:004:2 0:8 64 = 30be8000 80000008 80000880 0c19078e fe1b0dfe ffe8ff01 001b078c fe190dff
ffff89f7af1bd000 3627120848 S Ii:1:004:2 -115:8 64 <
ffff89f7af1bd000 3627135163 C Ii:1:004:2 0:8 64 = 30c18000 80000008 80000880 0c1f0791 fe1d0dff ffe7ff02 00190792 fe1e0dff
ffff89f7af1bd000 3627135201 S Ii:1:004:2 -115:8 64 <
ffff89f7af1bd000 3627152821 C Ii:1:004:2 0:8 64 = 30c48000 80000008 80000880 0c26078b fe150dff ffe6ff01 0026078b fe190dff
ffff89f7af1bd000 3627152864 S Ii:1:004:2 -115:8 64 <
ffff89f7af1bd000 3627167161 C Ii:1:004:2 0:8 64 = 30c88000 80000008 80000880 0c210799 fe1a0dfe ffe6ff02 00210799 fe1a0dfe
ffff89f7af1bd000 3627167199 S Ii:1:004:2 -115:8 64 <
ffff89f7af1bd000 3627183239 C Ii:1:004:2 0:8 64 = 30cb8000 80000008 80000880 0c290798 fe1b0dfe ffe7ff02 0024079b fe1c0dfe
ffff89f7af1bd000 3627183274 S Ii:1:004:2 -115:8 64 <
ffff89f7af1bd000 3627199135 C Ii:1:004:2 0:8 64 = 30ce8000 80000008 80000880 0c270796 fe150d00 00e6ff00 002b0795 fe170dff
ffff89f7af1bd000 3627199178 S Ii:1:004:2 -115:8 64 <
ffff89f7af1bd000 3627215167 C Ii:1:004:2 0:8 64 = 30d18000 80000008 80000880 0c210796 fe160d00 00e8ff00 00210797 fe140d00
ffff89f7af1bd000 3627215205 S Ii:1:004:2 -115:8 64 <
ffff89f7af1bd000 3627223817 C Ii:1:004:2 0:8 64 = 30d48000 80000008 80000880 0c290791 fe170dfe ffe6ff00 00250793 fe180dff
ffff89f7af1bd000 3627223857 S Ii:1:004:2 -115:8 64 <
ffff89f7af1bd000 3627240732 C Ii:1:004:2 0:8 64 = 30d68000 80000008 80000880 0c280790 fe160dfe ffe7ff00 00290791 fe170dfe
ffff89f7af1bd000 3627240769 S Ii:1:004:2 -115:8 64 <
ffff89f7af1bd000 3627264872 C Ii:1:004:2 0:8 64 = 30d98000 80000008 80000880 0c1e0793 fe190dff ffe9ff02 00220792 fe170dfe
ffff89f7af1bd000 3627264916 S Ii:1:004:2 -115:8 64 <
ffff89f7af1bd000 3627279186 C Ii:1:004:2 0:8 64 = 30de8000 80000008 80000880 0c280794 fe180d01 00e7ff02 00220792 fe190d01
ffff89f7af1bd000 3627279221 S Ii:1:004:2 -115:8 64 <
ffff89f7af1bd000 3627288567 C Ii:1:004:2 0:8 64 = 30e18000 80000008 80000880 0c28079c fe180dff ffe7ff00 002a0799 fe170d00
ffff89f7af1bd000 3627288615 S Ii:1:004:2 -115:8 64 <
ffff89f7af1bd000 3627304230 C Ii:1:004:2 0:8 64 = 30e38000 80000008 80000880 0c23079e fe180dff ffe9ff02 0028079c fe180dff
ffff89f7af1bd000 3627304269 S Ii:1:004:2 -115:8 64 <
ffff89f7af1bd000 3627320540 C Ii:1:004:2 0:8 64 = 30e68000 80000008 80000880 0c1d0794 fe160d00 00e8ff04 0020079a fe170dff
ffff89f7af1bd000 3627320584 S Ii:1:004:2 -115:8 64 <
ffff89f7af1bd000 3627335145 C Ii:1:004:2 0:8 64 = 30e98000 80000008 80000880 0c1d078f fe170d00 00e6ff02 001c0790 fe160d00
ffff89f7af1bd000 3627335190 S Ii:1:004:2 -115:8 64 <
ffff89f7af1bd000 3627351110 C Ii:1:004:2 0:8 64 = 30ec8000 80000008 80000880 0c23078e fe1c0dff ffe7ff01 0021078f fe1a0dff
ffff89f7af1bd000 3627351155 S Ii:1:004:2 -115:8 64 <
ffff89f7af1bd000 3627378079 C Ii:1:004:2 0:8 64 = 30f08000 80000008 80000880 0c21078c fe190dff ffe7ff02 0021078c fe190dff
ffff89f7af1bd000 3627378123 S Ii:1:004:2 -115:8 64 <
ffff89f7af1bd000 3627391124 C Ii:1:004:2 0:8 64 = 30f48000 80000008 80000880 0c210794 fe190dff ffe7ff02 00220792 fe190dff
ffff89f7af1bd000 3627391169 S Ii:1:004:2 -115:8 64 <
ffff89f7af1bd000 3627399697 C Ii:1:004:2 0:8 64 = 30f88000 80000008 80000880 0c240799 fe180dff ffe6ff04 00240799 fe180dff
ffff89f7af1bd000 3627399739 S Ii:1:004:2 -115:8 64 <
ffff89f7af1bd000 3627424101 C Ii:1:004:2 0:8 64 = 30f98000 80000008 80000880 0c27079a fe180dfe ffe6ff02 00240799 fe180dff
ffff89f7af1bd000 3627424145 S Ii:1:004:2 -115:8 64 <
ffff89f7af1bd000 3627440177 C Ii:1:004:2 0:8 64 = 30fe8000 80000008 80000880 0c260794 fe160dff ffe8ff00 00260797 fe180dfe
ffff89f7af1bd000 3627440245 S Ii:1:004:2 -115:8 64 <
ffff89f7af1bd000 3627455023 C Ii:1:004:2 0:8 64 = 30018000 80000008 80000880 0c280794 fe150dfe ffe7ff02 00280793 fe140dff
ffff89f7af1bd000 3627455071 S Ii:1:004:2 -115:8 64 <
ffff89f7af1bd000 3627471105 C Ii:1:004:2 0:8 64 = 30048000 80000008 80000880 0c220796 fe1a0dfe ffe7ff01 00260795 fe180dfd
ffff89f7af1bd000 3627471183 S Ii:1:004:2 -115:8 64 <
ffff89f7af1bd000 3627489009 C Ii:1:004:2 0:8 64 = 30088000 80000008 80000880 0c220791 fe180d00 00e7ff01 00220791 fe180d00
ffff89f7af1bd000 3627489062 S Ii:1:004:2 -115:8 64 <
ffff89f7af1bd000 3627503853 C Ii:1:004:2 0:8 64 = 300b8000 80000008 80000880 0c24078f fe160dff ffe7ff02 0024078e fe160dff
ffff89f7af1bd000 3627503900 S Ii:1:004:2 -115:8 64 <
ffff89f7af1bd000 3627527029 C Ii:1:004:2 0:8 64 = 300e8000 80000008 80000880 0c220793 fe190dff ffe7ff03 00210791 fe170dff
ffff89f7af1bd000 3627527088 S Ii:1:004:2 -115:8 64 <
ffff89f7af1bd000 3627536939 C Ii:1:004:2 0:8 64 = 30138000 80000008 80000880 0c260797 fe160dff ffe6ff00 00260796 fe170dff
ffff89f7af1bd000 3627536997 S Ii:1:004:2 -115:8 64 <
ffff89f7af1bd000 3627561937 C Ii:1:004:2 0:8 64 = 30148000 80000008 80000880 0c260796 fe140d00 00e8ff01 00260797 fe160dff
ffff89f7af1bd000 3627561985 S Ii:1:004:2 -115:8 64 <
ffff89f7af1bd000 3627576758 C Ii:1:004:2 0:8 64 = 30198000 80000008 80000880 0c24078d fe180d00 00e7ff01 00240790 fe170d00
ffff89f7af1bd000 3627576806 S Ii:1:004:2 -115:8 64 <
ffff89f7af1bd000 3627592996 C Ii:1:004:2 0:8 64 = 301c8000 80000008 80000880 0c21078f fe1f0dfe ffe7ff01 0023078d fe1b0dff
ffff89f7af1bd000 3627593059 S Ii:1:004:2 -115:8 64 <
ffff89f7af1bd000 3627607075 C Ii:1:004:2 0:8 64 = 30208000 80000008 80000880 0c200792 fe1d0d00 00e5ff03 00200792 fe1d0d00
ffff89f7af1bd000 3627607132 S Ii:1:004:2 -115:8 64 <
ffff89f7af1bd000 3627623089 C Ii:1:004:2 0:8 64 = 30238000 80000008 80000880 0c230792 fe180d00 00e6ff00 00220792 fe190d00
ffff89f7af1bd000 3627623136 S Ii:1:004:2 -115:8 64 <
ffff89f7af1bd000 3627647011 C Ii:1:004:2 0:8 64 = 30268000 80000008 80000880 0c240798 fe190d00 00e6ff02 00240795 fe190d00
ffff89f7af1bd000 3627647115 S Ii:1:004:2 -115:8 64 <
ffff89f7af1bd000 3627656565 C Ii:1:004:2 0:8 64 = 302b8000 80000008 80000880 0c260799 fe170dfe ffe7ff01 0025079b fe170dfe
ffff89f7af1bd000 3627656614 S Ii:1:004:2 -115:8 64 <
ffff89f7af1bd000 3627679097 C Ii:1:004:2 0:8 64 = 302c8000 80000008 80000880 0c270795 fe180dfe ffe6ff01 00260799 fe170dfe
ffff89f7af1bd000 3627679158 S Ii:1:004:2 -115:8 64 <
ffff89f7af1bd000 3627697937 C Ii:1:004:2 0:8 64 = 30318000 80000008 80000880 0c260793 fe190dfe ffe7ff00 00280793 fe1a0dfe
ffff89f7af1bd000 3627697997 S Ii:1:004:2 -115:8 64 <
ffff89f7af1bd000 3627711021 C Ii:1:004:2 0:8 64 = 30348000 80000008 80000880 0c1c0791 fe150dff ffe7ff00 00200790 fe160dfe
ffff89f7af1bd000 3627711061 S Ii:1:004:2 -115:8 64 <
ffff89f7af1bd000 3627719634 C Ii:1:004:2 0:8 64 = 30388000 80000008 80000880 0c1f0793 fe170dfe ffe8ff02 001f0793 fe170dfe
ffff89f7af1bd000 3627719694 S Ii:1:004:2 -115:8 64 <
ffff89f7af1bd000 3627736918 C Ii:1:004:2 0:8 64 = 30398000 80000008 80000880 0c220793 fe180dfe ffe6ff03 001f0793 fe170dfe
ffff89f7af1bd000 3627736963 S Ii:1:004:2 -115:8 64 <
ffff89f7af1bd000 3627759204 C Ii:1:004:2 0:8 64 = 303c8000 80000008 80000880 0c270794 fe180dfe ffe5ff02 00260793 fe180dfe
ffff89f7af1bd000 3627759244 S Ii:1:004:2 -115:8 64 <
ffff89f7af1bd000 3627777779 C Ii:1:004:2 0:8 64 = 30418000 80000008 80000880 0c230797 fe160dfe ffe8ff03 00240796 fe190dfe
ffff89f7af1bd000 3627777825 S Ii:1:004:2 -115:8 64 <
ffff89f7af1bd000 3627791095 C Ii:1:004:2 0:8 64 = 30448000 80000008 80000880 0c220795 fe180dfe ffe7ff01 00230797 fe140dfd
ffff89f7af1bd000 3627791141 S Ii:1:004:2 -115:8 64 <
ffff89f7af1bd000 3627800571 C Ii:1:004:2 0:8 64 = 30488000 80000008 80000880 0c240791 fe1e0dfe ffe7ff00 00240791 fe1e0dfe
ffff89f7af1bd000 3627800607 S Ii:1:004:2 -115:8 64 <
ffff89f7af1bd000 3627823167 C Ii:1:004:2 0:8 64 = 30498000 80000008 80000880 0c240790 fe1b0dfe ffe6ff01 00240791 fe1e0dfe
ffff89f7af1bd000 3627823210 S Ii:1:004:2 -115:8 64 <
ffff89f7af1bd000 3627839106 C Ii:1:004:2 0:8 64 = 304e8000 80000008 80000880 0c220790 fe150dff ffe7ff01 0022078f fe150dff
ffff89f7af1bd000 3627839143 S Ii:1:004:2 -115:8 64 <
ffff89f7af1bd000 3627855116 C Ii:1:004:2 0:8 64 = 30518000 80000008 80000880 0c260793 fe1a0dff ffe7ff00 00240791 fe180dfe
ffff89f7af1bd000 3627855183 S Ii:1:004:2 -115:8 64 <
ffff89f7af1bd000 3627872850 C Ii:1:004:2 0:8 64 = 30548000 80000008 80000880 0c280794 fe190dff ffe8ff03 00280794 fe1a0dff
ffff89f7af1bd000 3627872888 S Ii:1:004:2 -115:8 64 <
ffff89f7af1bd000 3627887780 C Ii:1:004:2 0:8 64 = 30588000 80000008 80000880 0c260793 fe1b0dfe ffe7ff03 00260793 fe1b0dfe
ffff89f7af1bd000 3627887787 S Ii:1:004:2 -115:8 64 <
ffff89f7af1bd000 3627903818 C Ii:1:004:2 0:8 64 = 305b8000 80000008 80000880 0c250797 fe170dff ffe7ffff ff250795 fe190dfe
ffff89f7af1bd000 3627903874 S Ii:1:004:2 -115:8 64 <
ffff89f7af1bd000 3627919227 C Ii:1:004:2 0:8 64 = 305e8000 80000008 80000880 0c240795 fe190dff ffe7ff02 00250796 fe180dff
ffff89f7af1bd000 3627919271 S Ii:1:004:2 -115:8 64 <
ffff89f7af1bd000 3627936897 C Ii:1:004:2 0:8 64 = 30618000 80000008 80000880 0c250792 fe170dfe ffe8ff03 00230793 fe180dff
ffff89f7af1bd000 3627936938 S Ii:1:004:2 -115:8 64 <
ffff89f7af1bd000 3627951242 C Ii:1:004:2 0:8 64 = 30648000 80000008 80000880 0c250792 fe190dff ffe5ff01 00260792 fe170dff
ffff89f7af1bd000 3627951285 S Ii:1:004:2 -115:8 64 <
ffff89f7af1bd000 3627967090 C Ii:1:004:2 0:8 64 = 30688000 80000008 80000880 0c220792 fe1c0dfe ffe8ff02 00220792 fe1c0dfe
ffff89f7af1bd000 3627967128 S Ii:1:004:2 -115:8 64 <
ffff89f7af1bd000 3627976729 C Ii:1:004:2 0:8 64 = 306b8000 80000008 80000880 0c230794 fe1b0dff ffe6ff02 00220793 fe1c0dfe
ffff89f7af1bd000 3627976784 S Ii:1:004:2 -115:8 64 <
ffff89f7af1bd000 3627992192 C Ii:1:004:2 0:8 64 = 306c8000 80000008 80000880 0c240793 fe1a0dff ffe5ff01 00230794 fe1b0dff
ffff89f7af1bd000 3627992250 S Ii:1:004:2 -115:8 64 <
ffff89f7af1bd000 3628015069 C Ii:1:004:2 0:8 64 = 30708000 80000008 80000880 0c260795 fe170dfe ffe7ff01 00260795 fe170dfe
ffff89f7af1bd000 3628015108 S Ii:1:004:2 -115:8 64 <
ffff89f7af1bd000 3628031091 C Ii:1:004:2 0:8 64 = 30748000 80000008 80000880 0c270795 fe190dfe ffe7ff02 00270795 fe1a0dfe
ffff89f7af1bd000 3628031132 S Ii:1:004:2 -115:8 64 <
ffff89f7af1bd000 3628040256 C Ii:1:004:2 0:8 64 = 30788000 80000008 80000880 0c240794 fe180dff ffe7ff01 00240794 fe180dff
ffff89f7af1bd000 3628040296 S Ii:1:004:2 -115:8 64 <
ffff89f7af1bd000 3628056833 C Ii:1:004:2 0:8 64 = 30798000 80000008 80000880 0c1f0793 fe190dfe ffe8ff01 00240794 fe180dff
ffff89f7af1bd000 3628056874 S Ii:1:004:2 -115:8 64 <
ffff89f7af1bd000 3628071188 C Ii:1:004:2 0:8 64 = 307c8000 80000008 80000880 0c1d0792 fe1a0dfe ffe9ff02 001d0792 fe190dfe
ffff89f7af1bd000 3628071226 S Ii:1:004:2 -115:8 64 <
ffff89f7af1bd000 3628087613 C Ii:1:004:2 0:8 64 = 30808000 80000008 80000880 0c210794 fe180dfe ffe6ff00 00210794 fe180dfe
ffff89f7af1bd000 3628087662 S Ii:1:004:2 -115:8 64 <
ffff89f7af1bd000 3628103125 C Ii:1:004:2 0:8 64 = 30838000 80000008 80000880 0c240794 fe170dfe ffe8ff01 00230794 fe170dfe
ffff89f7af1bd000 3628103162 S Ii:1:004:2 -115:8 64 <
ffff89f7af1bd000 3628127094 C Ii:1:004:2 0:8 64 = 30868000 80000008 80000880 0c240796 fe170dff ffe7ff02 00240795 fe170dfe
ffff89f7af1bd000 3628127138 S Ii:1:004:2 -115:8 64 <
ffff89f7af1bd000 3628136242 C Ii:1:004:2 0:8 64 = 308b8000 80000008 80000880 0c270794 fe180dff ffe8ff02 00260795 fe190dff
ffff89f7af1bd000 3628136279 S Ii:1:004:2 -115:8 64 <
ffff89f7af1bd000 3628153627 C Ii:1:004:2 0:8 64 = 308c8000 80000008 80000880 0c260794 fe180dff ffe6ff02 00270794 fe180dff
ffff89f7af1bd000 3628153669 S Ii:1:004:2 -115:8 64 <
ffff89f7af1bd000 3628175090 C Ii:1:004:2 0:8 64 = 30908000 80000008 80000880 0c250792 fe1a0dff ffe7ff02 00250792 fe1a0dff
ffff89f7af1bd000 3628175129 S Ii:1:004:2 -115:8 64 <
ffff89f7af1bd000 3628193763 C Ii:1:004:2 0:8 64 = 30948000 80000008 80000880 0c200794 fe170dfe ffe5ff03 00230793 fe170dfe
ffff89f7af1bd000 3628193802 S Ii:1:004:2 -115:8 64 <
ffff89f7af1bd000 3628208758 C Ii:1:004:2 0:8 64 = 30988000 80000008 80000880 0c220792 fe180dfd ffe7ff02 00220792 fe180dfd
ffff89f7af1bd000 3628208795 S Ii:1:004:2 -115:8 64 <
ffff89f7af1bd000 3628223076 C Ii:1:004:2 0:8 64 = 309b8000 80000008 80000880 0c21078f fe190dfc ffe7ff01 00210790 fe170dfc
ffff89f7af1bd000 3628223117 S Ii:1:004:2 -115:8 64 <
ffff89f7af1bd000 3628239175 C Ii:1:004:2 0:8 64 = 309e8000 80000008 80000880 0c210792 fe1c0dff ffe7ff01 00210791 fe1c0dfe
ffff89f7af1bd000 3628239213 S Ii:1:004:2 -115:8 64 <
ffff89f7af1bd000 3628256632 C Ii:1:004:2 0:8 64 = 30a18000 80000008 80000880 0c210791 fe180dfe ffe5ff01 00210792 fe190dfe
ffff89f7af1bd000 3628256677 S Ii:1:004:2 -115:8 64 <
ffff89f7af1bd000 3628279116 C Ii:1:004:2 0:8 64 = 30a48000 80000008 80000880 0c230790 fe1a0dfd ffe7ff02 00220790 fe190dfe
ffff89f7af1bd000 3628279154 S Ii:1:004:2 -115:8 64 <
ffff89f7af1bd000 3628288466 C Ii:1:004:2 0:8 64 = 30a98000 80000008 80000880 0c220794 fe140dff ffe7ff02 00220793 fe180dff
ffff89f7af1bd000 3628288510 S Ii:1:004:2 -115:8 64 <
ffff89f7af1bd000 3628303070 C Ii:1:004:2 0:8 64 = 30ab8000 80000008 80000880 0c230793 fe130dff ffe8ff02 00220794 fe140dff
ffff89f7af1bd000 3628303110 S Ii:1:004:2 -115:8 64 <
ffff89f7af1bd000 3628327190 C Ii:1:004:2 0:8 64 = 30ae8000 80000008 80000880 0c240794 fe170dfe ffe7ff02 00240793 fe150dfe
ffff89f7af1bd000 3628327234 S Ii:1:004:2 -115:8 64 <
ffff89f7af1bd000 3628343072 C Ii:1:004:2 0:8 64 = 30b38000 80000008 80000880 0c240796 fe160dff ffe7ff02 00220798 fe160dff
ffff89f7af1bd000 3628343110 S Ii:1:004:2 -115:8 64 <
ffff89f7af1bd000 3628351084 C Ii:1:004:2 0:8 64 = 30b68000 80000008 80000880 0c250791 fe180dfe ffe6ff03 00260793 fe180dff
ffff89f7af1bd000 3628351125 S Ii:1:004:2 -115:8 64 <
ffff89f7af1bd000 3628367172 C Ii:1:004:2 0:8 64 = 30b88000 80000008 80000880 0c260791 fe170dfe ffe7ff02 00260791 fe170dfe
ffff89f7af1bd000 3628367211 S Ii:1:004:2 -115:8 64 <
ffff89f7af1bd000 3628383100 C Ii:1:004:2 0:8 64 = 30bb8000 80000008 80000880 0c230792 fe180dfe ffe7ff01 00250792 fe180dfe
ffff89f7af1bd000 3628383138 S Ii:1:004:2 -115:8 64 <
ffff89f7af1bd000 3628402075 C Ii:1:004:2 0:8 64 = 30be8000 80000008 80000880 0c210791 fe150dff ffe7ff02 00220793 fe160dff
ffff89f7af1bd000 3628402116 S Ii:1:004:2 -115:8 64 <
ffff89f7af1bd000 3628414995 C Ii:1:004:2 0:8 64 = 30c18000 80000008 80000880 0c22078f fe140dfe ffe8ff01 0021078f fe150dfe
ffff89f7af1bd000 3628415032 S Ii:1:004:2 -115:8 64 <
ffff89f7af1bd000 3628431201 C Ii:1:004:2 0:8 64 = 30c48000 80000008 80000880 0c200790 fe150dff ffe6ff01 00220790 fe140dff
ffff89f7af1bd000 3628431241 S Ii:1:004:2 -115:8 64 <
ffff89f7af1bd000 3628440455 C Ii:1:004:2 0:8 64 = 30c88000 80000008 80000880 0c240793 fe1a0dfe ffe7ff02 00240793 fe1a0dfe
ffff89f7af1bd000 3628440502 S Ii:1:004:2 -115:8 64 <
ffff89f7af1bd000 3628455106 C Ii:1:004:2 0:8 64 = 30c98000 80000008 80000880 0c250794 fe1a0dfe ffe7ff03 00240793 fe1a0dfe
ffff89f7af1bd000 3628455150 S Ii:1:004:2 -115:8 64 <
ffff89f7af1bd000 3628471237 C Ii:1:004:2 0:8 64 = 30cc8000 80000008 80000880 0c230794 fe170dff ffe8ff01 00250795 fe190dff
ffff89f7af1bd000 3628471291 S Ii:1:004:2 -115:8 64 <
ffff89f7af1bd000 3628488768 C Ii:1:004:2 0:8 64 = 30d08000 80000008 80000880 0c210792 fe150dfd ffe7ff02 00210792 fe150dfd
ffff89f7af1bd000 3628488777 S Ii:1:004:2 -115:8 64 <
ffff89f7af1bd000 3628503738 C Ii:1:004:2 0:8 64 = 30d38000 80000008 80000880 0c240795 fe150dff ffe4ff03 00220793 fe150dfe
ffff89f7af1bd000 3628503782 S Ii:1:004:2 -115:8 64 <
ffff89f7af1bd000 3628519072 C Ii:1:004:2 0:8 64 = 30d68000 80000008 80000880 0c240795 fe190d00 00e7ff04 00240795 fe170d00
ffff89f7af1bd000 3628519118 S Ii:1:004:2 -115:8 64 <
ffff89f7af1bd000 3628536858 C Ii:1:004:2 0:8 64 = 30d98000 80000008 80000880 0c270794 fe170dff ffe6ff01 00260795 fe190dff
ffff89f7af1bd000 3628536901 S Ii:1:004:2 -115:8 64 <
ffff89f7af1bd000 3628559054 C Ii:1:004:2 0:8 64 = 30dc8000 80000008 80000880 0c240792 fe150d00 00e8ff02 00250793 fe160d00
ffff89f7af1bd000 3628559098 S Ii:1:004:2 -115:8 64 <
ffff89f7af1bd000 3628569261 C Ii:1:004:2 0:8 64 = 30e18000 80000008 80000880 0c20078f fe160d00 00e7ff01 00200792 fe150d00
ffff89f7af1bd000 3628569296 S Ii:1:004:2 -115:8 64 <
ffff89f7af1bd000 3628583751 C Ii:1:004:2 0:8 64 = 30e38000 80000008 80000880 0c200790 fe180dff ffe8ff00 0020078f fe160d00
ffff89f7af1bd000 3628583796 S Ii:1:004:2 -115:8 64 <
ffff89f7af1bd000 3628599196 C Ii:1:004:2 0:8 64 = 30e68000 80000008 80000880 0c1e0792 fe1a0dfe ffe8ff01 00200791 fe190dff
ffff89f7af1bd000 3628599240 S Ii:1:004:2 -115:8 64 <
ffff89f7af1bd000 3628615904 C Ii:1:004:2 0:8 64 = 30e98000 80000008 80000880 0c20078f fe1a0dff ffe7ff01 001e0791 fe190dfe
ffff89f7af1bd000 3628615945 S Ii:1:004:2 -115:8 64 <
ffff89f7af1bd000 3628632988 C Ii:1:004:2 0:8 64 = 30ec8000 80000008 80000880 0c22078e fe1a0dff ffe6ff01 0021078f fe1b0d00
ffff89f7af1bd000 3628633034 S Ii:1:004:2 -115:8 64 <
ffff89f7af1bd000 3628648563 C Ii:1:004:2 0:8 64 = 30f08000 80000008 80000880 0c220790 fe150dfe ffe6ff01 00220790 fe150dfe
ffff89f7af1bd000 3628648599 S Ii:1:004:2 -115:8 64 <
ffff89f7af1bd000 3628663061 C Ii:1:004:2 0:8 64 = 30f38000 80000008 80000880 0c250793 fe170d00 00e6ff02 00230793 fe150dfe
ffff89f7af1bd000 3628663102 S Ii:1:004:2 -115:8 64 <
ffff89f7af1bd000 3628680169 C Ii:1:004:2 0:8 64 = 30f68000 80000008 80000880 0c240796 fe180d00 00e6ff00 00260794 fe180d00
ffff89f7af1bd000 3628680204 S Ii:1:004:2 -115:8 64 <
ffff89f7af1bd000 3628695059 C Ii:1:004:2 0:8 64 = 30f98000 80000008 80000880 0c23079a fe150d00 00e8ff00 00230798 fe160dff
ffff89f7af1bd000 3628695100 S Ii:1:004:2 -115:8 64 <
ffff89f7af1bd000 3628711397 C Ii:1:004:2 0:8 64 = 30fc8000 80000008 80000880 0c260796 fe150dff ffe6ff01 00260799 fe160d00
ffff89f7af1bd000 3628711435 S Ii:1:004:2 -115:8 64 <
ffff89f7af1bd000 3628727084 C Ii:1:004:2 0:8 64 = 30008000 80000008 80000880 0c280795 fe130dfe ffe8ff01 00280795 fe130dfe
ffff89f7af1bd000 3628727129 S Ii:1:004:2 -115:8 64 <
ffff89f7af1bd000 3628744810 C Ii:1:004:2 0:8 64 = 30038000 80000008 80000880 0c290797 fe160d00 00e6ff01 00280797 fe140dff
ffff89f7af1bd000 3628744848 S Ii:1:004:2 -115:8 64 <
ffff89f7af1bd000 3628760542 C Ii:1:004:2 0:8 64 = 30068000 80000008 80000880 0c2a0792 fe150dff ffe7ff02 002a0794 fe170dff
ffff89f7af1bd000 3628760588 S Ii:1:004:2 -115:8 64 <
ffff89f7af1bd000 3628775947 C Ii:1:004:2 0:8 64 = 30098000 80000008 80000880 0c260796 fe120dff ffe7ff01 00270793 fe130dff
ffff89f7af1bd000 3628775985 S Ii:1:004:2 -115:8 64 <
ffff89f7af1bd000 3628793717 C Ii:1:004:2 0:8 64 = 300c8000 80000008 80000880 0c290793 fe150dff ffe7ff01 00270796 fe130dff
ffff89f7af1bd000 3628793763 S Ii:1:004:2 -115:8 64 <
ffff89f7af1bd000 3628807730 C Ii:1:004:2 0:8 64 = 30108000 80000008 80000880 0c230793 fe190dff ffe5ff01 00230793 fe190dff
ffff89f7af1bd000 3628807766 S Ii:1:004:2 -115:8 64 <
ffff89f7af1bd000 3628823663 C Ii:1:004:2 0:8 64 = 30138000 80000008 80000880 0c1d0791 fe190dff ffe8ff02 001e0793 fe190dff
ffff89f7af1bd000 3628823706 S Ii:1:004:2 -115:8 64 <
ffff89f7af1bd000 3628839886 C Ii:1:004:2 0:8 64 = 30168000 80000008 80000880 0c1e078f fe1c0dff ffe7ff03 001e078e fe1b0dff
ffff89f7af1bd000 3628839922 S Ii:1:004:2 -115:8 64 <
ffff89f7af1bd000 3628855066 C Ii:1:004:2 0:8 64 = 30198000 80000008 80000880 0c1f0792 fe1d0dff ffe7ff00 001f0791 fe1d0dff
ffff89f7af1bd000 3628855111 S Ii:1:004:2 -115:8 64 <
ffff89f7af1bd000 3628871317 C Ii:1:004:2 0:8 64 = 301c8000 80000008 80000880 0c1e078f fe1c0dfe ffe7ff02 001f0792 fe1d0dff
ffff89f7af1bd000 3628871357 S Ii:1:004:2 -115:8 64 <
ffff89f7af1bd000 3628889094 C Ii:1:004:2 0:8 64 = 30208000 80000008 80000880 0c220792 fe1d0dfe ffe5ff02 00220792 fe1d0dfe
ffff89f7af1bd000 3628889136 S Ii:1:004:2 -115:8 64 <
ffff89f7af1bd000 3628904052 C Ii:1:004:2 0:8 64 = 30238000 80000008 80000880 0c270797 fe1a0dff ffe7ffff ff260796 fe1d0dff
ffff89f7af1bd000 3628904092 S Ii:1:004:2 -115:8 64 <
ffff89f7af1bd000 3628918971 C Ii:1:004:2 0:8 64 = 30268000 80000008 80000880 0c250793 fe150dff ffe7ff02 00270795 fe150dff
ffff89f7af1bd000 3628919015 S Ii:1:004:2 -115:8 64 <
ffff89f7af1bd000 3628935918 C Ii:1:004:2 0:8 64 = 30298000 80000008 80000880 0c250793 fe170dfe ffe8ff01 00240792 fe160dfe
ffff89f7af1bd000 3628935958 S Ii:1:004:2 -115:8 64 <
ffff89f7af1bd000 3628952389 C Ii:1:004:2 0:8 64 = 302c8000 80000008 80000880 0c270792 fe190dfd ffe6ff00 00270793 fe190dfd
ffff89f7af1bd000 3628952449 S Ii:1:004:2 -115:8 64 <
ffff89f7af1bd000 3628968532 C Ii:1:004:2 0:8 64 = 30308000 80000008 80000880 0c260792 fe160dff ffe7ff02 00260792 fe160dff
ffff89f7af1bd000 3628968570 S Ii:1:004:2 -115:8 64 <
ffff89f7af1bd000 3628984066 C Ii:1:004:2 0:8 64 = 30338000 80000008 80000880 0c260791 fe160dff ffe7ff02 00260792 fe160dff
ffff89f7af1bd000 3628984105 S Ii:1:004:2 -115:8 64 <
ffff89f7af1bd000 3629000663 C Ii:1:004:2 0:8 64 = 30368000 80000008 80000880 0c280792 fe140dff ffe8ff00 00260791 fe140dff
ffff89f7af1bd000 3629000705 S Ii:1:004:2 -115:8 64 <
ffff89f7af1bd000 3629015054 C Ii:1:004:2 0:8 64 = 30398000 80000008 80000880 0c280794 fe180dff ffe6ff02 00290793 fe160dff
ffff89f7af1bd000 3629015091 S Ii:1:004:2 -115:8 64 <
ffff89f7af1bd000 3629039147 C Ii:1:004:2 0:8 64 = 303c8000 80000008 80000880 0c260798 fe180dff ffe7ff02 00280797 fe190dff
ffff89f7af1bd000 3629039208 S Ii:1:004:2 -115:8 64 <
ffff89f7af1bd000 3629057794 C Ii:1:004:2 0:8 64 = 30418000 80000008 80000880 0c210794 fe150dff ffe5ff02 00210794 fe150dfe
ffff89f7af1bd000 3629057859 S Ii:1:004:2 -115:8 64 <
ffff89f7af1bd000 3629073789 C Ii:1:004:2 0:8 64 = 30448000 80000008 80000880 0c230795 fe1e0dff ffe8ff02 00220795 fe1a0d00
ffff89f7af1bd000 3629073825 S Ii:1:004:2 -115:8 64 <
ffff89f7af1bd000 3629087080 C Ii:1:004:2 0:8 64 = 30488000 80000008 80000880 0c200792 fe1c0dfe ffe6ff01 00200792 fe1c0dfe
ffff89f7af1bd000 3629087122 S Ii:1:004:2 -115:8 64 <
ffff89f7af1bd000 3629103161 C Ii:1:004:2 0:8 64 = 304b8000 80000008 80000880 0c1d0792 fe170dfe ffe8ff00 001f0793 fe190dfd
ffff89f7af1bd000 3629103199 S Ii:1:004:2 -115:8 64 <
ffff89f7af1bd000 3629112269 C Ii:1:004:2 0:8 64 = 304e8000 80000008 80000880 0c21078f fe190d00 00e7ff01 001e0790 fe180dff
ffff89f7af1bd000 3629112306 S Ii:1:004:2 -115:8 64 <
ffff89f7af1bd000 3629127084 C Ii:1:004:2 0:8 64 = 30508000 80000008 80000880 0c23078f fe190d00 00e6ff02 0023078f fe190d00
ffff89f7af1bd000 3629127132 S Ii:1:004:2 -115:8 64 <
ffff89f7af1bd000 3629153821 C Ii:1:004:2 0:8 64 = 30538000 80000008 80000880 0c240795 fe130dff ffe8ff01 00230792 fe160d00
ffff89f7af1bd000 3629153864 S Ii:1:004:2 -115:8 64 <
ffff89f7af1bd000 3629167000 C Ii:1:004:2 0:8 64 = 30588000 80000008 80000880 0c230795 fe160dff ffe6ff02 00230795 fe160dff
ffff89f7af1bd000 3629167037 S Ii:1:004:2 -115:8 64 <
ffff89f7af1bd000 3629183134 C Ii:1:004:2 0:8 64 = 305b8000 80000008 80000880 0c260798 fe1a0dfe ffe6ff01 00250798 fe190dff
ffff89f7af1bd000 3629183180 S Ii:1:004:2 -115:8 64 <
ffff89f7af1bd000 3629198958 C Ii:1:004:2 0:8 64 = 305e8000 80000008 80000880 0c260795 fe120dfd ffe7ffff ff260797 fe180dfd
ffff89f7af1bd000 3629198996 S Ii:1:004:2 -115:8 64 <
ffff89f7af1bd000 3629216549 C Ii:1:004:2 0:8 64 = 30618000 80000008 80000880 0c230794 fe160dfe ffe9ff01 00240794 fe120dfe
ffff89f7af1bd000 3629216588 S Ii:1:004:2 -115:8 64 <
ffff89f7af1bd000 3629239030 C Ii:1:004:2 0:8 64 = 30648000 80000008 80000880 0c22078f fe170dfe ffe8ff03 00220791 fe180dfe
ffff89f7af1bd000 3629239075 S Ii:1:004:2 -115:8 64 <
ffff89f7af1bd000 3629249027 C Ii:1:004:2 0:8 64 = 30698000 80000008 80000880 0c200791 fe190dff ffe7ff01 0020078f fe170dff
ffff89f7af1bd000 3629249071 S Ii:1:004:2 -115:8 64 <
ffff89f7af1bd000 3629273574 C Ii:1:004:2 0:8 64 = 306b8000 80000008 80000880 0c1f0791 fe1a0dff ffe7ff02 00200791 fe190dff
ffff89f7af1bd000 3629273614 S Ii:1:004:2 -115:8 64 <
ffff89f7af1bd000 3629286998 C Ii:1:004:2 0:8 64 = 30708000 80000008 80000880 0c1e0793 fe150dfe ffe8ff01 001e0793 fe150dfe
ffff89f7af1bd000 3629287036 S Ii:1:004:2 -115:8 64 <
ffff89f7af1bd000 3629303744 C Ii:1:004:2 0:8 64 = 30738000 80000008 80000880 0c220793 fe160dfe ffe7ff01 00200793 fe150dfd
ffff89f7af1bd000 3629303794 S Ii:1:004:2 -115:8 64 <
ffff89f7af1bd000 3629320471 C Ii:1:004:2 0:8 64 = 30768000 80000008 80000880 0c240793 fe170dff ffe7ff01 00230793 fe170dff
ffff89f7af1bd000 3629320482 S Ii:1:004:2 -115:8 64 <
ffff89f7af1bd000 3629343062 C Ii:1:004:2 0:8 64 = 30798000 80000008 80000880 0c230792 fe160dfe ffe5ff00 00240793 fe170dfe
ffff89f7af1bd000 3629343103 S Ii:1:004:2 -115:8 64 <
ffff89f7af1bd000 3629358944 C Ii:1:004:2 0:8 64 = 307e8000 80000008 80000880 0c260791 fe130dfe ffe7ff03 00250790 fe140dfe
ffff89f7af1bd000 3629358983 S Ii:1:004:2 -115:8 64 <
ffff89f7af1bd000 3629375044 C Ii:1:004:2 0:8 64 = 30818000 80000008 80000880 0c240793 fe190dfe ffe6ff02 00250793 fe150dfe
ffff89f7af1bd000 3629375084 S Ii:1:004:2 -115:8 64 <
ffff89f7af1bd000 3629390994 C Ii:1:004:2 0:8 64 = 30848000 80000008 80000880 0c250792 fe180d00 00e8ff02 00240792 fe190dff
ffff89f7af1bd000 3629391032 S Ii:1:004:2 -115:8 64 <
ffff89f7af1bd000 3629399451 C Ii:1:004:2 0:8 64 = 30888000 80000008 80000880 0c240793 fe190dff ffe7ff02 00240793 fe190dff
ffff89f7af1bd000 3629399488 S Ii:1:004:2 -115:8 64 <
ffff89f7af1bd000 3629416650 C Ii:1:004:2 0:8 64 = 30898000 80000008 80000880 0c250793 fe180dfe ffe7ff01 00240793 fe190dff
ffff89f7af1bd000 3629416719 S Ii:1:004:2 -115:8 64 <
ffff89f7af1bd000 3629440911 C Ii:1:004:2 0:8 64 = 308c8000 80000008 80000880 0c220795 fe170dfe ffe6ff00 00240795 fe180dfe
ffff89f7af1bd000 3629440954 S Ii:1:004:2 -115:8 64 <
ffff89f7af1bd000 3629455058 C Ii:1:004:2 0:8 64 = 30918000 80000008 80000880 0c250790 fe1b0dff ffe8ff01 00230791 fe180dfe
ffff89f7af1bd000 3629455103 S Ii:1:004:2 -115:8 64 <
ffff89f7af1bd000 3629463853 C Ii:1:004:2 0:8 64 = 30948000 80000008 80000880 0c240794 fe1e0dff ffe7ff00 00260791 fe1d0d00
ffff89f7af1bd000 3629463889 S Ii:1:004:2 -115:8 64 <
ffff89f7af1bd000 3629478997 C Ii:1:004:2 0:8 64 = 30968000 80000008 80000880 0c220795 fe1c0dfe ffe7ff00 00240794 fe1e0dff
ffff89f7af1bd000 3629479032 S Ii:1:004:2 -115:8 64 <
ffff89f7af1bd000 3629505413 C Ii:1:004:2 0:8 64 = 30998000 80000008 80000880 0c220791 fe150dfe ffe8ff02 00210793 fe170dfe
ffff89f7af1bd000 3629505452 S Ii:1:004:2 -115:8 64 <
ffff89f7af1bd000 3629521379 C Ii:1:004:2 0:8 64 = 309e8000 80000008 80000880 0c220797 fe1a0dff ffe7ff01 00220796 fe190dff
ffff89f7af1bd000 3629521423 S Ii:1:004:2 -115:8 64 <
ffff89f7af1bd000 3629537850 C Ii:1:004:2 0:8 64 = 30a18000 80000008 80000880 0c220793 fe140d00 00e5ff02 00220795 fe170d00
ffff89f7af1bd000 3629537904 S Ii:1:004:2 -115:8 64 <
ffff89f7af1bd000 3629551684 C Ii:1:004:2 0:8 64 = 30a48000 80000008 80000880 0c240792 fe180dff ffe7ff00 00210791 fe140d00
ffff89f7af1bd000 3629551719 S Ii:1:004:2 -115:8 64 <
ffff89f7af1bd000 3629569136 C Ii:1:004:2 0:8 64 = 30a88000 80000008 80000880 0c250795 fe190dfe ffe7ff00 00250795 fe190dfe
ffff89f7af1bd000 3629569179 S Ii:1:004:2 -115:8 64 <
ffff89f7af1bd000 3629583965 C Ii:1:004:2 0:8 64 = 30ab8000 80000008 80000880 0c220793 fe190dff ffe5ff02 00240794 fe190dfe
ffff89f7af1bd000 3629584011 S Ii:1:004:2 -115:8 64 <
ffff89f7af1bd000 3629600349 C Ii:1:004:2 0:8 64 = 30ae8000 80000008 80000880 0c260795 fe180dfe ffe7ff03 00240794 fe180dff
ffff89f7af1bd000 3629600393 S Ii:1:004:2 -115:8 64 <
ffff89f7af1bd000 3629616098 C Ii:1:004:2 0:8 64 = 30b18000 80000008 80000880 0c250793 fe1a0dff ffe7ff01 00250795 fe190dfe
ffff89f7af1bd000 3629616137 S Ii:1:004:2 -115:8 64 <
ffff89f7af1bd000 3629632764 C Ii:1:004:2 0:8 64 = 30b48000 80000008 80000880 0c280792 fe1b0d00 00e7ff02 00260791 fe1b0d00
ffff89f7af1bd000 3629632802 S Ii:1:004:2 -115:8 64 <
ffff89f7af1bd000 3629647008 C Ii:1:004:2 0:8 64 = 30b88000 80000008 80000880 0c230796 fe190dff ffe6ff03 00230796 fe190dff
ffff89f7af1bd000 3629647043 S Ii:1:004:2 -115:8 64 <
ffff89f7af1bd000 3629664085 C Ii:1:004:2 0:8 64 = 30bb8000 80000008 80000880 0c260794 fe180dff ffe7ff02 00250796 fe180dff
ffff89f7af1bd000 3629664127 S Ii:1:004:2 -115:8 64 <
ffff89f7af1bd000 3629679127 C Ii:1:004:2 0:8 64 = 30be8000 80000008 80000880 0c270795 fe1a0dfe ffe8ff01 00260793 fe190dfe
ffff89f7af1bd000 3629679162 S Ii:1:004:2 -115:8 64 <
ffff89f7af1bd000 3629695022 C Ii:1:004:2 0:8 64 = 30c18000 80000008 80000880 0c2a0797 fe190d01 00e8ff01 00270796 fe1a0d00
ffff89f7af1bd000 3629695063 S Ii:1:004:2 -115:8 64 <
ffff89f7af1bd000 3629712949 C Ii:1:004:2 0:8 64 = 30c48000 80000008 80000880 0c280798 fe140d00 00e7ff02 002b0797 fe160d01
ffff89f7af1bd000 3629712992 S Ii:1:004:2 -115:8 64 <
ffff89f7af1bd000 3629726997 C Ii:1:004:2 0:8 64 = 30c88000 80000008 80000880 0c250789 fe150dfd ffe9ff02 00250789 fe150dfd
ffff89f7af1bd000 3629727041 S Ii:1:004:2 -115:8 64 <
ffff89f7af1bd000 3629736781 C Ii:1:004:2 0:8 64 = 30cb8000 80000008 80000880 0c1f0787 fe160dff ffe8ff00 00250781 fe130dfe
ffff89f7af1bd000 3629736816 S Ii:1:004:2 -115:8 64 <
ffff89f7af1bd000 3629761960 C Ii:1:004:2 0:8 64 = 30cc8000 80000008 80000880 0c1b0793 fe1b0d00 00e7ff00 001f0787 fe160dff
ffff89f7af1bd000 3629762004 S Ii:1:004:2 -115:8 64 <
ffff89f7af1bd000 3629775013 C Ii:1:004:2 0:8 64 = 30d18000 80000008 80000880 0c30078e fe100dfe ffe7ff03 0025079b fe160dff
ffff89f7af1bd000 3629775049 S Ii:1:004:2 -115:8 64 <
ffff89f7af1bd000 3629791924 C Ii:1:004:2 0:8 64 = 30d48000 80000008 80000880 0c2e078b fe110dfe ffe8ff01 00320789 fe0e0dfe
ffff89f7af1bd000 3629791965 S Ii:1:004:2 -115:8 64 <
ffff89f7af1bd000 3629810170 C Ii:1:004:2 0:8 64 = 30d88000 80000008 80000880 0c1207a1 fe200dff ffe5ff00 001207a1 fe200dff
ffff89f7af1bd000 3629810205 S Ii:1:004:2 -115:8 64 <
ffff89f7af1bd000 3629823023 C Ii:1:004:2 0:8 64 = 30db8000 80000008 80000880 0c190794 fe190dff ffe7ff02 000f07a3 fe240dff
ffff89f7af1bd000 3629823064 S Ii:1:004:2 -115:8 64 <
ffff89f7af1bd000 3629840133 C Ii:1:004:2 0:8 64 = 30de8000 80000008 80000880 0c2d0786 fe0f0dff ffe7ff01 002a0788 fe100dff
ffff89f7af1bd000 3629840171 S Ii:1:004:2 -115:8 64 <
ffff89f7af1bd000 3629855018 C Ii:1:004:2 0:8 64 = 30e18000 80000008 80000880 0c15079a fe230dfe ffe7ff00 0023078e fe170dff
ffff89f7af1bd000 3629855062 S Ii:1:004:2 -115:8 64 <
ffff89f7af1bd000 3629871123 C Ii:1:004:2 0:8 64 = 30e48000 80000008 80000880 0c1e0792 fe1c0d00 00e7ff02 00140799 fe230dff
ffff89f7af1bd000 3629871191 S Ii:1:004:2 -115:8 64 <
ffff89f7af1bd000 3629888214 C Ii:1:004:2 0:8 64 = 30e88000 80000008 80000880 0c28078f fe150dff ffe6ff01 0028078f fe150dff
ffff89f7af1bd000 3629888255 S Ii:1:004:2 -115:8 64 <
ffff89f7af1bd000 3629903106 C Ii:1:004:2 0:8 64 = 30eb8000 80000008 80000880 0c1b07a0 fe190dff ffe8ff01 001f079a fe180dff
ffff89f7af1bd000 3629903146 S Ii:1:004:2 -115:8 64 <
ffff89f7af1bd000 3629919895 C Ii:1:004:2 0:8 64 = 30ee8000 80000008 80000880 0c2d0792 fe140dff ffe5ff02 0021079b fe170dff
ffff89f7af1bd000 3629919941 S Ii:1:004:2 -115:8 64 <
ffff89f7af1bd000 3629936705 C Ii:1:004:2 0:8 64 = 30f18000 80000008 80000880 0c2b0792 fe150dfe ffe8ff01 0030078e fe130dff
ffff89f7af1bd000 3629936755 S Ii:1:004:2 -115:8 64 <
ffff89f7af1bd000 3629959010 C Ii:1:004:2 0:8 64 = 30f48000 80000008 80000880 0c1b079f fe1b0dff ffe6ff02 0023079a fe180dfe
ffff89f7af1bd000 3629959051 S Ii:1:004:2 -115:8 64 <
ffff89f7af1bd000 3629977857 C Ii:1:004:2 0:8 64 = 30f98000 80000008 80000880 0c270787 fe140dff ffe7ff03 0023078e fe160d00
ffff89f7af1bd000 3629977907 S Ii:1:004:2 -115:8 64 <
ffff89f7af1bd000 3629993781 C Ii:1:004:2 0:8 64 = 30fc8000 80000008 80000880 0c1e0793 fe190dff ffe6ff02 0024078a fe160dff
ffff89f7af1bd000 3629993819 S Ii:1:004:2 -115:8 64 <
ffff89f7af1bd000 3630007647 C Ii:1:004:2 0:8 64 = 30008000 80000008 80000880 0c230797 fe190dff ffe7ff03 00230797 fe190dff
ffff89f7af1bd000 3630007694 S Ii:1:004:2 -115:8 64 <
ffff89f7af1bd000 3630023038 C Ii:1:004:2 0:8 64 = 30038000 80000008 80000880 0c290792 fe150dfe ffe8ff03 00290794 fe160dfe
ffff89f7af1bd000 3630023079 S Ii:1:004:2 -115:8 64 <
ffff89f7af1bd000 3630041058 C Ii:1:004:2 0:8 64 = 30068000 80000008 80000880 0c200796 fe180dfe ffe8ff02 00240794 fe160dfe
ffff89f7af1bd000 3630041095 S Ii:1:004:2 -115:8 64 <
ffff89f7af1bd000 3630065495 C Ii:1:004:2 0:8 64 = 30098000 80000008 80000880 0c230794 fe1b0dfe ffe5ff01 00200796 fe1a0dfe
ffff89f7af1bd000 3630065535 S Ii:1:004:2 -115:8 64 <
ffff89f7af1bd000 3630081628 C Ii:1:004:2 0:8 64 = 300e8000 80000078 82000880 0ca507ef fe1d0dd1 ff4100f1 ff4f07b4 fe150df3
ffff89f7af1bd000 3630081661 S Ii:1:004:2 -115:8 64 <
ffff89f7af1bd000 3630094908 C Ii:1:004:2 0:8 64 = 30118000 8000f787 88000880 0ca608a0 ff4d0d80 fedc01af ff5c086a ff320d56
ffff89f7af1bd000 3630094947 S Ii:1:004:2 -115:8 64 <
ffff89f7af1bd000 3630113039 C Ii:1:004:2 0:8 64 = 30148000 8000f777 85000880 0c0e07bb fe6e0d0a fdbd0330 ff2b085e ff5f0dcb
ffff89f7af1bd000 3630113078 S Ii:1:004:2 -115:8 64 <
ffff89f7af1bd000 3630127906 C Ii:1:004:2 0:8 64 = 30188000 80000008 80000880 0ce4052c fe6a0db4 fc1a04c8 fee4052c fe6a0db4
ffff89f7af1bd000 3630127950 S Ii:1:004:2 -115:8 64 <
ffff89f7af1bd000 3630143108 C Ii:1:004:2 0:8 64 = 301b8000 80000008 80000880 0c7905f9 fd750d42 fd5403d5 febe051b fe6e0df1
ffff89f7af1bd000 3630143144 S Ii:1:004:2 -115:8 64 <
ffff89f7af1bd000 3630159169 C Ii:1:004:2 0:8 64 = 301e8000 80000008 80000880 0c9405b2 fd7e0d37 fe220238 ff5805c6 fd7c0dcf
ffff89f7af1bd000 3630159227 S Ii:1:004:2 -115:8 64 <
ffff89f7af1bd000 3630176041 C Ii:1:004:2 0:8 64 = 30218000 80000008 80000880 0ce905c8 fd870ded fe5301b9 fff705bf fd820d9d
ffff89f7af1bd000 3630176081 S Ii:1:004:2 -115:8 64 <
ffff89f7af1bd000 3630198958 C Ii:1:004:2 0:8 64 = 30248000 8000f777 7d000880 0cd90486 fda20db1 ff5f0000 005605b2 fd930d35
ffff89f7af1bd000 3630199001 S Ii:1:004:2 -115:8 64 <
ffff89f7af1bd000 3630206969 C Ii:1:004:2 0:8 64 = 30298000 8000e777 78000880 0c410545 fd9d0db6 00f0fe0f 00e10450 fda60d81
ffff89f7af1bd000 3630207003 S Ii:1:004:2 -115:8 64 <
ffff89f7af1bd000 3630223507 C Ii:1:004:2 0:8 64 = 302b8000 8000e767 74000880 0cb8053b fd8e0dd8 00cdfe02 00410545 fd9d0db6
ffff89f7af1bd000 3630223556 S Ii:1:004:2 -115:8 64 <
ffff89f7af1bd000 3630240886 C Ii:1:004:2 0:8 64 = 302e8000 8000e767 69000880 0c420650 fd780dd0 00c7fece fffe053d fd7d0ddc
ffff89f7af1bd000 3630240935 S Ii:1:004:2 -115:8 64 <
ffff89f7af1bd000 3630254902 C Ii:1:004:2 0:8 64 = 30318000 80002758 57000880 0c5606e8 fd9f0d85 0017ff87 ff590697 fd870dad
ffff89f7af1bd000 3630254947 S Ii:1:004:2 -115:8 64 <
ffff89f7af1bd000 3630271013 C Ii:1:004:2 0:8 64 = 30348000 8000e838 37000880 0c860673 febb0df3 ffcaff53 ff620648 feb60d41
ffff89f7af1bd000 3630271050 S Ii:1:004:2 -115:8 64 <
ffff89f7af1bd000 3630289208 C Ii:1:004:2 0:8 64 = 30388000 8000c919 12000880 0c0e07a3 fea90d5e ff8a003c ff0e07a3 fea90d5e
ffff89f7af1bd000 3630289252 S Ii:1:004:2 -115:8 64 <
ffff89f7af1bd000 3630305022 C Ii:1:004:2 0:8 64 = 303b8000 8000290a 05000880 0c880652 fe900de8 fe29014a ff1907a3 fea50d1a
ffff89f7af1bd000 3630305066 S Ii:1:004:2 -115:8 64 <
ffff89f7af1bd000 3630318922 C Ii:1:004:2 0:8 64 = 303e8000 8000390a 05000880 0c380554 fd2d0dcb ff1900ba ffd205df fd660d38
ffff89f7af1bd000 3630318969 S Ii:1:004:2 -115:8 64 <
ffff89f7af1bd000 3630334939 C Ii:1:004:2 0:8 64 = 30418000 8000890a 06000880 0cb0058e fd5f0d15 0184fe2d 003d0545 fd320da7
ffff89f7af1bd000 3630334978 S Ii:1:004:2 -115:8 64 <
ffff89f7af1bd000 3630353020 C Ii:1:004:2 0:8 64 = 30448000 80003a0b 0b000880 0c66062a fead0d19 017cfe20 002f0602 fe9a0d3a
ffff89f7af1bd000 3630353068 S Ii:1:004:2 -115:8 64 <
ffff89f7af1bd000 3630368132 C Ii:1:004:2 0:8 64 = 30488000 80002b1c 13000880 0ca30610 feaa0d66 0051ffd0 ffa30610 feaa0d66
ffff89f7af1bd000 3630368182 S Ii:1:004:2 -115:8 64 <
ffff89f7af1bd000 3630383092 C Ii:1:004:2 0:8 64 = 304b8000 80000c1d 1c000880 0c13077b feb50d82 ff5d006d ffd6062e fead0d0b
ffff89f7af1bd000 3630383135 S Ii:1:004:2 -115:8 64 <
ffff89f7af1bd000 3630399005 C Ii:1:004:2 0:8 64 = 304e8000 8000bc2d 27000880 0c5e0717 ffb90d95 fe83013c ff3907c0 feb90d18
ffff89f7af1bd000 3630399064 S Ii:1:004:2 -115:8 64 <
ffff89f7af1bd000 3630414963 C Ii:1:004:2 0:8 64 = 30518000 8000dd3d 3b000880 0c1a07da ff9f0df7 fd5c0269 ff650743 ffb70d24
ffff89f7af1bd000 3630415004 S Ii:1:004:2 -115:8 64 <
ffff89f7af1bd000 3630433747 C Ii:1:004:2 0:8 64 = 30548000 8000bb5c 59000880 0c0d0609 ff690db3 fea50143 007506fc ff600d4b
ffff89f7af1bd000 3630433797 S Ii:1:004:2 -115:8 64 <
ffff89f7af1bd000 3630447355 C Ii:1:004:2 0:8 64 = 30588000 8000996a 76000880 0c78052d fdba0d13 ff3f0175 0078052d fdba0d13
ffff89f7af1bd000 3630447399 S Ii:1:004:2 -115:8 64 <
ffff89f7af1bd000 3630464895 C Ii:1:004:2 0:8 64 = 305b8000 8000e888 8a000880 0c0704f2 fb770d9f ff820038 00a0047d fca60d38
ffff89f7af1bd000 3630464941 S Ii:1:004:2 -115:8 64 <
ffff89f7af1bd000 3630481216 C Ii:1:004:2 0:8 64 = 305e8000 80002788 96000880 0c3a056a fdf70d0f 00c8fff1 ff2c0437 fc930df2
ffff89f7af1bd000 3630481252 S Ii:1:004:2 -115:8 64 <
ffff89f7af1bd000 3630498488 C Ii:1:004:2 0:8 64 = 30618000 8000d797 9d000880 0cbf0597 fee90da0 ff3800a3 ffba0524 fe2a0ee1
ffff89f7af1bd000 3630498536 S Ii:1:004:2 -115:8 64 <
ffff89f7af1bd000 3630511896 C Ii:1:004:2 0:8 64 = 30648000 8000a797 9e000880 0c710540 fea10dbc ff0a0080 ff9c0590 fe910da6
ffff89f7af1bd000 3630511962 S Ii:1:004:2 -115:8 64 <
ffff89f7af1bd000 3630526880 C Ii:1:004:2 0:8 64 = 30688000 8000a797 9a000880 0c3e050c febb0dca ffeaff4e ff3e050c febb0dca
ffff89f7af1bd000 3630526928 S Ii:1:004:2 -115:8 64 <
ffff89f7af1bd000 3630543852 C Ii:1:004:2 0:8 64 = 306b8000 8000f787 8c000880 0cc005b4 fdc60df0 ffaaff4c ff6005f2 fdb10de0
ffff89f7af1bd000 3630543896 S Ii:1:004:2 -115:8 64 <
ffff89f7af1bd000 3630559117 C Ii:1:004:2 0:8 64 = 306e8000 80000078 81000880 0c3b06ec fcab0dce ffe7ff77 ff450649 fdd70de3
ffff89f7af1bd000 3630559165 S Ii:1:004:2 -115:8 64 <
ffff89f7af1bd000 3630575726 C Ii:1:004:2 0:8 64 = 30718000 80000008 80000880 0c4a05d4 fc770d39 007bffd4 ffb605b7 fc790de4
ffff89f7af1bd000 3630575775 S Ii:1:004:2 -115:8 64 <
ffff89f7af1bd000 3630592873 C Ii:1:004:2 0:8 64 = 30748000 80000008 80000880 0c440595 fdb40dd9 00cdfe2a 002f052f fd9a0d85
ffff89f7af1bd000 3630592917 S Ii:1:004:2 -115:8 64 <
ffff89f7af1bd000 3630608232 C Ii:1:004:2 0:8 64 = 30788000 80000078 80000880 0ca005ac fda20d2e 0168fe32 00a005ac fda20d2e
ffff89f7af1bd000 3630608270 S Ii:1:004:2 -115:8 64 <
ffff89f7af1bd000 3630623793 C Ii:1:004:2 0:8 64 = 307b8000 80000008 80000880 0cd505e3 fd9b0d57 012ffe33 00c705be fd9a0d49
ffff89f7af1bd000 3630623837 S Ii:1:004:2 -115:8 64 <
ffff89f7af1bd000 3630646975 C Ii:1:004:2 0:8 64 = 307e8000 80000008 80000880 0c1a0586 fd670de6 017efd50 008205d7 fd890d7a
ffff89f7af1bd000 3630647019 S Ii:1:004:2 -115:8 64 <
ffff89f7af1bd000 3630654918 C Ii:1:004:2 0:8 64 = 30838000 80000008 80000880 0c61056c fd1e0d8b 0371fb93 00240539 fd270d11
ffff89f7af1bd000 3630654973 S Ii:1:004:2 -115:8 64 <
ffff89f7af1bd000 3630671037 C Ii:1:004:2 0:8 64 = 30848000 80000008 80000880 0cdd05e6 fd8a0d06 04ddfaa5 0061056c fd1e0d8b
ffff89f7af1bd000 3630671081 S Ii:1:004:2 -115:8 64 <
ffff89f7af1bd000 3630687139 C Ii:1:004:2 0:8 64 = 30888000 80000008 80000880 0c6508c7 00580f97 01c1fe31 016508c7 00580f97
ffff89f7af1bd000 3630687181 S Ii:1:004:2 -115:8 64 <
ffff89f7af1bd000 3630702918 C Ii:1:004:2 0:8 64 = 308b8000 80000008 80000880 0c6a0616 ff2c0cb7 ff6101c6 00ad0732 00950dd0
ffff89f7af1bd000 3630702964 S Ii:1:004:2 -115:8 64 <
ffff89f7af1bd000 3630718958 C Ii:1:004:2 0:8 64 = 308e8000 80000008 80000880 0c250a18 ff490c3a 0055ff37 ff430893 fedc0b47
ffff89f7af1bd000 3630719006 S Ii:1:004:2 -115:8 64 <
ffff89f7af1bd000 3630734893 C Ii:1:004:2 0:8 64 = 30918000 80000008 80000880 0ca00705 ff440d8a ff41009a ff9d0980 ffe30caf
ffff89f7af1bd000 3630734936 S Ii:1:004:2 -115:8 64 <
ffff89f7af1bd000 3630750911 C Ii:1:004:2 0:8 64 = 30948000 80000008 80000880 0c4b0641 fe5a0d13 00cdff06 00ea053c fe650dc6
ffff89f7af1bd000 3630750955 S Ii:1:004:2 -115:8 64 <
ffff89f7af1bd000 3630769088 C Ii:1:004:2 0:8 64 = 30988000 80000008 80000880 0c2e07ae fe350d08 00dcff03 002e07ae fe350d08
ffff89f7af1bd000 3630769135 S Ii:1:004:2 -115:8 64 <
ffff89f7af1bd000 3630775235 C Ii:1:004:2 0:8 64 = 309b8000 80000008 80000880 0cc80697 fe430df6 fff0ffff ff0907ab fe390df6
ffff89f7af1bd000 3630775275 S Ii:1:004:2 -115:8 64 <
ffff89f7af1bd000 3630800698 C Ii:1:004:2 0:8 64 = 309c8000 80000008 80000880 0cbb068c fe460dfd ffe7ff02 00c80697 fe430df6
ffff89f7af1bd000 3630800742 S Ii:1:004:2 -115:8 64 <
ffff89f7af1bd000 3630808783 C Ii:1:004:2 0:8 64 = 30a18000 80000008 80000880 0cdc0692 fe410dfe ffe8ff01 00dd068f fe410d00
ffff89f7af1bd000 3630808826 S Ii:1:004:2 -115:8 64 <
ffff89f7af1bd000 3630830977 C Ii:1:004:2 0:8 64 = 30a38000 80000008 80000880 0cd60692 fe3e0dfd ffeaff00 00dc0692 fe410dfe
ffff89f7af1bd000 3630831025 S Ii:1:004:2 -115:8 64 <
ffff89f7af1bd000 3630838869 C Ii:1:004:2 0:8 64 = 30a88000 80000008 80000880 0cb10689 fe470dfa ffebfff7 ffb10689 fe470dfa
ffff89f7af1bd000 3630838906 S Ii:1:004:2 -115:8 64 <
ffff89f7af1bd000 3630854951 C Ii:1:004:2 0:8 64 = 30a98000 80000008 80000880 0cd706a5 fe3e0d01 00e3fffa ffb10689 fe470dfa
ffff89f7af1bd000 3630854997 S Ii:1:004:2 -115:8 64 <
ffff89f7af1bd000 3630871133 C Ii:1:004:2 0:8 64 = 30ac8000 80000008 80000880 0c94064e fe5d0def fff3ffec ffd90692 fe3f0dfe
ffff89f7af1bd000 3630871174 S Ii:1:004:2 -115:8 64 <
ffff89f7af1bd000 3630887072 C Ii:1:004:2 0:8 64 = 30b08000 80000008 80000880 0ccf06b9 fe460ddf fffbffc0 ffcf06b9 fe460ddf
ffff89f7af1bd000 3630887124 S Ii:1:004:2 -115:8 64 <
ffff89f7af1bd000 3630903135 C Ii:1:004:2 0:8 64 = 30b38000 80000008 80000880 0c5607f5 fe230dfe ffe5fffb ff3e0703 ff270dec
ffff89f7af1bd000 3630903181 S Ii:1:004:2 -115:8 64 <
ffff89f7af1bd000 3630927069 C Ii:1:004:2 0:8 64 = 30b68000 80000008 80000880 0cd90691 fe4a0df5 fff7ff0b 001a07bc fe340d00
ffff89f7af1bd000 3630927115 S Ii:1:004:2 -115:8 64 <
ffff89f7af1bd000 3630935842 C Ii:1:004:2 0:8 64 = 30bb8000 80000008 80000880 0ca70626 ff690dd5 ff200003 00c506d9 fe5c0dda
ffff89f7af1bd000 3630935879 S Ii:1:004:2 -115:8 64 <
ffff89f7af1bd000 3630951152 C Ii:1:004:2 0:8 64 = 30bc8000 80000008 80000880 0c840642 ff6f0dd7 ff22000a 00a70626 ff690dd5
ffff89f7af1bd000 3630951237 S Ii:1:004:2 -115:8 64 <
ffff89f7af1bd000 3630974979 C Ii:1:004:2 0:8 64 = 30c08000 90000008 80000880 0c6b068e fe560de4 ff0d00fa ff6b068e fe560de4
ffff89f7af1bd000 3630975025 S Ii:1:004:2 -115:8 64 <
ffff89f7af1bd000 3630991097 C Ii:1:004:2 0:8 64 = 30c48000 90000008 80000880 0c00085e fe350da0 ff5800e0 ff690717 fe2d0dd1
ffff89f7af1bd000 3630991144 S Ii:1:004:2 -115:8 64 <
ffff89f7af1bd000 3631000825 C Ii:1:004:2 0:8 64 = 30c88000 90000008 80000880 0c0d0859 ff8c0d87 feb201ce ff0d0859 ff8c0d87
ffff89f7af1bd000 3631000862 S Ii:1:004:2 -115:8 64 <
ffff89f7af1bd000 3631015898 C Ii:1:004:2 0:8 64 = 30c98000 90000008 80000880 0c9d0760 ffa60d0f fe4502bc ff0d0859 ff8c0d87
ffff89f7af1bd000 3631015940 S Ii:1:004:2 -115:8 64 <
ffff89f7af1bd000 3631031110 C Ii:1:004:2 0:8 64 = 30cc8000 90000008 80000880 0cde068c fea10d4d fd4303b1 ff2d07f6 fea50d8e
ffff89f7af1bd000 3631031169 S Ii:1:004:2 -115:8 64 <
ffff89f7af1bd000 3631046888 C Ii:1:004:2 0:8 64 = 30d08000 90000008 80000880 0c3406e2 fda70d15 fdc50308 003406e2 fda70d15
ffff89f7af1bd000 3631046933 S Ii:1:004:2 -115:8 64 <
ffff89f7af1bd000 3631063018 C Ii:1:004:2 0:8 64 = 30d38000 90000008 80000880 0cd905a2 fdbc0d10 fdfa0367 00f705c0 fdb20d13
ffff89f7af1bd000 3631063064 S Ii:1:004:2 -115:8 64 <
ffff89f7af1bd000 3631079687 C Ii:1:004:2 0:8 64 = 30d68000 90000008 80000880 0c2d058e fd8a0d32 fdd60364 00b1058b fdac0d0f
ffff89f7af1bd000 3631079725 S Ii:1:004:2 -115:8 64 <
ffff89f7af1bd000 3631094990 C Ii:1:004:2 0:8 64 = 30d98000 90000008 80000880 0ca5025b fcc00cef fe7c0104 0006044d fd520da6
ffff89f7af1bd000 3631095039 S Ii:1:004:2 -115:8 64 <
ffff89f7af1bd000 3631112633 C Ii:1:004:2 0:8 64 = 30dc8000 80000008 80000880 0c7204ff fc9d0d03 0163fe12 00df022b fcd40c65
ffff89f7af1bd000 3631112685 S Ii:1:004:2 -115:8 64 <
ffff89f7af1bd000 3631128377 C Ii:1:004:2 0:8 64 = 30e08000 80000008 80000880 0cec054a ff430ed5 00d0fe3a 00ec054a ff430ed5
ffff89f7af1bd000 3631128427 S Ii:1:004:2 -115:8 64 <
ffff89f7af1bd000 3631153487 C Ii:1:004:2 0:8 64 = 30e38000 80000008 80000880 0ca60441 fe3f0dbe 01c5fd9a 0042053e ffa90dfa
ffff89f7af1bd000 3631153545 S Ii:1:004:2 -115:8 64 <
ffff89f7af1bd000 3631167045 C Ii:1:004:2 0:8 64 = 30e88000 80000008 80000880 0c480580 fda60d98 0368fbf9 00480580 fda60d98
ffff89f7af1bd000 3631167094 S Ii:1:004:2 -115:8 64 <
ffff89f7af1bd000 3631176055 C Ii:1:004:2 0:8 64 = 30eb8000 80000008 80000880 0c870560 fefd0d4b 03c8fb7f 00710530 feee0d8a
ffff89f7af1bd000 3631176095 S Ii:1:004:2 -115:8 64 <
ffff89f7af1bd000 3631198970 C Ii:1:004:2 0:8 64 = 30ec8000 80000008 80000880 0cc50552 fee60ddd 021cfc35 00870560 fefd0d4b
ffff89f7af1bd000 3631199018 S Ii:1:004:2 -115:8 64 <
ffff89f7af1bd000 3631206921 C Ii:1:004:2 0:8 64 = 30f18000 80000008 80000880 0cc20635 fe9f0d12 02fbfc8e ff400634 fe800d45
ffff89f7af1bd000 3631206957 S Ii:1:004:2 -115:8 64 <
ffff89f7af1bd000 3631222932 C Ii:1:004:2 0:8 64 = 30f38000 80000008 80000880 0c4a0885 fef80da5 019ffdc5 ffc20635 fe9f0d12
ffff89f7af1bd000 3631222977 S Ii:1:004:2 -115:8 64 <
ffff89f7af1bd000 3631238981 C Ii:1:004:2 0:8 64 = 30f68000 80000008 80000880 0cc709b2 fe870ce5 ff4d0038 00f809ff fe430da3
ffff89f7af1bd000 3631239026 S Ii:1:004:2 -115:8 64 <
ffff89f7af1bd000 3631255817 C Ii:1:004:2 0:8 64 = 30f98000 80000008 80000880 0ca20618 fe190dde ff0d00f8 ff1b0813 fe960cbe
ffff89f7af1bd000 3631255866 S Ii:1:004:2 -115:8 64 <
ffff89f7af1bd000 3631272803 C Ii:1:004:2 0:8 64 = 30fc8000 80000008 80000880 0cb106a2 fe5e0d07 00cafff2 ff5d0662 fe5d0dfd
ffff89f7af1bd000 3631272840 S Ii:1:004:2 -115:8 64 <
ffff89f7af1bd000 3631287064 C Ii:1:004:2 0:8 64 = 30008000 80000008 80000880 0cfb068c fe2f0df4 ffeffff6 fffb068c fe2f0df4
ffff89f7af1bd000 3631287109 S Ii:1:004:2 -115:8 64 <
ffff89f7af1bd000 3631303752 C Ii:1:004:2 0:8 64 = 30038000 80000008 80000880 0cdb0668 fe380df8 ffe7fff4 ffe10678 fe340df5
ffff89f7af1bd000 3631303799 S Ii:1:004:2 -115:8 64 <
ffff89f7af1bd000 3631319843 C Ii:1:004:2 0:8 64 = 30068000 80000008 80000880 0cfb0648 fe300df6 ffe4ffea ffec0652 fe370df9
ffff89f7af1bd000 3631319901 S Ii:1:004:2 -115:8 64 <
ffff89f7af1bd000 3631336762 C Ii:1:004:2 0:8 64 = 30098000 80000008 80000880 0c060751 fe290ded ffeaffe6 ff05074e fe2b0df1
ffff89f7af1bd000 3631336829 S Ii:1:004:2 -115:8 64 <
ffff89f7af1bd000 3631350981 C Ii:1:004:2 0:8 64 = 300c8000 80000008 80000880 0cfc063b fe280ded ffebffe7 ff020747 fe280dec
ffff89f7af1bd000 3631351023 S Ii:1:004:2 -115:8 64 <
ffff89f7af1bd000 3631367075 C Ii:1:004:2 0:8 64 = 30108000 80000008 80000880 0ccd066d fe440df4 ffe6ffec ffcd066d fe440df4
ffff89f7af1bd000 3631367122 S Ii:1:004:2 -115:8 64 <
ffff89f7af1bd000 3631374944 C Ii:1:004:2 0:8 64 = 30138000 80000008 80000880 0ca006a1 fe5b0df7 ffe5ffed ffb50695 fe560df5
ffff89f7af1bd000 3631374987 S Ii:1:004:2 -115:8 64 <
ffff89f7af1bd000 3631391080 C Ii:1:004:2 0:8 64 = 30148000 80000008 80000880 0c8f0686 fe5b0dff ffdfffef ffa006a1 fe5b0df7
ffff89f7af1bd000 3631391127 S Ii:1:004:2 -115:8 64 <
ffff89f7af1bd000 3631414911 C Ii:1:004:2 0:8 64 = 30188000 80000008 80000880 0cb90667 fe470d0a 00defff5 ffb90667 fe470d0a
ffff89f7af1bd000 3631414954 S Ii:1:004:2 -115:8 64 <
ffff89f7af1bd000 3631432634 C Ii:1:004:2 0:8 64 = 301c8000 80000008 80000880 0c3e07de fd0c0df6 ffedffe2 ff260712 fe1b0d03
ffff89f7af1bd000 3631432693 S Ii:1:004:2 -115:8 64 <
ffff89f7af1bd000 3631448368 C Ii:1:004:2 0:8 64 = 30208000 80000008 80000880 0c5007a6 fd050ddf fff0ffc4 ff5007a6 fd050ddf
ffff89f7af1bd000 3631448420 S Ii:1:004:2 -115:8 64 <
ffff89f7af1bd000 3631463935 C Ii:1:004:2 0:8 64 = 30238000 80000008 80000880 0c7207f0 fdfe0cd4 fff0ffbd ff6207b5 fd020dd6
ffff89f7af1bd000 3631463979 S Ii:1:004:2 -115:8 64 <
ffff89f7af1bd000 3631478942 C Ii:1:004:2 0:8 64 = 30268000 80000008 80000880 0c4707b1 fe170de2 ffe7ffdb ff6c0740 fe080ddb
ffff89f7af1bd000 3631478983 S Ii:1:004:2 -115:8 64 <
ffff89f7af1bd000 3631494920 C Ii:1:004:2 0:8 64 = 30298000 80000008 80000880 0ce90606 ff430dec ffe1fff1 ff0d07f7 fe330de9
ffff89f7af1bd000 3631494965 S Ii:1:004:2 -115:8 64 <
ffff89f7af1bd000 3631511669 C Ii:1:004:2 0:8 64 = 302c8000 80000008 80000880 0c9d0615 ff5f0df9 ffd8fffe ffbe0606 ff510df3
ffff89f7af1bd000 3631511718 S Ii:1:004:2 -115:8 64 <
ffff89f7af1bd000 3631528958 C Ii:1:004:2 0:8 64 = 30308000 80000008 80000880 0c5c067d ff7e0df3 ffdffff3 ff5c067d ff7e0df3
ffff89f7af1bd000 3631529005 S Ii:1:004:2 -115:8 64 <
ffff89f7af1bd000 3631551030 C Ii:1:004:2 0:8 64 = 30338000 80000008 80000880 0c8a0695 ff730de8 ffeeffea ff580688 ff7d0def
ffff89f7af1bd000 3631551073 S Ii:1:004:2 -115:8 64 <
ffff89f7af1bd000 3631560620 C Ii:1:004:2 0:8 64 = 30388000 80000008 80000880 0c6a066a ff7c0dd7 ff0a00f5 ff6a066a ff7c0dd7
ffff89f7af1bd000 3631560668 S Ii:1:004:2 -115:8 64 <
ffff89f7af1bd000 3631575760 C Ii:1:004:2 0:8 64 = 30398000 80000008 80000880 0c0d06f4 fe7c0de6 fffafff9 ff6a066a ff7c0dd7
ffff89f7af1bd000 3631575808 S Ii:1:004:2 -115:8 64 <
ffff89f7af1bd000 3631590948 C Ii:1:004:2 0:8 64 = 303c8000 80000008 80000880 0c920669 fe440d17 00c6ff01 00370683 fe5b0d05
ffff89f7af1bd000 3631590996 S Ii:1:004:2 -115:8 64 <
ffff89f7af1bd000 3631607066 C Ii:1:004:2 0:8 64 = 30408000 80000008 80000880 0c2507a3 fe370d0b 00d9ff02 002507a3 fe370d0b
ffff89f7af1bd000 3631607107 S Ii:1:004:2 -115:8 64 <
ffff89f7af1bd000 3631631053 C Ii:1:004:2 0:8 64 = 30438000 80000008 80000880 0ce30690 fe400dfc ffecff02 001007a1 fe3b0d00
ffff89f7af1bd000 3631631113 S Ii:1:004:2 -115:8 64 <
ffff89f7af1bd000 3631639803 C Ii:1:004:2 0:8 64 = 30488000 80000008 80000880 0cdd0694 fe3a0d00 00e6ff00 00dd0694 fe3a0d00
ffff89f7af1bd000 3631639843 S Ii:1:004:2 -115:8 64 <
ffff89f7af1bd000 3631655566 C Ii:1:004:2 0:8 64 = 30498000 80000008 80000880 0ce10699 fe3b0dff ffe5ff00 00dd0694 fe3a0d00
ffff89f7af1bd000 3631655619 S Ii:1:004:2 -115:8 64 <
ffff89f7af1bd000 3631671127 C Ii:1:004:2 0:8 64 = 304c8000 80000008 80000880 0cdc0695 fe3c0dff ffe6ff02 00de0697 fe3d0dfe
ffff89f7af1bd000 3631671166 S Ii:1:004:2 -115:8 64 <
ffff89f7af1bd000 3631687565 C Ii:1:004:2 0:8 64 = 30508000 80000008 80000880 0cde0691 fe3e0dff ffe6ff01 00de0691 fe3e0dff
ffff89f7af1bd000 3631687610 S Ii:1:004:2 -115:8 64 <
ffff89f7af1bd000 3631703011 C Ii:1:004:2 0:8 64 = 30538000 80000008 80000880 0cdd0694 fe3f0dfe ffe6ff00 00df0692 fe3f0dfe
ffff89f7af1bd000 3631703055 S Ii:1:004:2 -115:8 64 <
ffff89f7af1bd000 3631718934 C Ii:1:004:2 0:8 64 = 30568000 80000008 80000880 0cd90696 fe3d0dfe ffe8ff01 00da0695 fe3e0dfe
ffff89f7af1bd000 3631718981 S Ii:1:004:2 -115:8 64 <
ffff89f7af1bd000 3631734836 C Ii:1:004:2 0:8 64 = 30598000 80000008 80000880 0cde0694 fe3d0dff ffe7ff03 00db0696 fe3d0dff
ffff89f7af1bd000 3631734884 S Ii:1:004:2 -115:8 64 <
ffff89f7af1bd000 3631750972 C Ii:1:004:2 0:8 64 = 305c8000 80000008 80000880 0cdb0692 fe400dff ffe7ff02 00dd0691 fe3f0dff
ffff89f7af1bd000 3631751015 S Ii:1:004:2 -115:8 64 <
ffff89f7af1bd000 3631766809 C Ii:1:004:2 0:8 64 = 30608000 80000008 80000880 0ce906a9 fe3f0dfb ffecffff ffe906a9 fe3f0dfb
ffff89f7af1bd000 3631766854 S Ii:1:004:2 -115:8 64 <
ffff89f7af1bd000 3631774894 C Ii:1:004:2 0:8 64 = 30638000 80000008 80000880 0cce0699 fe420dee fffbffff ffeb06ab fe440df0
ffff89f7af1bd000 3631774932 S Ii:1:004:2 -115:8 64 <
ffff89f7af1bd000 3631799016 C Ii:1:004:2 0:8 64 = 30648000 80000008 80000880 0cc006a6 fe430df7 fff1ff00 00ce0699 fe420dee
ffff89f7af1bd000 3631799063 S Ii:1:004:2 -115:8 64 <
ffff89f7af1bd000 3631808302 C Ii:1:004:2 0:8 64 = 30698000 8000e777 7e000880 0c650661 ff7e0de7 ff0c0000 00aa0631 ff670df1
ffff89f7af1bd000 3631808340 S Ii:1:004:2 -115:8 64 <
ffff89f7af1bd000 3631822871 C Ii:1:004:2 0:8 64 = 306b8000 8000d777 7d000880 0c3f0665 ff810de9 ff0a00fe ff650661 ff7e0de7
ffff89f7af1bd000 3631822919 S Ii:1:004:2 -115:8 64 <
ffff89f7af1bd000 3631840511 C Ii:1:004:2 0:8 64 = 306e8000 8000c777 7d000880 0c420613 ff660d12 00dafffe ff350643 ff730dfa
ffff89f7af1bd000 3631840560 S Ii:1:004:2 -115:8 64 <
ffff89f7af1bd000 3631857211 C Ii:1:004:2 0:8 64 = 30718000 8000c777 7c000880 0cc60677 fe590d10 00e2fffb ff7a06c2 fe600d1b
ffff89f7af1bd000 3631857270 S Ii:1:004:2 -115:8 64 <
ffff89f7af1bd000 3631878902 C Ii:1:004:2 0:8 64 = 30748000 8000d777 7d000880 0cfc0611 fe2b0de0 ff1400dd ffe9064d fe4a0dfb
ffff89f7af1bd000 3631878942 S Ii:1:004:2 -115:8 64 <
ffff89f7af1bd000 3631895037 C Ii:1:004:2 0:8 64 = 30798000 80000008 80000880 0c25079b fd100dbc ff1f009a ff2807a4 fd0e0dc4
ffff89f7af1bd000 3631895084 S Ii:1:004:2 -115:8 64 <
ffff89f7af1bd000 3631910892 C Ii:1:004:2 0:8 64 = 307c8000 80000008 80000880 0c10071d fe2c0dc0 ff17009e ff1907b4 fd140dbe
ffff89f7af1bd000 3631910938 S Ii:1:004:2 -115:8 64 <
ffff89f7af1bd000 3631919885 C Ii:1:004:2 0:8 64 = 30808000 80000008 80000880 0cc30696 fe650d9b ff430091 ffc30696 fe650d9b
ffff89f7af1bd000 3631919895 S Ii:1:004:2 -115:8 64 <
ffff89f7af1bd000 3631936728 C Ii:1:004:2 0:8 64 = 30818000 80003778 80000880 0ca60651 fe6c0d78 ff660075 ffc30696 fe650d9b
ffff89f7af1bd000 3631936773 S Ii:1:004:2 -115:8 64 <
ffff89f7af1bd000 3631951143 C Ii:1:004:2 0:8 64 = 30848000 8000a878 83000880 0cd106d9 fd5c0d2d ffa8002d ffab0605 fe670d5a
ffff89f7af1bd000 3631951187 S Ii:1:004:2 -115:8 64 <
ffff89f7af1bd000 3631974905 C Ii:1:004:2 0:8 64 = 30888000 80002879 86000880 0cc70613 fe520df5 fedc0001 ffc70613 fe520df5
ffff89f7af1bd000 3631974952 S Ii:1:004:2 -115:8 64 <
ffff89f7af1bd000 3631990886 C Ii:1:004:2 0:8 64 = 308c8000 8000c989 90000880 0c5306bf fd720df4 fed800f0 fe5f06dc fd690df3
ffff89f7af1bd000 3631990933 S Ii:1:004:2 -115:8 64 <
ffff89f7af1bd000 3632000272 C Ii:1:004:2 0:8 64 = 30908000 8000f999 a0000880 0c39063d ffc10c77 ff3c0013 ff39063d ffc10c77
ffff89f7af1bd000 3632000310 S Ii:1:004:2 -115:8 64 <
ffff89f7af1bd000 3632014896 C Ii:1:004:2 0:8 64 = 30918000 8000f999 a9000880 0c58067c ffc40c52 0053ff87 ff39063d ffc10c77
ffff89f7af1bd000 3632014940 S Ii:1:004:2 -115:8 64 <
ffff89f7af1bd000 3632031069 C Ii:1:004:2 0:8 64 = 30948000 8000a9b9 bd000880 0c2007d0 fea70d42 007fffc4 ffe506ee fe700d8f
ffff89f7af1bd000 3632031130 S Ii:1:004:2 -115:8 64 <
ffff89f7af1bd000 3632048118 C Ii:1:004:2 0:8 64 = 30988000 800008c9 d6000880 0cef064f ff5d0df4 ffe2ffcf ffef064f ff5d0df4
ffff89f7af1bd000 3632048186 S Ii:1:004:2 -115:8 64 <
ffff89f7af1bd000 3632071011 C Ii:1:004:2 0:8 64 = 309b8000 800037e8 f1000880 0caf06f8 fe6b0d0a 00daff00 00d20648 ff5d0dff
ffff89f7af1bd000 3632071056 S Ii:1:004:2 -115:8 64 <
ffff89f7af1bd000 3632078916 C Ii:1:004:2 0:8 64 = 30a08000 800077f7 ff000880 0cbd068e fe5c0df4 fff7ff03 00bd068e fe5c0df4
ffff89f7af1bd000 3632078951 S Ii:1:004:2 -115:8 64 <
ffff89f7af1bd000 3632097392 C Ii:1:004:2 0:8 64 = 30a18000 800056f7 ff000880 0c9d0681 fe550df5 fff7ff08 00bd068e fe5c0df4
ffff89f7af1bd000 3632097441 S Ii:1:004:2 -115:8 64 <
ffff89f7af1bd000 3632121278 C Ii:1:004:2 0:8 64 = 30a48000 8000f6e6 fe000880 0c680668 fe690d02 00e0ff04 006e066e fe600dfc
ffff89f7af1bd000 3632121364 S Ii:1:004:2 -115:8 64 <
ffff89f7af1bd000 3632134888 C Ii:1:004:2 0:8 64 = 30a98000 800005e6 fb000880 0c570643 fe4b0d23 00bcff05 00800663 fe5b0d0f
ffff89f7af1bd000 3632134929 S Ii:1:004:2 -115:8 64 <
ffff89f7af1bd000 3632152186 C Ii:1:004:2 0:8 64 = 30ac8000 800065e5 f3000880 0ccf05e3 fd240dae 00fbfe1e 00f805fe fd2e0d63
ffff89f7af1bd000 3632152264 S Ii:1:004:2 -115:8 64 <
ffff89f7af1bd000 3632169515 C Ii:1:004:2 0:8 64 = 30b08000 800044c5 db000880 0cef0603 fffd0daf 002dff2b 00ef0603 fffd0daf
ffff89f7af1bd000 3632169564 S Ii:1:004:2 -115:8 64 <
ffff89f7af1bd000 3632183015 C Ii:1:004:2 0:8 64 = 30b38000 800085b5 bb000880 0c0b07f2 fe580da2 ff5900da ff780746 ffdc0d24
ffff89f7af1bd000 3632183054 S Ii:1:004:2 -115:8 64 <
ffff89f7af1bd000 3632198825 C Ii:1:004:2 0:8 64 = 30b68000 80004596 9c000880 0c640666 fe3f0db6 ff1a009a ff9d0696 fe290d93
ffff89f7af1bd000 3632198870 S Ii:1:004:2 -115:8 64 <
ffff89f7af1bd000 3632216459 C Ii:1:004:2 0:8 64 = 30b98000 80005677 82000880 0c980698 fe720dc8 ff06009c ff730675 fe680dcd
ffff89f7af1bd000 3632216495 S Ii:1:004:2 -115:8 64 <
ffff89f7af1bd000 3632232622 C Ii:1:004:2 0:8 64 = 30bc8000 8000a777 7b000880 0c2e066c fe500dc5 ff0f0098 ff890697 fe640dbb
ffff89f7af1bd000 3632232692 S Ii:1:004:2 -115:8 64 <
ffff89f7af1bd000 3632254862 C Ii:1:004:2 0:8 64 = 30c08000 80009767 74000880 0cf70554 fe6f0d13 00ccff87 fff70554 fe6f0d13
ffff89f7af1bd000 3632254909 S Ii:1:004:2 -115:8 64 <
ffff89f7af1bd000 3632263941 C Ii:1:004:2 0:8 64 = 30c48000 8000f767 67000880 0c3c0837 ff130def ff1200be ffa1072d ff2c0de2
ffff89f7af1bd000 3632263978 S Ii:1:004:2 -115:8 64 <
ffff89f7af1bd000 3632286810 C Ii:1:004:2 0:8 64 = 30c68000 80003758 60000880 0cd407d3 fe240d02 00f3ff08 003c0837 ff130def
ffff89f7af1bd000 3632286855 S Ii:1:004:2 -115:8 64 <
ffff89f7af1bd000 3632294780 C Ii:1:004:2 0:8 64 = 30cb8000 8000a949 4d000880 0c5a068f fe660dfd ffe6fffc ff610670 fe640d01
ffff89f7af1bd000 3632294815 S Ii:1:004:2 -115:8 64 <
ffff89f7af1bd000 3632318914 C Ii:1:004:2 0:8 64 = 30cc8000 8000294a 49000880 0c9906a7 fe5f0dfe ffe8fffa ff5a068f fe660dfd
ffff89f7af1bd000 3632318960 S Ii:1:004:2 -115:8 64 <
ffff89f7af1bd000 3632336900 C Ii:1:004:2 0:8 64 = 30d18000 80009a4b 49000880 0ca706a0 fe5a0dff ffe7ff03 00ba06a8 fe580d01
ffff89f7af1bd000 3632336960 S Ii:1:004:2 -115:8 64 <
ffff89f7af1bd000 3632350898 C Ii:1:004:2 0:8 64 = 30d48000 80002b4c 54000880 0ca10698 fe5e0dfe ffe8ff01 009f069b fe5c0dfd
ffff89f7af1bd000 3632350940 S Ii:1:004:2 -115:8 64 <
ffff89f7af1bd000 3632360801 C Ii:1:004:2 0:8 64 = 30d88000 80009b5c 62000880 0ca50694 fe610dff ffe4ff02 00a50694 fe610dff
ffff89f7af1bd000 3632360850 S Ii:1:004:2 -115:8 64 <
ffff89f7af1bd000 3632384507 C Ii:1:004:2 0:8 64 = 30d98000 8000bb6c 69000880 0ca60696 fe5c0d00 00e4ff01 00a50694 fe610dff
ffff89f7af1bd000 3632384564 S Ii:1:004:2 -115:8 64 <
ffff89f7af1bd000 3632392810 C Ii:1:004:2 0:8 64 = 30de8000 8000bb7c 7d000880 0ca0069b fe5e0dfe ffe7ff01 00a1069a fe5a0dff
ffff89f7af1bd000 3632392854 S Ii:1:004:2 -115:8 64 <
ffff89f7af1bd000 3632417557 C Ii:1:004:2 0:8 64 = 30e08000 8000bb7c 82000880 0ca3069b fe600dfe ffe7ff01 00a3069b fe600dfe
ffff89f7af1bd000 3632417605 S Ii:1:004:2 -115:8 64 <
ffff89f7af1bd000 3632423835 C Ii:1:004:2 0:8 64 = 30e48000 80005b9c 99000880 0cad0697 fe5c0dff ffe5ff00 00a90696 fe5d0dff
ffff89f7af1bd000 3632423843 S Ii:1:004:2 -115:8 64 <
ffff89f7af1bd000 3632446791 C Ii:1:004:2 0:8 64 = 30e68000 80000b9c a1000880 0cad069d fe5d0dff ffe4ff01 00ad0697 fe5c0dff
ffff89f7af1bd000 3632446860 S Ii:1:004:2 -115:8 64 <
ffff89f7af1bd000 3632454910 C Ii:1:004:2 0:8 64 = 30eb8000 8000baaa b7000880 0ca7069f fe5a0dfc ffe9ff02 00a806a3 fe5a0dfd
ffff89f7af1bd000 3632454960 S Ii:1:004:2 -115:8 64 <
ffff89f7af1bd000 3632471983 C Ii:1:004:2 0:8 64 = 30ec8000 800049ba bb000880 0ca60697 fe5b0dfd ffe8ff02 00a7069f fe5a0dfc
ffff89f7af1bd000 3632472027 S Ii:1:004:2 -115:8 64 <
ffff89f7af1bd000 3632486856 C Ii:1:004:2 0:8 64 = 30f08000 800058b9 c0000880 0ca40694 fe5b0d01 00e9ff02 00a40694 fe5b0d01
ffff89f7af1bd000 3632486905 S Ii:1:004:2 -115:8 64 <
ffff89f7af1bd000 3632502976 C Ii:1:004:2 0:8 64 = 30f38000 800077b8 c0000880 0ca1069b fe5e0d00 00e7ff02 00a30698 fe5c0d01
ffff89f7af1bd000 3632503022 S Ii:1:004:2 -115:8 64 <
ffff89f7af1bd000 3632518863 C Ii:1:004:2 0:8 64 = 30f68000 8000b7b7 bf000880 0c9f0698 fe5d0dfc ffe8ff03 009f069b fe5f0dfd
ffff89f7af1bd000 3632518911 S Ii:1:004:2 -115:8 64 <
ffff89f7af1bd000 3632542907 C Ii:1:004:2 0:8 64 = 30f98000 800006a7 b8000880 0ca30698 fe5c0dfd ffe8ff02 00a20696 fe5b0dfc
ffff89f7af1bd000 3632542958 S Ii:1:004:2 -115:8 64 <
ffff89f7af1bd000 3632551177 C Ii:1:004:2 0:8 64 = 30fe8000 80008696 a4000880 0ca806a1 fe5d0dfe ffe9ff02 00a8069f fe5d0dfd
ffff89f7af1bd000 3632551224 S Ii:1:004:2 -115:8 64 <
ffff89f7af1bd000 3632574848 C Ii:1:004:2 0:8 64 = 30008000 80007696 9b000880 0ca806a5 fe5d0dff ffe8ff02 00a806a5 fe5d0dff
ffff89f7af1bd000 3632574891 S Ii:1:004:2 -115:8 64 <
ffff89f7af1bd000 3632590946 C Ii:1:004:2 0:8 64 = 30048000 8000c606 80000880 0ca10693 fe590dff ffe6ff03 00a30697 fe5a0dff
ffff89f7af1bd000 3632590992 S Ii:1:004:2 -115:8 64 <
ffff89f7af1bd000 3632609119 C Ii:1:004:2 0:8 64 = 30088000 8000a666 76000880 0ca2069c fe5d0d00 00e3ff03 00a2069c fe5d0d00
ffff89f7af1bd000 3632609159 S Ii:1:004:2 -115:8 64 <
ffff89f7af1bd000 3632624722 C Ii:1:004:2 0:8 64 = 300b8000 80008666 6a000880 0ca306a7 fe610dff ffe7ff04 00a306a3 fe600d00
ffff89f7af1bd000 3632624767 S Ii:1:004:2 -115:8 64 <
ffff89f7af1bd000 3632640217 C Ii:1:004:2 0:8 64 = 300e8000 80007656 60000880 0ca20699 fe5e0dfd ffe9ff03 00a106a4 fe600dfe
ffff89f7af1bd000 3632640263 S Ii:1:004:2 -115:8 64 <
ffff89f7af1bd000 3632654772 C Ii:1:004:2 0:8 64 = 30118000 80008656 57000880 0ca70680 fe560d00 00e7ff01 00a40682 fe580dfe
ffff89f7af1bd000 3632654816 S Ii:1:004:2 -115:8 64 <
ffff89f7af1bd000 3632670837 C Ii:1:004:2 0:8 64 = 30148000 8000b646 52000880 0ca5069e fe590d01 00e4ff00 00a70690 fe570d01
ffff89f7af1bd000 3632670877 S Ii:1:004:2 -115:8 64 <
ffff89f7af1bd000 3632686886 C Ii:1:004:2 0:8 64 = 30188000 80000647 4f000880 0ca4069c fe590dff ffe8ff00 00a4069c fe590dff
ffff89f7af1bd000 3632686931 S Ii:1:004:2 -115:8 64 <
ffff89f7af1bd000 3632702747 C Ii:1:004:2 0:8 64 = 301b8000 80006647 4f000880 0ca8069b fe5d0dfd ffe8ff01 00a6069b fe5a0dfe
ffff89f7af1bd000 3632702790 S Ii:1:004:2 -115:8 64 <
ffff89f7af1bd000 3632720633 C Ii:1:004:2 0:8 64 = 301e8000 8000d747 54000880 0ca20698 fe5e0dfe ffe8ff01 00a7069b fe5f0dfe
ffff89f7af1bd000 3632720683 S Ii:1:004:2 -115:8 64 <
ffff89f7af1bd000 3632734790 C Ii:1:004:2 0:8 64 = 30218000 80003758 5d000880 0ca20696 fe5d0d00 00e6ff01 00a10695 fe5c0dff
ffff89f7af1bd000 3632734835 S Ii:1:004:2 -115:8 64 <
ffff89f7af1bd000 3632750850 C Ii:1:004:2 0:8 64 = 30248000 80008868 68000880 0ca2069b fe600d01 00e6ff02 00a2069a fe600d01
ffff89f7af1bd000 3632750894 S Ii:1:004:2 -115:8 64 <
ffff89f7af1bd000 3632766916 C Ii:1:004:2 0:8 64 = 30288000 8000b868 74000880 0ca00691 fe590d01 00e6ff03 00a00691 fe590d01
ffff89f7af1bd000 3632766962 S Ii:1:004:2 -115:8 64 <
ffff89f7af1bd000 3632783027 C Ii:1:004:2 0:8 64 = 302b8000 80009878 7e000880 0ca60699 fe5c0d01 00e6ff01 00a10690 fe590d01
ffff89f7af1bd000 3632783074 S Ii:1:004:2 -115:8 64 <
ffff89f7af1bd000 3632798810 C Ii:1:004:2 0:8 64 = 302e8000 8000a878 83000880 0ca906a2 fe5b0d00 00e8ff01 00a906a0 fe5d0d00
ffff89f7af1bd000 3632798851 S Ii:1:004:2 -115:8 64 <
ffff89f7af1bd000 3632814823 C Ii:1:004:2 0:8 64 = 30318000 80005778 82000880 0ca6069d fe590dff ffe5ff00 00aa069c fe580dff
ffff89f7af1bd000 3632814865 S Ii:1:004:2 -115:8 64 <
ffff89f7af1bd000 3632823022 C Ii:1:004:2 0:8 64 = 30348000 80000008 80000880 0ca106a6 fe5f0dff ffe8ff00 00a006a3 fe5e0dff
ffff89f7af1bd000 3632823075 S Ii:1:004:2 -115:8 64 <
ffff89f7af1bd000 3632838953 C Ii:1:004:2 0:8 64 = 30368000 80000008 80000880 0ca406a0 fe5c0d00 00e8ff00 00a106a6 fe5f0dff
ffff89f7af1bd000 3632838994 S Ii:1:004:2 -115:8 64 <
ffff89f7af1bd000 3632854960 C Ii:1:004:2 0:8 64 = 30398000 80000008 80000880 0ca50693 fe5b0dff ffe7ff01 00a70699 fe5a0dff
ffff89f7af1bd000 3632855009 S Ii:1:004:2 -115:8 64 <
ffff89f7af1bd000 3632871674 C Ii:1:004:2 0:8 64 = 303c8000 80000008 80000880 0ca10699 fe5f0dff ffe5ff02 00a10695 fe5e0dff
ffff89f7af1bd000 3632871725 S Ii:1:004:2 -115:8 64 <
ffff89f7af1bd000 3632887593 C Ii:1:004:2 0:8 64 = 30408000 80000008 80000880 0ca3069a fe5f0dfe ffe4ff00 00a3069a fe5f0dfe
ffff89f7af1bd000 3632887635 S Ii:1:004:2 -115:8 64 <
ffff89f7af1bd000 3632902939 C Ii:1:004:2 0:8 64 = 30438000 80000008 80000880 0ca5069b fe5d0dff ffe9ff02 00a4069a fe5e0dfe
ffff89f7af1bd000 3632902984 S Ii:1:004:2 -115:8 64 <
ffff89f7af1bd000 3632919805 C Ii:1:004:2 0:8 64 = 30468000 80000008 80000880 0ca00699 fe5c0dfe ffe6ff02 00a3069b fe5d0dff
ffff89f7af1bd000 3632919847 S Ii:1:004:2 -115:8 64 <
ffff89f7af1bd000 3632934734 C Ii:1:004:2 0:8 64 = 30498000 80000008 80000880 0ca3069a fe5a0dfe ffe7ff00 00a00698 fe5b0dfe
ffff89f7af1bd000 3632934773 S Ii:1:004:2 -115:8 64 <
ffff89f7af1bd000 3632950717 C Ii:1:004:2 0:8 64 = 304c8000 80000008 80000880 0ca6069f fe5a0dfe ffe7ff01 00a5069d fe5a0dfe
ffff89f7af1bd000 3632950755 S Ii:1:004:2 -115:8 64 <
ffff89f7af1bd000 3632967399 C Ii:1:004:2 0:8 64 = 30508000 80000008 80000880 0c99069b fe5c0dff ffe5ff02 0099069b fe5c0dff
ffff89f7af1bd000 3632967437 S Ii:1:004:2 -115:8 64 <
ffff89f7af1bd000 3632982723 C Ii:1:004:2 0:8 64 = 30538000 80000008 80000880 0ca5068e fe660dff ffe6ff01 009a0694 fe630dff
ffff89f7af1bd000 3632982764 S Ii:1:004:2 -115:8 64 <
ffff89f7af1bd000 3632998750 C Ii:1:004:2 0:8 64 = 30568000 80000008 80000880 0ca50687 fe5c0d01 00e5ff00 00ae0685 fe610dff
ffff89f7af1bd000 3632998794 S Ii:1:004:2 -115:8 64 <
ffff89f7af1bd000 3633014824 C Ii:1:004:2 0:8 64 = 30598000 80000008 80000880 0c9706a4 fe5b0d04 00e5ff02 009a0693 fe5c0d02
ffff89f7af1bd000 3633014866 S Ii:1:004:2 -115:8 64 <
ffff89f7af1bd000 3633030733 C Ii:1:004:2 0:8 64 = 305c8000 80000008 80000880 0cb506a8 fe530d00 00e7ff03 00a206ab fe570d03
ffff89f7af1bd000 3633030777 S Ii:1:004:2 -115:8 64 <
ffff89f7af1bd000 3633048732 C Ii:1:004:2 0:8 64 = 30608000 80000008 80000880 0cb706a3 fe560dfb ffe8ff00 00b706a3 fe560dfb
ffff89f7af1bd000 3633048778 S Ii:1:004:2 -115:8 64 <
ffff89f7af1bd000 3633070853 C Ii:1:004:2 0:8 64 = 30638000 80000008 80000880 0ca206a9 fe5d0dfe ffeaff00 00aa06a9 fe5c0dfc
ffff89f7af1bd000 3633070905 S Ii:1:004:2 -115:8 64 <
ffff89f7af1bd000 3633078740 C Ii:1:004:2 0:8 64 = 30688000 80000008 80000880 0ca90695 fe550dff ffe6ff03 00a90695 fe550dff
ffff89f7af1bd000 3633078775 S Ii:1:004:2 -115:8 64 <
ffff89f7af1bd000 3633094743 C Ii:1:004:2 0:8 64 = 30698000 80000008 80000880 0ca00693 fe5a0dfe ffe4ff03 00a90695 fe550dff
ffff89f7af1bd000 3633094797 S Ii:1:004:2 -115:8 64 <
ffff89f7af1bd000 3633118728 C Ii:1:004:2 0:8 64 = 306c8000 80000008 80000880 0c950693 fe5f0d00 00e3ff02 00980693 fe5e0dff
ffff89f7af1bd000 3633118768 S Ii:1:004:2 -115:8 64 <
ffff89f7af1bd000 3633134730 C Ii:1:004:2 0:8 64 = 30718000 80000008 80000880 0ca50694 fe5a0d01 00e7ff01 00a30693 fe5e0d01
ffff89f7af1bd000 3633134781 S Ii:1:004:2 -115:8 64 <
ffff89f7af1bd000 3633150755 C Ii:1:004:2 0:8 64 = 30748000 80000008 80000880 0ca1069e fe5c0dff ffe6ff01 00a20697 fe590d00
ffff89f7af1bd000 3633150795 S Ii:1:004:2 -115:8 64 <
ffff89f7af1bd000 3633160391 C Ii:1:004:2 0:8 64 = 30788000 80000008 80000880 0cab06a3 fe5c0dff ffe8ff00 00ab06a3 fe5c0dff
ffff89f7af1bd000 3633160431 S Ii:1:004:2 -115:8 64 <
ffff89f7af1bd000 3633182716 C Ii:1:004:2 0:8 64 = 30798000 80000008 80000880 0cae06a0 fe5a0dff ffe8ff01 00ab06a3 fe5c0dff
ffff89f7af1bd000 3633182755 S Ii:1:004:2 -115:8 64 <
ffff89f7af1bd000 3633198801 C Ii:1:004:2 0:8 64 = 307e8000 80000008 80000880 0ca9069f fe570dff ffe8ff01 00ac069d fe570dff
ffff89f7af1bd000 3633198841 S Ii:1:004:2 -115:8 64 <
ffff89f7af1bd000 3633206847 C Ii:1:004:2 0:8 64 = 30818000 80000008 80000880 0ca6069c fe5b0dff ffe7ff02 00a6069e fe590dff
ffff89f7af1bd000 3633206886 S Ii:1:004:2 -115:8 64 <
ffff89f7af1bd000 3633222784 C Ii:1:004:2 0:8 64 = 30838000 80000008 80000880 0ca50697 fe5e0dff ffe7ff01 00a6069c fe5b0dff
ffff89f7af1bd000 3633222838 S Ii:1:004:2 -115:8 64 <
ffff89f7af1bd000 3633238744 C Ii:1:004:2 0:8 64 = 30868000 80000008 80000880 0c9d0692 fe5e0dff ffe8ff02 00a10693 fe5f0dff
ffff89f7af1bd000 3633238783 S Ii:1:004:2 -115:8 64 <
ffff89f7af1bd000 3633264843 C Ii:1:004:2 0:8 64 = 30898000 80000008 80000880 0c9e0696 fe5d0dff ffe7ff00 009c0693 fe5d0dff
ffff89f7af1bd000 3633264886 S Ii:1:004:2 -115:8 64 <
ffff89f7af1bd000 3633271769 C Ii:1:004:2 0:8 64 = 308e8000 80000008 80000880 0ca6069c fe5d0dff ffe7ff02 00a4069b fe5c0dff
ffff89f7af1bd000 3633271809 S Ii:1:004:2 -115:8 64 <
ffff89f7af1bd000 3633288675 C Ii:1:004:2 0:8 64 = 30908000 80000008 80000880 0ca5069d fe5f0dff ffe7ff02 00a5069d fe5f0dff
ffff89f7af1bd000 3633288726 S Ii:1:004:2 -115:8 64 <
ffff89f7af1bd000 3633302824 C Ii:1:004:2 0:8 64 = 30938000 80000008 80000880 0cab069c fe5b0dfe ffe8ff02 00a7069d fe5f0dfe
ffff89f7af1bd000 3633302864 S Ii:1:004:2 -115:8 64 <
ffff89f7af1bd000 3633326801 C Ii:1:004:2 0:8 64 = 30968000 80000008 80000880 0ca7069f fe5b0dfe ffe7ff00 00ab069d fe590dfe
ffff89f7af1bd000 3633326843 S Ii:1:004:2 -115:8 64 <
ffff89f7af1bd000 3633336842 C Ii:1:004:2 0:8 64 = 309b8000 80000008 80000880 0ca50699 fe5f0dfe ffe5ff01 00a4069c fe600dfe
ffff89f7af1bd000 3633336909 S Ii:1:004:2 -115:8 64 <
ffff89f7af1bd000 3633358771 C Ii:1:004:2 0:8 64 = 309c8000 80000008 80000880 0ca30698 fe5d0dfe ffe5ff01 00a50699 fe5f0dfe
ffff89f7af1bd000 3633358823 S Ii:1:004:2 -115:8 64 <
ffff89f7af1bd000 3633367472 C Ii:1:004:2 0:8 64 = 30a18000 80000008 80000880 0ca20696 fe5d0dff ffe7ff02 00a00695 fe5c0dff
ffff89f7af1bd000 3633367516 S Ii:1:004:2 -115:8 64 <
ffff89f7af1bd000 3633383903 C Ii:1:004:2 0:8 64 = 30a38000 80000008 80000880 0ca50699 fe5b0dff ffe6ff02 00a20696 fe5d0dff
ffff89f7af1bd000 3633383943 S Ii:1:004:2 -115:8 64 <
ffff89f7af1bd000 3633398938 C Ii:1:004:2 0:8 64 = 30a68000 80000008 80000880 0ca7069c fe5a0dff ffe8ff01 00a6069b fe590dff
ffff89f7af1bd000 3633398980 S Ii:1:004:2 -115:8 64 <
ffff89f7af1bd000 3633414870 C Ii:1:004:2 0:8 64 = 30a98000 80000008 80000880 0ca5069b fe600d00 00e6ff01 00a6069c fe5f0d00
ffff89f7af1bd000 3633414921 S Ii:1:004:2 -115:8 64 <
ffff89f7af1bd000 3633431041 C Ii:1:004:2 0:8 64 = 30ac8000 80000008 80000880 0ca60699 fe580dfe ffe5ff01 00a60699 fe5b0dfe
ffff89f7af1bd000 3633431104 S Ii:1:004:2 -115:8 64 <
ffff89f7af1bd000 3633446821 C Ii:1:004:2 0:8 64 = 30b08000 80000008 80000880 0ca706a0 fe5c0dff ffe7ff02 00a706a0 fe5c0dff
ffff89f7af1bd000 3633446862 S Ii:1:004:2 -115:8 64 <
ffff89f7af1bd000 3633462920 C Ii:1:004:2 0:8 64 = 30b38000 80000008 80000880 0ca8069c fe5d0dfe ffe7ff02 00a906a1 fe5e0dff
ffff89f7af1bd000 3633462961 S Ii:1:004:2 -115:8 64 <
ffff89f7af1bd000 3633478788 C Ii:1:004:2 0:8 64 = 30b68000 80000008 80000880 0ca50697 fe5a0dfe ffe8ff01 00a60699 fe5c0dfe
ffff89f7af1bd000 3633478828 S Ii:1:004:2 -115:8 64 <
ffff89f7af1bd000 3633494793 C Ii:1:004:2 0:8 64 = 30b98000 80000008 80000880 0ca30697 fe5c0dfd ffe6ff00 00a50696 fe5a0dfd
ffff89f7af1bd000 3633494833 S Ii:1:004:2 -115:8 64 <
ffff89f7af1bd000 3633510784 C Ii:1:004:2 0:8 64 = 30bc8000 80000008 80000880 0ca3069b fe5b0dfd ffe7ff01 00a20699 fe5c0dfd
ffff89f7af1bd000 3633510827 S Ii:1:004:2 -115:8 64 <
ffff89f7af1bd000 3633528776 C Ii:1:004:2 0:8 64 = 30c08000 80000008 80000880 0ca8069c fe5a0dff ffe7ff01 00a8069c fe5a0dff
ffff89f7af1bd000 3633528816 S Ii:1:004:2 -115:8 64 <
ffff89f7af1bd000 3633543718 C Ii:1:004:2 0:8 64 = 30c38000 80000008 80000880 0ca8069c fe590dff ffe8ff01 00aa069c fe590dff
ffff89f7af1bd000 3633543757 S Ii:1:004:2 -115:8 64 <
ffff89f7af1bd000 3633566814 C Ii:1:004:2 0:8 64 = 30c68000 80000008 80000880 0ca2069b fe5b0dff ffe6ff01 00a4069c fe5a0dff
ffff89f7af1bd000 3633566860 S Ii:1:004:2 -115:8 64 <
ffff89f7af1bd000 3633576655 C Ii:1:004:2 0:8 64 = 30cb8000 80000008 80000880 0ca40696 fe5a0dff ffe8ff01 00a40697 fe5b0dff
ffff89f7af1bd000 3633576698 S Ii:1:004:2 -115:8 64 <
ffff89f7af1bd000 3633600380 C Ii:1:004:2 0:8 64 = 30cc8000 80000008 80000880 0ca20696 fe5a0dfe ffe7ff01 00a40696 fe5a0dff
ffff89f7af1bd000 3633600427 S Ii:1:004:2 -115:8 64 <
ffff89f7af1bd000 3633614862 C Ii:1:004:2 0:8 64 = 30d18000 80000008 80000880 0ca00698 fe5b0d01 00e7ff02 009e0697 fe5c0d00
ffff89f7af1bd000 3633614918 S Ii:1:004:2 -115:8 64 <
ffff89f7af1bd000 3633622944 C Ii:1:004:2 0:8 64 = 30d48000 80000008 80000880 0ca6069b fe590d00 00e6ff02 00a30699 fe5a0d01
ffff89f7af1bd000 3633622986 S Ii:1:004:2 -115:8 64 <
ffff89f7af1bd000 3633646943 C Ii:1:004:2 0:8 64 = 30d68000 80000008 80000880 0ca8069c fe5a0dff ffe7ff01 00a6069b fe590d00
ffff89f7af1bd000 3633646993 S Ii:1:004:2 -115:8 64 <
ffff89f7af1bd000 3633655692 C Ii:1:004:2 0:8 64 = 30db8000 80000008 80000880 0ca7069d fe570dff ffe5ff02 00a8069d fe5a0dff
ffff89f7af1bd000 3633655735 S Ii:1:004:2 -115:8 64 <
ffff89f7af1bd000 3633670722 C Ii:1:004:2 0:8 64 = 30dc8000 80000008 80000880 0ca6069d fe560dff ffe4ff02 00a7069d fe570dff
ffff89f7af1bd000 3633670777 S Ii:1:004:2 -115:8 64 <
ffff89f7af1bd000 3633694737 C Ii:1:004:2 0:8 64 = 30e08000 80000008 80000880 0ca9069d fe5d0dff ffe7ff02 00a9069d fe5d0dff
ffff89f7af1bd000 3633694782 S Ii:1:004:2 -115:8 64 <
ffff89f7af1bd000 3633713580 C Ii:1:004:2 0:8 64 = 30e48000 80000008 80000880 0ca30697 fe5c0dfe ffe6ff02 00a80699 fe5f0dff
ffff89f7af1bd000 3633713628 S Ii:1:004:2 -115:8 64 <
ffff89f7af1bd000 3633726730 C Ii:1:004:2 0:8 64 = 30e88000 80000008 80000880 0ca00698 fe5e0dff ffe8ff02 00a00698 fe5e0dff
ffff89f7af1bd000 3633726773 S Ii:1:004:2 -115:8 64 <
ffff89f7af1bd000 3633734723 C Ii:1:004:2 0:8 64 = 30eb8000 80000008 80000880 0ca10698 fe5f0dff ffe8ff02 00a00698 fe600dff
ffff89f7af1bd000 3633734761 S Ii:1:004:2 -115:8 64 <
ffff89f7af1bd000 3633758748 C Ii:1:004:2 0:8 64 = 30ec8000 80000008 80000880 0ca4069a fe5d0dfe ffe9ff02 00a10698 fe5f0dff
ffff89f7af1bd000 3633758793 S Ii:1:004:2 -115:8 64 <
ffff89f7af1bd000 3633766839 C Ii:1:004:2 0:8 64 = 30f18000 80000008 80000880 0ca6069c fe5c0d00 00e8ff02 00a5069d fe5d0dff
ffff89f7af1bd000 3633766880 S Ii:1:004:2 -115:8 64 <
ffff89f7af1bd000 3633783667 C Ii:1:004:2 0:8 64 = 30f38000 80000008 80000880 0ca8069b fe5b0d00 00e8ff01 00a6069c fe5c0d00
ffff89f7af1bd000 3633783715 S Ii:1:004:2 -115:8 64 <
ffff89f7af1bd000 3633809350 C Ii:1:004:2 0:8 64 = 30f68000 80000008 80000880 0ca6069c fe5c0d00 00e6ffff ffa7069b fe5b0d00
ffff89f7af1bd000 3633809397 S Ii:1:004:2 -115:8 64 <
ffff89f7af1bd000 3633823031 C Ii:1:004:2 0:8 64 = 30fb8000 80000008 80000880 0ca60697 fe5c0dff ffe7ff01 00a50699 fe5d0dfe
ffff89f7af1bd000 3633823077 S Ii:1:004:2 -115:8 64 <
ffff89f7af1bd000 3633831090 C Ii:1:004:2 0:8 64 = 30fe8000 80000008 80000880 0ca40696 fe5b0d00 00e7ff02 00a60697 fe5b0dff
ffff89f7af1bd000 3633831134 S Ii:1:004:2 -115:8 64 <
ffff89f7af1bd000 3633854828 C Ii:1:004:2 0:8 64 = 30008000 80000008 80000880 0ca20695 fe5c0d00 00e7ff02 00a20695 fe5c0d00
ffff89f7af1bd000 3633854876 S Ii:1:004:2 -115:8 64 <
ffff89f7af1bd000 3633862923 C Ii:1:004:2 0:8 64 = 30048000 80000008 80000880 0ca7069e fe5d0d00 00e6ff02 00a50698 fe5f0d00
ffff89f7af1bd000 3633862960 S Ii:1:004:2 -115:8 64 <
ffff89f7af1bd000 3633879834 C Ii:1:004:2 0:8 64 = 30068000 80000008 80000880 0ca806a2 fe5b0dff ffe7ff02 00a7069e fe5d0d00
ffff89f7af1bd000 3633879873 S Ii:1:004:2 -115:8 64 <
ffff89f7af1bd000 3633902844 C Ii:1:004:2 0:8 64 = 30098000 80000008 80000880 0ca4069d fe5b0dff ffe8ff00 00a606a1 fe5a0dff
ffff89f7af1bd000 3633902891 S Ii:1:004:2 -115:8 64 <
ffff89f7af1bd000 3633912145 C Ii:1:004:2 0:8 64 = 300e8000 80000008 80000880 0ca50699 fe5c0d00 00e6ff01 00a30698 fe5c0d00
ffff89f7af1bd000 3633912183 S Ii:1:004:2 -115:8 64 <
ffff89f7af1bd000 3633934776 C Ii:1:004:2 0:8 64 = 30108000 80000008 80000880 0ca5069c fe5b0d01 00e6ff00 00a5069c fe5b0d01
ffff89f7af1bd000 3633934821 S Ii:1:004:2 -115:8 64 <
ffff89f7af1bd000 3633942925 C Ii:1:004:2 0:8 64 = 30148000 80000008 80000880 0ca20698 fe5c0dfe ffe6ffff ffa1069c fe5c0dff
ffff89f7af1bd000 3633942962 S Ii:1:004:2 -115:8 64 <
ffff89f7af1bd000 3633966701 C Ii:1:004:2 0:8 64 = 30168000 80000008 80000880 0ca50696 fe5c0dff ffe8ff00 00a20698 fe5c0dfe
ffff89f7af1bd000 3633966741 S Ii:1:004:2 -115:8 64 <
ffff89f7af1bd000 3633976410 C Ii:1:004:2 0:8 64 = 301b8000 80000008 80000880 0ca2069a fe5b0dff ffe5ff02 00a4069b fe5f0dff
ffff89f7af1bd000 3633976462 S Ii:1:004:2 -115:8 64 <
ffff89f7af1bd000 3633991801 C Ii:1:004:2 0:8 64 = 301c8000 80000008 80000880 0ca10698 fe580d00 00e8ff01 00a2069a fe5b0dff
ffff89f7af1bd000 3633991846 S Ii:1:004:2 -115:8 64 <
ffff89f7af1bd000 3634006885 C Ii:1:004:2 0:8 64 = 30208000 80000008 80000880 0ca1069c fe590d00 00e8ff00 00a1069c fe590d00
ffff89f7af1bd000 3634006942 S Ii:1:004:2 -115:8 64 <
ffff89f7af1bd000 3634033215 C Ii:1:004:2 0:8 64 = 30238000 80000008 80000880 0ca5069c fe5c0dfe ffe7ff01 00a2069d fe5b0dff
ffff89f7af1bd000 3634033260 S Ii:1:004:2 -115:8 64 <
ffff89f7af1bd000 3634046669 C Ii:1:004:2 0:8 64 = 30288000 80000008 80000880 0caa069a fe580dff ffe7ff00 00aa069a fe580dff
ffff89f7af1bd000 3634046708 S Ii:1:004:2 -115:8 64 <
ffff89f7af1bd000 3634063721 C Ii:1:004:2 0:8 64 = 302b8000 80000008 80000880 0ca40699 fe5b0dfe ffe7ff01 00a7069b fe590dfe
ffff89f7af1bd000 3634063764 S Ii:1:004:2 -115:8 64 <
ffff89f7af1bd000 3634078669 C Ii:1:004:2 0:8 64 = 302e8000 80000008 80000880 0ca50696 fe590dff ffe7ff03 00a30697 fe5a0dfe
ffff89f7af1bd000 3634078708 S Ii:1:004:2 -115:8 64 <
ffff89f7af1bd000 3634094723 C Ii:1:004:2 0:8 64 = 30318000 80000008 80000880 0ca60698 fe5e0dff ffe8ff01 00a60696 fe5b0dff
ffff89f7af1bd000 3634094766 S Ii:1:004:2 -115:8 64 <
ffff89f7af1bd000 3634112575 C Ii:1:004:2 0:8 64 = 30348000 80000008 80000880 0ca60698 fe5b0dfe ffe7ffff ffa60698 fe5e0dfe
ffff89f7af1bd000 3634112636 S Ii:1:004:2 -115:8 64 <
ffff89f7af1bd000 3634134666 C Ii:1:004:2 0:8 64 = 30388000 80000008 80000880 0ca40698 fe570d00 00e7ff02 00a40698 fe570d00
ffff89f7af1bd000 3634134705 S Ii:1:004:2 -115:8 64 <
ffff89f7af1bd000 3634150777 C Ii:1:004:2 0:8 64 = 303c8000 80000008 80000880 0ca3069a fe5f0dff ffe7ff01 00a3069b fe5f0d00
ffff89f7af1bd000 3634150818 S Ii:1:004:2 -115:8 64 <
ffff89f7af1bd000 3634160450 C Ii:1:004:2 0:8 64 = 30408000 80000008 80000880 0ca5069a fe590dfe ffe9ff01 00a5069a fe590dfe
ffff89f7af1bd000 3634160490 S Ii:1:004:2 -115:8 64 <
ffff89f7af1bd000 3634184541 C Ii:1:004:2 0:8 64 = 30418000 80000008 80000880 0ca6069c fe590dfd ffe8ff02 00a5069a fe590dfe
ffff89f7af1bd000 3634184592 S Ii:1:004:2 -115:8 64 <
ffff89f7af1bd000 3634198882 C Ii:1:004:2 0:8 64 = 30468000 80000008 80000880 0ca3069a fe5e0dff ffe7ff01 00a4069c fe5e0dfe
ffff89f7af1bd000 3634198953 S Ii:1:004:2 -115:8 64 <
ffff89f7af1bd000 3634214779 C Ii:1:004:2 0:8 64 = 30498000 80000008 80000880 0ca30696 fe5b0d00 00e6ff01 00a30697 fe5d0dff
ffff89f7af1bd000 3634214823 S Ii:1:004:2 -115:8 64 <
ffff89f7af1bd000 3634230799 C Ii:1:004:2 0:8 64 = 304c8000 80000008 80000880 0ca10698 fe5b0d00 00e8ff01 00a20697 fe5b0d00
ffff89f7af1bd000 3634230844 S Ii:1:004:2 -115:8 64 <
ffff89f7af1bd000 3634246831 C Ii:1:004:2 0:8 64 = 30508000 80000008 80000880 0ca30699 fe5b0dff ffe6ff02 00a30699 fe5b0dff
ffff89f7af1bd000 3634246872 S Ii:1:004:2 -115:8 64 <
ffff89f7af1bd000 3634255617 C Ii:1:004:2 0:8 64 = 30538000 80000008 80000880 0ca40699 fe5c0dff ffe8ff02 00a40699 fe5c0dff
ffff89f7af1bd000 3634255658 S Ii:1:004:2 -115:8 64 <
ffff89f7af1bd000 3634271842 C Ii:1:004:2 0:8 64 = 30548000 80000008 80000880 0ca50699 fe5c0dfe ffe8ff02 00a40699 fe5c0dff
ffff89f7af1bd000 3634271884 S Ii:1:004:2 -115:8 64 <
ffff89f7af1bd000 3634286701 C Ii:1:004:2 0:8 64 = 30588000 80000008 80000880 0ca30699 fe5d0dfe ffe6ff01 00a30699 fe5d0dfe
ffff89f7af1bd000 3634286741 S Ii:1:004:2 -115:8 64 <
ffff89f7af1bd000 3634302808 C Ii:1:004:2 0:8 64 = 305b8000 80000008 80000880 0ca50698 fe5c0d00 00e7ff00 00a50698 fe5c0d00
ffff89f7af1bd000 3634302874 S Ii:1:004:2 -115:8 64 <
ffff89f7af1bd000 3634318713 C Ii:1:004:2 0:8 64 = 305e8000 80000008 80000880 0ca60698 fe5d0dff ffe5ff01 00a60698 fe5d0dff
ffff89f7af1bd000 3634318752 S Ii:1:004:2 -115:8 64 <
ffff89f7af1bd000 3634336671 C Ii:1:004:2 0:8 64 = 30618000 80000008 80000880 0ca5069a fe5c0dff ffe8ff02 00a6069a fe5c0dff
ffff89f7af1bd000 3634336748 S Ii:1:004:2 -115:8 64 <
ffff89f7af1bd000 3634358664 C Ii:1:004:2 0:8 64 = 30648000 80000008 80000880 0ca4069a fe5e0dfe ffe7ff01 00a4069a fe5c0dfe
ffff89f7af1bd000 3634358706 S Ii:1:004:2 -115:8 64 <
ffff89f7af1bd000 3634366768 C Ii:1:004:2 0:8 64 = 30698000 80000008 80000880 0ca2069b fe5e0dff ffe7ff01 00a2069a fe600dfe
ffff89f7af1bd000 3634366813 S Ii:1:004:2 -115:8 64 <
ffff89f7af1bd000 3634390699 C Ii:1:004:2 0:8 64 = 306b8000 80000008 80000880 0ca30699 fe5d0dff ffe7ff02 00a2069b fe5e0dff
ffff89f7af1bd000 3634390740 S Ii:1:004:2 -115:8 64 <
ffff89f7af1bd000 3634409495 C Ii:1:004:2 0:8 64 = 30708000 80000008 80000880 0ca3069a fe5b0d00 00e8ff02 00a3069a fe5b0d00
ffff89f7af1bd000 3634409537 S Ii:1:004:2 -115:8 64 <
ffff89f7af1bd000 3634423728 C Ii:1:004:2 0:8 64 = 30738000 80000008 80000880 0ca0069c fe5d0dff ffe5ff01 00a0069c fe5d0dff
ffff89f7af1bd000 3634423769 S Ii:1:004:2 -115:8 64 <
ffff89f7af1bd000 3634441478 C Ii:1:004:2 0:8 64 = 30768000 80000008 80000880 0ca10699 fe5b0dfe ffe7ff01 00a10699 fe5b0dfe
ffff89f7af1bd000 3634441524 S Ii:1:004:2 -115:8 64 <
ffff89f7af1bd000 3634454791 C Ii:1:004:2 0:8 64 = 30798000 80000008 80000880 0ca7069a fe5c0dff ffe6ff00 00a50699 fe5c0dff
ffff89f7af1bd000 3634454858 S Ii:1:004:2 -115:8 64 <
ffff89f7af1bd000 3634470825 C Ii:1:004:2 0:8 64 = 307c8000 80000008 80000880 0ca6069a fe5b0d00 00e7ff02 00a6069b fe5a0d00
ffff89f7af1bd000 3634470903 S Ii:1:004:2 -115:8 64 <
ffff89f7af1bd000 3634486928 C Ii:1:004:2 0:8 64 = 30808000 80000008 80000880 0ca20699 fe5b0dff ffe8ff03 00a20699 fe5b0dff
ffff89f7af1bd000 3634486974 S Ii:1:004:2 -115:8 64 <
ffff89f7af1bd000 3634503677 C Ii:1:004:2 0:8 64 = 30838000 80000008 80000880 0ca30698 fe5b0dff ffe8ff01 00a30698 fe5b0dff
ffff89f7af1bd000 3634503736 S Ii:1:004:2 -115:8 64 <
ffff89f7af1bd000 3634518740 C Ii:1:004:2 0:8 64 = 30868000 80000008 80000880 0ca4069a fe5c0d00 00e7ff02 00a4069a fe5c0d00
ffff89f7af1bd000 3634518782 S Ii:1:004:2 -115:8 64 <
ffff89f7af1bd000 3634534821 C Ii:1:004:2 0:8 64 = 30898000 80000008 80000880 0ca4069b fe5e0dfe ffe7ff03 00a4069b fe5d0dff
ffff89f7af1bd000 3634534832 S Ii:1:004:2 -115:8 64 <
ffff89f7af1bd000 3634550828 C Ii:1:004:2 0:8 64 = 308c8000 80000008 80000880 0ca3069c fe5e0dff ffe8ff00 00a2069c fe5e0dfe
ffff89f7af1bd000 3634550886 S Ii:1:004:2 -115:8 64 <
ffff89f7af1bd000 3634558654 C Ii:1:004:2 0:8 64 = 30908000 80000008 80000880 0ca60697 fe5c0dfe ffe7ff00 00a60697 fe5c0dfe
ffff89f7af1bd000 3634558700 S Ii:1:004:2 -115:8 64 <
ffff89f7af1bd000 3634575762 C Ii:1:004:2 0:8 64 = 30918000 80000008 80000880 0ca40696 fe5b0dfe ffe7ff01 00a60697 fe5c0dfe
ffff89f7af1bd000 3634575808 S Ii:1:004:2 -115:8 64 <
ffff89f7af1bd000 3634590808 C Ii:1:004:2 0:8 64 = 30948000 80000008 80000880 0ca50699 fe5c0dff ffe7ff04 00a40698 fe5c0dfe
ffff89f7af1bd000 3634590852 S Ii:1:004:2 -115:8 64 <
ffff89f7af1bd000 3634607363 C Ii:1:004:2 0:8 64 = 30988000 80000008 80000880 0ca5069a fe580dff ffe8ff01 00a5069a fe580dff
ffff89f7af1bd000 3634607404 S Ii:1:004:2 -115:8 64 <
ffff89f7af1bd000 3634622756 C Ii:1:004:2 0:8 64 = 309b8000 80000008 80000880 0ca30696 fe580dff ffe6ff01 00a30696 fe580dff
ffff89f7af1bd000 3634622800 S Ii:1:004:2 -115:8 64 <
ffff89f7af1bd000 3634638699 C Ii:1:004:2 0:8 64 = 309e8000 80000008 80000880 0ca20699 fe5a0dff ffe5ff01 00a20699 fe5a0dff
ffff89f7af1bd000 3634638753 S Ii:1:004:2 -115:8 64 <
ffff89f7af1bd000 3634655492 C Ii:1:004:2 0:8 64 = 30a18000 80000008 80000880 0ca2069a fe5a0d00 00e8ff02 00a2069a fe590dff
ffff89f7af1bd000 3634655540 S Ii:1:004:2 -115:8 64 <
ffff89f7af1bd000 3634670776 C Ii:1:004:2 0:8 64 = 30a48000 80000008 80000880 0ca20699 fe5c0d01 00e7ff03 00a2069a fe5c0d01
ffff89f7af1bd000 3634670821 S Ii:1:004:2 -115:8 64 <
ffff89f7af1bd000 3634688828 C Ii:1:004:2 0:8 64 = 30a88000 80000008 80000880 0ca20699 fe5a0dfe ffe6ff01 00a20699 fe5a0dfe
ffff89f7af1bd000 3634688871 S Ii:1:004:2 -115:8 64 <
ffff89f7af1bd000 3634702839 C Ii:1:004:2 0:8 64 = 30ab8000 80000008 80000880 0ca5069b fe5f0dfe ffe4ff01 00a5069b fe5f0dfe
ffff89f7af1bd000 3634702883 S Ii:1:004:2 -115:8 64 <
ffff89f7af1bd000 3634718778 C Ii:1:004:2 0:8 64 = 30ae8000 80000008 80000880 0ca60698 fe590dff ffe7ff01 00a60698 fe590dff
ffff89f7af1bd000 3634718824 S Ii:1:004:2 -115:8 64 <
ffff89f7af1bd000 3634734687 C Ii:1:004:2 0:8 64 = 30b18000 80000008 80000880 0ca6069b fe5a0dff ffe6ff00 00a50699 fe580dff
ffff89f7af1bd000 3634734734 S Ii:1:004:2 -115:8 64 <
ffff89f7af1bd000 3634752281 C Ii:1:004:2 0:8 64 = 30b48000 80000008 80000880 0ca6069c fe5d0dff ffe6ff00 00a7069c fe5d0dff
ffff89f7af1bd000 3634752326 S Ii:1:004:2 -115:8 64 <
ffff89f7af1bd000 3634774768 C Ii:1:004:2 0:8 64 = 30b88000 80000008 80000880 0ca5069a fe5d0dff ffe7ff01 00a5069a fe5d0dff
ffff89f7af1bd000 3634774838 S Ii:1:004:2 -115:8 64 <
ffff89f7af1bd000 3634782713 C Ii:1:004:2 0:8 64 = 30bc8000 80000008 80000880 0ca60697 fe5d0d00 00e5ff02 00a60697 fe5b0d00
ffff89f7af1bd000 3634782754 S Ii:1:004:2 -115:8 64 <
ffff89f7af1bd000 3634806681 C Ii:1:004:2 0:8 64 = 30be8000 80000008 80000880 0ca5069a fe5d0dfe ffe6ff02 00a60697 fe5d0d00
ffff89f7af1bd000 3634806724 S Ii:1:004:2 -115:8 64 <
ffff89f7af1bd000 3634822711 C Ii:1:004:2 0:8 64 = 30c38000 80000008 80000880 0ca5069a fe5c0dff ffe6ff01 00a5069a fe5c0dff
ffff89f7af1bd000 3634822756 S Ii:1:004:2 -115:8 64 <
ffff89f7af1bd000 3634840691 C Ii:1:004:2 0:8 64 = 30c68000 80000008 80000880 0ca7069a fe5b0dff ffe7ff02 00a7069a fe5b0dff
ffff89f7af1bd000 3634840738 S Ii:1:004:2 -115:8 64 <
ffff89f7af1bd000 3634854707 C Ii:1:004:2 0:8 64 = 30c98000 80000008 80000880 0ca6069c fe590dff ffe6ff02 00a6069b fe5b0dff
ffff89f7af1bd000 3634854750 S Ii:1:004:2 -115:8 64 <
ffff89f7af1bd000 3634870765 C Ii:1:004:2 0:8 64 = 30cc8000 80000008 80000880 0ca7069e fe590dfe ffe8ff02 00a7069d fe590dfe
ffff89f7af1bd000 3634870804 S Ii:1:004:2 -115:8 64 <
ffff89f7af1bd000 3634887579 C Ii:1:004:2 0:8 64 = 30d08000 80000008 80000880 0ca5069c fe5c0dfd ffe8ff01 00a5069c fe5c0dfd
ffff89f7af1bd000 3634887622 S Ii:1:004:2 -115:8 64 <
ffff89f7af1bd000 3634903796 C Ii:1:004:2 0:8 64 = 30d38000 80000008 80000880 0ca2069a fe590dfd ffe7ff00 00a2069a fe590dfd
ffff89f7af1bd000 3634903843 S Ii:1:004:2 -115:8 64 <
ffff89f7af1bd000 3634918639 C Ii:1:004:2 0:8 64 = 30d68000 80000008 80000880 0ca3069c fe590dff ffe7ff02 00a3069c fe590dff
ffff89f7af1bd000 3634918681 S Ii:1:004:2 -115:8 64 <
ffff89f7af1bd000 3634934766 C Ii:1:004:2 0:8 64 = 30d98000 80000008 80000880 0ca3069b fe5b0dff ffe8ff00 00a4069b fe5a0d00
ffff89f7af1bd000 3634934807 S Ii:1:004:2 -115:8 64 <
ffff89f7af1bd000 3634952330 C Ii:1:004:2 0:8 64 = 30dc8000 80000008 80000880 0ca30699 fe5e0dfd ffe7ff00 00a2069a fe5c0dfe
ffff89f7af1bd000 3634952373 S Ii:1:004:2 -115:8 64 <
ffff89f7af1bd000 3634969158 C Ii:1:004:2 0:8 64 = 30e08000 80000008 80000880 0ca5069a fe5c0dfd ffe7ff02 00a5069a fe5c0dfd
ffff89f7af1bd000 3634969215 S Ii:1:004:2 -115:8 64 <
ffff89f7af1bd000 3634985344 C Ii:1:004:2 0:8 64 = 30e38000 80000008 80000880 0ca3069a fe5c0dff ffe6ff02 00a3069a fe5c0dff
ffff89f7af1bd000 3634985389 S Ii:1:004:2 -115:8 64 <
ffff89f7af1bd000 3635000389 C Ii:1:004:2 0:8 64 = 30e68000 80000008 80000880 0ca60699 fe5d0dff ffe7ff02 00a60699 fe5d0dff
ffff89f7af1bd000 3635000431 S Ii:1:004:2 -115:8 64 <
ffff89f7af1bd000 3635014806 C Ii:1:004:2 0:8 64 = 30e98000 80000008 80000880 0ca40699 fe5b0dfe ffe6ff02 00a5069a fe5c0dfe
ffff89f7af1bd000 3635014854 S Ii:1:004:2 -115:8 64 <
ffff89f7af1bd000 3635033359 C Ii:1:004:2 0:8 64 = 30ec8000 80000008 80000880 0ca40699 fe5f0dfe ffe6ff01 00a30698 fe5b0dfe
ffff89f7af1bd000 3635033406 S Ii:1:004:2 -115:8 64 <
ffff89f7af1bd000 3635048776 C Ii:1:004:2 0:8 64 = 30f08000 80000008 80000880 0ca4069b fe5c0dff ffe8ff01 00a4069b fe5c0dff
ffff89f7af1bd000 3635048819 S Ii:1:004:2 -115:8 64 <
ffff89f7af1bd000 3635062833 C Ii:1:004:2 0:8 64 = 30f38000 80000008 80000880 0ca50699 fe5a0dff ffe6ff03 00a50699 fe5a0dff
ffff89f7af1bd000 3635062895 S Ii:1:004:2 -115:8 64 <
ffff89f7af1bd000 3635078762 C Ii:1:004:2 0:8 64 = 30f68000 80000008 80000880 0ca4069c fe5e0dfe ffe7ff01 00a4069c fe5e0dfe
ffff89f7af1bd000 3635078800 S Ii:1:004:2 -115:8 64 <
ffff89f7af1bd000 3635096553 C Ii:1:004:2 0:8 64 = 30f98000 80000008 80000880 0ca4069c fe5c0dff ffe6ff00 00a4069d fe5d0dfe
ffff89f7af1bd000 3635096600 S Ii:1:004:2 -115:8 64 <
ffff89f7af1bd000 3635118770 C Ii:1:004:2 0:8 64 = 30fc8000 80000008 80000880 0ca50698 fe5a0d00 00e6ff01 00a50699 fe5a0dff
ffff89f7af1bd000 3635118818 S Ii:1:004:2 -115:8 64 <
ffff89f7af1bd000 3635127497 C Ii:1:004:2 0:8 64 = 30018000 80000008 80000880 0ca3069b fe5a0dff ffe6ff01 00a3069a fe5a0dff
ffff89f7af1bd000 3635127536 S Ii:1:004:2 -115:8 64 <
ffff89f7af1bd000 3635142750 C Ii:1:004:2 0:8 64 = 30038000 80000008 80000880 0ca4069c fe5b0dff ffe7ff01 00a3069b fe5a0dff
ffff89f7af1bd000 3635142790 S Ii:1:004:2 -115:8 64 <
ffff89f7af1bd000 3635158752 C Ii:1:004:2 0:8 64 = 30068000 80000008 80000880 0ca5069d fe5d0dff ffe7ff02 00a5069d fe5d0dff
ffff89f7af1bd000 3635158801 S Ii:1:004:2 -115:8 64 <
ffff89f7af1bd000 3635177025 C Ii:1:004:2 0:8 64 = 30098000 80000008 80000880 0ca5069d fe5d0dfe ffe5ff02 00a5069e fe5e0dfe
ffff89f7af1bd000 3635177074 S Ii:1:004:2 -115:8 64 <
ffff89f7af1bd000 3635198608 C Ii:1:004:2 0:8 64 = 300c8000 80000008 80000880 0ca30696 fe5e0dff ffe7ffff ffa30699 fe5e0dfe
ffff89f7af1bd000 3635198655 S Ii:1:004:2 -115:8 64 <
ffff89f7af1bd000 3635214838 C Ii:1:004:2 0:8 64 = 30118000 80000008 80000880 0ca3069b fe5b0d00 00e5ff02 00a4069a fe5b0d00
ffff89f7af1bd000 3635214878 S Ii:1:004:2 -115:8 64 <
ffff89f7af1bd000 3635222812 C Ii:1:004:2 0:8 64 = 30148000 80000008 80000880 0ca3069a fe5d0dff ffe7ff01 00a2069b fe5d0dff
ffff89f7af1bd000 3635222851 S Ii:1:004:2 -115:8 64 <
ffff89f7af1bd000 3635246763 C Ii:1:004:2 0:8 64 = 30168000 80000008 80000880 0ca40699 fe5b0dff ffe7ff01 00a3069a fe5d0dff
ffff89f7af1bd000 3635246813 S Ii:1:004:2 -115:8 64 <
ffff89f7af1bd000 3635256311 C Ii:1:004:2 0:8 64 = 301b8000 80000008 80000880 0c9e069b fe5a0dff ffe7ff01 009e069b fe5a0dff
ffff89f7af1bd000 3635256354 S Ii:1:004:2 -115:8 64 <
ffff89f7af1bd000 3635278754 C Ii:1:004:2 0:8 64 = 301c8000 80000008 80000880 0c9f0699 fe5a0d00 00e7ff00 009e069b fe5a0dff
ffff89f7af1bd000 3635278801 S Ii:1:004:2 -115:8 64 <
ffff89f7af1bd000 3635297726 C Ii:1:004:2 0:8 64 = 30218000 80000008 80000880 0ca50698 fe590dff ffe7ff02 00a50698 fe5b0d00
ffff89f7af1bd000 3635297774 S Ii:1:004:2 -115:8 64 <
ffff89f7af1bd000 3635310765 C Ii:1:004:2 0:8 64 = 30248000 80000008 80000880 0ca1069a fe590dff ffe6ff02 00a30699 fe580dff
ffff89f7af1bd000 3635310801 S Ii:1:004:2 -115:8 64 <
ffff89f7af1bd000 3635326648 C Ii:1:004:2 0:8 64 = 30288000 80000008 80000880 0ca00699 fe580d00 00e7ff00 00a00699 fe580d00
ffff89f7af1bd000 3635326690 S Ii:1:004:2 -115:8 64 <
ffff89f7af1bd000 3635334684 C Ii:1:004:2 0:8 64 = 302b8000 80000008 80000880 0ca5069c fe5a0dff ffe7ff00 00a5069c fe5a0dff
ffff89f7af1bd000 3635334723 S Ii:1:004:2 -115:8 64 <
ffff89f7af1bd000 3635352358 C Ii:1:004:2 0:8 64 = 302c8000 80000008 80000880 0ca3069d fe5c0dfe ffe6ff01 00a5069c fe5a0dff
ffff89f7af1bd000 3635352399 S Ii:1:004:2 -115:8 64 <
ffff89f7af1bd000 3635367984 C Ii:1:004:2 0:8 64 = 30308000 80000008 80000880 0ca20699 fe5a0dff ffe7ff02 00a20699 fe5a0dff
ffff89f7af1bd000 3635368026 S Ii:1:004:2 -115:8 64 <
ffff89f7af1bd000 3635390717 C Ii:1:004:2 0:8 64 = 30338000 80000008 80000880 0ca8069a fe590d00 00e6ff00 00a8069a fe590d00
ffff89f7af1bd000 3635390761 S Ii:1:004:2 -115:8 64 <
ffff89f7af1bd000 3635400738 C Ii:1:004:2 0:8 64 = 30388000 80000008 80000880 0ca5069e fe5c0dff ffe7ff03 00a5069e fe5c0dff
ffff89f7af1bd000 3635400775 S Ii:1:004:2 -115:8 64 <
ffff89f7af1bd000 3635415613 C Ii:1:004:2 0:8 64 = 30398000 80000008 80000880 0ca6069c fe5d0d00 00e6ff03 00a5069e fe5c0dff
ffff89f7af1bd000 3635415652 S Ii:1:004:2 -115:8 64 <
ffff89f7af1bd000 3635430843 C Ii:1:004:2 0:8 64 = 303c8000 80000008 80000880 0ca70697 fe5c0dff ffe4ff01 00a60699 fe5d0dff
ffff89f7af1bd000 3635430881 S Ii:1:004:2 -115:8 64 <
ffff89f7af1bd000 3635454741 C Ii:1:004:2 0:8 64 = 30408000 80000008 80000880 0ca30698 fe5b0d00 00e7ff01 00a30698 fe5b0d00
ffff89f7af1bd000 3635454784 S Ii:1:004:2 -115:8 64 <
ffff89f7af1bd000 3635473485 C Ii:1:004:2 0:8 64 = 30448000 80000008 80000880 0ca20698 fe5d0dfe ffe8ff03 009f0697 fe5c0dfe
ffff89f7af1bd000 3635473530 S Ii:1:004:2 -115:8 64 <
ffff89f7af1bd000 3635490034 C Ii:1:004:2 0:8 64 = 30488000 80000008 80000880 0ca50698 fe5b0dfd ffe7ff02 00a50698 fe5b0dfd
ffff89f7af1bd000 3635490083 S Ii:1:004:2 -115:8 64 <
ffff89f7af1bd000 3635502642 C Ii:1:004:2 0:8 64 = 304b8000 80000008 80000880 0ca2069a fe5b0dff ffe7ff01 00a2069a fe5b0dff
ffff89f7af1bd000 3635502677 S Ii:1:004:2 -115:8 64 <
ffff89f7af1bd000 3635511880 C Ii:1:004:2 0:8 64 = 304e8000 80000008 80000880 0ca4069b fe5d0d01 00e7ff01 00a4069b fe5d0d01
ffff89f7af1bd000 3635511935 S Ii:1:004:2 -115:8 64 <
ffff89f7af1bd000 3635528397 C Ii:1:004:2 0:8 64 = 30508000 80000008 80000880 0ca4069a fe5c0d00 00e6ff01 00a4069a fe5c0d00
ffff89f7af1bd000 3635528439 S Ii:1:004:2 -115:8 64 <
ffff89f7af1bd000 3635542723 C Ii:1:004:2 0:8 64 = 30538000 80000008 80000880 0ca2069a fe580dff ffe5ff01 00a2069a fe580dff
ffff89f7af1bd000 3635542774 S Ii:1:004:2 -115:8 64 <
ffff89f7af1bd000 3635560493 C Ii:1:004:2 0:8 64 = 30568000 80000008 80000880 0ca4069b fe5a0dff ffe7ff03 00a4069b fe5a0dff
ffff89f7af1bd000 3635560534 S Ii:1:004:2 -115:8 64 <
ffff89f7af1bd000 3635584337 C Ii:1:004:2 0:8 64 = 30598000 80000008 80000880 0ca70699 fe5d0dff ffe8ff02 00a7069a fe5c0dff
ffff89f7af1bd000 3635584380 S Ii:1:004:2 -115:8 64 <
ffff89f7af1bd000 3635600942 C Ii:1:004:2 0:8 64 = 305e8000 80000008 80000880 0c9f0697 fe5b0dff ffe8ff01 009f0697 fe5b0dff
ffff89f7af1bd000 3635600988 S Ii:1:004:2 -115:8 64 <
ffff89f7af1bd000 3635616618 C Ii:1:004:2 0:8 64 = 30618000 80000008 80000880 0ca20696 fe5e0dff ffe8ff02 00a00695 fe5c0dff
ffff89f7af1bd000 3635616657 S Ii:1:004:2 -115:8 64 <
ffff89f7af1bd000 3635630826 C Ii:1:004:2 0:8 64 = 30648000 80000008 80000880 0ca5069c fe5d0dfe ffe6ff01 00a40699 fe5e0dff
ffff89f7af1bd000 3635630864 S Ii:1:004:2 -115:8 64 <
ffff89f7af1bd000 3635647269 C Ii:1:004:2 0:8 64 = 30688000 80000008 80000880 0ca2069d fe5b0dff ffe8ff01 00a2069d fe5b0dff
ffff89f7af1bd000 3635647311 S Ii:1:004:2 -115:8 64 <
ffff89f7af1bd000 3635663559 C Ii:1:004:2 0:8 64 = 306b8000 80000008 80000880 0ca3069b fe5e0d00 00e5ff02 00a3069b fe5e0d00
ffff89f7af1bd000 3635663602 S Ii:1:004:2 -115:8 64 <
ffff89f7af1bd000 3635680403 C Ii:1:004:2 0:8 64 = 306e8000 80000008 80000880 0ca70699 fe580dff ffe5ff03 00a70699 fe580dff
ffff89f7af1bd000 3635680440 S Ii:1:004:2 -115:8 64 <
ffff89f7af1bd000 3635696326 C Ii:1:004:2 0:8 64 = 30718000 80000008 80000880 0ca50697 fe550dff ffe5ff00 00a60698 fe530dfe
ffff89f7af1bd000 3635696370 S Ii:1:004:2 -115:8 64 <
ffff89f7af1bd000 3635710699 C Ii:1:004:2 0:8 64 = 30748000 80000008 80000880 0ca2069a fe5d0d00 00e6ff01 00a30699 fe590dff
ffff89f7af1bd000 3635710735 S Ii:1:004:2 -115:8 64 <
ffff89f7af1bd000 3635728388 C Ii:1:004:2 0:8 64 = 30788000 80000008 80000880 0ca1069a fe5a0d00 00e8ff04 00a1069a fe5a0d00
ffff89f7af1bd000 3635728431 S Ii:1:004:2 -115:8 64 <
ffff89f7af1bd000 3635742853 C Ii:1:004:2 0:8 64 = 307b8000 80000008 80000880 0ca3069a fe5b0dff ffe6ff04 00a3069a fe5b0dff
ffff89f7af1bd000 3635742892 S Ii:1:004:2 -115:8 64 <
ffff89f7af1bd000 3635758719 C Ii:1:004:2 0:8 64 = 307e8000 80000008 80000880 0ca1069a fe5b0dff ffe7ff02 00a1069a fe5b0dff
ffff89f7af1bd000 3635758730 S Ii:1:004:2 -115:8 64 <
ffff89f7af1bd000 3635776351 C Ii:1:004:2 0:8 64 = 30818000 80000008 80000880 0ca10696 fe590dff ffe7ff02 00a10698 fe590dff
ffff89f7af1bd000 3635776392 S Ii:1:004:2 -115:8 64 <
ffff89f7af1bd000 3635791971 C Ii:1:004:2 0:8 64 = 30848000 80000008 80000880 0ca20698 fe5b0dff ffe7ff02 00a10697 fe5a0dff
ffff89f7af1bd000 3635792029 S Ii:1:004:2 -115:8 64 <
ffff89f7af1bd000 3635806759 C Ii:1:004:2 0:8 64 = 30888000 80000008 80000880 0ca70698 fe5c0dfe ffe7ff01 00a70698 fe5c0dfe
ffff89f7af1bd000 3635806795 S Ii:1:004:2 -115:8 64 <
ffff89f7af1bd000 3635822632 C Ii:1:004:2 0:8 64 = 308b8000 80000008 80000880 0ca2069b fe590dff ffe7ff01 00a2069b fe590dff
ffff89f7af1bd000 3635822673 S Ii:1:004:2 -115:8 64 <
ffff89f7af1bd000 3635838815 C Ii:1:004:2 0:8 64 = 308e8000 80000008 80000880 0ca2069b fe5a0dff ffe6ff00 00a2069b fe5a0dff
ffff89f7af1bd000 3635838853 S Ii:1:004:2 -115:8 64 <
ffff89f7af1bd000 3635856481 C Ii:1:004:2 0:8 64 = 30918000 80000008 80000880 0ca40698 fe590dff ffe6ff00 00a4069a fe5a0dff
ffff89f7af1bd000 3635856524 S Ii:1:004:2 -115:8 64 <
ffff89f7af1bd000 3635881236 C Ii:1:004:2 0:8 64 = 30948000 80000008 80000880 0ca3069b fe590d00 00e7ff01 00a40698 fe590d00
ffff89f7af1bd000 3635881308 S Ii:1:004:2 -115:8 64 <
ffff89f7af1bd000 3635894643 C Ii:1:004:2 0:8 64 = 30998000 80000008 80000880 0ca3069e fe5d0dff ffe6ff01 00a2069f fe5e0dfe
ffff89f7af1bd000 3635894684 S Ii:1:004:2 -115:8 64 <
ffff89f7af1bd000 3635910676 C Ii:1:004:2 0:8 64 = 309c8000 80000008 80000880 0ca6069c fe5c0d00 00e7ff02 00a6069d fe5c0d00
ffff89f7af1bd000 3635910715 S Ii:1:004:2 -115:8 64 <
ffff89f7af1bd000 3635920683 C Ii:1:004:2 0:8 64 = 30a08000 80000008 80000880 0ca50698 fe5b0dfe ffe6ff02 00a50698 fe5b0dfe
ffff89f7af1bd000 3635920735 S Ii:1:004:2 -115:8 64 <
ffff89f7af1bd000 3635934685 C Ii:1:004:2 0:8 64 = 30a18000 80000008 80000880 0ca50697 fe5c0dfe ffe6ff02 00a50698 fe5b0dfe
ffff89f7af1bd000 3635934722 S Ii:1:004:2 -115:8 64 <
ffff89f7af1bd000 3635950820 C Ii:1:004:2 0:8 64 = 30a48000 80000008 80000880 0ca20699 fe5d0dfe ffe6ff02 00a40699 fe5d0dfe
ffff89f7af1bd000 3635950861 S Ii:1:004:2 -115:8 64 <
ffff89f7af1bd000 3635966681 C Ii:1:004:2 0:8 64 = 30a88000 80000008 80000880 0ca10696 fe5c0dfe ffe6ff00 00a10696 fe5c0dfe
ffff89f7af1bd000 3635966720 S Ii:1:004:2 -115:8 64 <
ffff89f7af1bd000 3635982672 C Ii:1:004:2 0:8 64 = 30ab8000 80000008 80000880 0ca70696 fe590dff ffe7ff01 00a70696 fe590dff
ffff89f7af1bd000 3635982711 S Ii:1:004:2 -115:8 64 <
ffff89f7af1bd000 3635990792 C Ii:1:004:2 0:8 64 = 30ae8000 80000008 80000880 0ca4069a fe580d00 00e7ff03 00a4069a fe580d00
ffff89f7af1bd000 3635990832 S Ii:1:004:2 -115:8 64 <
ffff89f7af1bd000 3636007886 C Ii:1:004:2 0:8 64 = 30b08000 80000008 80000880 0ca3069b fe570d00 00e7ff02 00a3069b fe570d00
ffff89f7af1bd000 3636007925 S Ii:1:004:2 -115:8 64 <
ffff89f7af1bd000 3636033355 C Ii:1:004:2 0:8 64 = 30b38000 80000008 80000880 0ca4069b fe570dfe ffe5ff01 00a4069b fe570dfe
ffff89f7af1bd000 3636033399 S Ii:1:004:2 -115:8 64 <
ffff89f7af1bd000 3636046702 C Ii:1:004:2 0:8 64 = 30b88000 80000008 80000880 0ca5069c fe5d0dff ffe9ff02 00a5069c fe5d0dff
ffff89f7af1bd000 3636046737 S Ii:1:004:2 -115:8 64 <
ffff89f7af1bd000 3636054721 C Ii:1:004:2 0:8 64 = 30bb8000 80000008 80000880 0ca7069f fe5c0dfe ffe5ff02 00a7069f fe5c0dfe
ffff89f7af1bd000 3636054758 S Ii:1:004:2 -115:8 64 <
ffff89f7af1bd000 3636070707 C Ii:1:004:2 0:8 64 = 30bc8000 80000008 80000880 0ca7069e fe5d0dfe ffe6ff01 00a7069f fe5c0dfe
ffff89f7af1bd000 3636070746 S Ii:1:004:2 -115:8 64 <
ffff89f7af1bd000 3636078654 C Ii:1:004:2 0:8 64 = 30c08000 80000008 80000880 0ca3069a fe5e0dff ffe8ff01 00a3069a fe5e0dff
ffff89f7af1bd000 3636078691 S Ii:1:004:2 -115:8 64 <
ffff89f7af1bd000 3636094819 C Ii:1:004:2 0:8 64 = 30c18000 80000008 80000880 0ca20698 fe5f0dff ffe6ff00 00a3069a fe5e0dff
ffff89f7af1bd000 3636094867 S Ii:1:004:2 -115:8 64 <
ffff89f7af1bd000 3636113346 C Ii:1:004:2 0:8 64 = 30c48000 80000008 80000880 0ca40697 fe5e0d00 00e4ff00 00a20697 fe5f0dff
ffff89f7af1bd000 3636113384 S Ii:1:004:2 -115:8 64 <
ffff89f7af1bd000 3636127448 C Ii:1:004:2 0:8 64 = 30c88000 80000008 80000880 0ca6069b fe5a0dfe ffe7ff01 00a6069b fe5a0dfe
ffff89f7af1bd000 3636127490 S Ii:1:004:2 -115:8 64 <
ffff89f7af1bd000 3636143485 C Ii:1:004:2 0:8 64 = 30cb8000 80000008 80000880 0ca10698 fe5a0dfe ffe7ff01 00a10698 fe5a0dfe
ffff89f7af1bd000 3636143522 S Ii:1:004:2 -115:8 64 <
ffff89f7af1bd000 3636160113 C Ii:1:004:2 0:8 64 = 30ce8000 80000008 80000880 0ca20698 fe590dff ffe8ff00 00a20698 fe590dff
ffff89f7af1bd000 3636160155 S Ii:1:004:2 -115:8 64 <
ffff89f7af1bd000 3636175943 C Ii:1:004:2 0:8 64 = 30d18000 80000008 80000880 0ca60697 fe5c0d00 00e5ff01 00a30698 fe5b0d00
ffff89f7af1bd000 3636175980 S Ii:1:004:2 -115:8 64 <
ffff89f7af1bd000 3636190672 C Ii:1:004:2 0:8 64 = 30d48000 80000008 80000880 0ca40697 fe5c0dff ffe6ff02 00a60696 fe5c0dff
ffff89f7af1bd000 3636190712 S Ii:1:004:2 -115:8 64 <
ffff89f7af1bd000 3636208427 C Ii:1:004:2 0:8 64 = 30d88000 80000008 80000880 0ca4069a fe5a0d00 00e6ff01 00a4069a fe5a0d00
ffff89f7af1bd000 3636208471 S Ii:1:004:2 -115:8 64 <
ffff89f7af1bd000 3636222669 C Ii:1:004:2 0:8 64 = 30db8000 80000008 80000880 0ca7069a fe5d0dff ffe6ff00 00a7069a fe5d0dff
ffff89f7af1bd000 3636222722 S Ii:1:004:2 -115:8 64 <
ffff89f7af1bd000 3636239514 C Ii:1:004:2 0:8 64 = 30de8000 80000008 80000880 0ca70699 fe5c0d00 00e6ff03 00a70699 fe5c0d00
ffff89f7af1bd000 3636239555 S Ii:1:004:2 -115:8 64 <
ffff89f7af1bd000 3636254571 C Ii:1:004:2 0:8 64 = 30e18000 80000008 80000880 0ca70699 fe5f0dff ffe5ff02 00a80699 fe5c0d00
ffff89f7af1bd000 3636254614 S Ii:1:004:2 -115:8 64 <
ffff89f7af1bd000 3636271368 C Ii:1:004:2 0:8 64 = 30e48000 80000008 80000880 0ca4069a fe5e0dff ffe8ff02 00a60699 fe600dff
ffff89f7af1bd000 3636271406 S Ii:1:004:2 -115:8 64 <
ffff89f7af1bd000 3636286639 C Ii:1:004:2 0:8 64 = 30e88000 80000008 80000880 0ca3069b fe5d0d00 00e6ff01 00a3069b fe5d0d00
ffff89f7af1bd000 3636286682 S Ii:1:004:2 -115:8 64 <
ffff89f7af1bd000 3636303744 C Ii:1:004:2 0:8 64 = 30eb8000 80000008 80000880 0ca30699 fe5d0dfe ffe7ffff ffa30699 fe5d0dfe
ffff89f7af1bd000 3636303784 S Ii:1:004:2 -115:8 64 <
ffff89f7af1bd000 3636318572 C Ii:1:004:2 0:8 64 = 30ee8000 80000008 80000880 0ca10699 fe5c0dff ffe6ff02 00a10699 fe5c0dff
ffff89f7af1bd000 3636318619 S Ii:1:004:2 -115:8 64 <
ffff89f7af1bd000 3636335570 C Ii:1:004:2 0:8 64 = 30f18000 80000008 80000880 0ca20696 fe5d0dff ffe7ff01 00a10697 fe5d0dff
ffff89f7af1bd000 3636335616 S Ii:1:004:2 -115:8 64 <
ffff89f7af1bd000 3636352149 C Ii:1:004:2 0:8 64 = 30f48000 80000008 80000880 0ca40698 fe5e0dff ffe5ff00 00a30697 fe5c0dff
ffff89f7af1bd000 3636352203 S Ii:1:004:2 -115:8 64 <
ffff89f7af1bd000 3636368425 C Ii:1:004:2 0:8 64 = 30f88000 80000008 80000880 0ca30697 fe590dff ffe4ff01 00a30697 fe590dff
ffff89f7af1bd000 3636368467 S Ii:1:004:2 -115:8 64 <
ffff89f7af1bd000 3636383325 C Ii:1:004:2 0:8 64 = 30fb8000 80000008 80000880 0ca10697 fe5a0dff ffe7ff00 00a10697 fe5a0dff
ffff89f7af1bd000 3636383389 S Ii:1:004:2 -115:8 64 <
ffff89f7af1bd000 3636400293 C Ii:1:004:2 0:8 64 = 30fe8000 80000008 80000880 0ca8069c fe5d0dff ffe6ff01 00a8069c fe5d0dff
ffff89f7af1bd000 3636400336 S Ii:1:004:2 -115:8 64 <
ffff89f7af1bd000 3636416218 C Ii:1:004:2 0:8 64 = 30018000 80000008 80000880 0ca7069c fe5e0dff ffe7ff01 00a8069d fe5f0dff
ffff89f7af1bd000 3636416256 S Ii:1:004:2 -115:8 64 <
ffff89f7af1bd000 3636430803 C Ii:1:004:2 0:8 64 = 30048000 80000008 80000880 0ca70699 fe5a0dff ffe7ff02 00a8069a fe5b0dff
ffff89f7af1bd000 3636430842 S Ii:1:004:2 -115:8 64 <
ffff89f7af1bd000 3636447623 C Ii:1:004:2 0:8 64 = 30088000 80000008 80000880 0ca50698 fe5e0dfe ffe7ff01 00a50698 fe5e0dfe
ffff89f7af1bd000 3636447674 S Ii:1:004:2 -115:8 64 <
ffff89f7af1bd000 3636463422 C Ii:1:004:2 0:8 64 = 300b8000 80000008 80000880 0ca20699 fe5c0dff ffe5ff02 00a20699 fe5c0dff
ffff89f7af1bd000 3636463462 S Ii:1:004:2 -115:8 64 <
ffff89f7af1bd000 3636478757 C Ii:1:004:2 0:8 64 = 300e8000 80000008 80000880 0ca30696 fe5e0dff ffe7ff02 00a30696 fe5e0dff
ffff89f7af1bd000 3636478792 S Ii:1:004:2 -115:8 64 <
ffff89f7af1bd000 3636494641 C Ii:1:004:2 0:8 64 = 30118000 80000008 80000880 0ca50696 fe5b0dff ffe7ff01 00a40695 fe5e0dff
ffff89f7af1bd000 3636494685 S Ii:1:004:2 -115:8 64 <
ffff89f7af1bd000 3636503774 C Ii:1:004:2 0:8 64 = 30148000 80000008 80000880 0ca50699 fe5b0dff ffe6ff00 00a60698 fe5a0dff
ffff89f7af1bd000 3636503811 S Ii:1:004:2 -115:8 64 <
ffff89f7af1bd000 3636529324 C Ii:1:004:2 0:8 64 = 30168000 80000008 80000880 0ca4069a fe5c0dff ffe7ff01 00a4069a fe5c0dff
ffff89f7af1bd000 3636529370 S Ii:1:004:2 -115:8 64 <
ffff89f7af1bd000 3636536312 C Ii:1:004:2 0:8 64 = 301b8000 80000008 80000880 0ca50699 fe5c0dfe ffe7ff00 00a50699 fe5c0dfe
ffff89f7af1bd000 3636536351 S Ii:1:004:2 -115:8 64 <
ffff89f7af1bd000 3636561124 C Ii:1:004:2 0:8 64 = 301c8000 80000008 80000880 0ca50698 fe5d0dff ffe7ff00 00a50699 fe5c0dfe
ffff89f7af1bd000 3636561169 S Ii:1:004:2 -115:8 64 <
ffff89f7af1bd000 3636574577 C Ii:1:004:2 0:8 64 = 30218000 80000008 80000880 0ca60699 fe5c0d00 00e6ff02 00a80699 fe5b0d00
ffff89f7af1bd000 3636574624 S Ii:1:004:2 -115:8 64 <
ffff89f7af1bd000 3636583629 C Ii:1:004:2 0:8 64 = 30248000 80000008 80000880 0ca3069a fe590dff ffe7ff01 00a4069a fe5b0dff
ffff89f7af1bd000 3636583676 S Ii:1:004:2 -115:8 64 <
ffff89f7af1bd000 3636598557 C Ii:1:004:2 0:8 64 = 30268000 80000008 80000880 0ca4069a fe590dff ffe7ff01 00a4069a fe590dff
ffff89f7af1bd000 3636598602 S Ii:1:004:2 -115:8 64 <
ffff89f7af1bd000 3636614628 C Ii:1:004:2 0:8 64 = 30298000 80000008 80000880 0ca60699 fe5a0dfe ffe6ff00 00a6069a fe590dff
ffff89f7af1bd000 3636614677 S Ii:1:004:2 -115:8 64 <
ffff89f7af1bd000 3636638701 C Ii:1:004:2 0:8 64 = 302c8000 80000008 80000880 0ca50697 fe5b0dfe ffe7ff00 00a60698 fe5b0dfe
ffff89f7af1bd000 3636638743 S Ii:1:004:2 -115:8 64 <
ffff89f7af1bd000 3636647210 C Ii:1:004:2 0:8 64 = 30318000 80000008 80000880 0ca40698 fe570dff ffe8ff02 00a40698 fe560dff
ffff89f7af1bd000 3636647246 S Ii:1:004:2 -115:8 64 <
ffff89f7af1bd000 3636663597 C Ii:1:004:2 0:8 64 = 30338000 80000008 80000880 0ca50698 fe5b0dff ffe8ff03 00a50698 fe5b0dff
ffff89f7af1bd000 3636663642 S Ii:1:004:2 -115:8 64 <
ffff89f7af1bd000 3636680508 C Ii:1:004:2 0:8 64 = 30368000 80000008 80000880 0ca6069a fe5d0dff ffe6ff02 00a6069a fe5d0dff
ffff89f7af1bd000 3636680544 S Ii:1:004:2 -115:8 64 <
ffff89f7af1bd000 3636694650 C Ii:1:004:2 0:8 64 = 30398000 80000008 80000880 0ca7069c fe5d0dff ffe7ff01 00a7069b fe5d0dff
ffff89f7af1bd000 3636694695 S Ii:1:004:2 -115:8 64 <
ffff89f7af1bd000 3636712245 C Ii:1:004:2 0:8 64 = 303c8000 80000008 80000880 0ca9069b fe5c0dfe ffe6ff01 00a8069c fe5d0dff
ffff89f7af1bd000 3636712289 S Ii:1:004:2 -115:8 64 <
ffff89f7af1bd000 3636726655 C Ii:1:004:2 0:8 64 = 30408000 80000008 80000880 0ca4069b fe5e0dfe ffe9ff02 00a4069b fe5e0dfe
ffff89f7af1bd000 3636726698 S Ii:1:004:2 -115:8 64 <
ffff89f7af1bd000 3636735591 C Ii:1:004:2 0:8 64 = 30438000 80000008 80000880 0ca20696 fe5b0dfe ffe7ff00 00a20696 fe5b0dfe
ffff89f7af1bd000 3636735631 S Ii:1:004:2 -115:8 64 <
ffff89f7af1bd000 3636751414 C Ii:1:004:2 0:8 64 = 30448000 80000008 80000880 0ca70696 fe5b0dfe ffe6ff00 00a20696 fe5b0dfe
ffff89f7af1bd000 3636751459 S Ii:1:004:2 -115:8 64 <
ffff89f7af1bd000 3636766747 C Ii:1:004:2 0:8 64 = 30488000 80000008 80000880 0ca80699 fe590dff ffe8ff00 00a80699 fe590dff
ffff89f7af1bd000 3636766784 S Ii:1:004:2 -115:8 64 <
ffff89f7af1bd000 3636783433 C Ii:1:004:2 0:8 64 = 304b8000 80000008 80000880 0ca4069b fe5a0dff ffe6ff01 00a4069b fe5a0dff
ffff89f7af1bd000 3636783470 S Ii:1:004:2 -115:8 64 <
ffff89f7af1bd000 3636806622 C Ii:1:004:2 0:8 64 = 304e8000 80000008 80000880 0ca50698 fe5b0dfe ffe6ff01 00a50698 fe5b0dfe
ffff89f7af1bd000 3636806661 S Ii:1:004:2 -115:8 64 <
ffff89f7af1bd000 3636822772 C Ii:1:004:2 0:8 64 = 30538000 80000008 80000880 0ca40699 fe5f0dfe ffe5ff01 00a40699 fe5f0dfe
ffff89f7af1bd000 3636822815 S Ii:1:004:2 -115:8 64 <
ffff89f7af1bd000 3636830695 C Ii:1:004:2 0:8 64 = 30568000 80000008 80000880 0ca4069a fe5c0dff ffe7ff03 00a4069a fe5c0dff
ffff89f7af1bd000 3636830733 S Ii:1:004:2 -115:8 64 <
ffff89f7af1bd000 3636846644 C Ii:1:004:2 0:8 64 = 30588000 80000008 80000880 0ca30699 fe5a0d00 00e6ff02 00a30699 fe5a0d00
ffff89f7af1bd000 3636846711 S Ii:1:004:2 -115:8 64 <
ffff89f7af1bd000 3636863403 C Ii:1:004:2 0:8 64 = 305b8000 80000008 80000880 0ca20697 fe580dff ffe5ff02 00a20697 fe580dff
ffff89f7af1bd000 3636863450 S Ii:1:004:2 -115:8 64 <
ffff89f7af1bd000 3636878654 C Ii:1:004:2 0:8 64 = 305e8000 80000008 80000880 0ca20697 fe5b0dff ffe7ff02 00a20697 fe5b0dff
ffff89f7af1bd000 3636878701 S Ii:1:004:2 -115:8 64 <
ffff89f7af1bd000 3636896448 C Ii:1:004:2 0:8 64 = 30618000 80000008 80000880 0ca40697 fe5b0dff ffe6ff02 00a30697 fe5b0dff
ffff89f7af1bd000 3636896495 S Ii:1:004:2 -115:8 64 <
ffff89f7af1bd000 3636913273 C Ii:1:004:2 0:8 64 = 30648000 80000008 80000880 0ca6069a fe5b0dff ffe7ff02 00a50698 fe5b0dff
ffff89f7af1bd000 3636913318 S Ii:1:004:2 -115:8 64 <
ffff89f7af1bd000 3636934642 C Ii:1:004:2 0:8 64 = 30688000 80000008 80000880 0ca6069d fe580dff ffe8ff02 00a6069d fe580dff
ffff89f7af1bd000 3636934683 S Ii:1:004:2 -115:8 64 <
ffff89f7af1bd000 3636953418 C Ii:1:004:2 0:8 64 = 306c8000 80000008 80000880 0ca80697 fe5e0dff ffe6ff01 00a8069a fe5b0dff
ffff89f7af1bd000 3636953462 S Ii:1:004:2 -115:8 64 <
ffff89f7af1bd000 3636966748 C Ii:1:004:2 0:8 64 = 30708000 80000008 80000880 0ca20697 fe5d0dff ffe5ff01 00a20697 fe5d0dff
ffff89f7af1bd000 3636966785 S Ii:1:004:2 -115:8 64 <
ffff89f7af1bd000 3636975621 C Ii:1:004:2 0:8 64 = 30738000 80000008 80000880 0ca10696 fe610dfd ffe8ff01 00a10696 fe610dfd
ffff89f7af1bd000 3636975655 S Ii:1:004:2 -115:8 64 <
ffff89f7af1bd000 3636998662 C Ii:1:004:2 0:8 64 = 30748000 80000008 80000880 0ca10696 fe5f0dfd ffe8ff00 00a10696 fe610dfd
ffff89f7af1bd000 3636998705 S Ii:1:004:2 -115:8 64 <
ffff89f7af1bd000 3637016562 C Ii:1:004:2 0:8 64 = 30798000 80000008 80000880 0ca2069b fe5a0d00 00e7ff02 00a1069c fe5a0d00
ffff89f7af1bd000 3637016599 S Ii:1:004:2 -115:8 64 <
ffff89f7af1bd000 3637023662 C Ii:1:004:2 0:8 64 = 307c8000 80000008 80000880 0ca60697 fe5d0dff ffe7ffff ffa50698 fe5c0d00
ffff89f7af1bd000 3637023703 S Ii:1:004:2 -115:8 64 <
ffff89f7af1bd000 3637049588 C Ii:1:004:2 0:8 64 = 307e8000 80000008 80000880 0ca50699 fe5c0dff ffe7ffff ffa50699 fe5c0dff
ffff89f7af1bd000 3637049627 S Ii:1:004:2 -115:8 64 <
ffff89f7af1bd000 3637062633 C Ii:1:004:2 0:8 64 = 30838000 80000008 80000880 0ca8069b fe5d0dff ffe7ff02 00a8069b fe5d0dff
ffff89f7af1bd000 3637062681 S Ii:1:004:2 -115:8 64 <
ffff89f7af1bd000 3637078644 C Ii:1:004:2 0:8 64 = 30868000 80000008 80000880 0ca80699 fe5b0d00 00e7ff00 00a80699 fe5b0d00
ffff89f7af1bd000 3637078681 S Ii:1:004:2 -115:8 64 <
ffff89f7af1bd000 3637095949 C Ii:1:004:2 0:8 64 = 30898000 80000008 80000880 0ca2069a fe580dff ffe7ff01 00a6069a fe5a0d00
ffff89f7af1bd000 3637095994 S Ii:1:004:2 -115:8 64 <
ffff89f7af1bd000 3637110632 C Ii:1:004:2 0:8 64 = 308c8000 80000008 80000880 0ca00699 fe590dfe ffe6ff02 009f069a fe580dff
ffff89f7af1bd000 3637110667 S Ii:1:004:2 -115:8 64 <
ffff89f7af1bd000 3637128150 C Ii:1:004:2 0:8 64 = 30908000 80000008 80000880 0ca50699 fe5f0dfe ffe6ff01 00a50699 fe5f0dfe
ffff89f7af1bd000 3637128190 S Ii:1:004:2 -115:8 64 <
ffff89f7af1bd000 3637143771 C Ii:1:004:2 0:8 64 = 30938000 80000008 80000880 0ca50698 fe5f0d00 00e6ff01 00a50698 fe5f0d00
ffff89f7af1bd000 3637143807 S Ii:1:004:2 -115:8 64 <
ffff89f7af1bd000 3637160303 C Ii:1:004:2 0:8 64 = 30968000 80000008 80000880 0ca70696 fe5f0dff ffe7ff02 00a70696 fe5f0dff
ffff89f7af1bd000 3637160346 S Ii:1:004:2 -115:8 64 <
ffff89f7af1bd000 3637174622 C Ii:1:004:2 0:8 64 = 30998000 80000008 80000880 0ca40699 fe5b0dfd ffe7ff01 00a60697 fe5e0dfd
ffff89f7af1bd000 3637174658 S Ii:1:004:2 -115:8 64 <
ffff89f7af1bd000 3637190653 C Ii:1:004:2 0:8 64 = 309c8000 80000008 80000880 0ca4069c fe5b0dff ffe7ff00 00a4069b fe590dfe
ffff89f7af1bd000 3637190699 S Ii:1:004:2 -115:8 64 <
ffff89f7af1bd000 3637209235 C Ii:1:004:2 0:8 64 = 30a08000 80000008 80000880 0ca40699 fe5e0dff ffe4ff01 00a40699 fe5e0dff
ffff89f7af1bd000 3637209275 S Ii:1:004:2 -115:8 64 <
ffff89f7af1bd000 3637222642 C Ii:1:004:2 0:8 64 = 30a38000 80000008 80000880 0ca2069c fe5d0dff ffe7ff02 00a2069c fe5d0dff
ffff89f7af1bd000 3637222681 S Ii:1:004:2 -115:8 64 <
ffff89f7af1bd000 3637238760 C Ii:1:004:2 0:8 64 = 30a68000 80000008 80000880 0ca406a0 fe5a0d00 00e8ff02 00a406a0 fe5a0d00
ffff89f7af1bd000 3637238800 S Ii:1:004:2 -115:8 64 <
ffff89f7af1bd000 3637254621 C Ii:1:004:2 0:8 64 = 30a98000 80000008 80000880 0ca6069e fe5e0d00 00e7ff02 00a606a0 fe5b0d00
ffff89f7af1bd000 3637254663 S Ii:1:004:2 -115:8 64 <
ffff89f7af1bd000 3637262740 C Ii:1:004:2 0:8 64 = 30ac8000 80000008 80000880 0ca4069a fe5f0d00 00e5ff02 00a5069c fe5f0d00
ffff89f7af1bd000 3637262775 S Ii:1:004:2 -115:8 64 <
ffff89f7af1bd000 3637280354 C Ii:1:004:2 0:8 64 = 30ae8000 80000008 80000880 0ca5069a fe5f0dff ffe4ff01 00a5069a fe5f0dff
ffff89f7af1bd000 3637280391 S Ii:1:004:2 -115:8 64 <
ffff89f7af1bd000 3637295660 C Ii:1:004:2 0:8 64 = 30b18000 80000008 80000880 0caa0697 fe5d0dff ffe4ff00 00a70699 fe5e0dff
ffff89f7af1bd000 3637295703 S Ii:1:004:2 -115:8 64 <
ffff89f7af1bd000 3637321295 C Ii:1:004:2 0:8 64 = 30b48000 80000008 80000880 0ca80698 fe5a0d00 00e7ff01 00aa0697 fe5b0d00
ffff89f7af1bd000 3637321338 S Ii:1:004:2 -115:8 64 <
ffff89f7af1bd000 3637334535 C Ii:1:004:2 0:8 64 = 30b98000 80000008 80000880 0ca10696 fe5d0d00 00e7ff02 00a20698 fe5e0d00
ffff89f7af1bd000 3637334571 S Ii:1:004:2 -115:8 64 <
ffff89f7af1bd000 3637350666 C Ii:1:004:2 0:8 64 = 30bc8000 80000008 80000880 0ca30693 fe590dfe ffe7ff02 00a20694 fe5b0dff
ffff89f7af1bd000 3637350703 S Ii:1:004:2 -115:8 64 <
ffff89f7af1bd000 3637359292 C Ii:1:004:2 0:8 64 = 30c08000 80000008 80000880 0ca20694 fe570dfe ffe6ffff ffa20694 fe570dfe
ffff89f7af1bd000 3637359348 S Ii:1:004:2 -115:8 64 <
ffff89f7af1bd000 3637374581 C Ii:1:004:2 0:8 64 = 30c18000 80000008 80000880 0ca60698 fe570dff ffe7fffc ffa20694 fe570dfe
ffff89f7af1bd000 3637374619 S Ii:1:004:2 -115:8 64 <
ffff89f7af1bd000 3637398731 C Ii:1:004:2 0:8 64 = 30c48000 80000008 80000880 0ca706a0 fe5e0dff ffe6ffff ffa7069c fe5a0dff
ffff89f7af1bd000 3637398775 S Ii:1:004:2 -115:8 64 <
ffff89f7af1bd000 3637406607 C Ii:1:004:2 0:8 64 = 30c98000 80000008 80000880 0ca5069d fe560dff ffe7ff02 00a4069f fe5a0dfe
ffff89f7af1bd000 3637406644 S Ii:1:004:2 -115:8 64 <
ffff89f7af1bd000 3637423464 C Ii:1:004:2 0:8 64 = 30cb8000 80000008 80000880 0ca4069c fe570dff ffe6ff01 00a4069c fe570dff
ffff89f7af1bd000 3637423508 S Ii:1:004:2 -115:8 64 <
ffff89f7af1bd000 3637440570 C Ii:1:004:2 0:8 64 = 30ce8000 80000008 80000880 0ca3069d fe5d0dff ffe6ff02 00a3069d fe5d0dff
ffff89f7af1bd000 3637440608 S Ii:1:004:2 -115:8 64 <
ffff89f7af1bd000 3637456283 C Ii:1:004:2 0:8 64 = 30d18000 80000008 80000880 0ca6069e fe5c0d00 00e7ff03 00a4069e fe600d00
ffff89f7af1bd000 3637456330 S Ii:1:004:2 -115:8 64 <
ffff89f7af1bd000 3637470723 C Ii:1:004:2 0:8 64 = 30d48000 80000008 80000880 0ca406a0 fe590dff ffe6ff01 00a6069f fe590dff
ffff89f7af1bd000 3637470762 S Ii:1:004:2 -115:8 64 <
ffff89f7af1bd000 3637486659 C Ii:1:004:2 0:8 64 = 30d88000 80000008 80000880 0ca6069d fe5d0dff ffe7ff02 00a6069d fe5d0dff
ffff89f7af1bd000 3637486698 S Ii:1:004:2 -115:8 64 <
ffff89f7af1bd000 3637513550 C Ii:1:004:2 0:8 64 = 30db8000 80000008 80000880 0ca80698 fe5c0d00 00e5ff02 00a80698 fe5c0d00
ffff89f7af1bd000 3637513593 S Ii:1:004:2 -115:8 64 <
ffff89f7af1bd000 3637526706 C Ii:1:004:2 0:8 64 = 30e08000 80000008 80000880 0ca50699 fe5b0dfe ffe8ff00 00a50699 fe5b0dfe
ffff89f7af1bd000 3637526751 S Ii:1:004:2 -115:8 64 <
ffff89f7af1bd000 3637536246 C Ii:1:004:2 0:8 64 = 30e38000 80000008 80000880 0ca70699 fe570dfd ffe5ff01 00a70699 fe570dfd
ffff89f7af1bd000 3637536287 S Ii:1:004:2 -115:8 64 <
ffff89f7af1bd000 3637552361 C Ii:1:004:2 0:8 64 = 30e48000 80000008 80000880 0ca60697 fe5a0dfe ffe6ff03 00a70699 fe570dfd
ffff89f7af1bd000 3637552424 S Ii:1:004:2 -115:8 64 <
ffff89f7af1bd000 3637568379 C Ii:1:004:2 0:8 64 = 30e88000 80000008 80000880 0ca50696 fe5e0dfe ffe8ff02 00a50696 fe5e0dfe
ffff89f7af1bd000 3637568425 S Ii:1:004:2 -115:8 64 <
ffff89f7af1bd000 3637590511 C Ii:1:004:2 0:8 64 = 30eb8000 80000008 80000880 0ca5069b fe5a0dfe ffe5ff01 00a5069b fe5a0dfe
ffff89f7af1bd000 3637590568 S Ii:1:004:2 -115:8 64 <
ffff89f7af1bd000 3637600309 C Ii:1:004:2 0:8 64 = 30f08000 80000008 80000880 0ca2069b fe5c0dff ffe5ff02 00a2069b fe5c0dff
ffff89f7af1bd000 3637600349 S Ii:1:004:2 -115:8 64 <
ffff89f7af1bd000 3637614550 C Ii:1:004:2 0:8 64 = 30f18000 80000008 80000880 0ca3069c fe5e0dff ffe6ff02 00a2069b fe5c0dff
ffff89f7af1bd000 3637614585 S Ii:1:004:2 -115:8 64 <
ffff89f7af1bd000 3637631915 C Ii:1:004:2 0:8 64 = 30f48000 80000008 80000880 0ca0069a fe5f0dfe ffe8ff01 00a1069b fe600dff
ffff89f7af1bd000 3637631960 S Ii:1:004:2 -115:8 64 <
ffff89f7af1bd000 3637646753 C Ii:1:004:2 0:8 64 = 30f88000 80000008 80000880 0ca4069a fe580dff ffe6ff02 00a4069a fe580dff
ffff89f7af1bd000 3637646806 S Ii:1:004:2 -115:8 64 <
ffff89f7af1bd000 3637663392 C Ii:1:004:2 0:8 64 = 30fb8000 80000008 80000880 0ca3069b fe5a0d00 00e7ff03 00a3069b fe5a0d00
ffff89f7af1bd000 3637663435 S Ii:1:004:2 -115:8 64 <
ffff89f7af1bd000 3637679808 C Ii:1:004:2 0:8 64 = 30fe8000 80000008 80000880 0ca3069b fe5c0dff ffe6ff03 00a3069b fe5c0dff
ffff89f7af1bd000 3637679847 S Ii:1:004:2 -115:8 64 <
ffff89f7af1bd000 3637694607 C Ii:1:004:2 0:8 64 = 30018000 80000008 80000880 0ca6069d fe5e0d00 00e6ff02 00a5069c fe5e0d00
ffff89f7af1bd000 3637694649 S Ii:1:004:2 -115:8 64 <
ffff89f7af1bd000 3637718591 C Ii:1:004:2 0:8 64 = 30048000 80000008 80000880 0ca6069d fe5b0d00 00e8ff03 00a6069d fe5c0d01
ffff89f7af1bd000 3637718630 S Ii:1:004:2 -115:8 64 <
ffff89f7af1bd000 3637726640 C Ii:1:004:2 0:8 64 = 30098000 80000008 80000880 0ca5069b fe5b0dfe ffe6ff00 00a8069d fe5c0dfe
ffff89f7af1bd000 3637726683 S Ii:1:004:2 -115:8 64 <
ffff89f7af1bd000 3637742719 C Ii:1:004:2 0:8 64 = 300b8000 80000008 80000880 0ca4069a fe5a0dff ffe7ff01 00a4069a fe5a0dff
ffff89f7af1bd000 3637742755 S Ii:1:004:2 -115:8 64 <
ffff89f7af1bd000 3637760734 C Ii:1:004:2 0:8 64 = 300e8000 80000008 80000880 0ca60698 fe5d0d00 00e8ff01 00a60698 fe5d0d00
ffff89f7af1bd000 3637760793 S Ii:1:004:2 -115:8 64 <
ffff89f7af1bd000 3637776312 C Ii:1:004:2 0:8 64 = 30118000 80000008 80000880 0ca50697 fe5d0dff ffe9ff00 00a60697 fe5d0d00
ffff89f7af1bd000 3637776349 S Ii:1:004:2 -115:8 64 <
ffff89f7af1bd000 3637801622 C Ii:1:004:2 0:8 64 = 30148000 80000008 80000880 0ca20696 fe5b0dff ffe7ff01 00a30697 fe5c0dff
ffff89f7af1bd000 3637801662 S Ii:1:004:2 -115:8 64 <
ffff89f7af1bd000 3637814582 C Ii:1:004:2 0:8 64 = 30198000 80000008 80000880 0ca5069b fe620d00 00e7ff05 00a5069a fe600d00
ffff89f7af1bd000 3637814617 S Ii:1:004:2 -115:8 64 <
ffff89f7af1bd000 3637824284 C Ii:1:004:2 0:8 64 = 301c8000 80000008 80000880 0ca50699 fe5d0dff ffe7ff03 00a5069a fe600dff
ffff89f7af1bd000 3637824326 S Ii:1:004:2 -115:8 64 <
ffff89f7af1bd000 3637849050 C Ii:1:004:2 0:8 64 = 301e8000 80000008 80000880 0ca60697 fe5b0dfe ffe7ff02 00a60697 fe5b0dfe
ffff89f7af1bd000 3637849087 S Ii:1:004:2 -115:8 64 <
ffff89f7af1bd000 3637862510 C Ii:1:004:2 0:8 64 = 30238000 80000008 80000880 0ca30699 fe5c0dfe ffe7ff03 00a30699 fe5c0dfe
ffff89f7af1bd000 3637862553 S Ii:1:004:2 -115:8 64 <
ffff89f7af1bd000 3637879713 C Ii:1:004:2 0:8 64 = 30268000 80000008 80000880 0ca5069c fe5e0dfe ffe7ff03 00a5069c fe5e0dfe
ffff89f7af1bd000 3637879753 S Ii:1:004:2 -115:8 64 <
ffff89f7af1bd000 3637894539 C Ii:1:004:2 0:8 64 = 30298000 80000008 80000880 0ca6069b fe5d0dfd ffe5ff01 00a6069c fe5d0dfe
ffff89f7af1bd000 3637894595 S Ii:1:004:2 -115:8 64 <
ffff89f7af1bd000 3637911945 C Ii:1:004:2 0:8 64 = 302c8000 80000008 80000880 0ca7069d fe5b0dff ffe7ff02 00a6069a fe5c0dfe
ffff89f7af1bd000 3637911992 S Ii:1:004:2 -115:8 64 <
ffff89f7af1bd000 3637927826 C Ii:1:004:2 0:8 64 = 30308000 80000008 80000880 0ca6069d fe5b0dff ffe6ff02 00a6069d fe5b0dff
ffff89f7af1bd000 3637927874 S Ii:1:004:2 -115:8 64 <
ffff89f7af1bd000 3637942637 C Ii:1:004:2 0:8 64 = 30338000 80000008 80000880 0ca6069b fe590dff ffe7ff01 00a6069b fe590dff
ffff89f7af1bd000 3637942673 S Ii:1:004:2 -115:8 64 <
ffff89f7af1bd000 3637958722 C Ii:1:004:2 0:8 64 = 30368000 80000008 80000880 0ca7069a fe5a0dfe ffe7ff03 00a7069a fe5a0dfe
ffff89f7af1bd000 3637958767 S Ii:1:004:2 -115:8 64 <
ffff89f7af1bd000 3637975617 C Ii:1:004:2 0:8 64 = 30398000 80000008 80000880 0ca30695 fe5b0dfd ffe6ff01 00a40698 fe5b0dfe
ffff89f7af1bd000 3637975654 S Ii:1:004:2 -115:8 64 <
ffff89f7af1bd000 3637998586 C Ii:1:004:2 0:8 64 = 303c8000 80000008 80000880 0ca80698 fe5c0dfe ffe7ff02 00a60695 fe5c0dfd
ffff89f7af1bd000 3637998631 S Ii:1:004:2 -115:8 64 <
ffff89f7af1bd000 3638014611 C Ii:1:004:2 0:8 64 = 30418000 80000008 80000880 0ca4069d fe5b0dff ffe9ff03 00a7069d fe5d0dff
ffff89f7af1bd000 3638014655 S Ii:1:004:2 -115:8 64 <
ffff89f7af1bd000 3638032515 C Ii:1:004:2 0:8 64 = 30448000 80000008 80000880 0ca10698 fe5e0dfe ffe8ff01 00a2069b fe5c0dff
ffff89f7af1bd000 3638032560 S Ii:1:004:2 -115:8 64 <
ffff89f7af1bd000 3638039791 C Ii:1:004:2 0:8 64 = 30488000 80000008 80000880 0ca5069a fe5d0dfd ffe7ff02 00a5069a fe5d0dfd
ffff89f7af1bd000 3638039825 S Ii:1:004:2 -115:8 64 <
ffff89f7af1bd000 3638055378 C Ii:1:004:2 0:8 64 = 30498000 80000008 80000880 0ca5069d fe5a0dfe ffe7ff02 00a5069a fe5d0dfd
ffff89f7af1bd000 3638055415 S Ii:1:004:2 -115:8 64 <
ffff89f7af1bd000 3638070571 C Ii:1:004:2 0:8 64 = 304c8000 8000f777 80000880 0ca2069e fe580dfe ffe6ff02 00a3069e fe580dfe
ffff89f7af1bd000 3638070610 S Ii:1:004:2 -115:8 64 <
ffff89f7af1bd000 3638086606 C Ii:1:004:2 0:8 64 = 30508000 8000e777 81000880 0ca1069e fe5b0dfe ffe7ff01 00a1069e fe5b0dfe
ffff89f7af1bd000 3638086649 S Ii:1:004:2 -115:8 64 <
ffff89f7af1bd000 3638103284 C Ii:1:004:2 0:8 64 = 30538000 8000c777 85000880 0ca40697 fe590dfe ffe7ff02 00a40697 fe590dfe
ffff89f7af1bd000 3638103321 S Ii:1:004:2 -115:8 64 <
ffff89f7af1bd000 3638120729 C Ii:1:004:2 0:8 64 = 30568000 80008787 8b000880 0c9d0698 fe5d0dff ffe8ff01 009d0698 fe5d0dff
ffff89f7af1bd000 3638120772 S Ii:1:004:2 -115:8 64 <
ffff89f7af1bd000 3638135655 C Ii:1:004:2 0:8 64 = 30598000 80003687 92000880 0ca6069c fe5d0dff ffe5ff01 00a1069c fe5f0d00
ffff89f7af1bd000 3638135692 S Ii:1:004:2 -115:8 64 <
ffff89f7af1bd000 3638150562 C Ii:1:004:2 0:8 64 = 305c8000 8000f686 98000880 0ca8069c fe5b0dff ffe6ff01 00a9069b fe5c0dff
ffff89f7af1bd000 3638150601 S Ii:1:004:2 -115:8 64 <
ffff89f7af1bd000 3638168600 C Ii:1:004:2 0:8 64 = 30608000 8000d696 9a000880 0ca4069b fe5b0dff ffe8ff01 00a4069b fe5b0dff
ffff89f7af1bd000 3638168642 S Ii:1:004:2 -115:8 64 <
ffff89f7af1bd000 3638190663 C Ii:1:004:2 0:8 64 = 30638000 8000d696 9b000880 0ca00697 fe5b0dfe ffe8ff01 00a00697 fe5b0dfe
ffff89f7af1bd000 3638190711 S Ii:1:004:2 -115:8 64 <
ffff89f7af1bd000 3638199661 C Ii:1:004:2 0:8 64 = 30688000 8000d696 9a000880 0c9f0697 fe580dff ffe4ff01 009f0697 fe580dff
ffff89f7af1bd000 3638199698 S Ii:1:004:2 -115:8 64 <
ffff89f7af1bd000 3638215525 C Ii:1:004:2 0:8 64 = 30698000 8000f686 97000880 0c9f0699 fe580dff ffe3ff02 009f0697 fe580dff
ffff89f7af1bd000 3638215562 S Ii:1:004:2 -115:8 64 <
ffff89f7af1bd000 3638230590 C Ii:1:004:2 0:8 64 = 306c8000 80007787 8c000880 0ca4069a fe5a0dfd ffe8ff01 00a3069b fe5a0dff
ffff89f7af1bd000 3638230629 S Ii:1:004:2 -115:8 64 <
ffff89f7af1bd000 3638246453 C Ii:1:004:2 0:8 64 = 30708000 8000f777 81000880 0c9e0695 fe590dfe ffe6ff02 009e0695 fe590dfe
ffff89f7af1bd000 3638246488 S Ii:1:004:2 -115:8 64 <
ffff89f7af1bd000 3638262558 C Ii:1:004:2 0:8 64 = 30738000 80000008 80000880 0ca4069f fe5c0d01 00e5ff02 00a4069f fe5c0d01
ffff89f7af1bd000 3638262605 S Ii:1:004:2 -115:8 64 <
ffff89f7af1bd000 3638279338 C Ii:1:004:2 0:8 64 = 30768000 80000008 80000880 0ca4069b fe5b0dfe ffe6ff02 00a4069b fe5b0dfe
ffff89f7af1bd000 3638279375 S Ii:1:004:2 -115:8 64 <
ffff89f7af1bd000 3638295617 C Ii:1:004:2 0:8 64 = 30798000 80000008 80000880 0ca50696 fe5b0dff ffe6ff01 00a50696 fe5b0dfe
ffff89f7af1bd000 3638295669 S Ii:1:004:2 -115:8 64 <
ffff89f7af1bd000 3638311911 C Ii:1:004:2 0:8 64 = 307c8000 80000008 80000880 0ca0069b fe5d0dff ffe8ff00 00a2069a fe5c0dff
ffff89f7af1bd000 3638311967 S Ii:1:004:2 -115:8 64 <
ffff89f7af1bd000 3638334567 C Ii:1:004:2 0:8 64 = 30808000 80000008 80000880 0ca30699 fe5b0d00 00e5ff02 00a30699 fe5b0d00
ffff89f7af1bd000 3638334610 S Ii:1:004:2 -115:8 64 <
ffff89f7af1bd000 3638343576 C Ii:1:004:2 0:8 64 = 30848000 80000008 80000880 0ca3069a fe5c0dfd ffe7ff01 00a40699 fe5c0dfe
ffff89f7af1bd000 3638343613 S Ii:1:004:2 -115:8 64 <
ffff89f7af1bd000 3638369613 C Ii:1:004:2 0:8 64 = 30868000 80000008 80000880 0ca1069a fe5a0dfd ffe5ff02 00a1069a fe5a0dfd
ffff89f7af1bd000 3638369659 S Ii:1:004:2 -115:8 64 <
ffff89f7af1bd000 3638382584 C Ii:1:004:2 0:8 64 = 308b8000 80000008 80000880 0caa069b fe580dff ffe8ff01 00aa069b fe580dff
ffff89f7af1bd000 3638382636 S Ii:1:004:2 -115:8 64 <
ffff89f7af1bd000 3638398580 C Ii:1:004:2 0:8 64 = 308e8000 80000008 80000880 0ca8069b fe5c0dfe ffe8ff01 00a8069b fe5c0dfe
ffff89f7af1bd000 3638398624 S Ii:1:004:2 -115:8 64 <
ffff89f7af1bd000 3638414569 C Ii:1:004:2 0:8 64 = 30918000 80000008 80000880 0ca2069c fe600dfe ffe8ff01 00a4069c fe5d0dfe
ffff89f7af1bd000 3638414610 S Ii:1:004:2 -115:8 64 <
ffff89f7af1bd000 3638422672 C Ii:1:004:2 0:8 64 = 30948000 80000008 80000880 0ca40698 fe5a0dff ffe6ff01 00a3069a fe5e0dff
ffff89f7af1bd000 3638422708 S Ii:1:004:2 -115:8 64 <
ffff89f7af1bd000 3638438665 C Ii:1:004:2 0:8 64 = 30968000 80000008 80000880 0ca30698 fe560d00 00e6ff01 00a30698 fe560d00
ffff89f7af1bd000 3638438701 S Ii:1:004:2 -115:8 64 <
ffff89f7af1bd000 3638454532 C Ii:1:004:2 0:8 64 = 30998000 80000008 80000880 0ca50699 fe580dff ffe8ff02 00a30699 fe560d00
ffff89f7af1bd000 3638454592 S Ii:1:004:2 -115:8 64 <
ffff89f7af1bd000 3638470733 C Ii:1:004:2 0:8 64 = 309c8000 80000008 80000880 0ca6069a fe580dfe ffe6ff01 00a60699 fe580dfe
ffff89f7af1bd000 3638470780 S Ii:1:004:2 -115:8 64 <
ffff89f7af1bd000 3638478642 C Ii:1:004:2 0:8 64 = 30a08000 80000008 80000880 0ca50699 fe5a0dff ffe7ff01 00a50699 fe5a0dff
ffff89f7af1bd000 3638478676 S Ii:1:004:2 -115:8 64 <
ffff89f7af1bd000 3638502701 C Ii:1:004:2 0:8 64 = 30a18000 80000008 80000880 0ca5069a fe5d0d00 00e7ff02 00a50699 fe5a0dff
ffff89f7af1bd000 3638502745 S Ii:1:004:2 -115:8 64 <
ffff89f7af1bd000 3638518576 C Ii:1:004:2 0:8 64 = 30a68000 80000008 80000880 0ca70698 fe5b0dfe ffe8ff03 00a70698 fe5b0dfe
ffff89f7af1bd000 3638518619 S Ii:1:004:2 -115:8 64 <
ffff89f7af1bd000 3638537425 C Ii:1:004:2 0:8 64 = 30a98000 80000008 80000880 0ca5069b fe580d00 00e7ff02 00a40699 fe5a0dfe
ffff89f7af1bd000 3638537469 S Ii:1:004:2 -115:8 64 <
ffff89f7af1bd000 3638550639 C Ii:1:004:2 0:8 64 = 30ac8000 80000008 80000880 0ca40699 fe580d01 00e7ff02 00a4069a fe580d00
ffff89f7af1bd000 3638550674 S Ii:1:004:2 -115:8 64 <
ffff89f7af1bd000 3638566556 C Ii:1:004:2 0:8 64 = 30b08000 80000008 80000880 0ca4069c fe5a0d00 00e7ff01 00a4069c fe5a0d00
ffff89f7af1bd000 3638566636 S Ii:1:004:2 -115:8 64 <
ffff89f7af1bd000 3638576299 C Ii:1:004:2 0:8 64 = 30b38000 80000078 7e000880 0ca8069f fe5a0d00 00e8ff01 00a8069f fe5a0d00
ffff89f7af1bd000 3638576339 S Ii:1:004:2 -115:8 64 <
ffff89f7af1bd000 3638598515 C Ii:1:004:2 0:8 64 = 30b48000 80000078 7d000880 0caa069e fe5a0dff ffe9ff02 00a8069f fe5a0d00
ffff89f7af1bd000 3638598557 S Ii:1:004:2 -115:8 64 <
ffff89f7af1bd000 3638614561 C Ii:1:004:2 0:8 64 = 30b98000 80002778 79000880 0ca40697 fe5b0dff ffe7ff02 00a70698 fe5a0dfe
ffff89f7af1bd000 3638614602 S Ii:1:004:2 -115:8 64 <
ffff89f7af1bd000 3638630550 C Ii:1:004:2 0:8 64 = 30bc8000 80005768 76000880 0ca2069b fe5c0dff ffe7ff00 00a30698 fe5d0dff
ffff89f7af1bd000 3638630592 S Ii:1:004:2 -115:8 64 <
ffff89f7af1bd000 3638640443 C Ii:1:004:2 0:8 64 = 30c08000 8000b868 70000880 0ca4069b fe570dfe ffe6ff01 00a4069b fe570dfe
ffff89f7af1bd000 3638640480 S Ii:1:004:2 -115:8 64 <
ffff89f7af1bd000 3638662537 C Ii:1:004:2 0:8 64 = 30c18000 8000e868 6c000880 0ca50697 fe570dfe ffe6ff01 00a4069b fe570dfe
ffff89f7af1bd000 3638662582 S Ii:1:004:2 -115:8 64 <
ffff89f7af1bd000 3638672473 C Ii:1:004:2 0:8 64 = 30c68000 8000b959 62000880 0ca10699 fe5d0dff ffe5ff01 00a10699 fe5d0dff
ffff89f7af1bd000 3638672510 S Ii:1:004:2 -115:8 64 <
ffff89f7af1bd000 3638687622 C Ii:1:004:2 0:8 64 = 30c88000 8000f959 5f000880 0ca3069a fe5d0dff ffe5ff01 00a3069a fe5d0dff
ffff89f7af1bd000 3638687662 S Ii:1:004:2 -115:8 64 <
ffff89f7af1bd000 3638702491 C Ii:1:004:2 0:8 64 = 30cb8000 8000795a 59000880 0ca4069a fe5f0dff ffe6ff01 00a4069a fe5f0dff
ffff89f7af1bd000 3638702532 S Ii:1:004:2 -115:8 64 <
ffff89f7af1bd000 3638720568 C Ii:1:004:2 0:8 64 = 30ce8000 8000ea4a 54000880 0ca40699 fe5d0dfe ffe4ff01 00a40699 fe5d0dfe
ffff89f7af1bd000 3638720612 S Ii:1:004:2 -115:8 64 <
ffff89f7af1bd000 3638735456 C Ii:1:004:2 0:8 64 = 30d18000 80002a4b 52000880 0caa0698 fe5a0dfe ffe7ff01 00a70698 fe5a0dff
ffff89f7af1bd000 3638735503 S Ii:1:004:2 -115:8 64 <
ffff89f7af1bd000 3638751395 C Ii:1:004:2 0:8 64 = 30d48000 80003a4b 51000880 0ca6069b fe5c0dff ffe6ff01 00a90699 fe5c0dfe
ffff89f7af1bd000 3638751448 S Ii:1:004:2 -115:8 64 <
ffff89f7af1bd000 3638766536 C Ii:1:004:2 0:8 64 = 30d88000 80005a4b 50000880 0ca606a3 fe5b0dff ffe7ff04 00a606a3 fe5b0dff
ffff89f7af1bd000 3638766576 S Ii:1:004:2 -115:8 64 <
ffff89f7af1bd000 3638783501 C Ii:1:004:2 0:8 64 = 30db8000 80006a4b 51000880 0ca8069d fe5b0dff ffe7ff02 00a8069d fe5b0dff
ffff89f7af1bd000 3638783545 S Ii:1:004:2 -115:8 64 <
ffff89f7af1bd000 3638799750 C Ii:1:004:2 0:8 64 = 30de8000 80006a4b 51000880 0ca5069e fe5c0dff ffe6ff01 00a5069e fe5c0dff
ffff89f7af1bd000 3638799790 S Ii:1:004:2 -115:8 64 <
ffff89f7af1bd000 3638814522 C Ii:1:004:2 0:8 64 = 30e18000 80006a4b 52000880 0ca3069e fe5d0dfe ffe8ff02 00a306a0 fe5d0dff
ffff89f7af1bd000 3638814558 S Ii:1:004:2 -115:8 64 <
ffff89f7af1bd000 3638832865 C Ii:1:004:2 0:8 64 = 30e48000 80000a5b 59000880 0ca20695 fe5a0dfd ffe8ff00 00a30698 fe5b0dfd
ffff89f7af1bd000 3638832905 S Ii:1:004:2 -115:8 64 <
ffff89f7af1bd000 3638848056 C Ii:1:004:2 0:8 64 = 30e88000 8000e969 68000880 0ca20698 fe5b0dff ffe7ff00 00a20698 fe5b0dff
ffff89f7af1bd000 3638848093 S Ii:1:004:2 -115:8 64 <
ffff89f7af1bd000 3638862635 C Ii:1:004:2 0:8 64 = 30eb8000 80007778 7b000880 0ca7069a fe5b0d00 00e6ff03 00a7069a fe5b0d00
ffff89f7af1bd000 3638862678 S Ii:1:004:2 -115:8 64 <
ffff89f7af1bd000 3638880366 C Ii:1:004:2 0:8 64 = 30ee8000 80000008 80000880 0cb006a2 fe590dfb ffedff02 00b006a2 fe590dfb
ffff89f7af1bd000 3638880405 S Ii:1:004:2 -115:8 64 <
ffff89f7af1bd000 3638894466 C Ii:1:004:2 0:8 64 = 30f18000 80000008 80000880 0c9e0693 fe580dfc ffecff01 00a40698 fe580dfb
ffff89f7af1bd000 3638894508 S Ii:1:004:2 -115:8 64 <
ffff89f7af1bd000 3638913179 C Ii:1:004:2 0:8 64 = 30f48000 80000008 80000880 0ca00695 fe5d0dfe ffe8ff01 009e0693 fe5c0dfe
ffff89f7af1bd000 3638913220 S Ii:1:004:2 -115:8 64 <
ffff89f7af1bd000 3638937102 C Ii:1:004:2 0:8 64 = 30f88000 80000008 80000880 0ca40697 fe580d00 00e8ffff ffa40697 fe580d00
ffff89f7af1bd000 3638937157 S Ii:1:004:2 -115:8 64 <
ffff89f7af1bd000 3638950537 C Ii:1:004:2 0:8 64 = 30fc8000 80000008 80000880 0ca70699 fe5d0d00 00e6ff02 00a60697 fe5c0d00
ffff89f7af1bd000 3638950573 S Ii:1:004:2 -115:8 64 <
ffff89f7af1bd000 3638958651 C Ii:1:004:2 0:8 64 = 30008000 8000f707 80000880 0ca6069c fe5c0dff ffe7ff01 00a6069c fe5c0dff
ffff89f7af1bd000 3638958689 S Ii:1:004:2 -115:8 64 <
ffff89f7af1bd000 3638976590 C Ii:1:004:2 0:8 64 = 30018000 8000e777 80000880 0ca4069a fe5b0dff ffe5ff02 00a6069c fe5c0dff
ffff89f7af1bd000 3638976626 S Ii:1:004:2 -115:8 64 <
ffff89f7af1bd000 3638990881 C Ii:1:004:2 0:8 64 = 30048000 8000c777 80000880 0ca4069c fe5d0dff ffe5ff02 00a3069a fe5b0dff
ffff89f7af1bd000 3638990931 S Ii:1:004:2 -115:8 64 <
ffff89f7af1bd000 3639006584 C Ii:1:004:2 0:8 64 = 30088000 80008707 80000880 0caa069f fe5f0dff ffe8ff02 00aa069f fe5f0dff
ffff89f7af1bd000 3639006627 S Ii:1:004:2 -115:8 64 <
ffff89f7af1bd000 3639022537 C Ii:1:004:2 0:8 64 = 300b8000 80003677 7d000880 0ca6069a fe5e0dfe ffe7ff01 00a6069a fe5e0dfe
ffff89f7af1bd000 3639022583 S Ii:1:004:2 -115:8 64 <
ffff89f7af1bd000 3639038541 C Ii:1:004:2 0:8 64 = 300e8000 80000677 79000880 0c9e069c fe5c0dff ffe6ff03 009e069c fe5c0dff
ffff89f7af1bd000 3639038581 S Ii:1:004:2 -115:8 64 <
ffff89f7af1bd000 3639055974 C Ii:1:004:2 0:8 64 = 30118000 8000d666 73000880 0ca20697 fe5c0dff ffe4ff03 00a0069c fe5c0d00
ffff89f7af1bd000 3639056013 S Ii:1:004:2 -115:8 64 <
ffff89f7af1bd000 3639078625 C Ii:1:004:2 0:8 64 = 30148000 8000d666 6c000880 0ca40695 fe5e0dff ffe7ff01 00a30694 fe5e0dff
ffff89f7af1bd000 3639078686 S Ii:1:004:2 -115:8 64 <
ffff89f7af1bd000 3639088562 C Ii:1:004:2 0:8 64 = 30198000 80003657 62000880 0ca4069b fe5b0dfe ffe5ff02 00a1069b fe5a0dfe
ffff89f7af1bd000 3639088604 S Ii:1:004:2 -115:8 64 <
ffff89f7af1bd000 3639110577 C Ii:1:004:2 0:8 64 = 301b8000 80006657 5f000880 0ca7069a fe5d0dfe ffe6ff01 00a7069a fe5d0dfe
ffff89f7af1bd000 3639110614 S Ii:1:004:2 -115:8 64 <
ffff89f7af1bd000 3639118516 C Ii:1:004:2 0:8 64 = 30208000 8000f747 54000880 0ca5069f fe590dfe ffe5ff01 00a5069f fe590dfe
ffff89f7af1bd000 3639118553 S Ii:1:004:2 -115:8 64 <
ffff89f7af1bd000 3639142599 C Ii:1:004:2 0:8 64 = 30218000 80001748 50000880 0ca2069c fe5a0dfe ffe5ff02 00a5069f fe590dfe
ffff89f7af1bd000 3639142637 S Ii:1:004:2 -115:8 64 <
ffff89f7af1bd000 3639151886 C Ii:1:004:2 0:8 64 = 30268000 8000a848 48000880 0ca70698 fe5d0dfd ffe7ff00 00a70698 fe5d0dfd
ffff89f7af1bd000 3639151938 S Ii:1:004:2 -115:8 64 <
ffff89f7af1bd000 3639176763 C Ii:1:004:2 0:8 64 = 30288000 8000c848 47000880 0ca90699 fe5d0dfd ffe7ff00 00a90699 fe5d0dfd
ffff89f7af1bd000 3639176805 S Ii:1:004:2 -115:8 64 <
ffff89f7af1bd000 3639190483 C Ii:1:004:2 0:8 64 = 302c8000 80003849 49000880 0ca1069d fe5d0dfe ffe9ff01 00a4069c fe5d0dfd
ffff89f7af1bd000 3639190525 S Ii:1:004:2 -115:8 64 <
ffff89f7af1bd000 3639198645 C Ii:1:004:2 0:8 64 = 30308000 80007849 4e000880 0ca3069c fe5e0dfe ffe7ff00 00a3069c fe5e0dfe
ffff89f7af1bd000 3639198686 S Ii:1:004:2 -115:8 64 <
ffff89f7af1bd000 3639214514 C Ii:1:004:2 0:8 64 = 30318000 8000a949 53000880 0ca2069d fe5d0dfe ffe7ff00 00a3069c fe5e0dfe
ffff89f7af1bd000 3639214550 S Ii:1:004:2 -115:8 64 <
ffff89f7af1bd000 3639230513 C Ii:1:004:2 0:8 64 = 30348000 8000f959 5a000880 0ca3069d fe580dfe ffe7ff00 00a2069f fe5a0dfe
ffff89f7af1bd000 3639230555 S Ii:1:004:2 -115:8 64 <
ffff89f7af1bd000 3639246520 C Ii:1:004:2 0:8 64 = 30388000 8000395a 61000880 0ca40694 fe5a0dfe ffe8ff01 00a40694 fe5a0dfe
ffff89f7af1bd000 3639246555 S Ii:1:004:2 -115:8 64 <
ffff89f7af1bd000 3639263260 C Ii:1:004:2 0:8 64 = 303b8000 8000595a 65000880 0ca10698 fe5c0dff ffe6ff00 00a10698 fe5c0dff
ffff89f7af1bd000 3639263306 S Ii:1:004:2 -115:8 64 <
ffff89f7af1bd000 3639279477 C Ii:1:004:2 0:8 64 = 303e8000 8000696a 68000880 0ca2069a fe5f0d01 00e7ff02 00a2069a fe5f0d01
ffff89f7af1bd000 3639279518 S Ii:1:004:2 -115:8 64 <
ffff89f7af1bd000 3639295913 C Ii:1:004:2 0:8 64 = 30418000 8000696a 6c000880 0ca7069a fe5b0d00 00e9ff02 00a50699 fe5d0d01
ffff89f7af1bd000 3639295959 S Ii:1:004:2 -115:8 64 <
ffff89f7af1bd000 3639310556 C Ii:1:004:2 0:8 64 = 30448000 8000596a 71000880 0ca5069d fe5b0dff ffe9ff00 00a8069c fe5b0d00
ffff89f7af1bd000 3639310592 S Ii:1:004:2 -115:8 64 <
ffff89f7af1bd000 3639328327 C Ii:1:004:2 0:8 64 = 30488000 8000f979 78000880 0ca4069b fe5e0dff ffe6ff01 00a4069b fe5e0dff
ffff89f7af1bd000 3639328371 S Ii:1:004:2 -115:8 64 <
ffff89f7af1bd000 3639343610 C Ii:1:004:2 0:8 64 = 304b8000 8000a979 7d000880 0ca7069a fe590dfe ffe8ff03 00a7069a fe590dfe
ffff89f7af1bd000 3639343646 S Ii:1:004:2 -115:8 64 <
ffff89f7af1bd000 3639358555 C Ii:1:004:2 0:8 64 = 304e8000 80007809 80000880 0ca50699 fe580dfd ffe8ff02 00a50699 fe580dfd
ffff89f7af1bd000 3639358601 S Ii:1:004:2 -115:8 64 <
ffff89f7af1bd000 3639374531 C Ii:1:004:2 0:8 64 = 30518000 80006879 80000880 0ca40697 fe5c0dfd ffe8ff00 00a40698 fe5b0dfd
ffff89f7af1bd000 3639374580 S Ii:1:004:2 -115:8 64 <
ffff89f7af1bd000 3639398625 C Ii:1:004:2 0:8 64 = 30548000 80005879 81000880 0ca60699 fe5e0d00 00e7ff02 00a60698 fe5e0dfe
ffff89f7af1bd000 3639398672 S Ii:1:004:2 -115:8 64 <
ffff89f7af1bd000 3639407922 C Ii:1:004:2 0:8 64 = 30598000 80000879 82000880 0ca10697 fe5a0d00 00e6ff01 00a10696 fe5c0d00
ffff89f7af1bd000 3639407963 S Ii:1:004:2 -115:8 64 <
ffff89f7af1bd000 3639423368 C Ii:1:004:2 0:8 64 = 305b8000 8000d878 83000880 0ca10699 fe570d00 00e6ff01 00a10699 fe570d00
ffff89f7af1bd000 3639423409 S Ii:1:004:2 -115:8 64 <
ffff89f7af1bd000 3639438626 C Ii:1:004:2 0:8 64 = 305e8000 80007778 83000880 0ca3069d fe5b0dfe ffe8ff03 00a3069d fe5b0dfe
ffff89f7af1bd000 3639438664 S Ii:1:004:2 -115:8 64 <
ffff89f7af1bd000 3639457110 C Ii:1:004:2 0:8 64 = 30618000 80003778 82000880 0ca40699 fe5c0dff ffe6ff02 00a4069b fe5c0dfe
ffff89f7af1bd000 3639457157 S Ii:1:004:2 -115:8 64 <
ffff89f7af1bd000 3639470615 C Ii:1:004:2 0:8 64 = 30648000 80000008 80000880 0ca4069c fe5c0d00 00e5ff01 00a4069a fe5b0d00
ffff89f7af1bd000 3639470661 S Ii:1:004:2 -115:8 64 <
ffff89f7af1bd000 3639488663 C Ii:1:004:2 0:8 64 = 30688000 80000008 80000880 0ca6069c fe5b0dff ffe7ff00 00a6069c fe5b0dff
ffff89f7af1bd000 3639488707 S Ii:1:004:2 -115:8 64 <
ffff89f7af1bd000 3639502488 C Ii:1:004:2 0:8 64 = 306b8000 80000008 80000880 0ca3069c fe590dfe ffe8ff00 00a3069c fe590dfe
ffff89f7af1bd000 3639502524 S Ii:1:004:2 -115:8 64 <
ffff89f7af1bd000 3639518545 C Ii:1:004:2 0:8 64 = 306e8000 80000008 80000880 0c9c069a fe5a0dfe ffe9ff02 009c069a fe5a0dfe
ffff89f7af1bd000 3639518605 S Ii:1:004:2 -115:8 64 <
ffff89f7af1bd000 3639534451 C Ii:1:004:2 0:8 64 = 30718000 8000f707 80000880 0ca1069c fe5b0dff ffe4ff03 009d069b fe5b0dff
ffff89f7af1bd000 3639534494 S Ii:1:004:2 -115:8 64 <
ffff89f7af1bd000 3639551836 C Ii:1:004:2 0:8 64 = 30748000 8000d777 7d000880 0c9f0698 fe590d00 00e6ff02 00a0069b fe5a0d00
ffff89f7af1bd000 3639551881 S Ii:1:004:2 -115:8 64 <
ffff89f7af1bd000 3639566441 C Ii:1:004:2 0:8 64 = 30788000 8000b777 7c000880 0ca50696 fe5b0d00 00e4ff02 00a50696 fe5b0d00
ffff89f7af1bd000 3639566485 S Ii:1:004:2 -115:8 64 <
ffff89f7af1bd000 3639583298 C Ii:1:004:2 0:8 64 = 307b8000 8000a777 7b000880 0ca40699 fe5e0dff ffe6ff02 00a40699 fe5e0dff
ffff89f7af1bd000 3639583355 S Ii:1:004:2 -115:8 64 <
ffff89f7af1bd000 3639598699 C Ii:1:004:2 0:8 64 = 307e8000 8000a777 7a000880 0ca5069b fe5b0dfe ffe6ff01 00a5069b fe5b0dfe
ffff89f7af1bd000 3639598744 S Ii:1:004:2 -115:8 64 <
ffff89f7af1bd000 3639614522 C Ii:1:004:2 0:8 64 = 30818000 80009777 7a000880 0ca306a1 fe5b0dff ffe6ff01 00a4069e fe590dfe
ffff89f7af1bd000 3639614556 S Ii:1:004:2 -115:8 64 <
ffff89f7af1bd000 3639632119 C Ii:1:004:2 0:8 64 = 30848000 80009777 7a000880 0ca8069c fe5d0d01 00e8ff03 00a6069e fe5e0d01
ffff89f7af1bd000 3639632161 S Ii:1:004:2 -115:8 64 <
ffff89f7af1bd000 3639647252 C Ii:1:004:2 0:8 64 = 30888000 8000a777 79000880 0ca7069b fe590d00 00e7ff01 00a7069b fe590d00
ffff89f7af1bd000 3639647288 S Ii:1:004:2 -115:8 64 <
ffff89f7af1bd000 3639662536 C Ii:1:004:2 0:8 64 = 308b8000 8000b777 79000880 0ca40697 fe5b0dfe ffe6ff00 00a40697 fe5b0dfe
ffff89f7af1bd000 3639662578 S Ii:1:004:2 -115:8 64 <
ffff89f7af1bd000 3639680232 C Ii:1:004:2 0:8 64 = 308e8000 8000e777 7a000880 0ca40695 fe580dff ffe6ff02 00a40695 fe580dff
ffff89f7af1bd000 3639680270 S Ii:1:004:2 -115:8 64 <
ffff89f7af1bd000 3639694538 C Ii:1:004:2 0:8 64 = 30918000 80000078 7b000880 0ca00698 fe5f0d00 00e8ff02 00a20696 fe5b0d00
ffff89f7af1bd000 3639694548 S Ii:1:004:2 -115:8 64 <
ffff89f7af1bd000 3639710649 C Ii:1:004:2 0:8 64 = 30948000 80001778 7a000880 0ca7069b fe5c0dff ffe8ff00 00a2069a fe5e0dff
ffff89f7af1bd000 3639710684 S Ii:1:004:2 -115:8 64 <
ffff89f7af1bd000 3639726427 C Ii:1:004:2 0:8 64 = 30988000 80006778 78000880 0ca80698 fe5e0d00 00e7ff00 00a80698 fe5e0d00
ffff89f7af1bd000 3639726472 S Ii:1:004:2 -115:8 64 <
ffff89f7af1bd000 3639743207 C Ii:1:004:2 0:8 64 = 309b8000 8000b868 75000880 0ca6069e fe5c0dff ffe6ff02 00a6069e fe5c0dff
ffff89f7af1bd000 3639743244 S Ii:1:004:2 -115:8 64 <
ffff89f7af1bd000 3639759990 C Ii:1:004:2 0:8 64 = 309e8000 80001869 73000880 0ca6069c fe5e0dff ffe8ff02 00a6069c fe5e0dff
ffff89f7af1bd000 3639760034 S Ii:1:004:2 -115:8 64 <
ffff89f7af1bd000 3639776039 C Ii:1:004:2 0:8 64 = 30a18000 80009969 71000880 0ca40698 fe5c0dfe ffe8ff02 00a6069a fe5d0dff
ffff89f7af1bd000 3639776078 S Ii:1:004:2 -115:8 64 <
ffff89f7af1bd000 3639790584 C Ii:1:004:2 0:8 64 = 30a48000 8000296a 6e000880 0ca50696 fe590dfe ffe9ff00 00a40697 fe5a0dfe
ffff89f7af1bd000 3639790640 S Ii:1:004:2 -115:8 64 <
ffff89f7af1bd000 3639807893 C Ii:1:004:2 0:8 64 = 30a88000 8000ca6a 6b000880 0ca30697 fe590dff ffe6ff01 00a30697 fe590dff
ffff89f7af1bd000 3639807930 S Ii:1:004:2 -115:8 64 <
ffff89f7af1bd000 3639832368 C Ii:1:004:2 0:8 64 = 30ab8000 80004a6b 68000880 0ca20699 fe5e0dff ffe7ff01 00a20699 fe5e0dff
ffff89f7af1bd000 3639832413 S Ii:1:004:2 -115:8 64 <
ffff89f7af1bd000 3639839585 C Ii:1:004:2 0:8 64 = 30b08000 8000bb5b 65000880 0ca20699 fe5c0dff ffe5ff01 00a20699 fe5c0dff
ffff89f7af1bd000 3639839622 S Ii:1:004:2 -115:8 64 <
ffff89f7af1bd000 3639854519 C Ii:1:004:2 0:8 64 = 30b18000 8000cb5b 64000880 0ca50699 fe590dff ffe6ff01 00a20699 fe5c0dff
ffff89f7af1bd000 3639854557 S Ii:1:004:2 -115:8 64 <
ffff89f7af1bd000 3639878561 C Ii:1:004:2 0:8 64 = 30b48000 8000cb5b 64000880 0cae069d fe5c0dff ffe7ff01 00aa069a fe5a0dff
ffff89f7af1bd000 3639878604 S Ii:1:004:2 -115:8 64 <
ffff89f7af1bd000 3639887881 C Ii:1:004:2 0:8 64 = 30b98000 8000cb5b 65000880 0ca806a0 fe5b0dff ffe8ff02 00aa06a0 fe5b0dff
ffff89f7af1bd000 3639887920 S Ii:1:004:2 -115:8 64 <
ffff89f7af1bd000 3639902460 C Ii:1:004:2 0:8 64 = 30bb8000 80009a6b 66000880 0ca6069f fe5b0dfe ffe8ff01 00a6069f fe5b0dfe
ffff89f7af1bd000 3639902503 S Ii:1:004:2 -115:8 64 <
ffff89f7af1bd000 3639918480 C Ii:1:004:2 0:8 64 = 30be8000 8000ea6a 6b000880 0ca10699 fe5b0dff ffe7ff01 00a10699 fe5b0dff
ffff89f7af1bd000 3639918527 S Ii:1:004:2 -115:8 64 <
ffff89f7af1bd000 3639935414 C Ii:1:004:2 0:8 64 = 30c18000 80009969 73000880 0ca20696 fe5a0dfe ffe6ff02 00a10696 fe5a0dff
ffff89f7af1bd000 3639935451 S Ii:1:004:2 -115:8 64 <
ffff89f7af1bd000 3639952445 C Ii:1:004:2 0:8 64 = 30c48000 80004778 7c000880 0c9f0696 fe5e0dfe ffe5ff00 00a00695 fe5c0dfe
ffff89f7af1bd000 3639952489 S Ii:1:004:2 -115:8 64 <
ffff89f7af1bd000 3639968269 C Ii:1:004:2 0:8 64 = 30c88000 80000008 80000880 0ca6069e fe600dff ffe9ff02 00a6069e fe600dff
ffff89f7af1bd000 3639968310 S Ii:1:004:2 -115:8 64 <
ffff89f7af1bd000 3639983263 C Ii:1:004:2 0:8 64 = 30cb8000 8000e777 7e000880 0ca4069b fe5a0dff ffe5ff03 00a4069b fe5a0dff
ffff89f7af1bd000 3639983282 S Ii:1:004:2 -115:8 64 <
ffff89f7af1bd000 3639998566 C Ii:1:004:2 0:8 64 = 30ce8000 8000a777 7b000880 0cac06a2 fe570dfc ffe7ff03 00ac06a2 fe570dfc
ffff89f7af1bd000 3639998608 S Ii:1:004:2 -115:8 64 <
ffff89f7af1bd000 3640014534 C Ii:1:004:2 0:8 64 = 30d18000 80005677 78000880 0ca706a1 fe5b0dfd ffe8ff03 00a906a2 fe580dfc
ffff89f7af1bd000 3640014569 S Ii:1:004:2 -115:8 64 <
ffff89f7af1bd000 3640032410 C Ii:1:004:2 0:8 64 = 30d48000 80001667 74000880 0ca50697 fe5c0dfe ffe8ff02 00a6069d fe5d0dfe
ffff89f7af1bd000 3640032454 S Ii:1:004:2 -115:8 64 <
ffff89f7af1bd000 3640047767 C Ii:1:004:2 0:8 64 = 30d88000 8000f666 70000880 0c9c068f fe5d0dff ffe6ff01 009c068f fe5d0dff
ffff89f7af1bd000 3640047807 S Ii:1:004:2 -115:8 64 <
ffff89f7af1bd000 3640063548 C Ii:1:004:2 0:8 64 = 30db8000 8000b666 6a000880 0c9b0691 fe600dff ffe6ff01 009b0691 fe600dff
ffff89f7af1bd000 3640063592 S Ii:1:004:2 -115:8 64 <
ffff89f7af1bd000 3640078500 C Ii:1:004:2 0:8 64 = 30de8000 80009656 65000880 0ca10692 fe5d0dff ffe7ffff ffa10692 fe5d0dff
ffff89f7af1bd000 3640078538 S Ii:1:004:2 -115:8 64 <
ffff89f7af1bd000 3640094563 C Ii:1:004:2 0:8 64 = 30e18000 80007656 61000880 0ca4069b fe590dff ffe6ff00 00a30697 fe590dff
ffff89f7af1bd000 3640094611 S Ii:1:004:2 -115:8 64 <
ffff89f7af1bd000 3640111259 C Ii:1:004:2 0:8 64 = 30e48000 80007656 5e000880 0ca9069f fe5b0dff ffe7ff01 00a6069f fe5b0dff
ffff89f7af1bd000 3640111307 S Ii:1:004:2 -115:8 64 <
ffff89f7af1bd000 3640128061 C Ii:1:004:2 0:8 64 = 30e88000 8000b656 5b000880 0cad06a1 fe5a0dff ffe5ff00 00ad06a1 fe5a0dff
ffff89f7af1bd000 3640128106 S Ii:1:004:2 -115:8 64 <
ffff89f7af1bd000 3640153244 C Ii:1:004:2 0:8 64 = 30eb8000 80001657 5a000880 0ca606a0 fe5b0dfe ffe6ff02 00a606a0 fe5b0dfe
ffff89f7af1bd000 3640153286 S Ii:1:004:2 -115:8 64 <
ffff89f7af1bd000 3640166581 C Ii:1:004:2 0:8 64 = 30f08000 8000d757 5b000880 0ca30691 fe570dff ffe7ff00 00a30691 fe570dff
ffff89f7af1bd000 3640166623 S Ii:1:004:2 -115:8 64 <
ffff89f7af1bd000 3640182549 C Ii:1:004:2 0:8 64 = 30f38000 80004758 5b000880 0ca10691 fe5c0dff ffe7ff00 00a10691 fe5c0dff
ffff89f7af1bd000 3640182584 S Ii:1:004:2 -115:8 64 <
ffff89f7af1bd000 3640191825 C Ii:1:004:2 0:8 64 = 30f68000 8000d858 5a000880 0c9f0695 fe620d00 00e6ff03 009f0695 fe620d00
ffff89f7af1bd000 3640191870 S Ii:1:004:2 -115:8 64 <
ffff89f7af1bd000 3640206569 C Ii:1:004:2 0:8 64 = 30f88000 80001859 5b000880 0c9f0696 fe600d00 00e7ff02 009f0696 fe600d00
ffff89f7af1bd000 3640206609 S Ii:1:004:2 -115:8 64 <
ffff89f7af1bd000 3640222516 C Ii:1:004:2 0:8 64 = 30fb8000 80009959 5c000880 0ca8069c fe580dff ffe7ff00 00a8069c fe580dff
ffff89f7af1bd000 3640222562 S Ii:1:004:2 -115:8 64 <
ffff89f7af1bd000 3640239704 C Ii:1:004:2 0:8 64 = 30fe8000 8000195a 60000880 0ca9069e fe590d00 00e6ff00 00a9069e fe590d00
ffff89f7af1bd000 3640239748 S Ii:1:004:2 -115:8 64 <
ffff89f7af1bd000 3640262584 C Ii:1:004:2 0:8 64 = 30018000 8000496a 66000880 0caa069d fe5e0dfe ffe9ff02 00aa069d fe5b0dff
ffff89f7af1bd000 3640262628 S Ii:1:004:2 -115:8 64 <
ffff89f7af1bd000 3640271178 C Ii:1:004:2 0:8 64 = 30068000 8000596a 6e000880 0ca70698 fe5d0dfe ffe8ff02 00a70698 fe5d0dfe
ffff89f7af1bd000 3640271223 S Ii:1:004:2 -115:8 64 <
ffff89f7af1bd000 3640286468 C Ii:1:004:2 0:8 64 = 30088000 8000396a 71000880 0ca60696 fe5e0dfe ffe8ff01 00a60696 fe5e0dfe
ffff89f7af1bd000 3640286510 S Ii:1:004:2 -115:8 64 <
ffff89f7af1bd000 3640303605 C Ii:1:004:2 0:8 64 = 300b8000 8000a979 78000880 0ca00692 fe5c0dfe ffe8ff00 00a00692 fe5c0dfe
ffff89f7af1bd000 3640303644 S Ii:1:004:2 -115:8 64 <
ffff89f7af1bd000 3640319589 C Ii:1:004:2 0:8 64 = 300e8000 80009808 80000880 0ca40699 fe5c0dff ffe8ff01 00a40699 fe5c0dff
ffff89f7af1bd000 3640319635 S Ii:1:004:2 -115:8 64 <
ffff89f7af1bd000 3640336111 C Ii:1:004:2 0:8 64 = 30118000 80000078 80000880 0cac06a3 fe5f0dfc ffe9ff02 00a8069e fe5d0dff
ffff89f7af1bd000 3640336151 S Ii:1:004:2 -115:8 64 <
ffff89f7af1bd000 3640350447 C Ii:1:004:2 0:8 64 = 30148000 80000008 80000880 0ca20699 fe5a0dfc ffe8ff01 00a6069e fe5d0dfb
ffff89f7af1bd000 3640350482 S Ii:1:004:2 -115:8 64 <
ffff89f7af1bd000 3640366467 C Ii:1:004:2 0:8 64 = 30188000 80000078 80000880 0ca50697 fe5c0dfe ffe6ff01 00a50697 fe5c0dfe
ffff89f7af1bd000 3640366514 S Ii:1:004:2 -115:8 64 <
ffff89f7af1bd000 3640382469 C Ii:1:004:2 0:8 64 = 301b8000 8000f707 80000880 0ca20698 fe5c0dfd ffe6ff01 00a20698 fe5c0dfd
ffff89f7af1bd000 3640382512 S Ii:1:004:2 -115:8 64 <
ffff89f7af1bd000 3640399977 C Ii:1:004:2 0:8 64 = 301e8000 8000c707 80000880 0ca30699 fe5c0d00 00e6ff01 00a30699 fe5c0d00
ffff89f7af1bd000 3640400049 S Ii:1:004:2 -115:8 64 <
ffff89f7af1bd000 3640415442 C Ii:1:004:2 0:8 64 = 30218000 80009777 7e000880 0ca30696 fe5d0dff ffe7ff03 00a40697 fe5c0d00
ffff89f7af1bd000 3640415499 S Ii:1:004:2 -115:8 64 <
ffff89f7af1bd000 3640432020 C Ii:1:004:2 0:8 64 = 30248000 80006677 7c000880 0ca30698 fe5c0d00 00e5ff02 00a20696 fe5d0dff
ffff89f7af1bd000 3640432069 S Ii:1:004:2 -115:8 64 <
ffff89f7af1bd000 3640454450 C Ii:1:004:2 0:8 64 = 30288000 80001677 7a000880 0ca3069b fe590d01 00e6ff00 00a3069b fe590d01
ffff89f7af1bd000 3640454507 S Ii:1:004:2 -115:8 64 <
ffff89f7af1bd000 3640470559 C Ii:1:004:2 0:8 64 = 302c8000 8000a666 73000880 0ca806a2 fe5c0d00 00e6ff02 00a7069f fe5c0d01
ffff89f7af1bd000 3640470602 S Ii:1:004:2 -115:8 64 <
ffff89f7af1bd000 3640486679 C Ii:1:004:2 0:8 64 = 30308000 80006666 6d000880 0ca8069d fe5d0dfe ffe8ff01 00a8069d fe5d0dfe
ffff89f7af1bd000 3640486720 S Ii:1:004:2 -115:8 64 <
ffff89f7af1bd000 3640496289 C Ii:1:004:2 0:8 64 = 30338000 80004566 66000880 0ca6069b fe5c0dfd ffe6ff01 00a6069b fe5c0dfd
ffff89f7af1bd000 3640496334 S Ii:1:004:2 -115:8 64 <
ffff89f7af1bd000 3640510512 C Ii:1:004:2 0:8 64 = 30348000 80004556 62000880 0ca20698 fe5b0dff ffe6ff02 00a6069b fe5c0dfd
ffff89f7af1bd000 3640510551 S Ii:1:004:2 -115:8 64 <
ffff89f7af1bd000 3640526455 C Ii:1:004:2 0:8 64 = 30388000 8000a656 5c000880 0ca00698 fe5c0dff ffe7ff02 00a00698 fe5c0dff
ffff89f7af1bd000 3640526497 S Ii:1:004:2 -115:8 64 <
ffff89f7af1bd000 3640543517 C Ii:1:004:2 0:8 64 = 303b8000 80001657 56000880 0ca00694 fe5d0dff ffe6ff01 00a00694 fe5d0dff
ffff89f7af1bd000 3640543562 S Ii:1:004:2 -115:8 64 <
ffff89f7af1bd000 3640560078 C Ii:1:004:2 0:8 64 = 303e8000 80006647 51000880 0ca50697 fe5c0dff ffe7ff02 00a50697 fe5c0dff
ffff89f7af1bd000 3640560140 S Ii:1:004:2 -115:8 64 <
ffff89f7af1bd000 3640575351 C Ii:1:004:2 0:8 64 = 30418000 8000b747 4c000880 0ca5069b fe580dfd ffe5ff01 00a5069a fe5a0dfd
ffff89f7af1bd000 3640575396 S Ii:1:004:2 -115:8 64 <
ffff89f7af1bd000 3640591731 C Ii:1:004:2 0:8 64 = 30448000 8000f747 47000880 0ca7069c fe590dff ffe5ff01 00a6069b fe580dfe
ffff89f7af1bd000 3640591787 S Ii:1:004:2 -115:8 64 <
ffff89f7af1bd000 3640607061 C Ii:1:004:2 0:8 64 = 30488000 80002738 43000880 0ca9069f fe570dfe ffe7ff02 00a9069f fe570dfe
ffff89f7af1bd000 3640607109 S Ii:1:004:2 -115:8 64 <
ffff89f7af1bd000 3640623064 C Ii:1:004:2 0:8 64 = 304b8000 80007738 3f000880 0ca406a1 fe590dff ffe6ff02 00a406a1 fe590dff
ffff89f7af1bd000 3640623114 S Ii:1:004:2 -115:8 64 <
ffff89f7af1bd000 3640638459 C Ii:1:004:2 0:8 64 = 304e8000 8000e838 3c000880 0ca9069d fe5a0dff ffe8ff01 00a9069d fe5a0dff
ffff89f7af1bd000 3640638503 S Ii:1:004:2 -115:8 64 <
ffff89f7af1bd000 3640656395 C Ii:1:004:2 0:8 64 = 30518000 80005839 3a000880 0ca90699 fe5e0dfe ffe7ff02 00aa069a fe5d0dfe
ffff89f7af1bd000 3640656442 S Ii:1:004:2 -115:8 64 <
ffff89f7af1bd000 3640673426 C Ii:1:004:2 0:8 64 = 30548000 8000c939 3b000880 0ca40697 fe5c0dff ffe8ff02 00a60697 fe5d0dfe
ffff89f7af1bd000 3640673473 S Ii:1:004:2 -115:8 64 <
ffff89f7af1bd000 3640688351 C Ii:1:004:2 0:8 64 = 30588000 8000393a 3e000880 0ca00697 fe5a0d00 00e7ff01 00a00697 fe5a0d00
ffff89f7af1bd000 3640688398 S Ii:1:004:2 -115:8 64 <
ffff89f7af1bd000 3640702510 C Ii:1:004:2 0:8 64 = 305b8000 8000993a 43000880 0ca20699 fe5d0dff ffe7ff03 00a20699 fe5d0dff
ffff89f7af1bd000 3640702554 S Ii:1:004:2 -115:8 64 <
ffff89f7af1bd000 3640719083 C Ii:1:004:2 0:8 64 = 305e8000 8000ca4a 48000880 0ca70698 fe5a0dff ffe7ff02 00a70698 fe5a0dff
ffff89f7af1bd000 3640719121 S Ii:1:004:2 -115:8 64 <
ffff89f7af1bd000 3640742556 C Ii:1:004:2 0:8 64 = 30618000 8000da4a 4c000880 0ca50697 fe5e0dff ffe7ff01 00a60696 fe5c0dff
ffff89f7af1bd000 3640742601 S Ii:1:004:2 -115:8 64 <
ffff89f7af1bd000 3640758520 C Ii:1:004:2 0:8 64 = 30668000 8000da4a 52000880 0ca7069d fe5c0dff ffe5ff01 00a7069d fe5c0dff
ffff89f7af1bd000 3640758566 S Ii:1:004:2 -115:8 64 <
ffff89f7af1bd000 3640768984 C Ii:1:004:2 0:8 64 = 30698000 8000ca5a 59000880 0ca3069a fe5d0dff ffe8ff02 00a8069b fe5c0dff
ffff89f7af1bd000 3640769024 S Ii:1:004:2 -115:8 64 <
ffff89f7af1bd000 3640790523 C Ii:1:004:2 0:8 64 = 306b8000 8000ba5a 5d000880 0ca0069c fe5d0dfe ffe7ff03 00a0069c fe5d0dfe
ffff89f7af1bd000 3640790570 S Ii:1:004:2 -115:8 64 <
ffff89f7af1bd000 3640806486 C Ii:1:004:2 0:8 64 = 30708000 8000d969 6c000880 0ca20694 fe5a0dff ffe8ff01 00a20694 fe5a0dff
ffff89f7af1bd000 3640806524 S Ii:1:004:2 -115:8 64 <
ffff89f7af1bd000 3640815345 C Ii:1:004:2 0:8 64 = 30738000 8000e878 77000880 0c9c069a fe5c0dfd ffe4ff01 009c069a fe5c0dfd
ffff89f7af1bd000 3640815382 S Ii:1:004:2 -115:8 64 <
ffff89f7af1bd000 3640831322 C Ii:1:004:2 0:8 64 = 30748000 80006778 7c000880 0c9b069b fe5b0dfe ffe3ff02 009c069a fe5c0dfd
ffff89f7af1bd000 3640831385 S Ii:1:004:2 -115:8 64 <
ffff89f7af1bd000 3640848479 C Ii:1:004:2 0:8 64 = 30788000 80000008 80000880 0ca806a1 fe5f0dff ffe8ff01 00a806a1 fe5f0dff
ffff89f7af1bd000 3640848517 S Ii:1:004:2 -115:8 64 <
ffff89f7af1bd000 3640863451 C Ii:1:004:2 0:8 64 = 307b8000 80000008 80000880 0ca60698 fe5a0dff ffe6ff01 00a60698 fe5a0dff
ffff89f7af1bd000 3640863495 S Ii:1:004:2 -115:8 64 <
ffff89f7af1bd000 3640886365 C Ii:1:004:2 0:8 64 = 307e8000 80000008 80000880 0ca7069d fe5c0dff ffe6ff02 00a7069d fe5c0dff
ffff89f7af1bd000 3640886413 S Ii:1:004:2 -115:8 64 <
ffff89f7af1bd000 3640895474 C Ii:1:004:2 0:8 64 = 30838000 8000e777 7e000880 0c9d0698 fe580d00 00e6ff02 009d0698 fe580d00
ffff89f7af1bd000 3640895523 S Ii:1:004:2 -115:8 64 <
ffff89f7af1bd000 3640910532 C Ii:1:004:2 0:8 64 = 30848000 8000c777 7c000880 0c9f0696 fe570d00 00e6ff03 009d0698 fe580d00
ffff89f7af1bd000 3640910579 S Ii:1:004:2 -115:8 64 <
ffff89f7af1bd000 3640926515 C Ii:1:004:2 0:8 64 = 30888000 80009777 79000880 0ca00697 fe5b0dff ffe7ff01 00a00697 fe5b0dff
ffff89f7af1bd000 3640926561 S Ii:1:004:2 -115:8 64 <
ffff89f7af1bd000 3640942565 C Ii:1:004:2 0:8 64 = 308b8000 80004667 74000880 0ca10698 fe5b0dff ffe8ff02 00a10698 fe5b0dff
ffff89f7af1bd000 3640942606 S Ii:1:004:2 -115:8 64 <
ffff89f7af1bd000 3640950553 C Ii:1:004:2 0:8 64 = 308e8000 8000e666 6e000880 0ca20695 fe5d0dfe ffe8ff01 00a20695 fe5d0dfe
ffff89f7af1bd000 3640950593 S Ii:1:004:2 -115:8 64 <
ffff89f7af1bd000 3640974398 C Ii:1:004:2 0:8 64 = 30908000 8000b666 6b000880 0ca20695 fe5d0dfe ffe7ff01 00a20695 fe5d0dfe
ffff89f7af1bd000 3640974444 S Ii:1:004:2 -115:8 64 <
ffff89f7af1bd000 3640990567 C Ii:1:004:2 0:8 64 = 30948000 80006656 64000880 0ca7069f fe590dfe ffe8ff02 00a6069c fe5a0dff
ffff89f7af1bd000 3640990614 S Ii:1:004:2 -115:8 64 <
ffff89f7af1bd000 3641009314 C Ii:1:004:2 0:8 64 = 30988000 80005556 60000880 0ca4069f fe5a0dff ffe8ff02 00a4069f fe5a0dff
ffff89f7af1bd000 3641009352 S Ii:1:004:2 -115:8 64 <
ffff89f7af1bd000 3641023482 C Ii:1:004:2 0:8 64 = 309b8000 80006656 5c000880 0ca6069b fe5a0dff ffe7ff01 00a6069b fe5a0dff
ffff89f7af1bd000 3641023527 S Ii:1:004:2 -115:8 64 <
ffff89f7af1bd000 3641038543 C Ii:1:004:2 0:8 64 = 309e8000 8000b656 56000880 0ca50699 fe5d0dfe ffe7ff02 00a50699 fe5d0dfe
ffff89f7af1bd000 3641038585 S Ii:1:004:2 -115:8 64 <
ffff89f7af1bd000 3641054365 C Ii:1:004:2 0:8 64 = 30a18000 80001647 50000880 0c9d0699 fe620d01 00e7ff02 009e069a fe610d00
ffff89f7af1bd000 3641054435 S Ii:1:004:2 -115:8 64 <
ffff89f7af1bd000 3641072158 C Ii:1:004:2 0:8 64 = 30a48000 80006647 4b000880 0ca30698 fe5f0d00 00e6ff01 00a00697 fe600d01
ffff89f7af1bd000 3641072211 S Ii:1:004:2 -115:8 64 <
ffff89f7af1bd000 3641088038 C Ii:1:004:2 0:8 64 = 30a88000 8000a747 47000880 0ca5069c fe5d0dfe ffe8ff01 00a5069c fe5d0dfe
ffff89f7af1bd000 3641088099 S Ii:1:004:2 -115:8 64 <
ffff89f7af1bd000 3641104154 C Ii:1:004:2 0:8 64 = 30ab8000 8000d747 46000880 0ca9069c fe5d0dff ffe6ff00 00a9069c fe5d0dff
ffff89f7af1bd000 3641104201 S Ii:1:004:2 -115:8 64 <
ffff89f7af1bd000 3641120423 C Ii:1:004:2 0:8 64 = 30ae8000 80000048 46000880 0ca8069e fe5e0dfe ffe8ff01 00a8069e fe5e0dfe
ffff89f7af1bd000 3641120469 S Ii:1:004:2 -115:8 64 <
ffff89f7af1bd000 3641144243 C Ii:1:004:2 0:8 64 = 30b18000 80004748 45000880 0ca7069f fe5c0dfe ffe7ff00 00a706a0 fe5e0dfe
ffff89f7af1bd000 3641144289 S Ii:1:004:2 -115:8 64 <
ffff89f7af1bd000 3641152500 C Ii:1:004:2 0:8 64 = 30b68000 8000e848 48000880 0ca50697 fe580dfd ffe8ff02 00a50697 fe580dfd
ffff89f7af1bd000 3641152544 S Ii:1:004:2 -115:8 64 <
ffff89f7af1bd000 3641177435 C Ii:1:004:2 0:8 64 = 30b88000 80002849 49000880 0ca10699 fe5d0dff ffe7ff01 00a10699 fe5d0dff
ffff89f7af1bd000 3641177485 S Ii:1:004:2 -115:8 64 <
ffff89f7af1bd000 3641190563 C Ii:1:004:2 0:8 64 = 30bc8000 8000d949 4d000880 0ca10697 fe600dff ffe8ff01 00a0069a fe620dff
ffff89f7af1bd000 3641190607 S Ii:1:004:2 -115:8 64 <
ffff89f7af1bd000 3641206784 C Ii:1:004:2 0:8 64 = 30c08000 8000194a 4e000880 0ca20695 fe5d0dfe ffe6ff02 00a20695 fe5d0dfe
ffff89f7af1bd000 3641206831 S Ii:1:004:2 -115:8 64 <
ffff89f7af1bd000 3641224182 C Ii:1:004:2 0:8 64 = 30c38000 8000494a 50000880 0ca50699 fe5d0dff ffe6ff02 00a50699 fe5d0dff
ffff89f7af1bd000 3641224195 S Ii:1:004:2 -115:8 64 <
ffff89f7af1bd000 3641239972 C Ii:1:004:2 0:8 64 = 30c68000 8000494a 53000880 0ca8069f fe5c0dff ffe6ff01 00a8069f fe5c0dff
ffff89f7af1bd000 3641240020 S Ii:1:004:2 -115:8 64 <
ffff89f7af1bd000 3641254518 C Ii:1:004:2 0:8 64 = 30c98000 8000595a 57000880 0ca4069c fe5f0dfe ffe7ff01 00a706a0 fe5d0dfe
ffff89f7af1bd000 3641254573 S Ii:1:004:2 -115:8 64 <
ffff89f7af1bd000 3641273201 C Ii:1:004:2 0:8 64 = 30cc8000 8000495a 5e000880 0ca30699 fe5f0dfe ffe8ff03 00a3069a fe610dfe
ffff89f7af1bd000 3641273245 S Ii:1:004:2 -115:8 64 <
ffff89f7af1bd000 3641286410 C Ii:1:004:2 0:8 64 = 30d08000 8000296a 66000880 0ca30698 fe5b0dfe ffe7ff02 00a30698 fe5b0dfe
ffff89f7af1bd000 3641286454 S Ii:1:004:2 -115:8 64 <
ffff89f7af1bd000 3641302534 C Ii:1:004:2 0:8 64 = 30d38000 8000b969 6e000880 0ca20699 fe5b0dfd ffe7ffff ffa20699 fe5b0dfd
ffff89f7af1bd000 3641302580 S Ii:1:004:2 -115:8 64 <
ffff89f7af1bd000 3641318390 C Ii:1:004:2 0:8 64 = 30d68000 80002869 76000880 0c9e0697 fe5e0dfe ffe6ff01 009e0697 fe5e0dfe
ffff89f7af1bd000 3641318435 S Ii:1:004:2 -115:8 64 <
ffff89f7af1bd000 3641334469 C Ii:1:004:2 0:8 64 = 30d98000 80006778 7d000880 0ca30695 fe5f0dff ffe6ff01 00a00694 fe5f0dff
ffff89f7af1bd000 3641334513 S Ii:1:004:2 -115:8 64 <
ffff89f7af1bd000 3641351633 C Ii:1:004:2 0:8 64 = 30dc8000 80000008 80000880 0ca806a2 fe5d0dff ffe7ff00 00a6069b fe5e0d00
ffff89f7af1bd000 3641351699 S Ii:1:004:2 -115:8 64 <
ffff89f7af1bd000 3641368363 C Ii:1:004:2 0:8 64 = 30e08000 80000008 80000880 0c9f06a0 fe5c0dff ffeaff02 009f06a0 fe5c0dff
ffff89f7af1bd000 3641368412 S Ii:1:004:2 -115:8 64 <
ffff89f7af1bd000 3641382976 C Ii:1:004:2 0:8 64 = 30e38000 80000008 80000880 0ca7069c fe5b0dfe ffe8ff03 00a7069c fe5b0dfe
ffff89f7af1bd000 3641383020 S Ii:1:004:2 -115:8 64 <
ffff89f7af1bd000 3641398400 C Ii:1:004:2 0:8 64 = 30e68000 80000008 80000880 0ca00697 fe5f0dff ffe7ff00 00a00697 fe5f0dff
ffff89f7af1bd000 3641398446 S Ii:1:004:2 -115:8 64 <
ffff89f7af1bd000 3641416310 C Ii:1:004:2 0:8 64 = 30e98000 80000008 80000880 0ca30694 fe590d01 00e5ff01 00a10696 fe5c0d00
ffff89f7af1bd000 3641416353 S Ii:1:004:2 -115:8 64 <
ffff89f7af1bd000 3641438320 C Ii:1:004:2 0:8 64 = 30ec8000 80000008 80000880 0c9f0697 fe5c0d00 00e5ff03 00a10694 fe580d01
ffff89f7af1bd000 3641438365 S Ii:1:004:2 -115:8 64 <
ffff89f7af1bd000 3641448195 C Ii:1:004:2 0:8 64 = 30f18000 8000b777 7b000880 0ca5069b fe590dfe ffe5ff01 00a1069d fe5c0dfe
ffff89f7af1bd000 3641448238 S Ii:1:004:2 -115:8 64 <
ffff89f7af1bd000 3641462993 C Ii:1:004:2 0:8 64 = 30f38000 80009777 79000880 0ca7069a fe570dfe ffe5ff01 00a7069a fe570dfe
ffff89f7af1bd000 3641463043 S Ii:1:004:2 -115:8 64 <
ffff89f7af1bd000 3641478568 C Ii:1:004:2 0:8 64 = 30f68000 80006667 75000880 0ca5069f fe590dfe ffe7ff02 00a5069f fe590dfe
ffff89f7af1bd000 3641478615 S Ii:1:004:2 -115:8 64 <
ffff89f7af1bd000 3641494314 C Ii:1:004:2 0:8 64 = 30f98000 80002667 70000880 0ca706a0 fe5b0dfe ffe7ff00 00a606a1 fe590dfe
ffff89f7af1bd000 3641494358 S Ii:1:004:2 -115:8 64 <
ffff89f7af1bd000 3641518438 C Ii:1:004:2 0:8 64 = 30fc8000 80001667 6c000880 0ca9069a fe5b0dff ffe8ff00 00a8069e fe5b0dff
ffff89f7af1bd000 3641518484 S Ii:1:004:2 -115:8 64 <
ffff89f7af1bd000 3641526375 C Ii:1:004:2 0:8 64 = 30018000 80001657 65000880 0ca30699 fe5f0dff ffe4ff03 00a20697 fe5c0dff
ffff89f7af1bd000 3641526420 S Ii:1:004:2 -115:8 64 <
ffff89f7af1bd000 3641542355 C Ii:1:004:2 0:8 64 = 30038000 80001657 63000880 0ca4069b fe610dfe ffe7ff02 00a4069b fe610dfe
ffff89f7af1bd000 3641542394 S Ii:1:004:2 -115:8 64 <
ffff89f7af1bd000 3641558300 C Ii:1:004:2 0:8 64 = 30068000 80003657 5f000880 0ca50697 fe620dfe ffe9ff02 00a50697 fe620dfe
ffff89f7af1bd000 3641558346 S Ii:1:004:2 -115:8 64 <
ffff89f7af1bd000 3641574452 C Ii:1:004:2 0:8 64 = 30098000 80006657 5b000880 0ca30698 fe5e0d00 00e6ff02 00a30696 fe610dff
ffff89f7af1bd000 3641574500 S Ii:1:004:2 -115:8 64 <
ffff89f7af1bd000 3641590349 C Ii:1:004:2 0:8 64 = 300c8000 80009757 57000880 0ca3069c fe5a0dff ffe6ff01 00a4069a fe5c0dff
ffff89f7af1bd000 3641590393 S Ii:1:004:2 -115:8 64 <
ffff89f7af1bd000 3641606552 C Ii:1:004:2 0:8 64 = 30108000 8000c747 53000880 0ca4069f fe5b0dfe ffe5ff01 00a4069f fe5b0dfe
ffff89f7af1bd000 3641606599 S Ii:1:004:2 -115:8 64 <
ffff89f7af1bd000 3641622626 C Ii:1:004:2 0:8 64 = 30138000 8000e747 50000880 0ca4069c fe600dff ffe8ff02 00a4069c fe600dff
ffff89f7af1bd000 3641622686 S Ii:1:004:2 -115:8 64 <
ffff89f7af1bd000 3641638499 C Ii:1:004:2 0:8 64 = 30168000 80000048 4d000880 0ca50698 fe5d0dff ffe8ff02 00a50698 fe5d0dff
ffff89f7af1bd000 3641638544 S Ii:1:004:2 -115:8 64 <
ffff89f7af1bd000 3641654388 C Ii:1:004:2 0:8 64 = 30198000 80000048 4c000880 0ca40697 fe590d00 00e8ff01 00a50697 fe5a0dff
ffff89f7af1bd000 3641654435 S Ii:1:004:2 -115:8 64 <
ffff89f7af1bd000 3641662496 C Ii:1:004:2 0:8 64 = 301c8000 80003748 4a000880 0ca30696 fe590dff ffe7ff02 00a30696 fe5a0dff
ffff89f7af1bd000 3641662532 S Ii:1:004:2 -115:8 64 <
ffff89f7af1bd000 3641686400 C Ii:1:004:2 0:8 64 = 301e8000 80004748 49000880 0ca50697 fe580dff ffe8ff02 00a50697 fe580dff
ffff89f7af1bd000 3641686445 S Ii:1:004:2 -115:8 64 <
ffff89f7af1bd000 3641702368 C Ii:1:004:2 0:8 64 = 30238000 80009848 47000880 0ca8069b fe5c0d00 00e6ff00 00a8069b fe5c0d00
ffff89f7af1bd000 3641702411 S Ii:1:004:2 -115:8 64 <
ffff89f7af1bd000 3641710525 C Ii:1:004:2 0:8 64 = 30268000 8000e848 47000880 0ca6069d fe590dfe ffe9ff02 00a6069d fe590dfe
ffff89f7af1bd000 3641710561 S Ii:1:004:2 -115:8 64 <
ffff89f7af1bd000 3641734365 C Ii:1:004:2 0:8 64 = 30288000 80001849 47000880 0ca4069b fe590dfd ffe8ff02 00a4069b fe590dfd
ffff89f7af1bd000 3641734410 S Ii:1:004:2 -115:8 64 <
ffff89f7af1bd000 3641743554 C Ii:1:004:2 0:8 64 = 302c8000 8000b949 4a000880 0ca0069a fe5f0dfe ffe9ff02 00a20699 fe5f0dfd
ffff89f7af1bd000 3641743590 S Ii:1:004:2 -115:8 64 <
ffff89f7af1bd000 3641768657 C Ii:1:004:2 0:8 64 = 302e8000 8000e949 4c000880 0ca10699 fe5d0dff ffe9ff02 00a10699 fe5d0dff
ffff89f7af1bd000 3641768704 S Ii:1:004:2 -115:8 64 <
ffff89f7af1bd000 3641775279 C Ii:1:004:2 0:8 64 = 30338000 8000aa4a 50000880 0ca70698 fe580dfe ffe9ff02 00a70698 fe580dfe
ffff89f7af1bd000 3641775349 S Ii:1:004:2 -115:8 64 <
ffff89f7af1bd000 3641791954 C Ii:1:004:2 0:8 64 = 30348000 8000ea4a 52000880 0ca50695 fe5b0dfd ffe9ff02 00a70698 fe580dfe
ffff89f7af1bd000 3641792009 S Ii:1:004:2 -115:8 64 <
ffff89f7af1bd000 3641806403 C Ii:1:004:2 0:8 64 = 30388000 80002a5b 55000880 0ca10699 fe600dfe ffe8ff01 00a10699 fe600dfe
ffff89f7af1bd000 3641806443 S Ii:1:004:2 -115:8 64 <
ffff89f7af1bd000 3641823345 C Ii:1:004:2 0:8 64 = 303b8000 80004a5b 59000880 0ca3069b fe5c0dff ffe7ff01 00a3069b fe5c0dff
ffff89f7af1bd000 3641823392 S Ii:1:004:2 -115:8 64 <
ffff89f7af1bd000 3641839358 C Ii:1:004:2 0:8 64 = 303e8000 80003a5b 5d000880 0ca6069d fe5c0dff ffe6ff01 00a6069d fe5c0dff
ffff89f7af1bd000 3641839405 S Ii:1:004:2 -115:8 64 <
ffff89f7af1bd000 3641855954 C Ii:1:004:2 0:8 64 = 30418000 80002a5b 63000880 0ca7069b fe5c0dff ffe7ff03 00a6069d fe5d0dff
ffff89f7af1bd000 3641856001 S Ii:1:004:2 -115:8 64 <
ffff89f7af1bd000 3641871279 C Ii:1:004:2 0:8 64 = 30448000 8000ca6a 6a000880 0ca30697 fe590dff ffe7ff03 00a50698 fe590dfe
ffff89f7af1bd000 3641871343 S Ii:1:004:2 -115:8 64 <
ffff89f7af1bd000 3641888270 C Ii:1:004:2 0:8 64 = 30488000 8000396a 71000880 0ca2069d fe5d0dff ffe7ff02 00a2069d fe5d0dff
ffff89f7af1bd000 3641888320 S Ii:1:004:2 -115:8 64 <
ffff89f7af1bd000 3641902495 C Ii:1:004:2 0:8 64 = 304b8000 80009979 77000880 0c9c0696 fe600dfe ffe6ff01 009c0696 fe600dfe
ffff89f7af1bd000 3641902537 S Ii:1:004:2 -115:8 64 <
ffff89f7af1bd000 3641918357 C Ii:1:004:2 0:8 64 = 304e8000 8000d878 7c000880 0c9b0697 fe630dff ffe6ff02 009b0697 fe630dff
ffff89f7af1bd000 3641918419 S Ii:1:004:2 -115:8 64 <
ffff89f7af1bd000 3641934367 C Ii:1:004:2 0:8 64 = 30518000 80000008 80000880 0ca40695 fe5a0dff ffe4ff02 009d0693 fe5f0dff
ffff89f7af1bd000 3641934410 S Ii:1:004:2 -115:8 64 <
ffff89f7af1bd000 3641950475 C Ii:1:004:2 0:8 64 = 30548000 80000008 80000880 0ca7069f fe590dfe ffe9ff02 00ab069e fe590dfe
ffff89f7af1bd000 3641950521 S Ii:1:004:2 -115:8 64 <
ffff89f7af1bd000 3641966336 C Ii:1:004:2 0:8 64 = 30588000 80000008 80000880 0ca1069d fe5a0dff ffe7ff00 00a1069d fe5a0dff
ffff89f7af1bd000 3641966382 S Ii:1:004:2 -115:8 64 <
ffff89f7af1bd000 3641982314 C Ii:1:004:2 0:8 64 = 305b8000 80000008 80000880 0ca6069d fe590d00 00e7ff02 00a6069d fe590d00
ffff89f7af1bd000 3641982357 S Ii:1:004:2 -115:8 64 <
ffff89f7af1bd000 3641998485 C Ii:1:004:2 0:8 64 = 305e8000 8000d777 7c000880 0ca6069a fe5a0d00 00e6ff02 00a6069a fe5a0d00
ffff89f7af1bd000 3641998530 S Ii:1:004:2 -115:8 64 <
ffff89f7af1bd000 3642014341 C Ii:1:004:2 0:8 64 = 30618000 8000b777 78000880 0ca30696 fe5c0dff ffe6ff00 00a60698 fe5c0dff
ffff89f7af1bd000 3642014377 S Ii:1:004:2 -115:8 64 <
ffff89f7af1bd000 3642031755 C Ii:1:004:2 0:8 64 = 30648000 80008767 72000880 0ca10694 fe600d00 00e8ff01 00a10696 fe5e0dff
ffff89f7af1bd000 3642031804 S Ii:1:004:2 -115:8 64 <
ffff89f7af1bd000 3642046320 C Ii:1:004:2 0:8 64 = 30688000 80004667 6b000880 0ca10692 fe600d01 00e4ff02 00a10692 fe600d01
ffff89f7af1bd000 3642046358 S Ii:1:004:2 -115:8 64 <
ffff89f7af1bd000 3642064134 C Ii:1:004:2 0:8 64 = 306b8000 80002657 63000880 0ca20699 fe5c0d00 00e7ff00 00a20699 fe5c0d00
ffff89f7af1bd000 3642064181 S Ii:1:004:2 -115:8 64 <
ffff89f7af1bd000 3642078368 C Ii:1:004:2 0:8 64 = 306e8000 80001657 5b000880 0ca6069d fe580dff ffe6ff00 00a6069d fe580dff
ffff89f7af1bd000 3642078405 S Ii:1:004:2 -115:8 64 <
ffff89f7af1bd000 3642096352 C Ii:1:004:2 0:8 64 = 30718000 80000657 56000880 0cab06a0 fe590d00 00e8ff02 00a9069d fe580d00
ffff89f7af1bd000 3642096400 S Ii:1:004:2 -115:8 64 <
ffff89f7af1bd000 3642110387 C Ii:1:004:2 0:8 64 = 30748000 80000647 51000880 0ca8069e fe5b0dff ffe8ff02 00aa06a0 fe5c0dff
ffff89f7af1bd000 3642110426 S Ii:1:004:2 -115:8 64 <
ffff89f7af1bd000 3642127323 C Ii:1:004:2 0:8 64 = 30788000 80003647 4c000880 0ca2069b fe580dfe ffe7ff02 00a2069b fe580dfe
ffff89f7af1bd000 3642127370 S Ii:1:004:2 -115:8 64 <
ffff89f7af1bd000 3642143276 C Ii:1:004:2 0:8 64 = 307b8000 80007747 46000880 0ca30696 fe5e0d01 00e6ff02 00a30696 fe5e0d01
ffff89f7af1bd000 3642143325 S Ii:1:004:2 -115:8 64 <
ffff89f7af1bd000 3642159957 C Ii:1:004:2 0:8 64 = 307e8000 8000c737 3f000880 0ca40695 fe5e0d00 00e7ff01 00a40695 fe5e0d00
ffff89f7af1bd000 3642160006 S Ii:1:004:2 -115:8 64 <
ffff89f7af1bd000 3642174422 C Ii:1:004:2 0:8 64 = 30818000 80000038 38000880 0ca3069b fe5b0d00 00e7ff01 00a30698 fe5c0d00
ffff89f7af1bd000 3642174462 S Ii:1:004:2 -115:8 64 <
ffff89f7af1bd000 3642191325 C Ii:1:004:2 0:8 64 = 30848000 80004738 33000880 0ca5069f fe5d0dff ffe6ff00 00a3069e fe5c0dff
ffff89f7af1bd000 3642191383 S Ii:1:004:2 -115:8 64 <
ffff89f7af1bd000 3642206698 C Ii:1:004:2 0:8 64 = 30888000 80008828 30000880 0ca7069d fe5b0d00 00e9ff02 00a7069d fe5b0d00
ffff89f7af1bd000 3642206741 S Ii:1:004:2 -115:8 64 <
ffff89f7af1bd000 3642223241 C Ii:1:004:2 0:8 64 = 308b8000 8000b828 30000880 0ca5069e fe5b0dff ffe7ff01 00a5069e fe5b0dff
ffff89f7af1bd000 3642223291 S Ii:1:004:2 -115:8 64 <
ffff89f7af1bd000 3642240210 C Ii:1:004:2 0:8 64 = 308e8000 8000f828 31000880 0ca806a0 fe5b0dfe ffe8ff00 00a806a0 fe5b0dfe
ffff89f7af1bd000 3642240261 S Ii:1:004:2 -115:8 64 <
ffff89f7af1bd000 3642254505 C Ii:1:004:2 0:8 64 = 30918000 80005839 36000880 0ca30698 fe5a0dff ffe7ff02 00a7069c fe5a0dfe
ffff89f7af1bd000 3642254576 S Ii:1:004:2 -115:8 64 <
ffff89f7af1bd000 3642271644 C Ii:1:004:2 0:8 64 = 30948000 8000c939 3d000880 0c9e0696 fe600dff ffe8ff02 00a00697 fe5c0d00
ffff89f7af1bd000 3642271686 S Ii:1:004:2 -115:8 64 <
ffff89f7af1bd000 3642286342 C Ii:1:004:2 0:8 64 = 30988000 8000494a 44000880 0ca10694 fe5f0dff ffe6ff01 00a10694 fe5f0dff
ffff89f7af1bd000 3642286389 S Ii:1:004:2 -115:8 64 <
ffff89f7af1bd000 3642310301 C Ii:1:004:2 0:8 64 = 309b8000 8000ba4a 49000880 0ca50697 fe5b0dff ffe8ff02 00a50697 fe5b0dff
ffff89f7af1bd000 3642310350 S Ii:1:004:2 -115:8 64 <
ffff89f7af1bd000 3642319213 C Ii:1:004:2 0:8 64 = 30a08000 80000a4b 4f000880 0ca4069b fe5c0d00 00e8ff00 00a4069b fe5c0d00
ffff89f7af1bd000 3642319257 S Ii:1:004:2 -115:8 64 <
ffff89f7af1bd000 3642344358 C Ii:1:004:2 0:8 64 = 30a18000 80000a4b 52000880 0ca5069c fe5b0d00 00e9ff01 00a4069b fe5c0d00
ffff89f7af1bd000 3642344401 S Ii:1:004:2 -115:8 64 <
ffff89f7af1bd000 3642351039 C Ii:1:004:2 0:8 64 = 30a68000 8000ca5a 5d000880 0cab069c fe5a0dfe ffe7ff03 00ab069c fe5a0dfe
ffff89f7af1bd000 3642351074 S Ii:1:004:2 -115:8 64 <
ffff89f7af1bd000 3642367872 C Ii:1:004:2 0:8 64 = 30a88000 8000995a 63000880 0ca40695 fe5b0dfe ffe8ff02 00a40695 fe5b0dfe
ffff89f7af1bd000 3642367916 S Ii:1:004:2 -115:8 64 <
ffff89f7af1bd000 3642382331 C Ii:1:004:2 0:8 64 = 30ab8000 8000c969 6f000880 0c9f0697 fe5f0dfe ffe4ff01 009f0697 fe5f0dfe
ffff89f7af1bd000 3642382373 S Ii:1:004:2 -115:8 64 <
ffff89f7af1bd000 3642398339 C Ii:1:004:2 0:8 64 = 30ae8000 8000c878 7b000880 0ca30694 fe5b0dff ffe6ff02 00a30694 fe5b0dff
ffff89f7af1bd000 3642398382 S Ii:1:004:2 -115:8 64 <
ffff89f7af1bd000 3642414718 C Ii:1:004:2 0:8 64 = 30b18000 80000008 80000880 0ca7069a fe5a0dfe ffe7ff01 00a40695 fe590dff
ffff89f7af1bd000 3642414772 S Ii:1:004:2 -115:8 64 <
ffff89f7af1bd000 3642440721 C Ii:1:004:2 0:8 64 = 30b48000 80000008 80000880 0ca10699 fe5d0dfc ffe9ff01 00a6069e fe5c0dfd
ffff89f7af1bd000 3642440767 S Ii:1:004:2 -115:8 64 <
ffff89f7af1bd000 3642454389 C Ii:1:004:2 0:8 64 = 30b98000 80000008 80000880 0ca4069a fe5a0dff ffe5ff02 00a30699 fe5b0dfe
ffff89f7af1bd000 3642454432 S Ii:1:004:2 -115:8 64 <
ffff89f7af1bd000 3642462483 C Ii:1:004:2 0:8 64 = 30bc8000 80000008 80000880 0ca0069a fe5e0dfe ffe8ff01 00a3069b fe5c0dff
ffff89f7af1bd000 3642462518 S Ii:1:004:2 -115:8 64 <
ffff89f7af1bd000 3642480348 C Ii:1:004:2 0:8 64 = 30be8000 80000008 80000880 0c9f069a fe5e0dfe ffe8ff00 009f069a fe5e0dfe
ffff89f7af1bd000 3642480393 S Ii:1:004:2 -115:8 64 <
ffff89f7af1bd000 3642495093 C Ii:1:004:2 0:8 64 = 30c18000 80000008 80000880 0ca20694 fe5b0d00 00e7ff02 00a00697 fe5b0dff
ffff89f7af1bd000 3642495139 S Ii:1:004:2 -115:8 64 <
ffff89f7af1bd000 3642518373 C Ii:1:004:2 0:8 64 = 30c48000 80000008 80000880 0ca00691 fe5d0d01 00e6ff02 00a20692 fe5c0d01
ffff89f7af1bd000 3642518415 S Ii:1:004:2 -115:8 64 <
ffff89f7af1bd000 3642537250 C Ii:1:004:2 0:8 64 = 30c98000 8000b777 7b000880 0ca1069c fe5c0dff ffe5ff02 00a1069b fe5f0dff
ffff89f7af1bd000 3642537292 S Ii:1:004:2 -115:8 64 <
ffff89f7af1bd000 3642550227 C Ii:1:004:2 0:8 64 = 30cc8000 80008767 75000880 0ca7069a fe560d00 00e6ff02 00a4069b fe570d00
ffff89f7af1bd000 3642550262 S Ii:1:004:2 -115:8 64 <
ffff89f7af1bd000 3642559644 C Ii:1:004:2 0:8 64 = 30d08000 80006667 6f000880 0ca906a1 fe5b0dfe ffe5ff02 00a906a1 fe5b0dfe
ffff89f7af1bd000 3642559691 S Ii:1:004:2 -115:8 64 <
ffff89f7af1bd000 3642582382 C Ii:1:004:2 0:8 64 = 30d18000 80006667 6c000880 0ca706a1 fe5c0dfe ffe7ff02 00a906a1 fe5b0dfe
ffff89f7af1bd000 3642582428 S Ii:1:004:2 -115:8 64 <
ffff89f7af1bd000 3642590293 C Ii:1:004:2 0:8 64 = 30d68000 80005657 63000880 0ca6069a fe570dff ffe5ff02 00a6069a fe570dff
ffff89f7af1bd000 3642590332 S Ii:1:004:2 -115:8 64 <
ffff89f7af1bd000 3642617172 C Ii:1:004:2 0:8 64 = 30d88000 80005657 5f000880 0ca20698 fe590dff ffe6ff02 00a20698 fe590dff
ffff89f7af1bd000 3642617223 S Ii:1:004:2 -115:8 64 <
ffff89f7af1bd000 3642630345 C Ii:1:004:2 0:8 64 = 30dc8000 80006647 52000880 0ca20693 fe5e0dff ffe6ff01 00a00695 fe5f0d00
ffff89f7af1bd000 3642630413 S Ii:1:004:2 -115:8 64 <
ffff89f7af1bd000 3642640259 C Ii:1:004:2 0:8 64 = 30e08000 8000a747 48000880 0ca40698 fe5c0dff ffe6ff01 00a40698 fe5c0dff
ffff89f7af1bd000 3642640305 S Ii:1:004:2 -115:8 64 <
ffff89f7af1bd000 3642662368 C Ii:1:004:2 0:8 64 = 30e18000 8000b747 44000880 0ca7069d fe5b0dff ffe7ff01 00a40698 fe5c0dff
ffff89f7af1bd000 3642662412 S Ii:1:004:2 -115:8 64 <
ffff89f7af1bd000 3642681100 C Ii:1:004:2 0:8 64 = 30e68000 8000f737 3c000880 0ca7069d fe5b0dfd ffe7ff02 00a7069d fe5b0dfd
ffff89f7af1bd000 3642681181 S Ii:1:004:2 -115:8 64 <
ffff89f7af1bd000 3642694278 C Ii:1:004:2 0:8 64 = 30e98000 80001738 38000880 0ca7069a fe590dfe ffe8ff03 00a7069a fe590dfe
ffff89f7af1bd000 3642694325 S Ii:1:004:2 -115:8 64 <
ffff89f7af1bd000 3642711880 C Ii:1:004:2 0:8 64 = 30ec8000 80004738 36000880 0ca6069f fe5a0dfe ffe7ff03 00a8069d fe5a0dfe
ffff89f7af1bd000 3642711921 S Ii:1:004:2 -115:8 64 <
ffff89f7af1bd000 3642726432 C Ii:1:004:2 0:8 64 = 30f08000 80008838 35000880 0ca3069c fe5d0dfd ffe7ff02 00a3069c fe5d0dfd
ffff89f7af1bd000 3642726481 S Ii:1:004:2 -115:8 64 <
ffff89f7af1bd000 3642734413 C Ii:1:004:2 0:8 64 = 30f38000 8000d838 33000880 0ca20695 fe5e0dfe ffe8ff03 00a20695 fe5e0dfe
ffff89f7af1bd000 3642734460 S Ii:1:004:2 -115:8 64 <
ffff89f7af1bd000 3642750363 C Ii:1:004:2 0:8 64 = 30f48000 80000839 33000880 0ca10693 fe5c0dfe ffe9ff02 00a20695 fe5e0dfe
ffff89f7af1bd000 3642750411 S Ii:1:004:2 -115:8 64 <
ffff89f7af1bd000 3642766358 C Ii:1:004:2 0:8 64 = 30f88000 80009939 34000880 0ca00696 fe580dfe ffe8ff01 00a00696 fe580dfe
ffff89f7af1bd000 3642766404 S Ii:1:004:2 -115:8 64 <
ffff89f7af1bd000 3642783302 C Ii:1:004:2 0:8 64 = 30fb8000 8000293a 38000880 0ca30698 fe5a0dfe ffe7ff00 00a30698 fe5a0dfe
ffff89f7af1bd000 3642783348 S Ii:1:004:2 -115:8 64 <
ffff89f7af1bd000 3642798362 C Ii:1:004:2 0:8 64 = 30fe8000 8000ba3a 3c000880 0ca4069a fe5a0dfe ffe8ff01 00a4069a fe5a0dfe
ffff89f7af1bd000 3642798405 S Ii:1:004:2 -115:8 64 <
ffff89f7af1bd000 3642817158 C Ii:1:004:2 0:8 64 = 30018000 80000a3b 41000880 0ca406a0 fe5c0d00 00e8ff03 00a3069c fe5b0dff
ffff89f7af1bd000 3642817197 S Ii:1:004:2 -115:8 64 <
ffff89f7af1bd000 3642831328 C Ii:1:004:2 0:8 64 = 30048000 80001a4b 47000880 0ca4069c fe5b0dff ffe7ff02 00a5069f fe5a0d00
ffff89f7af1bd000 3642831392 S Ii:1:004:2 -115:8 64 <
ffff89f7af1bd000 3642846453 C Ii:1:004:2 0:8 64 = 30088000 80001a4b 4e000880 0ca4069b fe5f0dfe ffe7ff01 00a4069b fe5f0dfe
ffff89f7af1bd000 3642846509 S Ii:1:004:2 -115:8 64 <
ffff89f7af1bd000 3642864367 C Ii:1:004:2 0:8 64 = 300b8000 8000ea5a 56000880 0ca30697 fe5c0dfe ffe8ff00 00a30697 fe5c0dfe
ffff89f7af1bd000 3642864413 S Ii:1:004:2 -115:8 64 <
ffff89f7af1bd000 3642881319 C Ii:1:004:2 0:8 64 = 300e8000 8000aa5a 5e000880 0ca2069a fe5e0d00 00e5ff01 00a2069a fe5e0d00
ffff89f7af1bd000 3642881365 S Ii:1:004:2 -115:8 64 <
ffff89f7af1bd000 3642895766 C Ii:1:004:2 0:8 64 = 30118000 8000895a 64000880 0c9f0698 fe5c0dff ffe6ff00 009e0698 fe5d0d00
ffff89f7af1bd000 3642895813 S Ii:1:004:2 -115:8 64 <
ffff89f7af1bd000 3642912916 C Ii:1:004:2 0:8 64 = 30148000 8000596a 69000880 0ca2069a fe5b0dff ffe7ff01 00a0069a fe5c0dff
ffff89f7af1bd000 3642912962 S Ii:1:004:2 -115:8 64 <
ffff89f7af1bd000 3642928690 C Ii:1:004:2 0:8 64 = 30188000 8000296a 6e000880 0ca30697 fe5b0dfe ffe8ff01 00a30697 fe5b0dfe
ffff89f7af1bd000 3642928735 S Ii:1:004:2 -115:8 64 <
ffff89f7af1bd000 3642942364 C Ii:1:004:2 0:8 64 = 301b8000 8000d969 72000880 0ca3069c fe5a0dfe ffe7ff00 00a3069c fe5a0dfe
ffff89f7af1bd000 3642942405 S Ii:1:004:2 -115:8 64 <
ffff89f7af1bd000 3642958345 C Ii:1:004:2 0:8 64 = 301e8000 80004879 77000880 0ca2069c fe5d0dff ffe7ff02 00a2069c fe5d0dff
ffff89f7af1bd000 3642958390 S Ii:1:004:2 -115:8 64 <
ffff89f7af1bd000 3642976798 C Ii:1:004:2 0:8 64 = 30218000 80008878 7d000880 0ca5069a fe5d0d00 00e5ff01 00a3069b fe5f0d00
ffff89f7af1bd000 3642976843 S Ii:1:004:2 -115:8 64 <
ffff89f7af1bd000 3642990313 C Ii:1:004:2 0:8 64 = 30248000 80000008 80000880 0cac069d fe5d0dff ffe8ff01 00a70699 fe5b0dff
ffff89f7af1bd000 3642990359 S Ii:1:004:2 -115:8 64 <
ffff89f7af1bd000 3643008052 C Ii:1:004:2 0:8 64 = 30288000 80000008 80000880 0ca70699 fe5e0dfe ffe8ff02 00a70699 fe5e0dfe
ffff89f7af1bd000 3643008090 S Ii:1:004:2 -115:8 64 <
ffff89f7af1bd000 3643022381 C Ii:1:004:2 0:8 64 = 302b8000 80000008 80000880 0ca20697 fe5e0dfe ffe5ff02 00a20697 fe5e0dfe
ffff89f7af1bd000 3643022424 S Ii:1:004:2 -115:8 64 <
ffff89f7af1bd000 3643039302 C Ii:1:004:2 0:8 64 = 302e8000 80000008 80000880 0ca00698 fe590dfe ffe5ff01 00a00698 fe590dfe
ffff89f7af1bd000 3643039344 S Ii:1:004:2 -115:8 64 <
ffff89f7af1bd000 3643057292 C Ii:1:004:2 0:8 64 = 30318000 80000008 80000880 0ca10696 fe5b0dfe ffe5ff01 009f0697 fe590dfe
ffff89f7af1bd000 3643057337 S Ii:1:004:2 -115:8 64 <
ffff89f7af1bd000 3643070432 C Ii:1:004:2 0:8 64 = 30348000 80000008 80000880 0ca7069c fe5e0d00 00e8ff01 00a50697 fe5d0dff
ffff89f7af1bd000 3643070470 S Ii:1:004:2 -115:8 64 <
ffff89f7af1bd000 3643080070 C Ii:1:004:2 0:8 64 = 30388000 80000008 80000880 0ca4069f fe5b0dff ffe9ff01 00a4069f fe5b0dff
ffff89f7af1bd000 3643080107 S Ii:1:004:2 -115:8 64 <
ffff89f7af1bd000 3643102474 C Ii:1:004:2 0:8 64 = 30398000 80000008 80000880 0ca3069d fe5a0dff ffe9ff02 00a4069f fe5b0dff
ffff89f7af1bd000 3643102519 S Ii:1:004:2 -115:8 64 <
ffff89f7af1bd000 3643110422 C Ii:1:004:2 0:8 64 = 303e8000 80000008 80000880 0ca3069c fe5e0dff ffe4ff01 00a3069c fe5e0dff
ffff89f7af1bd000 3643110460 S Ii:1:004:2 -115:8 64 <
ffff89f7af1bd000 3643126442 C Ii:1:004:2 0:8 64 = 30408000 80000008 80000880 0ca6069d fe5e0d00 00e3ff00 00a6069d fe5e0d00
ffff89f7af1bd000 3643126487 S Ii:1:004:2 -115:8 64 <
ffff89f7af1bd000 3643143374 C Ii:1:004:2 0:8 64 = 30438000 8000f777 7d000880 0ca7069b fe5d0dff ffe7ff02 00a7069b fe5d0dff
ffff89f7af1bd000 3643143422 S Ii:1:004:2 -115:8 64 <
ffff89f7af1bd000 3643158403 C Ii:1:004:2 0:8 64 = 30468000 8000c777 79000880 0ca40698 fe5c0dfe ffe6ff02 00a40698 fe5c0dfe
ffff89f7af1bd000 3643158488 S Ii:1:004:2 -115:8 64 <
ffff89f7af1bd000 3643174295 C Ii:1:004:2 0:8 64 = 30498000 80009767 76000880 0ca50697 fe5d0dff ffe6ff01 00a40697 fe5d0dfe
ffff89f7af1bd000 3643174341 S Ii:1:004:2 -115:8 64 <
ffff89f7af1bd000 3643198389 C Ii:1:004:2 0:8 64 = 304c8000 80007767 73000880 0ca6069a fe5c0dff ffe7ff01 00a70699 fe5c0dff
ffff89f7af1bd000 3643198434 S Ii:1:004:2 -115:8 64 <
ffff89f7af1bd000 3643206849 C Ii:1:004:2 0:8 64 = 30518000 80004667 6e000880 0ca60699 fe5e0dff ffe7ff02 00a50699 fe5f0dfe
ffff89f7af1bd000 3643206890 S Ii:1:004:2 -115:8 64 <
ffff89f7af1bd000 3643230315 C Ii:1:004:2 0:8 64 = 30538000 80003667 6c000880 0ca50698 fe5d0d00 00e7ff01 00a50698 fe5d0d00
ffff89f7af1bd000 3643230362 S Ii:1:004:2 -115:8 64 <
ffff89f7af1bd000 3643238443 C Ii:1:004:2 0:8 64 = 30588000 80001667 67000880 0ca6069a fe5b0dff ffe6ff00 00a6069a fe5b0dff
ffff89f7af1bd000 3643238480 S Ii:1:004:2 -115:8 64 <
ffff89f7af1bd000 3643264799 C Ii:1:004:2 0:8 64 = 30598000 80000657 65000880 0ca6069a fe5c0dff ffe7ff01 00a6069a fe5b0dff
ffff89f7af1bd000 3643264840 S Ii:1:004:2 -115:8 64 <
ffff89f7af1bd000 3643278651 C Ii:1:004:2 0:8 64 = 305e8000 8000d656 60000880 0ca40696 fe5a0dfe ffe7ff03 00a40696 fe5a0dfe
ffff89f7af1bd000 3643278689 S Ii:1:004:2 -115:8 64 <
ffff89f7af1bd000 3643286239 C Ii:1:004:2 0:8 64 = 30618000 8000c656 5d000880 0ca20698 fe5c0dff ffe7ff00 00a40695 fe5a0dfe
ffff89f7af1bd000 3643286277 S Ii:1:004:2 -115:8 64 <
ffff89f7af1bd000 3643303150 C Ii:1:004:2 0:8 64 = 30638000 8000c656 5b000880 0ca3069c fe5d0dff ffe6ff00 00a3069c fe5d0dff
ffff89f7af1bd000 3643303206 S Ii:1:004:2 -115:8 64 <
ffff89f7af1bd000 3643318318 C Ii:1:004:2 0:8 64 = 30668000 8000c656 59000880 0ca5069a fe5b0d00 00e7ff01 00a5069a fe5b0d00
ffff89f7af1bd000 3643318360 S Ii:1:004:2 -115:8 64 <
ffff89f7af1bd000 3643334317 C Ii:1:004:2 0:8 64 = 30698000 8000c656 56000880 0ca30699 fe5c0dfd ffe6ff01 00a40698 fe5b0dff
ffff89f7af1bd000 3643334357 S Ii:1:004:2 -115:8 64 <
ffff89f7af1bd000 3643351834 C Ii:1:004:2 0:8 64 = 306c8000 8000b646 54000880 0ca4069c fe5e0dff ffe6ff02 00a3069b fe5d0dfd
ffff89f7af1bd000 3643351876 S Ii:1:004:2 -115:8 64 <
ffff89f7af1bd000 3643366310 C Ii:1:004:2 0:8 64 = 30708000 8000b646 52000880 0ca4069a fe5d0dff ffe8ff01 00a4069a fe5d0dff
ffff89f7af1bd000 3643366355 S Ii:1:004:2 -115:8 64 <
ffff89f7af1bd000 3643382463 C Ii:1:004:2 0:8 64 = 30738000 8000b646 51000880 0ca4069b fe5b0dff ffe9ff01 00a4069b fe5b0dff
ffff89f7af1bd000 3643382508 S Ii:1:004:2 -115:8 64 <
ffff89f7af1bd000 3643399530 C Ii:1:004:2 0:8 64 = 30768000 8000b646 50000880 0ca5069b fe5b0dff ffe7ff00 00a5069b fe5b0dff
ffff89f7af1bd000 3643399573 S Ii:1:004:2 -115:8 64 <
ffff89f7af1bd000 3643415285 C Ii:1:004:2 0:8 64 = 30798000 8000b646 4e000880 0ca50698 fe5d0d00 00e6ff00 00a6069a fe5c0dff
ffff89f7af1bd000 3643415333 S Ii:1:004:2 -115:8 64 <
ffff89f7af1bd000 3643431731 C Ii:1:004:2 0:8 64 = 307c8000 8000e646 4a000880 0c9f069a fe5c0d00 00e6ff01 00a20699 fe5c0d00
ffff89f7af1bd000 3643431777 S Ii:1:004:2 -115:8 64 <
ffff89f7af1bd000 3643446581 C Ii:1:004:2 0:8 64 = 30808000 80003647 45000880 0ca30699 fe5d0dff ffe3ff03 00a30699 fe5d0dff
ffff89f7af1bd000 3643446627 S Ii:1:004:2 -115:8 64 <
ffff89f7af1bd000 3643463264 C Ii:1:004:2 0:8 64 = 30838000 80008737 40000880 0ca7069a fe5f0d00 00e6ff00 00a7069a fe5f0d00
ffff89f7af1bd000 3643463307 S Ii:1:004:2 -115:8 64 <
ffff89f7af1bd000 3643478311 C Ii:1:004:2 0:8 64 = 30868000 8000c737 3a000880 0ca4069d fe610dff ffe5ff01 00a4069d fe610dff
ffff89f7af1bd000 3643478360 S Ii:1:004:2 -115:8 64 <
ffff89f7af1bd000 3643494307 C Ii:1:004:2 0:8 64 = 30898000 80000038 35000880 0ca0069a fe5e0dff ffe6ff02 00a2069b fe5f0dff
ffff89f7af1bd000 3643494355 S Ii:1:004:2 -115:8 64 <
ffff89f7af1bd000 3643510336 C Ii:1:004:2 0:8 64 = 308c8000 80005728 30000880 0ca20698 fe5e0dff ffe8ff00 00a00699 fe5d0dff
ffff89f7af1bd000 3643510387 S Ii:1:004:2 -115:8 64 <
ffff89f7af1bd000 3643527219 C Ii:1:004:2 0:8 64 = 30908000 8000a828 2c000880 0ca30699 fe5d0dfe ffe4ff01 00a30699 fe5d0dfe
ffff89f7af1bd000 3643527306 S Ii:1:004:2 -115:8 64 <
ffff89f7af1bd000 3643543227 C Ii:1:004:2 0:8 64 = 30938000 80000829 2a000880 0ca4069e fe5b0dff ffe7ff03 00a4069e fe5b0dff
ffff89f7af1bd000 3643543303 S Ii:1:004:2 -115:8 64 <
ffff89f7af1bd000 3643558263 C Ii:1:004:2 0:8 64 = 30968000 80007829 29000880 0ca5069c fe5f0dff ffe8ff02 00a5069c fe5f0dff
ffff89f7af1bd000 3643558310 S Ii:1:004:2 -115:8 64 <
ffff89f7af1bd000 3643575898 C Ii:1:004:2 0:8 64 = 30998000 8000e929 29000880 0ca60699 fe600dfd ffeaff02 00a60699 fe600dfe
ffff89f7af1bd000 3643575948 S Ii:1:004:2 -115:8 64 <
ffff89f7af1bd000 3643590797 C Ii:1:004:2 0:8 64 = 309c8000 8000692a 2c000880 0ca5069a fe5c0dfe ffe8ff01 00a6069a fe5e0dfd
ffff89f7af1bd000 3643590842 S Ii:1:004:2 -115:8 64 <
ffff89f7af1bd000 3643608264 C Ii:1:004:2 0:8 64 = 30a08000 8000ca2a 30000880 0ca30698 fe5c0dff ffe7ff02 00a30698 fe5c0dff
ffff89f7af1bd000 3643608308 S Ii:1:004:2 -115:8 64 <
ffff89f7af1bd000 3643622984 C Ii:1:004:2 0:8 64 = 30a38000 80002a3b 35000880 0ca40696 fe5c0dff ffe6ff02 00a40696 fe5c0dff
ffff89f7af1bd000 3643623033 S Ii:1:004:2 -115:8 64 <
ffff89f7af1bd000 3643641057 C Ii:1:004:2 0:8 64 = 30a68000 80005a3b 3d000880 0ca4069a fe610dfe ffe7ff02 00a4069a fe610dfe
ffff89f7af1bd000 3643641102 S Ii:1:004:2 -115:8 64 <
ffff89f7af1bd000 3643654384 C Ii:1:004:2 0:8 64 = 30a98000 80006a4b 46000880 0ca4069c fe5e0dff ffe7ff01 00a4069c fe600dfe
ffff89f7af1bd000 3643654456 S Ii:1:004:2 -115:8 64 <
ffff89f7af1bd000 3643662422 C Ii:1:004:2 0:8 64 = 30ac8000 80004a4b 51000880 0ca70699 fe5b0dff ffe8ff02 00a5069b fe5c0dff
ffff89f7af1bd000 3643662468 S Ii:1:004:2 -115:8 64 <
ffff89f7af1bd000 3643678443 C Ii:1:004:2 0:8 64 = 30ae8000 80001a5b 58000880 0ca80699 fe5a0dff ffe7ff02 00a80699 fe5a0dff
ffff89f7af1bd000 3643678486 S Ii:1:004:2 -115:8 64 <
ffff89f7af1bd000 3643694328 C Ii:1:004:2 0:8 64 = 30b18000 8000895a 64000880 0ca8069d fe5a0dff ffe5ff01 00a7069b fe5a0dff
ffff89f7af1bd000 3643694376 S Ii:1:004:2 -115:8 64 <
ffff89f7af1bd000 3643710388 C Ii:1:004:2 0:8 64 = 30b48000 8000b969 71000880 0ca50699 fe580dff ffe8ff02 00a7069c fe5a0dff
ffff89f7af1bd000 3643710436 S Ii:1:004:2 -115:8 64 <
ffff89f7af1bd000 3643728163 C Ii:1:004:2 0:8 64 = 30b88000 8000c878 7c000880 0ca10696 fe580d00 00e6ff00 00a10696 fe580d00
ffff89f7af1bd000 3643728213 S Ii:1:004:2 -115:8 64 <
ffff89f7af1bd000 3643742419 C Ii:1:004:2 0:8 64 = 30bb8000 80001708 80000880 0ca5069b fe5e0d00 00e8ff00 00a5069b fe5e0d00
ffff89f7af1bd000 3643742458 S Ii:1:004:2 -115:8 64 <
ffff89f7af1bd000 3643758395 C Ii:1:004:2 0:8 64 = 30be8000 80000008 80000880 0ca30698 fe5b0dfe ffe9ff01 00a30698 fe5b0dfe
ffff89f7af1bd000 3643758439 S Ii:1:004:2 -115:8 64 <
ffff89f7af1bd000 3643775283 C Ii:1:004:2 0:8 64 = 30c18000 80000008 80000880 0ca40698 fe5b0dff ffe7ff01 00a20696 fe5a0dfe
ffff89f7af1bd000 3643775342 S Ii:1:004:2 -115:8 64 <
ffff89f7af1bd000 3643798297 C Ii:1:004:2 0:8 64 = 30c48000 80000008 80000880 0ca5069b fe5d0dfe ffe5ff02 00a6069a fe5d0dfe
ffff89f7af1bd000 3643798345 S Ii:1:004:2 -115:8 64 <
ffff89f7af1bd000 3643806255 C Ii:1:004:2 0:8 64 = 30c98000 80000008 80000880 0ca40698 fe580d00 00e8ff02 00a2069a fe590dff
ffff89f7af1bd000 3643806309 S Ii:1:004:2 -115:8 64 <
ffff89f7af1bd000 3643822273 C Ii:1:004:2 0:8 64 = 30cb8000 80000008 80000880 0ca60698 fe570d00 00e7ff01 00a60698 fe570d00
ffff89f7af1bd000 3643822318 S Ii:1:004:2 -115:8 64 <
ffff89f7af1bd000 3643840215 C Ii:1:004:2 0:8 64 = 30ce8000 80000008 80000880 0ca20697 fe5b0d00 00e5ff01 00a20697 fe5b0d00
ffff89f7af1bd000 3643840263 S Ii:1:004:2 -115:8 64 <
ffff89f7af1bd000 3643855043 C Ii:1:004:2 0:8 64 = 30d18000 80000008 80000880 0ca40699 fe5c0dff ffe6ff02 00a20697 fe5c0dff
ffff89f7af1bd000 3643855086 S Ii:1:004:2 -115:8 64 <
ffff89f7af1bd000 3643870195 C Ii:1:004:2 0:8 64 = 30d48000 80000008 80000880 0ca9069e fe5b0dff ffe7ff00 00a8069d fe5b0dff
ffff89f7af1bd000 3643870234 S Ii:1:004:2 -115:8 64 <
ffff89f7af1bd000 3643886388 C Ii:1:004:2 0:8 64 = 30d88000 80000008 80000880 0ca3069e fe5d0d00 00e6ff00 00a3069e fe5d0d00
ffff89f7af1bd000 3643886442 S Ii:1:004:2 -115:8 64 <
ffff89f7af1bd000 3643902408 C Ii:1:004:2 0:8 64 = 30db8000 8000e777 7d000880 0ca8069d fe5c0d00 00e5ff02 00a8069d fe5c0d00
ffff89f7af1bd000 3643902453 S Ii:1:004:2 -115:8 64 <
ffff89f7af1bd000 3643918272 C Ii:1:004:2 0:8 64 = 30de8000 8000b777 7a000880 0ca70697 fe580dfe ffe5ff03 00a70697 fe580dfe
ffff89f7af1bd000 3643918317 S Ii:1:004:2 -115:8 64 <
ffff89f7af1bd000 3643934270 C Ii:1:004:2 0:8 64 = 30e18000 80009777 77000880 0ca10697 fe590dff ffe8ff00 00a40697 fe570dfe
ffff89f7af1bd000 3643934312 S Ii:1:004:2 -115:8 64 <
ffff89f7af1bd000 3643950242 C Ii:1:004:2 0:8 64 = 30e48000 80008767 74000880 0ca10697 fe5d0dff ffe8ff00 00a00697 fe5b0dff
ffff89f7af1bd000 3643950338 S Ii:1:004:2 -115:8 64 <
ffff89f7af1bd000 3643966263 C Ii:1:004:2 0:8 64 = 30e88000 80007767 72000880 0ca40695 fe5d0d00 00e8ff01 00a40695 fe5d0d00
ffff89f7af1bd000 3643966309 S Ii:1:004:2 -115:8 64 <
ffff89f7af1bd000 3643982228 C Ii:1:004:2 0:8 64 = 30eb8000 80005667 70000880 0ca4069c fe5a0d00 00e5ff01 00a4069c fe5a0d00
ffff89f7af1bd000 3643982269 S Ii:1:004:2 -115:8 64 <
ffff89f7af1bd000 3643998479 C Ii:1:004:2 0:8 64 = 30ee8000 80005667 6e000880 0ca7069d fe570d00 00e8ff01 00a7069d fe570d00
ffff89f7af1bd000 3643998526 S Ii:1:004:2 -115:8 64 <
ffff89f7af1bd000 3644014264 C Ii:1:004:2 0:8 64 = 30f18000 80004667 6d000880 0ca6069c fe590dff ffe7ff01 00a8069c fe570d00
ffff89f7af1bd000 3644014300 S Ii:1:004:2 -115:8 64 <
ffff89f7af1bd000 3644032106 C Ii:1:004:2 0:8 64 = 30f48000 80004667 6b000880 0ca3069d fe5d0dff ffe7ff02 00a4069d fe5b0dff
ffff89f7af1bd000 3644032170 S Ii:1:004:2 -115:8 64 <
ffff89f7af1bd000 3644046420 C Ii:1:004:2 0:8 64 = 30f88000 80004667 68000880 0ca60697 fe5f0d00 00e6ff02 00a60697 fe5f0d00
ffff89f7af1bd000 3644046469 S Ii:1:004:2 -115:8 64 <
ffff89f7af1bd000 3644054295 C Ii:1:004:2 0:8 64 = 30fb8000 80007757 65000880 0ca60696 fe5f0d00 00e7ff02 00a60696 fe5f0d00
ffff89f7af1bd000 3644054333 S Ii:1:004:2 -115:8 64 <
ffff89f7af1bd000 3644070427 C Ii:1:004:2 0:8 64 = 30fc8000 80008757 64000880 0ca50699 fe5e0dff ffe7ff02 00a60696 fe5f0d00
ffff89f7af1bd000 3644070468 S Ii:1:004:2 -115:8 64 <
ffff89f7af1bd000 3644088166 C Ii:1:004:2 0:8 64 = 30008000 80009757 62000880 0ca3069b fe5c0dfe ffe7ff02 00a3069b fe5c0dfe
ffff89f7af1bd000 3644088251 S Ii:1:004:2 -115:8 64 <
ffff89f7af1bd000 3644103519 C Ii:1:004:2 0:8 64 = 30038000 8000a757 61000880 0ca3069b fe5a0d00 00e7ff01 00a3069b fe5a0d00
ffff89f7af1bd000 3644103566 S Ii:1:004:2 -115:8 64 <
ffff89f7af1bd000 3644118249 C Ii:1:004:2 0:8 64 = 30068000 8000b757 60000880 0ca6069b fe5b0dff ffe6ff01 00a6069b fe5b0dff
ffff89f7af1bd000 3644118294 S Ii:1:004:2 -115:8 64 <
ffff89f7af1bd000 3644134294 C Ii:1:004:2 0:8 64 = 30098000 8000d757 5e000880 0ca7069c fe5b0dfd ffe7ff00 00a6069d fe5c0dfe
ffff89f7af1bd000 3644134334 S Ii:1:004:2 -115:8 64 <
ffff89f7af1bd000 3644150449 C Ii:1:004:2 0:8 64 = 300c8000 8000f757 5b000880 0ca70698 fe590dfe ffe6ff01 00a90699 fe590dfd
ffff89f7af1bd000 3644150502 S Ii:1:004:2 -115:8 64 <
ffff89f7af1bd000 3644166299 C Ii:1:004:2 0:8 64 = 30108000 80001758 56000880 0c9f0698 fe5d0dfe ffe7ff04 009f0698 fe5d0dfe
ffff89f7af1bd000 3644166346 S Ii:1:004:2 -115:8 64 <
ffff89f7af1bd000 3644184710 C Ii:1:004:2 0:8 64 = 30138000 80005748 52000880 0c9f0697 fe5f0dfe ffe8ff02 009f0697 fe5f0dfe
ffff89f7af1bd000 3644184751 S Ii:1:004:2 -115:8 64 <
ffff89f7af1bd000 3644206311 C Ii:1:004:2 0:8 64 = 30168000 80008848 4d000880 0ca30696 fe5d0d00 00e5ff00 00a30696 fe5d0d00
ffff89f7af1bd000 3644206356 S Ii:1:004:2 -115:8 64 <
ffff89f7af1bd000 3644222269 C Ii:1:004:2 0:8 64 = 301b8000 8000b848 49000880 0ca3069a fe5e0dff ffe7ff02 00a3069a fe5e0dff
ffff89f7af1bd000 3644222315 S Ii:1:004:2 -115:8 64 <
ffff89f7af1bd000 3644230364 C Ii:1:004:2 0:8 64 = 301e8000 8000d848 45000880 0ca20699 fe5e0dff ffe6ff02 00a20699 fe5e0dff
ffff89f7af1bd000 3644230404 S Ii:1:004:2 -115:8 64 <
ffff89f7af1bd000 3644254181 C Ii:1:004:2 0:8 64 = 30208000 8000f838 43000880 0ca30699 fe5e0dff ffe7ff01 00a30699 fe5e0dff
ffff89f7af1bd000 3644254226 S Ii:1:004:2 -115:8 64 <
ffff89f7af1bd000 3644262260 C Ii:1:004:2 0:8 64 = 30248000 80006839 3b000880 0ca3069a fe5a0d00 00e6ff01 00a2069b fe5b0dff
ffff89f7af1bd000 3644262297 S Ii:1:004:2 -115:8 64 <
ffff89f7af1bd000 3644286240 C Ii:1:004:2 0:8 64 = 30268000 80008839 38000880 0ca5069a fe5a0d00 00e6ff01 00a5069a fe5a0d00
ffff89f7af1bd000 3644286278 S Ii:1:004:2 -115:8 64 <
ffff89f7af1bd000 3644302214 C Ii:1:004:2 0:8 64 = 302b8000 8000f929 2f000880 0ca40698 fe5a0dff ffe5ff00 00a40698 fe5a0dff
ffff89f7af1bd000 3644302255 S Ii:1:004:2 -115:8 64 <
ffff89f7af1bd000 3644318319 C Ii:1:004:2 0:8 64 = 302e8000 8000292a 2b000880 0ca50695 fe5b0dff ffe7ff01 00a50695 fe5b0dff
ffff89f7af1bd000 3644318361 S Ii:1:004:2 -115:8 64 <
ffff89f7af1bd000 3644327718 C Ii:1:004:2 0:8 64 = 30318000 8000492a 29000880 0ca50697 fe5d0d00 00e8ff01 00a40697 fe5b0dff
ffff89f7af1bd000 3644327761 S Ii:1:004:2 -115:8 64 <
ffff89f7af1bd000 3644350169 C Ii:1:004:2 0:8 64 = 30338000 8000592a 29000880 0ca70698 fe5f0d00 00e7ff01 00a70698 fe5f0d00
ffff89f7af1bd000 3644350205 S Ii:1:004:2 -115:8 64 <
ffff89f7af1bd000 3644358213 C Ii:1:004:2 0:8 64 = 30388000 8000692a 28000880 0ca8069c fe5c0d00 00e7ff02 00a8069c fe5c0d00
ffff89f7af1bd000 3644358252 S Ii:1:004:2 -115:8 64 <
ffff89f7af1bd000 3644375960 C Ii:1:004:2 0:8 64 = 30398000 8000792a 29000880 0ca7069b fe5c0dff ffe7ff02 00a8069c fe5c0d00
ffff89f7af1bd000 3644376006 S Ii:1:004:2 -115:8 64 <
ffff89f7af1bd000 3644399886 C Ii:1:004:2 0:8 64 = 303c8000 8000992a 2a000880 0ca50699 fe5c0dfe ffe8ff02 00a5069a fe5c0dfe
ffff89f7af1bd000 3644399932 S Ii:1:004:2 -115:8 64 <
ffff89f7af1bd000 3644406295 C Ii:1:004:2 0:8 64 = 30418000 8000fa2a 31000880 0ca5069a fe5b0dfe ffe7ff01 00a6069a fe5c0dfe
ffff89f7af1bd000 3644406332 S Ii:1:004:2 -115:8 64 <
ffff89f7af1bd000 3644422284 C Ii:1:004:2 0:8 64 = 30438000 80001a3b 35000880 0ca40699 fe5b0dff ffe8ff02 00a40699 fe5b0dff
ffff89f7af1bd000 3644422330 S Ii:1:004:2 -115:8 64 <
ffff89f7af1bd000 3644446291 C Ii:1:004:2 0:8 64 = 30468000 80003a3b 3f000880 0ca2069a fe5c0dff ffe8ff00 00a2069a fe5c0dff
ffff89f7af1bd000 3644446353 S Ii:1:004:2 -115:8 64 <
ffff89f7af1bd000 3644455437 C Ii:1:004:2 0:8 64 = 304b8000 80003a4b 4d000880 0ca70696 fe5c0dfe ffe7ff02 00a70696 fe5c0dfe
ffff89f7af1bd000 3644455490 S Ii:1:004:2 -115:8 64 <
ffff89f7af1bd000 3644481115 C Ii:1:004:2 0:8 64 = 304c8000 80003a4b 52000880 0ca70696 fe5d0dfe ffe6ff03 00a70696 fe5c0dfe
ffff89f7af1bd000 3644481158 S Ii:1:004:2 -115:8 64 <
ffff89f7af1bd000 3644494163 C Ii:1:004:2 0:8 64 = 30518000 8000795a 64000880 0ca50698 fe5b0dfd ffe8ff01 00a60697 fe5c0dfe
ffff89f7af1bd000 3644494210 S Ii:1:004:2 -115:8 64 <
ffff89f7af1bd000 3644503324 C Ii:1:004:2 0:8 64 = 30548000 80009969 71000880 0ca3069a fe5a0dfe ffe6ff03 00a40699 fe5a0dfe
ffff89f7af1bd000 3644503364 S Ii:1:004:2 -115:8 64 <
ffff89f7af1bd000 3644520205 C Ii:1:004:2 0:8 64 = 30568000 80001879 77000880 0ca2069c fe590dfe ffe7ff03 00a2069c fe590dfe
ffff89f7af1bd000 3644520249 S Ii:1:004:2 -115:8 64 <
ffff89f7af1bd000 3644545109 C Ii:1:004:2 0:8 64 = 30598000 80005778 7e000880 0ca7069a fe590dfd ffe7ff01 00a4069b fe590dfd
ffff89f7af1bd000 3644545156 S Ii:1:004:2 -115:8 64 <
ffff89f7af1bd000 3644558395 C Ii:1:004:2 0:8 64 = 305e8000 80000008 80000880 0ca5069d fe5b0dfc ffe8ff01 00a5069d fe5b0dfc
ffff89f7af1bd000 3644558441 S Ii:1:004:2 -115:8 64 <
ffff89f7af1bd000 3644567898 C Ii:1:004:2 0:8 64 = 30618000 80001708 80000880 0ca00693 fe590d00 00e8ff01 00a10698 fe5a0dfe
ffff89f7af1bd000 3644567954 S Ii:1:004:2 -115:8 64 <
ffff89f7af1bd000 3644590332 C Ii:1:004:2 0:8 64 = 30638000 80000008 80000880 0ca00693 fe5b0d01 00e7ff01 00a00693 fe5b0d01
ffff89f7af1bd000 3644590380 S Ii:1:004:2 -115:8 64 <
ffff89f7af1bd000 3644598346 C Ii:1:004:2 0:8 64 = 30688000 80000008 80000880 0ca30697 fe610dfe ffe6ff01 00a30697 fe610dfe
ffff89f7af1bd000 3644598386 S Ii:1:004:2 -115:8 64 <
ffff89f7af1bd000 3644615050 C Ii:1:004:2 0:8 64 = 30698000 80000008 80000880 0ca30696 fe600dfd ffe7ff02 00a30697 fe610dfe
ffff89f7af1bd000 3644615091 S Ii:1:004:2 -115:8 64 <
ffff89f7af1bd000 3644631704 C Ii:1:004:2 0:8 64 = 306c8000 80000008 80000880 0ca30697 fe5d0dff ffe7ff03 00a30695 fe5e0dfe
ffff89f7af1bd000 3644631752 S Ii:1:004:2 -115:8 64 <
ffff89f7af1bd000 3644646314 C Ii:1:004:2 0:8 64 = 30708000 80000008 80000880 0ca4069c fe5a0dff ffe5ff03 00a4069c fe5a0dff
ffff89f7af1bd000 3644646361 S Ii:1:004:2 -115:8 64 <
ffff89f7af1bd000 3644670346 C Ii:1:004:2 0:8 64 = 30738000 80000008 80000880 0ca50699 fe580dfe ffe7ff02 00a50699 fe580dfe
ffff89f7af1bd000 3644670390 S Ii:1:004:2 -115:8 64 <
ffff89f7af1bd000 3644678466 C Ii:1:004:2 0:8 64 = 30788000 80000008 80000880 0ca6069d fe5c0d00 00e5ff02 00a6069d fe5c0d00
ffff89f7af1bd000 3644678513 S Ii:1:004:2 -115:8 64 <
ffff89f7af1bd000 3644694845 C Ii:1:004:2 0:8 64 = 30798000 80000008 80000880 0ca5069b fe5d0dff ffe6ff01 00a6069d fe5c0d00
ffff89f7af1bd000 3644694890 S Ii:1:004:2 -115:8 64 <
ffff89f7af1bd000 3644710224 C Ii:1:004:2 0:8 64 = 307c8000 80000008 80000880 0ca50699 fe5d0d00 00e6ff00 00a30699 fe5d0dff
ffff89f7af1bd000 3644710263 S Ii:1:004:2 -115:8 64 <
ffff89f7af1bd000 3644726271 C Ii:1:004:2 0:8 64 = 30808000 8000f777 7d000880 0ca50699 fe5b0dff ffe6ff02 00a50699 fe5b0dff
ffff89f7af1bd000 3644726317 S Ii:1:004:2 -115:8 64 <
ffff89f7af1bd000 3644742373 C Ii:1:004:2 0:8 64 = 30838000 8000d777 79000880 0ca40698 fe5f0dff ffe7ff01 00a40698 fe5f0dff
ffff89f7af1bd000 3644742414 S Ii:1:004:2 -115:8 64 <
ffff89f7af1bd000 3644758418 C Ii:1:004:2 0:8 64 = 30868000 8000a767 75000880 0ca00698 fe5c0dfe ffe4ff03 00a00698 fe5c0dfe
ffff89f7af1bd000 3644758464 S Ii:1:004:2 -115:8 64 <
ffff89f7af1bd000 3644774240 C Ii:1:004:2 0:8 64 = 30898000 80009767 71000880 0ca10699 fe5d0d00 00e7ff02 009f0699 fe5b0dff
ffff89f7af1bd000 3644774282 S Ii:1:004:2 -115:8 64 <
ffff89f7af1bd000 3644791652 C Ii:1:004:2 0:8 64 = 308c8000 80008767 6e000880 0ca5069a fe5c0d00 00e6ff02 00a2069a fe5d0d00
ffff89f7af1bd000 3644791696 S Ii:1:004:2 -115:8 64 <
ffff89f7af1bd000 3644806369 C Ii:1:004:2 0:8 64 = 30908000 80007767 6a000880 0ca50696 fe5a0dfe ffe7ff01 00a50696 fe5a0dfe
ffff89f7af1bd000 3644806408 S Ii:1:004:2 -115:8 64 <
ffff89f7af1bd000 3644822347 C Ii:1:004:2 0:8 64 = 30938000 80006667 66000880 0ca4069a fe590dfe ffe7ff01 00a4069a fe590dfe
ffff89f7af1bd000 3644822392 S Ii:1:004:2 -115:8 64 <
ffff89f7af1bd000 3644839256 C Ii:1:004:2 0:8 64 = 30968000 80006657 63000880 0ca5069b fe5b0d00 00e5ffff ffa5069b fe5b0d00
ffff89f7af1bd000 3644839306 S Ii:1:004:2 -115:8 64 <
ffff89f7af1bd000 3644855840 C Ii:1:004:2 0:8 64 = 30998000 80006657 60000880 0ca5069b fe5a0dfe ffe8ff01 00a6069b fe5a0dff
ffff89f7af1bd000 3644855898 S Ii:1:004:2 -115:8 64 <
ffff89f7af1bd000 3644870229 C Ii:1:004:2 0:8 64 = 309c8000 80006657 5c000880 0ca2069c fe5e0dfe ffe6ff02 00a2069b fe5c0dfe
ffff89f7af1bd000 3644870273 S Ii:1:004:2 -115:8 64 <
ffff89f7af1bd000 3644887180 C Ii:1:004:2 0:8 64 = 30a08000 80009757 58000880 0ca6069a fe5d0d00 00e8ff00 00a6069a fe5d0d00
ffff89f7af1bd000 3644887222 S Ii:1:004:2 -115:8 64 <
ffff89f7af1bd000 3644902291 C Ii:1:004:2 0:8 64 = 30a38000 8000b757 55000880 0ca5069c fe5c0d00 00e6ffff ffa5069c fe5c0d00
ffff89f7af1bd000 3644902336 S Ii:1:004:2 -115:8 64 <
ffff89f7af1bd000 3644920201 C Ii:1:004:2 0:8 64 = 30a68000 8000c747 53000880 0ca2069b fe5b0dff ffe6ff03 00a2069b fe5b0dff
ffff89f7af1bd000 3644920247 S Ii:1:004:2 -115:8 64 <
ffff89f7af1bd000 3644934260 C Ii:1:004:2 0:8 64 = 30a98000 8000e747 51000880 0ca20699 fe5c0d00 00e6ff02 00a1069a fe5c0d00
ffff89f7af1bd000 3644934302 S Ii:1:004:2 -115:8 64 <
ffff89f7af1bd000 3644950134 C Ii:1:004:2 0:8 64 = 30ac8000 8000f747 50000880 0ca30699 fe5e0dfe ffe7ff00 00a20699 fe5e0d00
ffff89f7af1bd000 3644950190 S Ii:1:004:2 -115:8 64 <
ffff89f7af1bd000 3644967242 C Ii:1:004:2 0:8 64 = 30b08000 80000048 4f000880 0ca3069b fe590dfe ffe8ff03 00a3069b fe590dfe
ffff89f7af1bd000 3644967288 S Ii:1:004:2 -115:8 64 <
ffff89f7af1bd000 3644983099 C Ii:1:004:2 0:8 64 = 30b38000 80005748 4d000880 0ca5069a fe580dff ffe6ff02 00a5069a fe580dff
ffff89f7af1bd000 3644983140 S Ii:1:004:2 -115:8 64 <
ffff89f7af1bd000 3644998793 C Ii:1:004:2 0:8 64 = 30b68000 80009848 4c000880 0ca70698 fe5a0dff ffe7ff01 00a70698 fe5a0dff
ffff89f7af1bd000 3644998837 S Ii:1:004:2 -115:8 64 <
ffff89f7af1bd000 3645014938 C Ii:1:004:2 0:8 64 = 30b98000 8000d848 4b000880 0ca3069c fe5b0dff ffe6ff01 00a5069a fe5a0dff
ffff89f7af1bd000 3645014975 S Ii:1:004:2 -115:8 64 <
ffff89f7af1bd000 3645031060 C Ii:1:004:2 0:8 64 = 30bc8000 80000849 4c000880 0ca5069a fe5c0dfe ffe9ff01 00a3069b fe5c0dfe
ffff89f7af1bd000 3645031107 S Ii:1:004:2 -115:8 64 <
ffff89f7af1bd000 3645047719 C Ii:1:004:2 0:8 64 = 30c08000 80004849 4e000880 0ca50696 fe5b0dfe ffe8ff01 00a50696 fe5b0dfe
ffff89f7af1bd000 3645047761 S Ii:1:004:2 -115:8 64 <
ffff89f7af1bd000 3645063356 C Ii:1:004:2 0:8 64 = 30c38000 80008849 54000880 0ca40699 fe5a0dff ffe7ff01 00a40699 fe5a0dff
ffff89f7af1bd000 3645063401 S Ii:1:004:2 -115:8 64 <
ffff89f7af1bd000 3645078372 C Ii:1:004:2 0:8 64 = 30c68000 8000b959 5a000880 0ca4069a fe5b0dfe ffe5ff02 00a4069a fe5b0dfe
ffff89f7af1bd000 3645078412 S Ii:1:004:2 -115:8 64 <
ffff89f7af1bd000 3645094309 C Ii:1:004:2 0:8 64 = 30c98000 8000d959 61000880 0ca5069b fe5b0dff ffe7ff01 00a5069b fe5b0dff
ffff89f7af1bd000 3645094356 S Ii:1:004:2 -115:8 64 <
ffff89f7af1bd000 3645110312 C Ii:1:004:2 0:8 64 = 30cc8000 8000d969 67000880 0ca4069b fe5d0dfe ffe6ff01 00a5069b fe5d0dfe
ffff89f7af1bd000 3645110354 S Ii:1:004:2 -115:8 64 <
ffff89f7af1bd000 3645126330 C Ii:1:004:2 0:8 64 = 30d08000 8000c969 6b000880 0ca7069b fe5d0dfd ffe8ff01 00a7069b fe5d0dfd
ffff89f7af1bd000 3645126371 S Ii:1:004:2 -115:8 64 <
ffff89f7af1bd000 3645150354 C Ii:1:004:2 0:8 64 = 30d38000 8000b969 6e000880 0ca8069d fe5a0dfe ffe7ff02 00a8069d fe5a0dfe
ffff89f7af1bd000 3645150391 S Ii:1:004:2 -115:8 64 <
ffff89f7af1bd000 3645158131 C Ii:1:004:2 0:8 64 = 30d88000 8000a969 72000880 0ca10698 fe5d0dff ffe7ff01 00a10698 fe5d0dff
ffff89f7af1bd000 3645158177 S Ii:1:004:2 -115:8 64 <
ffff89f7af1bd000 3645174174 C Ii:1:004:2 0:8 64 = 30d98000 8000a969 73000880 0ca20696 fe5f0dff ffe7ff02 00a10698 fe5d0dff
ffff89f7af1bd000 3645174218 S Ii:1:004:2 -115:8 64 <
ffff89f7af1bd000 3645190330 C Ii:1:004:2 0:8 64 = 30dc8000 8000a969 75000880 0ca60696 fe5c0dfe ffe7ff02 00a30695 fe5e0dfe
ffff89f7af1bd000 3645190376 S Ii:1:004:2 -115:8 64 <
ffff89f7af1bd000 3645206164 C Ii:1:004:2 0:8 64 = 30e08000 80009979 77000880 0ca8069c fe5b0dff ffe9ff03 00a8069c fe5b0dff
ffff89f7af1bd000 3645206212 S Ii:1:004:2 -115:8 64 <
ffff89f7af1bd000 3645222990 C Ii:1:004:2 0:8 64 = 30e38000 80009979 78000880 0ca70698 fe590dfd ffe7ff00 00a70698 fe590dfd
ffff89f7af1bd000 3645223036 S Ii:1:004:2 -115:8 64 <
ffff89f7af1bd000 3645239591 C Ii:1:004:2 0:8 64 = 30e68000 80008879 7a000880 0ca50696 fe5b0dfe ffe7ffff ffa50696 fe5b0dfe
ffff89f7af1bd000 3645239640 S Ii:1:004:2 -115:8 64 <
ffff89f7af1bd000 3645256266 C Ii:1:004:2 0:8 64 = 30e98000 80007879 7c000880 0ca20699 fe5c0dff ffe7ff01 00a40698 fe5c0dff
ffff89f7af1bd000 3645256314 S Ii:1:004:2 -115:8 64 <
ffff89f7af1bd000 3645270323 C Ii:1:004:2 0:8 64 = 30ec8000 80001809 80000880 0ca50699 fe5c0dff ffe7ff02 00a20699 fe5c0dff
ffff89f7af1bd000 3645270376 S Ii:1:004:2 -115:8 64 <
ffff89f7af1bd000 3645288113 C Ii:1:004:2 0:8 64 = 30f08000 8000b878 82000880 0ca40699 fe590dfe ffe5ff01 00a40699 fe590dfe
ffff89f7af1bd000 3645288159 S Ii:1:004:2 -115:8 64 <
ffff89f7af1bd000 3645310442 C Ii:1:004:2 0:8 64 = 30f38000 80007778 83000880 0ca6069c fe5b0dfe ffe8ff02 00a6069c fe5b0dfe
ffff89f7af1bd000 3645310488 S Ii:1:004:2 -115:8 64 <
ffff89f7af1bd000 3645326198 C Ii:1:004:2 0:8 64 = 30f88000 80005778 84000880 0ca10697 fe5c0dfe ffe6ff00 00a10697 fe5c0dfe
ffff89f7af1bd000 3645326237 S Ii:1:004:2 -115:8 64 <
ffff89f7af1bd000 3645334180 C Ii:1:004:2 0:8 64 = 30fb8000 80003778 83000880 0ca40698 fe5e0dfd ffe6ff02 00a40698 fe5e0dfd
ffff89f7af1bd000 3645334216 S Ii:1:004:2 -115:8 64 <
ffff89f7af1bd000 3645351204 C Ii:1:004:2 0:8 64 = 30fc8000 80002778 82000880 0ca60697 fe5c0dfd ffe6ff03 00a40698 fe5e0dfd
ffff89f7af1bd000 3645351259 S Ii:1:004:2 -115:8 64 <
ffff89f7af1bd000 3645366285 C Ii:1:004:2 0:8 64 = 30008000 80000078 81000880 0ca80699 fe5e0d00 00e8ff01 00a80699 fe5e0d00
ffff89f7af1bd000 3645366330 S Ii:1:004:2 -115:8 64 <
ffff89f7af1bd000 3645382139 C Ii:1:004:2 0:8 64 = 30038000 80000008 80000880 0ca3069b fe5e0d00 00e5ff01 00a3069b fe5e0d00
ffff89f7af1bd000 3645382179 S Ii:1:004:2 -115:8 64 <
ffff89f7af1bd000 3645398123 C Ii:1:004:2 0:8 64 = 30068000 80000008 80000880 0ca00698 fe5a0dff ffe4ff02 00a00698 fe5a0dff
ffff89f7af1bd000 3645398168 S Ii:1:004:2 -115:8 64 <
ffff89f7af1bd000 3645416444 C Ii:1:004:2 0:8 64 = 30098000 80000008 80000880 0ca40696 fe580d00 00e7ff01 00a20696 fe580d00
ffff89f7af1bd000 3645416487 S Ii:1:004:2 -115:8 64 <
ffff89f7af1bd000 3645438321 C Ii:1:004:2 0:8 64 = 300c8000 80000008 80000880 0ca2069b fe5e0dff ffe5ff01 00a60699 fe5b0dff
ffff89f7af1bd000 3645438363 S Ii:1:004:2 -115:8 64 <
ffff89f7af1bd000 3645447701 C Ii:1:004:2 0:8 64 = 30118000 80000008 80000880 0ca7069c fe5b0dff ffe8ff02 00a6069c fe5c0dff
ffff89f7af1bd000 3645447764 S Ii:1:004:2 -115:8 64 <
ffff89f7af1bd000 3645462340 C Ii:1:004:2 0:8 64 = 30138000 80000008 80000880 0ca6069b fe590dfe ffe7ff01 00a6069b fe590dfe
ffff89f7af1bd000 3645462381 S Ii:1:004:2 -115:8 64 <
ffff89f7af1bd000 3645489188 C Ii:1:004:2 0:8 64 = 30168000 80000008 80000880 0ca4069a fe5a0dfd ffe5ff01 00a4069a fe5a0dfd
ffff89f7af1bd000 3645489233 S Ii:1:004:2 -115:8 64 <
ffff89f7af1bd000 3645502357 C Ii:1:004:2 0:8 64 = 301b8000 8000e777 7d000880 0ca10695 fe5e0dfe ffe7ff03 00a10695 fe5e0dfe
ffff89f7af1bd000 3645502403 S Ii:1:004:2 -115:8 64 <
ffff89f7af1bd000 3645520281 C Ii:1:004:2 0:8 64 = 301e8000 8000d777 7c000880 0ca40696 fe5d0d00 00e8ff01 00a40696 fe5d0d00
ffff89f7af1bd000 3645520324 S Ii:1:004:2 -115:8 64 <
ffff89f7af1bd000 3645536912 C Ii:1:004:2 0:8 64 = 30218000 8000b777 78000880 0ca4069b fe5a0dff ffe6ff01 00a4069a fe5a0dff
ffff89f7af1bd000 3645536954 S Ii:1:004:2 -115:8 64 <
ffff89f7af1bd000 3645550297 C Ii:1:004:2 0:8 64 = 30248000 8000a767 75000880 0ca6069b fe5e0d00 00e6ff01 00a6069b fe5c0d00
ffff89f7af1bd000 3645550332 S Ii:1:004:2 -115:8 64 <
ffff89f7af1bd000 3645558168 C Ii:1:004:2 0:8 64 = 30288000 80009767 6f000880 0ca6069c fe5c0dff ffe6ff02 00a6069c fe5c0dff
ffff89f7af1bd000 3645558207 S Ii:1:004:2 -115:8 64 <
ffff89f7af1bd000 3645574232 C Ii:1:004:2 0:8 64 = 30298000 80009767 6d000880 0ca6069d fe5c0dff ffe5ff02 00a6069c fe5c0dff
ffff89f7af1bd000 3645574275 S Ii:1:004:2 -115:8 64 <
ffff89f7af1bd000 3645598342 C Ii:1:004:2 0:8 64 = 302c8000 80008767 67000880 0ca6069c fe5f0dff ffe7ff01 00a7069e fe5e0dff
ffff89f7af1bd000 3645598388 S Ii:1:004:2 -115:8 64 <
ffff89f7af1bd000 3645608174 C Ii:1:004:2 0:8 64 = 30318000 80009757 5e000880 0ca40698 fe5e0dff ffe8ff01 00a50698 fe5f0dff
ffff89f7af1bd000 3645608212 S Ii:1:004:2 -115:8 64 <
ffff89f7af1bd000 3645633081 C Ii:1:004:2 0:8 64 = 30338000 8000a757 5b000880 0ca20698 fe5c0dfe ffe8ff02 00a20698 fe5c0dfe
ffff89f7af1bd000 3645633125 S Ii:1:004:2 -115:8 64 <
ffff89f7af1bd000 3645638825 C Ii:1:004:2 0:8 64 = 30388000 8000e747 54000880 0ca40696 fe5a0dff ffe5ff01 00a40696 fe5a0dff
ffff89f7af1bd000 3645638862 S Ii:1:004:2 -115:8 64 <
ffff89f7af1bd000 3645655938 C Ii:1:004:2 0:8 64 = 30398000 8000f747 51000880 0ca40697 fe5c0dff ffe5ff01 00a40696 fe5a0dff
ffff89f7af1bd000 3645655980 S Ii:1:004:2 -115:8 64 <
ffff89f7af1bd000 3645671284 C Ii:1:004:2 0:8 64 = 303c8000 80001748 4c000880 0ca2069d fe5d0dfe ffe6ff03 00a1069b fe5d0dfe
ffff89f7af1bd000 3645671332 S Ii:1:004:2 -115:8 64 <
ffff89f7af1bd000 3645686167 C Ii:1:004:2 0:8 64 = 30408000 80005748 46000880 0ca9069d fe570d00 00e6ff02 00a9069d fe570d00
ffff89f7af1bd000 3645686205 S Ii:1:004:2 -115:8 64 <
ffff89f7af1bd000 3645710325 C Ii:1:004:2 0:8 64 = 30438000 80009838 42000880 0caa0699 fe5f0dff ffe8ff01 00aa0699 fe5f0dff
ffff89f7af1bd000 3645710368 S Ii:1:004:2 -115:8 64 <
ffff89f7af1bd000 3645718250 C Ii:1:004:2 0:8 64 = 30488000 8000e838 3d000880 0ca30698 fe5c0dff ffe6ff01 00a30698 fe5c0dff
ffff89f7af1bd000 3645718285 S Ii:1:004:2 -115:8 64 <
ffff89f7af1bd000 3645734189 C Ii:1:004:2 0:8 64 = 30498000 80000839 3c000880 0ca50698 fe5a0dff ffe8ff01 00a30698 fe5c0dff
ffff89f7af1bd000 3645734231 S Ii:1:004:2 -115:8 64 <
ffff89f7af1bd000 3645751518 C Ii:1:004:2 0:8 64 = 304c8000 80004839 3b000880 0ca40698 fe5d0dff ffe8ff00 00a50697 fe5b0dff
ffff89f7af1bd000 3645751560 S Ii:1:004:2 -115:8 64 <
ffff89f7af1bd000 3645774202 C Ii:1:004:2 0:8 64 = 30508000 80008839 3c000880 0ca40699 fe5c0dff ffe7ff01 00a40699 fe5c0dff
ffff89f7af1bd000 3645774244 S Ii:1:004:2 -115:8 64 <
ffff89f7af1bd000 3645791983 C Ii:1:004:2 0:8 64 = 30548000 8000e939 43000880 0ca60698 fe5d0dfe ffe7ff00 00a80698 fe5a0dff
ffff89f7af1bd000 3645791994 S Ii:1:004:2 -115:8 64 <
ffff89f7af1bd000 3645808447 C Ii:1:004:2 0:8 64 = 30588000 8000f949 4b000880 0ca30699 fe5d0dfc ffe8ff02 00a30699 fe5d0dfc
ffff89f7af1bd000 3645808484 S Ii:1:004:2 -115:8 64 <
ffff89f7af1bd000 3645822184 C Ii:1:004:2 0:8 64 = 305b8000 8000095a 55000880 0ca50697 fe5a0dfe ffe5ff00 00a50697 fe5a0dfe
ffff89f7af1bd000 3645822226 S Ii:1:004:2 -115:8 64 <
ffff89f7af1bd000 3645839718 C Ii:1:004:2 0:8 64 = 305e8000 8000f959 5d000880 0ca00695 fe570dff ffe8ff00 00a00695 fe570dff
ffff89f7af1bd000 3645839758 S Ii:1:004:2 -115:8 64 <
ffff89f7af1bd000 3645855029 C Ii:1:004:2 0:8 64 = 30618000 8000c959 64000880 0ca40695 fe5b0dff ffe6ff01 00a10695 fe580dff
ffff89f7af1bd000 3645855070 S Ii:1:004:2 -115:8 64 <
ffff89f7af1bd000 3645871863 C Ii:1:004:2 0:8 64 = 30648000 80007869 6c000880 0ca40696 fe600d00 00e6ff03 00a40696 fe5f0d00
ffff89f7af1bd000 3645871905 S Ii:1:004:2 -115:8 64 <
ffff89f7af1bd000 3645886277 C Ii:1:004:2 0:8 64 = 30688000 80001869 73000880 0ca60698 fe5b0dff ffe7ff03 00a60698 fe5b0dff
ffff89f7af1bd000 3645886312 S Ii:1:004:2 -115:8 64 <
ffff89f7af1bd000 3645903293 C Ii:1:004:2 0:8 64 = 306b8000 8000a878 7a000880 0ca5069a fe5c0dfe ffe7ff03 00a5069a fe5c0dfe
ffff89f7af1bd000 3645903334 S Ii:1:004:2 -115:8 64 <
ffff89f7af1bd000 3645918922 C Ii:1:004:2 0:8 64 = 306e8000 80003708 80000880 0ca60698 fe5d0dfd ffe7ff03 00a60698 fe5d0dfd
ffff89f7af1bd000 3645918972 S Ii:1:004:2 -115:8 64 <
ffff89f7af1bd000 3645935661 C Ii:1:004:2 0:8 64 = 30718000 80000008 80000880 0ca5069b fe5b0dfe ffe6ff02 00a6069a fe5c0dfd
ffff89f7af1bd000 3645935710 S Ii:1:004:2 -115:8 64 <
ffff89f7af1bd000 3645950179 C Ii:1:004:2 0:8 64 = 30748000 80000008 80000880 0ca00695 fe5e0d00 00e8ff01 00a20698 fe5c0dff
ffff89f7af1bd000 3645950221 S Ii:1:004:2 -115:8 64 <
ffff89f7af1bd000 3645967941 C Ii:1:004:2 0:8 64 = 30788000 80000008 80000880 0ca00697 fe5f0d00 00e6ff00 00a00697 fe5f0d00
ffff89f7af1bd000 3645967985 S Ii:1:004:2 -115:8 64 <
ffff89f7af1bd000 3645991823 C Ii:1:004:2 0:8 64 = 307b8000 80000008 80000880 0ca00699 fe5e0dff ffe7ff01 00a00699 fe5e0dff
ffff89f7af1bd000 3645991883 S Ii:1:004:2 -115:8 64 <
ffff89f7af1bd000 3646006187 C Ii:1:004:2 0:8 64 = 30808000 80000008 80000880 0ca1069a fe580dff ffe5ff03 00a1069a fe580dff
ffff89f7af1bd000 3646006223 S Ii:1:004:2 -115:8 64 <
ffff89f7af1bd000 3646015473 C Ii:1:004:2 0:8 64 = 30838000 80000008 80000880 0ca6069a fe590dfe ffe7ff01 00a6069a fe590dfe
ffff89f7af1bd000 3646015508 S Ii:1:004:2 -115:8 64 <
ffff89f7af1bd000 3646038200 C Ii:1:004:2 0:8 64 = 30848000 80000008 80000880 0ca5069b fe590dfd ffe6ff00 00a6069a fe590dfe
ffff89f7af1bd000 3646038243 S Ii:1:004:2 -115:8 64 <
ffff89f7af1bd000 3646046136 C Ii:1:004:2 0:8 64 = 30898000 80000008 80000880 0ca20698 fe5b0d01 00e5ff01 00a1069a fe5b0dff
ffff89f7af1bd000 3646046171 S Ii:1:004:2 -115:8 64 <
ffff89f7af1bd000 3646063096 C Ii:1:004:2 0:8 64 = 308b8000 80000008 80000880 0ca30698 fe5b0d01 00e6ff01 00a30698 fe5b0d01
ffff89f7af1bd000 3646063138 S Ii:1:004:2 -115:8 64 <
ffff89f7af1bd000 3646078190 C Ii:1:004:2 0:8 64 = 308e8000 80000008 80000880 0ca4069a fe5c0d00 00e5ff00 00a4069a fe5c0d00
ffff89f7af1bd000 3646078232 S Ii:1:004:2 -115:8 64 <
ffff89f7af1bd000 3646094304 C Ii:1:004:2 0:8 64 = 30918000 80000008 80000880 0c9e0696 fe5a0dff ffe5ff02 00a00697 fe5b0dff
ffff89f7af1bd000 3646094348 S Ii:1:004:2 -115:8 64 <
ffff89f7af1bd000 3646110158 C Ii:1:004:2 0:8 64 = 30948000 8000d777 7c000880 0ca70697 fe5c0dff ffe5ff01 00a20697 fe5a0d00
ffff89f7af1bd000 3646110194 S Ii:1:004:2 -115:8 64 <
ffff89f7af1bd000 3646126301 C Ii:1:004:2 0:8 64 = 30988000 8000a777 77000880 0ca60698 fe5b0dfe ffe4ff00 00a60698 fe5b0dfe
ffff89f7af1bd000 3646126345 S Ii:1:004:2 -115:8 64 <
ffff89f7af1bd000 3646150248 C Ii:1:004:2 0:8 64 = 309b8000 80006667 70000880 0ca4069c fe5d0dfe ffe7ff01 00a4069c fe5d0dfe
ffff89f7af1bd000 3646150282 S Ii:1:004:2 -115:8 64 <
ffff89f7af1bd000 3646158348 C Ii:1:004:2 0:8 64 = 30a08000 80001667 66000880 0ca40699 fe5f0dff ffe6ff00 00a40699 fe5f0dff
ffff89f7af1bd000 3646158390 S Ii:1:004:2 -115:8 64 <
ffff89f7af1bd000 3646182297 C Ii:1:004:2 0:8 64 = 30a18000 80000657 63000880 0ca40697 fe5e0dff ffe6ff00 00a40699 fe5f0dff
ffff89f7af1bd000 3646182334 S Ii:1:004:2 -115:8 64 <
ffff89f7af1bd000 3646198195 C Ii:1:004:2 0:8 64 = 30a68000 8000e656 5b000880 0c9f0697 fe5c0d00 00e7ff01 009f0697 fe5c0d00
ffff89f7af1bd000 3646198241 S Ii:1:004:2 -115:8 64 <
ffff89f7af1bd000 3646208333 C Ii:1:004:2 0:8 64 = 30a98000 8000e656 56000880 0ca20695 fe5e0d00 00e8ff02 00a00696 fe5b0d00
ffff89f7af1bd000 3646208369 S Ii:1:004:2 -115:8 64 <
ffff89f7af1bd000 3646223945 C Ii:1:004:2 0:8 64 = 30ab8000 8000e646 53000880 0ca30697 fe620dff ffe6ff01 00a30697 fe620dff
ffff89f7af1bd000 3646223989 S Ii:1:004:2 -115:8 64 <
ffff89f7af1bd000 3646238320 C Ii:1:004:2 0:8 64 = 30ae8000 80001647 4e000880 0ca30699 fe5d0dfe ffe5ff00 00a30699 fe5d0dfe
ffff89f7af1bd000 3646238361 S Ii:1:004:2 -115:8 64 <
ffff89f7af1bd000 3646262169 C Ii:1:004:2 0:8 64 = 30b18000 80004647 4a000880 0ca50699 fe5c0dff ffe8ff01 00a40699 fe5b0dff
ffff89f7af1bd000 3646262214 S Ii:1:004:2 -115:8 64 <
ffff89f7af1bd000 3646278040 C Ii:1:004:2 0:8 64 = 30b68000 80006647 46000880 0ca2069b fe570d00 00e6ff02 00a2069b fe570d00
ffff89f7af1bd000 3646278076 S Ii:1:004:2 -115:8 64 <
ffff89f7af1bd000 3646294164 C Ii:1:004:2 0:8 64 = 30b98000 80006647 45000880 0ca5069a fe5a0dff ffe7ff03 00a4069a fe580d00
ffff89f7af1bd000 3646294206 S Ii:1:004:2 -115:8 64 <
ffff89f7af1bd000 3646310152 C Ii:1:004:2 0:8 64 = 30bc8000 80007747 44000880 0ca0069a fe5b0dff ffe7ff02 00a2069a fe5b0dfe
ffff89f7af1bd000 3646310188 S Ii:1:004:2 -115:8 64 <
ffff89f7af1bd000 3646318115 C Ii:1:004:2 0:8 64 = 30c08000 80009737 42000880 0ca00699 fe5b0dff ffe6ff01 00a00699 fe5b0dff
ffff89f7af1bd000 3646318151 S Ii:1:004:2 -115:8 64 <
ffff89f7af1bd000 3646342286 C Ii:1:004:2 0:8 64 = 30c18000 8000b737 42000880 0ca2069a fe5e0dff ffe5ff01 00a00699 fe5b0dff
ffff89f7af1bd000 3646342326 S Ii:1:004:2 -115:8 64 <
ffff89f7af1bd000 3646358170 C Ii:1:004:2 0:8 64 = 30c68000 80000038 41000880 0ca60699 fe590dff ffe9ff01 00a60699 fe590dff
ffff89f7af1bd000 3646358214 S Ii:1:004:2 -115:8 64 <
ffff89f7af1bd000 3646367475 C Ii:1:004:2 0:8 64 = 30c98000 80005738 43000880 0ca5069a fe5c0dff ffe8ff01 00a60699 fe590dff
ffff89f7af1bd000 3646367513 S Ii:1:004:2 -115:8 64 <
ffff89f7af1bd000 3646382108 C Ii:1:004:2 0:8 64 = 30cb8000 80008848 46000880 0ca4069b fe5e0dff ffe9ff01 00a4069b fe5e0dff
ffff89f7af1bd000 3646382146 S Ii:1:004:2 -115:8 64 <
ffff89f7af1bd000 3646398191 C Ii:1:004:2 0:8 64 = 30ce8000 8000c848 4e000880 0ca6069a fe5c0dff ffe7ff01 00a6069a fe5c0dff
ffff89f7af1bd000 3646398247 S Ii:1:004:2 -115:8 64 <
ffff89f7af1bd000 3646414314 C Ii:1:004:2 0:8 64 = 30d18000 8000f858 58000880 0ca6069a fe590dfd ffe7ff01 00a7069a fe5b0dfe
ffff89f7af1bd000 3646414353 S Ii:1:004:2 -115:8 64 <
ffff89f7af1bd000 3646431964 C Ii:1:004:2 0:8 64 = 30d48000 8000f858 62000880 0ca30698 fe590dfe ffe8ff00 00a4069a fe580dfe
ffff89f7af1bd000 3646432008 S Ii:1:004:2 -115:8 64 <
ffff89f7af1bd000 3646456155 C Ii:1:004:2 0:8 64 = 30d88000 80000869 6a000880 0ca20695 fe5d0dfe ffe8ff01 00a20695 fe5d0dfe
ffff89f7af1bd000 3646456230 S Ii:1:004:2 -115:8 64 <
ffff89f7af1bd000 3646472975 C Ii:1:004:2 0:8 64 = 30dc8000 80000869 71000880 0ca00699 fe5e0d00 00e5ff00 009f0698 fe5f0dff
ffff89f7af1bd000 3646473018 S Ii:1:004:2 -115:8 64 <
ffff89f7af1bd000 3646479380 C Ii:1:004:2 0:8 64 = 30e08000 80000869 74000880 0ca30699 fe5c0dff ffe7ff02 00a30699 fe5c0dff
ffff89f7af1bd000 3646479415 S Ii:1:004:2 -115:8 64 <
ffff89f7af1bd000 3646496026 C Ii:1:004:2 0:8 64 = 30e18000 8000f868 75000880 0ca4069a fe5e0dff ffe7ff03 00a30699 fe5c0dff
ffff89f7af1bd000 3646496067 S Ii:1:004:2 -115:8 64 <
ffff89f7af1bd000 3646510256 C Ii:1:004:2 0:8 64 = 30e48000 8000f878 78000880 0ca5069a fe5b0dfc ffe7ff02 00a4069a fe5e0dfe
ffff89f7af1bd000 3646510293 S Ii:1:004:2 -115:8 64 <
ffff89f7af1bd000 3646534212 C Ii:1:004:2 0:8 64 = 30e88000 8000e878 7b000880 0ca50697 fe5a0dfd ffe7ff00 00a50697 fe5a0dfd
ffff89f7af1bd000 3646534258 S Ii:1:004:2 -115:8 64 <
ffff89f7af1bd000 3646542977 C Ii:1:004:2 0:8 64 = 30ec8000 8000c808 80000880 0ca20699 fe5b0dff ffe8ff01 00a10697 fe5c0dfe
ffff89f7af1bd000 3646543012 S Ii:1:004:2 -115:8 64 <
ffff89f7af1bd000 3646566093 C Ii:1:004:2 0:8 64 = 30ee8000 8000a808 80000880 0ca5069a fe5b0dff ffe9ff02 00a5069a fe5b0dff
ffff89f7af1bd000 3646566136 S Ii:1:004:2 -115:8 64 <
ffff89f7af1bd000 3646584170 C Ii:1:004:2 0:8 64 = 30f38000 80005778 81000880 0c9f0698 fe630dff ffe7ff01 009f0698 fe630dff
ffff89f7af1bd000 3646584214 S Ii:1:004:2 -115:8 64 <
ffff89f7af1bd000 3646599076 C Ii:1:004:2 0:8 64 = 30f68000 80003778 81000880 0ca5069a fe600dfe ffe8ff01 00a5069a fe600dfe
ffff89f7af1bd000 3646599122 S Ii:1:004:2 -115:8 64 <
ffff89f7af1bd000 3646614103 C Ii:1:004:2 0:8 64 = 30f98000 80001778 80000880 0ca6069a fe5a0dff ffe7ff02 00a70699 fe5b0dff
ffff89f7af1bd000 3646614140 S Ii:1:004:2 -115:8 64 <
ffff89f7af1bd000 3646630156 C Ii:1:004:2 0:8 64 = 30fc8000 80000008 80000880 0ca6069a fe5a0dff ffe7ff01 00a4069a fe5a0dff
ffff89f7af1bd000 3646630197 S Ii:1:004:2 -115:8 64 <
ffff89f7af1bd000 3646648421 C Ii:1:004:2 0:8 64 = 30008000 80000008 80000880 0ca40699 fe5c0dfe ffe7ff00 00a40699 fe5c0dfe
ffff89f7af1bd000 3646648459 S Ii:1:004:2 -115:8 64 <
ffff89f7af1bd000 3646664100 C Ii:1:004:2 0:8 64 = 30038000 80000008 80000880 0ca20696 fe5a0dff ffe7ff00 00a20696 fe5a0dff
ffff89f7af1bd000 3646664177 S Ii:1:004:2 -115:8 64 <
ffff89f7af1bd000 3646681046 C Ii:1:004:2 0:8 64 = 30068000 80000008 80000880 0ca10697 fe5c0dff ffe4ff01 00a10697 fe5c0dff
ffff89f7af1bd000 3646681088 S Ii:1:004:2 -115:8 64 <
ffff89f7af1bd000 3646696383 C Ii:1:004:2 0:8 64 = 30098000 80000008 80000880 0ca40696 fe5e0dff ffe7ff01 00a30697 fe5e0dff
ffff89f7af1bd000 3646696427 S Ii:1:004:2 -115:8 64 <
ffff89f7af1bd000 3646713255 C Ii:1:004:2 0:8 64 = 300c8000 80000008 80000880 0ca30699 fe5e0dff ffe4ff01 00a10695 fe5e0dff
ffff89f7af1bd000 3646713293 S Ii:1:004:2 -115:8 64 <
ffff89f7af1bd000 3646726348 C Ii:1:004:2 0:8 64 = 30108000 8000d777 7b000880 0ca8069c fe5a0dfe ffe6ff01 00a8069c fe5a0dfe
ffff89f7af1bd000 3646726390 S Ii:1:004:2 -115:8 64 <
ffff89f7af1bd000 3646742239 C Ii:1:004:2 0:8 64 = 30138000 8000a767 76000880 0ca6069b fe5a0dfe ffe6ffff ffa6069b fe5a0dfe
ffff89f7af1bd000 3646742274 S Ii:1:004:2 -115:8 64 <
ffff89f7af1bd000 3646760368 C Ii:1:004:2 0:8 64 = 30168000 80008767 6f000880 0ca0069c fe5d0d00 00e5ff02 00a0069c fe5d0d00
ffff89f7af1bd000 3646760410 S Ii:1:004:2 -115:8 64 <
ffff89f7af1bd000 3646768795 C Ii:1:004:2 0:8 64 = 30198000 80006667 69000880 0ca3069a fe5c0d00 00e7ff01 00a0069c fe5c0d00
ffff89f7af1bd000 3646768842 S Ii:1:004:2 -115:8 64 <
ffff89f7af1bd000 3646793028 C Ii:1:004:2 0:8 64 = 301b8000 80006657 65000880 0ca70696 fe5c0d00 00e6ff01 00a70696 fe5c0d00
ffff89f7af1bd000 3646793075 S Ii:1:004:2 -115:8 64 <
ffff89f7af1bd000 3646806214 C Ii:1:004:2 0:8 64 = 30208000 80007757 5d000880 0ca00699 fe5d0d00 00e8ff02 00a00699 fe5d0d00
ffff89f7af1bd000 3646806253 S Ii:1:004:2 -115:8 64 <
ffff89f7af1bd000 3646822200 C Ii:1:004:2 0:8 64 = 30238000 80009757 59000880 0ca00694 fe590d00 00e5ff01 00a00694 fe590d00
ffff89f7af1bd000 3646822241 S Ii:1:004:2 -115:8 64 <
ffff89f7af1bd000 3646830263 C Ii:1:004:2 0:8 64 = 30268000 8000c757 55000880 0ca50698 fe570dff ffe5ff01 00a50698 fe570dff
ffff89f7af1bd000 3646830300 S Ii:1:004:2 -115:8 64 <
ffff89f7af1bd000 3646846142 C Ii:1:004:2 0:8 64 = 30288000 8000c747 53000880 0ca5069d fe590d00 00e8ff01 00a5069d fe590d00
ffff89f7af1bd000 3646846177 S Ii:1:004:2 -115:8 64 <
ffff89f7af1bd000 3646862238 C Ii:1:004:2 0:8 64 = 302b8000 8000e747 52000880 0ca606a2 fe5b0d00 00e7ff00 00a606a2 fe5b0d00
ffff89f7af1bd000 3646862311 S Ii:1:004:2 -115:8 64 <
ffff89f7af1bd000 3646878178 C Ii:1:004:2 0:8 64 = 302e8000 8000e747 52000880 0ca7069b fe5c0dff ffe8ff01 00a7069b fe5c0dff
ffff89f7af1bd000 3646878212 S Ii:1:004:2 -115:8 64 <
ffff89f7af1bd000 3646896052 C Ii:1:004:2 0:8 64 = 30318000 8000f747 52000880 0ca60699 fe5c0dfe ffe7ff02 00a5069a fe5d0dfe
ffff89f7af1bd000 3646896096 S Ii:1:004:2 -115:8 64 <
ffff89f7af1bd000 3646909990 C Ii:1:004:2 0:8 64 = 30348000 80000058 55000880 0ca30698 fe5c0dfe ffe7ff02 00a50699 fe5b0dfe
ffff89f7af1bd000 3646910030 S Ii:1:004:2 -115:8 64 <
ffff89f7af1bd000 3646926235 C Ii:1:004:2 0:8 64 = 30388000 80001758 5a000880 0ca10697 fe5f0dff ffe7ff00 00a10697 fe5f0dff
ffff89f7af1bd000 3646926282 S Ii:1:004:2 -115:8 64 <
ffff89f7af1bd000 3646943206 C Ii:1:004:2 0:8 64 = 303b8000 80002758 60000880 0ca60695 fe5d0dfe ffe6ff01 00a60695 fe5d0dfe
ffff89f7af1bd000 3646943243 S Ii:1:004:2 -115:8 64 <
ffff89f7af1bd000 3646961003 C Ii:1:004:2 0:8 64 = 303e8000 80004758 65000880 0ca30695 fe5b0dff ffe5ff02 00a30695 fe5b0dff
ffff89f7af1bd000 3646961043 S Ii:1:004:2 -115:8 64 <
ffff89f7af1bd000 3646974107 C Ii:1:004:2 0:8 64 = 30418000 80007768 6a000880 0ca5069b fe5c0dff ffe6ff00 00a30698 fe5b0dff
ffff89f7af1bd000 3646974146 S Ii:1:004:2 -115:8 64 <
ffff89f7af1bd000 3646991976 C Ii:1:004:2 0:8 64 = 30448000 80009868 6f000880 0ca6069c fe5b0dfd ffe7ff00 00a7069c fe5c0dfe
ffff89f7af1bd000 3646992017 S Ii:1:004:2 -115:8 64 <
ffff89f7af1bd000 3647007309 C Ii:1:004:2 0:8 64 = 30488000 8000a868 73000880 0ca5069c fe5a0dfe ffe6ff02 00a5069c fe5a0dfe
ffff89f7af1bd000 3647007347 S Ii:1:004:2 -115:8 64 <
ffff89f7af1bd000 3647022039 C Ii:1:004:2 0:8 64 = 304b8000 8000b878 77000880 0ca20698 fe5f0dff ffe8ff01 00a20698 fe5f0dff
ffff89f7af1bd000 3647022084 S Ii:1:004:2 -115:8 64 <
ffff89f7af1bd000 3647040274 C Ii:1:004:2 0:8 64 = 304e8000 8000b878 7a000880 0ca50695 fe5b0dfe ffe8ff01 00a50695 fe5b0dfe
ffff89f7af1bd000 3647040317 S Ii:1:004:2 -115:8 64 <
ffff89f7af1bd000 3647055877 C Ii:1:004:2 0:8 64 = 30518000 8000c878 7c000880 0ca20694 fe5b0dfe ffe8ff02 00a50694 fe590dfe
ffff89f7af1bd000 3647055918 S Ii:1:004:2 -115:8 64 <
ffff89f7af1bd000 3647078082 C Ii:1:004:2 0:8 64 = 30548000 8000c878 7d000880 0ca20697 fe5f0dfe ffe6ff01 00a00695 fe5e0dfd
ffff89f7af1bd000 3647078117 S Ii:1:004:2 -115:8 64 <
ffff89f7af1bd000 3647096794 C Ii:1:004:2 0:8 64 = 30598000 8000c808 80000880 0ca50698 fe5c0dfe ffe7ff01 00a70699 fe5c0dff
ffff89f7af1bd000 3647096834 S Ii:1:004:2 -115:8 64 <
ffff89f7af1bd000 3647110021 C Ii:1:004:2 0:8 64 = 305c8000 8000c808 80000880 0ca30696 fe590dfe ffe5ff01 00a40697 fe5b0dfe
ffff89f7af1bd000 3647110059 S Ii:1:004:2 -115:8 64 <
ffff89f7af1bd000 3647126003 C Ii:1:004:2 0:8 64 = 30608000 8000c808 80000880 0ca30699 fe5a0d00 00e7ff03 00a30699 fe5a0d00
ffff89f7af1bd000 3647126043 S Ii:1:004:2 -115:8 64 <
ffff89f7af1bd000 3647134127 C Ii:1:004:2 0:8 64 = 30638000 8000a808 80000880 0ca3069b fe5d0d00 00e5ff02 00a3069b fe5d0d00
ffff89f7af1bd000 3647134168 S Ii:1:004:2 -115:8 64 <
ffff89f7af1bd000 3647158051 C Ii:1:004:2 0:8 64 = 30648000 80007708 80000880 0ca20697 fe5c0d00 00e4ff01 00a3069b fe5d0d00
ffff89f7af1bd000 3647158062 S Ii:1:004:2 -115:8 64 <
ffff89f7af1bd000 3647166049 C Ii:1:004:2 0:8 64 = 30698000 80000008 80000880 0ca40696 fe5f0dff ffe8ff00 00a50692 fe5b0d00
ffff89f7af1bd000 3647166103 S Ii:1:004:2 -115:8 64 <
ffff89f7af1bd000 3647183007 C Ii:1:004:2 0:8 64 = 306b8000 80000008 80000880 0ca5069a fe620d00 00e6ff01 00a5069a fe620d00
ffff89f7af1bd000 3647183047 S Ii:1:004:2 -115:8 64 <
ffff89f7af1bd000 3647206039 C Ii:1:004:2 0:8 64 = 306e8000 80000008 80000880 0ca30699 fe5e0dff ffe6ff03 00a30699 fe5e0dff
ffff89f7af1bd000 3647206079 S Ii:1:004:2 -115:8 64 <
ffff89f7af1bd000 3647214084 C Ii:1:004:2 0:8 64 = 30738000 80000008 80000880 0ca5069c fe590d00 00e5ff02 00a5069c fe590d00
ffff89f7af1bd000 3647214148 S Ii:1:004:2 -115:8 64 <
ffff89f7af1bd000 3647230223 C Ii:1:004:2 0:8 64 = 30748000 80000078 7e000880 0ca7069a fe5e0d00 00e5ff02 00a5069c fe590d00
ffff89f7af1bd000 3647230264 S Ii:1:004:2 -115:8 64 <
ffff89f7af1bd000 3647247088 C Ii:1:004:2 0:8 64 = 30788000 80000078 7b000880 0ca60698 fe5e0d01 00e7ff02 00a60698 fe5e0d01
ffff89f7af1bd000 3647247131 S Ii:1:004:2 -115:8 64 <
ffff89f7af1bd000 3647262930 C Ii:1:004:2 0:8 64 = 307b8000 8000f777 78000880 0ca20699 fe5f0dff ffe5ff00 00a20699 fe5f0dff
ffff89f7af1bd000 3647262978 S Ii:1:004:2 -115:8 64 <
ffff89f7af1bd000 3647286068 C Ii:1:004:2 0:8 64 = 307e8000 8000e767 76000880 0ca30698 fe5d0dff ffe7ff01 00a30698 fe5d0dff
ffff89f7af1bd000 3647286108 S Ii:1:004:2 -115:8 64 <
ffff89f7af1bd000 3647295891 C Ii:1:004:2 0:8 64 = 30838000 8000e767 75000880 0ca40699 fe5c0dff ffe6ff02 00a40699 fe5c0dff
ffff89f7af1bd000 3647295931 S Ii:1:004:2 -115:8 64 <
ffff89f7af1bd000 3647318097 C Ii:1:004:2 0:8 64 = 30848000 8000e767 75000880 0ca4069b fe5d0dfe ffe7ff02 00a40699 fe5c0dff
ffff89f7af1bd000 3647318131 S Ii:1:004:2 -115:8 64 <
ffff89f7af1bd000 3647334021 C Ii:1:004:2 0:8 64 = 30898000 8000e767 75000880 0ca5069b fe5b0dfe ffe8ff01 00a5069a fe5b0dff
ffff89f7af1bd000 3647334060 S Ii:1:004:2 -115:8 64 <
ffff89f7af1bd000 3647343057 C Ii:1:004:2 0:8 64 = 308c8000 8000e767 75000880 0ca5069d fe5c0dfe ffe7ff00 00a4069e fe5b0dfe
ffff89f7af1bd000 3647343093 S Ii:1:004:2 -115:8 64 <
ffff89f7af1bd000 3647359771 C Ii:1:004:2 0:8 64 = 308e8000 8000e767 75000880 0ca6069a fe5c0dff ffe6ff01 00a6069a fe5c0dff
ffff89f7af1bd000 3647359783 S Ii:1:004:2 -115:8 64 <
ffff89f7af1bd000 3647382232 C Ii:1:004:2 0:8 64 = 30918000 8000e767 75000880 0ca50695 fe5e0dff ffe6ff02 00a60696 fe5d0dff
ffff89f7af1bd000 3647382276 S Ii:1:004:2 -115:8 64 <
ffff89f7af1bd000 3647398139 C Ii:1:004:2 0:8 64 = 30968000 8000e767 76000880 0ca70698 fe5b0dff ffe7ff00 00a70698 fe5b0dff
ffff89f7af1bd000 3647398178 S Ii:1:004:2 -115:8 64 <
ffff89f7af1bd000 3647414000 C Ii:1:004:2 0:8 64 = 30998000 8000e767 76000880 0ca60696 fe5c0dff ffe7ff01 00a70698 fe5c0dff
ffff89f7af1bd000 3647414036 S Ii:1:004:2 -115:8 64 <
ffff89f7af1bd000 3647430020 C Ii:1:004:2 0:8 64 = 309c8000 8000e777 78000880 0ca20696 fe5a0dff ffe6ff02 00a40696 fe5b0dff
ffff89f7af1bd000 3647430059 S Ii:1:004:2 -115:8 64 <
ffff89f7af1bd000 3647447383 C Ii:1:004:2 0:8 64 = 30a08000 8000e777 79000880 0ca20699 fe5b0dff ffe7ff01 00a20699 fe5b0dff
ffff89f7af1bd000 3647447435 S Ii:1:004:2 -115:8 64 <
ffff89f7af1bd000 3647470224 C Ii:1:004:2 0:8 64 = 30a38000 8000f777 7b000880 0ca6069a fe5d0dfe ffe8ff01 00a6069a fe5d0dfe
ffff89f7af1bd000 3647470263 S Ii:1:004:2 -115:8 64 <
ffff89f7af1bd000 3647478040 C Ii:1:004:2 0:8 64 = 30a88000 8000f777 7d000880 0ca5069b fe5d0dfe ffe6ff02 00a5069b fe5d0dfe
ffff89f7af1bd000 3647478077 S Ii:1:004:2 -115:8 64 <
ffff89f7af1bd000 3647494019 C Ii:1:004:2 0:8 64 = 30a98000 8000f777 7d000880 0ca50699 fe5d0dff ffe6ff02 00a5069b fe5d0dfe
ffff89f7af1bd000 3647494057 S Ii:1:004:2 -115:8 64 <
ffff89f7af1bd000 3647511021 C Ii:1:004:2 0:8 64 = 30ac8000 8000f777 7e000880 0ca40695 fe5c0dff ffe6ff01 00a60695 fe5d0dff
ffff89f7af1bd000 3647511068 S Ii:1:004:2 -115:8 64 <
ffff89f7af1bd000 3647527829 C Ii:1:004:2 0:8 64 = 30b08000 80000078 7e000880 0ca10699 fe5d0dff ffe8ff00 00a10699 fe5d0dff
ffff89f7af1bd000 3647527870 S Ii:1:004:2 -115:8 64 <
ffff89f7af1bd000 3647541979 C Ii:1:004:2 0:8 64 = 30b38000 80000008 80000880 0ca10698 fe5c0dff ffe7ff01 00a10698 fe5c0dff
ffff89f7af1bd000 3647542010 S Ii:1:004:2 -115:8 64 <
ffff89f7af1bd000 3647558178 C Ii:1:004:2 0:8 64 = 30b68000 80000008 80000880 0ca40699 fe590d00 00e8ff01 00a40699 fe590d00
ffff89f7af1bd000 3647558227 S Ii:1:004:2 -115:8 64 <
ffff89f7af1bd000 3647575949 C Ii:1:004:2 0:8 64 = 30b98000 80000008 80000880 0ca30699 fe5d0d00 00e6ff01 00a40699 fe5a0dff
ffff89f7af1bd000 3647575997 S Ii:1:004:2 -115:8 64 <
ffff89f7af1bd000 3647598115 C Ii:1:004:2 0:8 64 = 30bc8000 80000008 80000880 0ca5069d fe600d00 00e6ff00 00a4069b fe600d00
ffff89f7af1bd000 3647598160 S Ii:1:004:2 -115:8 64 <
ffff89f7af1bd000 3647614060 C Ii:1:004:2 0:8 64 = 30c18000 80000008 80000880 0ca10698 fe5d0dfd ffe7ff01 00a3069a fe5d0dfe
ffff89f7af1bd000 3647614099 S Ii:1:004:2 -115:8 64 <
ffff89f7af1bd000 3647623000 C Ii:1:004:2 0:8 64 = 30c48000 80000008 80000880 0ca2069a fe5e0dff ffe8ff01 00a00698 fe5d0dfe
ffff89f7af1bd000 3647623052 S Ii:1:004:2 -115:8 64 <
ffff89f7af1bd000 3647639756 C Ii:1:004:2 0:8 64 = 30c68000 80000008 80000880 0ca6069c fe5f0dff ffe7ff01 00a6069c fe5f0dff
ffff89f7af1bd000 3647639795 S Ii:1:004:2 -115:8 64 <
ffff89f7af1bd000 3647655739 C Ii:1:004:2 0:8 64 = 30c98000 80000008 80000880 0ca80699 fe5e0dff ffe6ff02 00a8069b fe5f0d00
ffff89f7af1bd000 3647655781 S Ii:1:004:2 -115:8 64 <
ffff89f7af1bd000 3647671922 C Ii:1:004:2 0:8 64 = 30cc8000 80000008 80000880 0ca30699 fe5c0dfe ffe7ff01 00a50698 fe5c0dff
ffff89f7af1bd000 3647671962 S Ii:1:004:2 -115:8 64 <
ffff89f7af1bd000 3647687242 C Ii:1:004:2 0:8 64 = 30d08000 80000008 80000880 0ca1069c fe5e0dff ffe4ff01 00a1069c fe5e0dff
ffff89f7af1bd000 3647687281 S Ii:1:004:2 -115:8 64 <
ffff89f7af1bd000 3647709990 C Ii:1:004:2 0:8 64 = 30d38000 80000008 80000880 0ca4069a fe600d00 00e6ff02 00a4069a fe600d00
ffff89f7af1bd000 3647710029 S Ii:1:004:2 -115:8 64 <
ffff89f7af1bd000 3647726120 C Ii:1:004:2 0:8 64 = 30d88000 80000008 80000880 0ca4069b fe5d0dfd ffe6ff02 00a4069b fe5d0dfd
ffff89f7af1bd000 3647726163 S Ii:1:004:2 -115:8 64 <
ffff89f7af1bd000 3647734081 C Ii:1:004:2 0:8 64 = 30db8000 80000008 80000880 0ca7069c fe5b0dfe ffe7ff01 00a7069c fe5b0dfe
ffff89f7af1bd000 3647734117 S Ii:1:004:2 -115:8 64 <
ffff89f7af1bd000 3647750929 C Ii:1:004:2 0:8 64 = 30dc8000 80000008 80000880 0ca6069b fe5b0d00 00e7ff01 00a7069c fe5b0dfe
ffff89f7af1bd000 3647750982 S Ii:1:004:2 -115:8 64 <
ffff89f7af1bd000 3647766076 C Ii:1:004:2 0:8 64 = 30e08000 80000008 80000880 0ca50698 fe5b0dff ffe5ff02 00a50698 fe5b0dff
ffff89f7af1bd000 3647766116 S Ii:1:004:2 -115:8 64 <
ffff89f7af1bd000 3647782816 C Ii:1:004:2 0:8 64 = 30e38000 80000008 80000880 0ca50699 fe590dfe ffe8ff03 00a50699 fe590dfe
ffff89f7af1bd000 3647782853 S Ii:1:004:2 -115:8 64 <
ffff89f7af1bd000 3647799202 C Ii:1:004:2 0:8 64 = 30e68000 80000008 80000880 0ca4069b fe5a0d00 00e7ff00 00a4069b fe5a0d00
ffff89f7af1bd000 3647799245 S Ii:1:004:2 -115:8 64 <
ffff89f7af1bd000 3647814175 C Ii:1:004:2 0:8 64 = 30e98000 80000008 80000880 0ca40699 fe5a0dff ffe7ff01 00a4069b fe5b0dff
ffff89f7af1bd000 3647814210 S Ii:1:004:2 -115:8 64 <
ffff89f7af1bd000 3647822067 C Ii:1:004:2 0:8 64 = 30ec8000 80000008 80000880 0ca70698 fe5e0dfe ffe6ff03 00a50698 fe5b0dff
ffff89f7af1bd000 3647822107 S Ii:1:004:2 -115:8 64 <
ffff89f7af1bd000 3647838191 C Ii:1:004:2 0:8 64 = 30ee8000 80000008 80000880 0ca70699 fe5e0dfe ffe6ff03 00a70699 fe5e0dfe
ffff89f7af1bd000 3647838229 S Ii:1:004:2 -115:8 64 <
ffff89f7af1bd000 3647862058 C Ii:1:004:2 0:8 64 = 30f18000 80000008 80000880 0ca3069c fe5a0dfe ffe7ff00 00a5069b fe5c0dfe
ffff89f7af1bd000 3647862102 S Ii:1:004:2 -115:8 64 <
ffff89f7af1bd000 3647878102 C Ii:1:004:2 0:8 64 = 30f68000 80000008 80000880 0ca70699 fe5a0d00 00e7ff00 00a70699 fe5a0d00
ffff89f7af1bd000 3647878138 S Ii:1:004:2 -115:8 64 <
ffff89f7af1bd000 3647886194 C Ii:1:004:2 0:8 64 = 30f98000 80000008 80000880 0ca5069a fe5c0dff ffe6ff00 00a60699 fe5a0dff
ffff89f7af1bd000 3647886231 S Ii:1:004:2 -115:8 64 <
ffff89f7af1bd000 3647902194 C Ii:1:004:2 0:8 64 = 30fb8000 80000008 80000880 0ca4069b fe5d0dff ffe6ff01 00a4069b fe5d0dff
ffff89f7af1bd000 3647902244 S Ii:1:004:2 -115:8 64 <
ffff89f7af1bd000 3647919864 C Ii:1:004:2 0:8 64 = 30fe8000 80000008 80000880 0ca70699 fe5a0dfe ffe7ff01 00a70699 fe5a0dfe
ffff89f7af1bd000 3647919905 S Ii:1:004:2 -115:8 64 <
ffff89f7af1bd000 3647935003 C Ii:1:004:2 0:8 64 = 30018000 80000008 80000880 0ca9069a fe5a0dfe ffe7ff01 00a9069a fe5a0dfe
ffff89f7af1bd000 3647935045 S Ii:1:004:2 -115:8 64 <
ffff89f7af1bd000 3647951057 C Ii:1:004:2 0:8 64 = 30048000 80000008 80000880 0ca9069a fe5b0dfe ffe9ff01 00aa0699 fe5b0dfd
ffff89f7af1bd000 3647951111 S Ii:1:004:2 -115:8 64 <
ffff89f7af1bd000 3647967177 C Ii:1:004:2 0:8 64 = 30088000 80000008 80000880 0ca3069b fe5b0dfe ffe6ff01 00a3069b fe5b0dfe
ffff89f7af1bd000 3647967216 S Ii:1:004:2 -115:8 64 <
ffff89f7af1bd000 3647982030 C Ii:1:004:2 0:8 64 = 300b8000 80000008 80000880 0ca40699 fe5b0dff ffe5ff01 00a40699 fe5b0dff
ffff89f7af1bd000 3647982068 S Ii:1:004:2 -115:8 64 <
ffff89f7af1bd000 3648006056 C Ii:1:004:2 0:8 64 = 300e8000 80000008 80000880 0ca50696 fe5e0dff ffe6ff01 00a50696 fe5e0dff
ffff89f7af1bd000 3648006097 S Ii:1:004:2 -115:8 64 <
ffff89f7af1bd000 3648022104 C Ii:1:004:2 0:8 64 = 30138000 80000008 80000880 0ca60697 fe590dff ffe9ff02 00a60697 fe590dff
ffff89f7af1bd000 3648022115 S Ii:1:004:2 -115:8 64 <
ffff89f7af1bd000 3648039299 C Ii:1:004:2 0:8 64 = 30168000 80000008 80000880 0ca10698 fe5b0dff ffe6ff01 00a10698 fe5b0dff
ffff89f7af1bd000 3648039343 S Ii:1:004:2 -115:8 64 <
ffff89f7af1bd000 3648055997 C Ii:1:004:2 0:8 64 = 30198000 80000008 80000880 0ca5069b fe590dff ffe7ff00 00a3069a fe5a0dfe
ffff89f7af1bd000 3648056036 S Ii:1:004:2 -115:8 64 <
ffff89f7af1bd000 3648070182 C Ii:1:004:2 0:8 64 = 301c8000 80000008 80000880 0ca7069b fe5a0dff ffe5ff01 00a7069a fe590d00
ffff89f7af1bd000 3648070219 S Ii:1:004:2 -115:8 64 <
ffff89f7af1bd000 3648087517 C Ii:1:004:2 0:8 64 = 30208000 80000008 80000880 0ca8069e fe5a0dfe ffe6ff02 00a8069e fe5a0dfe
ffff89f7af1bd000 3648087558 S Ii:1:004:2 -115:8 64 <
ffff89f7af1bd000 3648110216 C Ii:1:004:2 0:8 64 = 30238000 80000008 80000880 0ca8069c fe5b0dfe ffe6ff01 00a8069c fe5b0dfe
ffff89f7af1bd000 3648110259 S Ii:1:004:2 -115:8 64 <
ffff89f7af1bd000 3648120122 C Ii:1:004:2 0:8 64 = 30288000 80000008 80000880 0ca4069a fe5d0dff ffe7ff01 00a4069a fe5d0dff
ffff89f7af1bd000 3648120173 S Ii:1:004:2 -115:8 64 <
ffff89f7af1bd000 3648142190 C Ii:1:004:2 0:8 64 = 30298000 80000008 80000880 0ca50698 fe5c0dff ffe7ff01 00a4069a fe5d0dff
ffff89f7af1bd000 3648142232 S Ii:1:004:2 -115:8 64 <
ffff89f7af1bd000 3648151610 C Ii:1:004:2 0:8 64 = 302e8000 80000008 80000880 0ca5069b fe580d00 00e6ff00 00a5069b fe580d00
ffff89f7af1bd000 3648151652 S Ii:1:004:2 -115:8 64 <
ffff89f7af1bd000 3648174066 C Ii:1:004:2 0:8 64 = 30308000 80000008 80000880 0ca4069c fe590dff ffe7ff01 00a4069c fe590dff
ffff89f7af1bd000 3648174110 S Ii:1:004:2 -115:8 64 <
ffff89f7af1bd000 3648182060 C Ii:1:004:2 0:8 64 = 30348000 80000008 80000880 0ca6069d fe5c0dff ffe6ff02 00a5069d fe5c0dff
ffff89f7af1bd000 3648182096 S Ii:1:004:2 -115:8 64 <
ffff89f7af1bd000 3648206233 C Ii:1:004:2 0:8 64 = 30368000 80000008 80000880 0ca7069d fe5b0d00 00e6ff02 00a7069d fe5b0d00
ffff89f7af1bd000 3648206284 S Ii:1:004:2 -115:8 64 <
ffff89f7af1bd000 3648215730 C Ii:1:004:2 0:8 64 = 303b8000 80000008 80000880 0ca6069e fe5d0d00 00e6ff02 00a6069e fe5d0d00
ffff89f7af1bd000 3648215778 S Ii:1:004:2 -115:8 64 <
ffff89f7af1bd000 3648230131 C Ii:1:004:2 0:8 64 = 303c8000 80000008 80000880 0ca5069b fe5b0d00 00e5ff01 00a6069e fe5d0d00
ffff89f7af1bd000 3648230175 S Ii:1:004:2 -115:8 64 <
ffff89f7af1bd000 3648246186 C Ii:1:004:2 0:8 64 = 30408000 80000008 80000880 0ca40697 fe5b0d00 00e7ff02 00a40697 fe5b0d00
ffff89f7af1bd000 3648246223 S Ii:1:004:2 -115:8 64 <
ffff89f7af1bd000 3648261991 C Ii:1:004:2 0:8 64 = 30438000 80000008 80000880 0ca10699 fe5c0dff ffe5ff02 00a10699 fe5c0dff
ffff89f7af1bd000 3648262030 S Ii:1:004:2 -115:8 64 <
ffff89f7af1bd000 3648279678 C Ii:1:004:2 0:8 64 = 30468000 80000008 80000880 0ca4069b fe5b0dff ffe6ff03 00a4069b fe5b0dff
ffff89f7af1bd000 3648279714 S Ii:1:004:2 -115:8 64 <
ffff89f7af1bd000 3648296156 C Ii:1:004:2 0:8 64 = 30498000 80000008 80000880 0ca30698 fe5c0dff ffe6ff02 00a50699 fe5b0dff
ffff89f7af1bd000 3648296200 S Ii:1:004:2 -115:8 64 <
ffff89f7af1bd000 3648311030 C Ii:1:004:2 0:8 64 = 304c8000 80000008 80000880 0ca2069b fe5b0dff ffe7ff02 00a20699 fe5d0dff
ffff89f7af1bd000 3648311081 S Ii:1:004:2 -115:8 64 <
ffff89f7af1bd000 3648326038 C Ii:1:004:2 0:8 64 = 30508000 80000008 80000880 0ca7069e fe590d00 00e8ff02 00a7069e fe590d00
ffff89f7af1bd000 3648326082 S Ii:1:004:2 -115:8 64 <
ffff89f7af1bd000 3648342221 C Ii:1:004:2 0:8 64 = 30538000 80000008 80000880 0ca6069d fe5c0d00 00e7ff01 00a6069d fe5c0d00
ffff89f7af1bd000 3648342258 S Ii:1:004:2 -115:8 64 <
ffff89f7af1bd000 3648359409 C Ii:1:004:2 0:8 64 = 30568000 80000008 80000880 0ca40698 fe5e0dff ffe8ff01 00a40698 fe5e0dff
ffff89f7af1bd000 3648359453 S Ii:1:004:2 -115:8 64 <
ffff89f7af1bd000 3648374071 C Ii:1:004:2 0:8 64 = 30598000 80000008 80000880 0ca40696 fe600d00 00e7ff01 00a30696 fe5f0d00
ffff89f7af1bd000 3648374107 S Ii:1:004:2 -115:8 64 <
ffff89f7af1bd000 3648392582 C Ii:1:004:2 0:8 64 = 305c8000 80000008 80000880 0ca10697 fe5a0dfe ffe8ff01 00a30695 fe5e0d00
ffff89f7af1bd000 3648392625 S Ii:1:004:2 -115:8 64 <
ffff89f7af1bd000 3648414171 C Ii:1:004:2 0:8 64 = 30608000 80000008 80000880 0ca4069b fe560dff ffe8ff02 00a4069b fe560dff
ffff89f7af1bd000 3648414213 S Ii:1:004:2 -115:8 64 <
ffff89f7af1bd000 3648430071 C Ii:1:004:2 0:8 64 = 30648000 80000008 80000880 0ca50698 fe5c0dfe ffe6ff01 00a40697 fe5c0dfe
ffff89f7af1bd000 3648430114 S Ii:1:004:2 -115:8 64 <
ffff89f7af1bd000 3648438002 C Ii:1:004:2 0:8 64 = 30688000 80000008 80000880 0ca4069c fe5d0dfe ffe6ff02 00a4069c fe5d0dfe
ffff89f7af1bd000 3648438042 S Ii:1:004:2 -115:8 64 <
ffff89f7af1bd000 3648454048 C Ii:1:004:2 0:8 64 = 30698000 80000008 80000880 0ca3069c fe5e0d00 00e8ff02 00a4069c fe5d0dfe
ffff89f7af1bd000 3648454090 S Ii:1:004:2 -115:8 64 <
ffff89f7af1bd000 3648471782 C Ii:1:004:2 0:8 64 = 306c8000 80000008 80000880 0ca6069a fe5d0dff ffe6ff00 00a3069c fe5e0d00
ffff89f7af1bd000 3648471831 S Ii:1:004:2 -115:8 64 <
ffff89f7af1bd000 3648488178 C Ii:1:004:2 0:8 64 = 30708000 80000008 80000880 0ca50699 fe5c0dfd ffe6ff00 00a50699 fe5c0dfd
ffff89f7af1bd000 3648488230 S Ii:1:004:2 -115:8 64 <
ffff89f7af1bd000 3648503132 C Ii:1:004:2 0:8 64 = 30738000 80000008 80000880 0ca20699 fe5e0dff ffe7ff02 00a20699 fe5e0dff
ffff89f7af1bd000 3648503169 S Ii:1:004:2 -115:8 64 <
ffff89f7af1bd000 3648519540 C Ii:1:004:2 0:8 64 = 30768000 80000008 80000880 0ca1069a fe5e0d00 00e8ff01 00a1069a fe5e0d00
ffff89f7af1bd000 3648519581 S Ii:1:004:2 -115:8 64 <
ffff89f7af1bd000 3648542102 C Ii:1:004:2 0:8 64 = 30798000 80000008 80000880 0ca50699 fe5b0dff ffe6ff01 00a3069a fe5c0d00
ffff89f7af1bd000 3648542145 S Ii:1:004:2 -115:8 64 <
ffff89f7af1bd000 3648558070 C Ii:1:004:2 0:8 64 = 307e8000 80000008 80000880 0ca4069c fe5e0dfe ffe8ff01 00a4069c fe5e0dfe
ffff89f7af1bd000 3648558119 S Ii:1:004:2 -115:8 64 <
ffff89f7af1bd000 3648565939 C Ii:1:004:2 0:8 64 = 30818000 80000008 80000880 0ca2069c fe5a0dff ffe6ff01 00a2069e fe5c0dfe
ffff89f7af1bd000 3648565977 S Ii:1:004:2 -115:8 64 <
ffff89f7af1bd000 3648582699 C Ii:1:004:2 0:8 64 = 30838000 80000008 80000880 0ca4069a fe5a0dff ffe5ff00 00a4069a fe5a0dff
ffff89f7af1bd000 3648582741 S Ii:1:004:2 -115:8 64 <
ffff89f7af1bd000 3648598190 C Ii:1:004:2 0:8 64 = 30868000 80000008 80000880 0ca5069c fe5a0dff ffe8ff01 00a5069c fe5a0dff
ffff89f7af1bd000 3648598230 S Ii:1:004:2 -115:8 64 <
ffff89f7af1bd000 3648615715 C Ii:1:004:2 0:8 64 = 30898000 80000008 80000880 0ca5069b fe590dff ffe8ff01 00a4069d fe590dff
ffff89f7af1bd000 3648615755 S Ii:1:004:2 -115:8 64 <
ffff89f7af1bd000 3648631867 C Ii:1:004:2 0:8 64 = 308c8000 80000008 80000880 0ca5069b fe5c0d00 00e8ff01 00a5069a fe5a0dff
ffff89f7af1bd000 3648631911 S Ii:1:004:2 -115:8 64 <
ffff89f7af1bd000 3648648082 C Ii:1:004:2 0:8 64 = 30908000 80000008 80000880 0ca2069a fe5d0dfe ffe6ff02 00a2069a fe5d0dfe
ffff89f7af1bd000 3648648117 S Ii:1:004:2 -115:8 64 <
ffff89f7af1bd000 3648661957 C Ii:1:004:2 0:8 64 = 30938000 80000008 80000880 0ca6069a fe5d0dfe ffe7ff03 00a6069a fe5d0dfe
ffff89f7af1bd000 3648661995 S Ii:1:004:2 -115:8 64 <
ffff89f7af1bd000 3648679509 C Ii:1:004:2 0:8 64 = 30968000 80000008 80000880 0ca60699 fe5b0dff ffe5ff01 00a60699 fe5b0dff
ffff89f7af1bd000 3648679556 S Ii:1:004:2 -115:8 64 <
ffff89f7af1bd000 3648693963 C Ii:1:004:2 0:8 64 = 30998000 80000008 80000880 0ca10697 fe5a0dfe ffe7ff02 00a30698 fe590dff
ffff89f7af1bd000 3648694010 S Ii:1:004:2 -115:8 64 <
ffff89f7af1bd000 3648711847 C Ii:1:004:2 0:8 64 = 309c8000 80000008 80000880 0ca00698 fe5c0dff ffe7ff03 00a00696 fe5b0dfe
ffff89f7af1bd000 3648711886 S Ii:1:004:2 -115:8 64 <
ffff89f7af1bd000 3648734049 C Ii:1:004:2 0:8 64 = 30a08000 80000008 80000880 0ca5069a fe5b0dff ffe6ff01 00a5069a fe5b0dff
ffff89f7af1bd000 3648734106 S Ii:1:004:2 -115:8 64 <
ffff89f7af1bd000 3648749956 C Ii:1:004:2 0:8 64 = 30a48000 80000008 80000880 0ca20698 fe5d0dfe ffe7ff01 00a40698 fe5e0dfd
ffff89f7af1bd000 3648749994 S Ii:1:004:2 -115:8 64 <
ffff89f7af1bd000 3648768409 C Ii:1:004:2 0:8 64 = 30a88000 80000008 80000880 0ca00699 fe580d00 00e8ff01 00a00699 fe580d00
ffff89f7af1bd000 3648768451 S Ii:1:004:2 -115:8 64 <
ffff89f7af1bd000 3648774012 C Ii:1:004:2 0:8 64 = 30ab8000 80000008 80000880 0ca30699 fe5b0dff ffe6ff02 00a30699 fe5b0dff
ffff89f7af1bd000 3648774060 S Ii:1:004:2 -115:8 64 <
ffff89f7af1bd000 3648800085 C Ii:1:004:2 0:8 64 = 30ac8000 80000008 80000880 0ca50698 fe5d0dff ffe5ff02 00a30699 fe5b0dff
ffff89f7af1bd000 3648800130 S Ii:1:004:2 -115:8 64 <
ffff89f7af1bd000 3648808001 C Ii:1:004:2 0:8 64 = 30b18000 80000008 80000880 0ca5069b fe5b0dff ffe7ff01 00a70699 fe5b0dff
ffff89f7af1bd000 3648808037 S Ii:1:004:2 -115:8 64 <
ffff89f7af1bd000 3648823008 C Ii:1:004:2 0:8 64 = 30b38000 80000008 80000880 0ca4069d fe5e0dff ffe6ff02 00a4069d fe5e0dff
ffff89f7af1bd000 3648823052 S Ii:1:004:2 -115:8 64 <
ffff89f7af1bd000 3648839296 C Ii:1:004:2 0:8 64 = 30b68000 80000008 80000880 0ca4069c fe620dff ffe7ff01 00a4069c fe620dff
ffff89f7af1bd000 3648839336 S Ii:1:004:2 -115:8 64 <
ffff89f7af1bd000 3648854683 C Ii:1:004:2 0:8 64 = 30b98000 80000008 80000880 0ca6069a fe5e0dff ffe6ff01 00a6069b fe600dff
ffff89f7af1bd000 3648854720 S Ii:1:004:2 -115:8 64 <
ffff89f7af1bd000 3648870137 C Ii:1:004:2 0:8 64 = 30bc8000 80000008 80000880 0ca20698 fe5c0dff ffe7ff03 00a40699 fe5c0dff
ffff89f7af1bd000 3648870176 S Ii:1:004:2 -115:8 64 <
ffff89f7af1bd000 3648887651 C Ii:1:004:2 0:8 64 = 30c08000 80000008 80000880 0ca50696 fe5a0d00 00e7ff01 00a50696 fe5a0d00
ffff89f7af1bd000 3648887695 S Ii:1:004:2 -115:8 64 <
ffff89f7af1bd000 3648902689 C Ii:1:004:2 0:8 64 = 30c38000 80000008 80000880 0ca40697 fe590d00 00e5ff00 00a40697 fe590d00
ffff89f7af1bd000 3648902733 S Ii:1:004:2 -115:8 64 <
ffff89f7af1bd000 3648918018 C Ii:1:004:2 0:8 64 = 30c68000 80000008 80000880 0ca5069a fe5b0d00 00e7ff02 00a5069a fe5b0d00
ffff89f7af1bd000 3648918060 S Ii:1:004:2 -115:8 64 <
ffff89f7af1bd000 3648935417 C Ii:1:004:2 0:8 64 = 30c98000 80000008 80000880 0ca4069a fe570dff ffe5ff02 00a5069a fe580d00
ffff89f7af1bd000 3648935457 S Ii:1:004:2 -115:8 64 <
ffff89f7af1bd000 3648950029 C Ii:1:004:2 0:8 64 = 30cc8000 80000078 7e000880 0ca2069a fe5d0dff ffe7ff02 00a3069b fe5a0dff
ffff89f7af1bd000 3648950070 S Ii:1:004:2 -115:8 64 <
ffff89f7af1bd000 3648966166 C Ii:1:004:2 0:8 64 = 30d08000 8000f777 7d000880 0ca70698 fe5a0dfe ffe6ff01 00a70698 fe5a0dfe
ffff89f7af1bd000 3648966243 S Ii:1:004:2 -115:8 64 <
ffff89f7af1bd000 3648982032 C Ii:1:004:2 0:8 64 = 30d38000 8000f777 7c000880 0ca80698 fe5a0dff ffe6ff02 00a80698 fe5a0dff
ffff89f7af1bd000 3648982067 S Ii:1:004:2 -115:8 64 <
ffff89f7af1bd000 3648998765 C Ii:1:004:2 0:8 64 = 30d68000 8000f777 79000880 0ca7069b fe5b0dfe ffe8ff01 00a7069b fe5b0dfe
ffff89f7af1bd000 3648998807 S Ii:1:004:2 -115:8 64 <
ffff89f7af1bd000 3649014152 C Ii:1:004:2 0:8 64 = 30d98000 8000f767 75000880 0ca8069b fe5c0dfd ffe6ff01 00a8069c fe5c0dfd
ffff89f7af1bd000 3649014188 S Ii:1:004:2 -115:8 64 <
ffff89f7af1bd000 3649031918 C Ii:1:004:2 0:8 64 = 30dc8000 8000e767 72000880 0ca40697 fe5d0dfd ffe8ff01 00a7069a fe5c0dfd
ffff89f7af1bd000 3649031963 S Ii:1:004:2 -115:8 64 <
ffff89f7af1bd000 3649047530 C Ii:1:004:2 0:8 64 = 30e08000 8000e767 70000880 0ca1069a fe5e0dfd ffe7ff01 00a1069a fe5e0dfd
ffff89f7af1bd000 3649047564 S Ii:1:004:2 -115:8 64 <
ffff89f7af1bd000 3649061954 C Ii:1:004:2 0:8 64 = 30e38000 8000e767 6f000880 0ca6069c fe570dfe ffe8ff01 00a6069c fe570dfe
ffff89f7af1bd000 3649061993 S Ii:1:004:2 -115:8 64 <
ffff89f7af1bd000 3649079008 C Ii:1:004:2 0:8 64 = 30e68000 8000e767 6f000880 0ca60697 fe590dfe ffe9ff01 00a60697 fe590dfe
ffff89f7af1bd000 3649079044 S Ii:1:004:2 -115:8 64 <
ffff89f7af1bd000 3649094029 C Ii:1:004:2 0:8 64 = 30e98000 8000d767 70000880 0ca30699 fe5d0dff ffe9ff01 00a40698 fe5d0dff
ffff89f7af1bd000 3649094076 S Ii:1:004:2 -115:8 64 <
ffff89f7af1bd000 3649110878 C Ii:1:004:2 0:8 64 = 30ec8000 8000b767 71000880 0ca60699 fe5b0dff ffe8ff01 00a5069a fe5c0dff
ffff89f7af1bd000 3649110915 S Ii:1:004:2 -115:8 64 <
ffff89f7af1bd000 3649126015 C Ii:1:004:2 0:8 64 = 30f08000 80008767 73000880 0ca7069f fe5c0dff ffe8ff00 00a7069f fe5c0dff
ffff89f7af1bd000 3649126057 S Ii:1:004:2 -115:8 64 <
ffff89f7af1bd000 3649142143 C Ii:1:004:2 0:8 64 = 30f38000 80005667 75000880 0cab069c fe5a0dff ffe8ff01 00ab069c fe5a0dff
ffff89f7af1bd000 3649142177 S Ii:1:004:2 -115:8 64 <
ffff89f7af1bd000 3649160065 C Ii:1:004:2 0:8 64 = 30f68000 80005677 78000880 0ca7069b fe5e0dff ffe8ff02 00a7069b fe5e0dff
ffff89f7af1bd000 3649160111 S Ii:1:004:2 -115:8 64 <
ffff89f7af1bd000 3649175001 C Ii:1:004:2 0:8 64 = 30f98000 80005677 7b000880 0ca3069c fe5e0dfe ffe8ff01 00a4069b fe5e0dfe
ffff89f7af1bd000 3649175045 S Ii:1:004:2 -115:8 64 <
ffff89f7af1bd000 3649190028 C Ii:1:004:2 0:8 64 = 30fc8000 80006677 7e000880 0ca20699 fe5c0dfd ffe8ff02 00a2069a fe5e0dfd
ffff89f7af1bd000 3649190076 S Ii:1:004:2 -115:8 64 <
ffff89f7af1bd000 3649206665 C Ii:1:004:2 0:8 64 = 30008000 80006677 80000880 0c9f0699 fe5e0dfe ffe7ff02 009f0699 fe5e0dfe
ffff89f7af1bd000 3649206709 S Ii:1:004:2 -115:8 64 <
ffff89f7af1bd000 3649222008 C Ii:1:004:2 0:8 64 = 30038000 80004677 85000880 0ca10698 fe5d0dfd ffe7ff01 00a10698 fe5d0dfd
ffff89f7af1bd000 3649222047 S Ii:1:004:2 -115:8 64 <
ffff89f7af1bd000 3649240063 C Ii:1:004:2 0:8 64 = 30068000 80003687 89000880 0ca1069b fe580dfd ffe7ff01 00a1069b fe580dfd
ffff89f7af1bd000 3649240105 S Ii:1:004:2 -115:8 64 <
ffff89f7af1bd000 3649254055 C Ii:1:004:2 0:8 64 = 30098000 80002687 8e000880 0ca4069b fe5c0dff ffe8ff02 00a3069b fe5a0dfe
ffff89f7af1bd000 3649254099 S Ii:1:004:2 -115:8 64 <
ffff89f7af1bd000 3649270153 C Ii:1:004:2 0:8 64 = 300c8000 80002687 91000880 0ca3069c fe5f0dff ffe8ff02 00a4069b fe5f0dff
ffff89f7af1bd000 3649270193 S Ii:1:004:2 -115:8 64 <
ffff89f7af1bd000 3649285981 C Ii:1:004:2 0:8 64 = 30108000 80002687 92000880 0ca0069b fe5d0dfe ffe6ff01 00a0069b fe5d0dfe
ffff89f7af1bd000 3649286021 S Ii:1:004:2 -115:8 64 <
ffff89f7af1bd000 3649302134 C Ii:1:004:2 0:8 64 = 30138000 80001687 93000880 0ca60698 fe5e0d00 00e4ff01 00a60698 fe5e0d00
ffff89f7af1bd000 3649302172 S Ii:1:004:2 -115:8 64 <
ffff89f7af1bd000 3649320303 C Ii:1:004:2 0:8 64 = 30168000 80001687 93000880 0ca5069b fe5e0d00 00e5ff01 00a5069b fe5e0d00
ffff89f7af1bd000 3649320343 S Ii:1:004:2 -115:8 64 <
ffff89f7af1bd000 3649335807 C Ii:1:004:2 0:8 64 = 30198000 80002687 92000880 0ca4069b fe5c0d00 00e5ff01 00a4069b fe5e0d00
ffff89f7af1bd000 3649335847 S Ii:1:004:2 -115:8 64 <
ffff89f7af1bd000 3649358042 C Ii:1:004:2 0:8 64 = 301c8000 80002687 90000880 0ca4069c fe5c0d00 00e4ff02 00a4069b fe5c0d00
ffff89f7af1bd000 3649358085 S Ii:1:004:2 -115:8 64 <
ffff89f7af1bd000 3649367947 C Ii:1:004:2 0:8 64 = 30218000 8000c777 82000880 0cac06a1 fe5a0dff ffe8ff00 00ac06a0 fe5b0dff
ffff89f7af1bd000 3649367982 S Ii:1:004:2 -115:8 64 <
ffff89f7af1bd000 3649389951 C Ii:1:004:2 0:8 64 = 30238000 80000008 80000880 0c9f0696 fe580dfe ffe6ffff ff9f0696 fe580dfe
ffff89f7af1bd000 3649389993 S Ii:1:004:2 -115:8 64 <
ffff89f7af1bd000 3649399077 C Ii:1:004:2 0:8 64 = 30288000 80000008 80000880 0ca20698 fe5c0d02 00e5ff01 00a20698 fe5c0d02
ffff89f7af1bd000 3649399118 S Ii:1:004:2 -115:8 64 <
ffff89f7af1bd000 3649415212 C Ii:1:004:2 0:8 64 = 30298000 80000078 7e000880 0ca20699 fe5f0d02 00e5ff02 00a20698 fe5c0d02
ffff89f7af1bd000 3649415255 S Ii:1:004:2 -115:8 64 <
ffff89f7af1bd000 3649431457 C Ii:1:004:2 0:8 64 = 302c8000 8000f777 79000880 0ca70692 fe5b0d01 00e6ff01 00a40696 fe5d0d01
ffff89f7af1bd000 3649431500 S Ii:1:004:2 -115:8 64 <
ffff89f7af1bd000 3649455984 C Ii:1:004:2 0:8 64 = 30308000 8000e767 74000880 0ca40695 fe5a0d00 00e8ff02 00a40695 fe5a0d00
ffff89f7af1bd000 3649456032 S Ii:1:004:2 -115:8 64 <
ffff89f7af1bd000 3649462889 C Ii:1:004:2 0:8 64 = 30348000 8000c767 6f000880 0ca60699 fe610dff ffe5ff01 00a3069a fe600dff
ffff89f7af1bd000 3649462928 S Ii:1:004:2 -115:8 64 <
ffff89f7af1bd000 3649479505 C Ii:1:004:2 0:8 64 = 30368000 8000b767 6d000880 0ca9069b fe5e0dff ffe7ff00 00a9069b fe5e0dff
ffff89f7af1bd000 3649479540 S Ii:1:004:2 -115:8 64 <
ffff89f7af1bd000 3649501948 C Ii:1:004:2 0:8 64 = 30398000 8000a767 6b000880 0ca606a0 fe5c0d00 00e7ff00 00a9069f fe5d0d00
ffff89f7af1bd000 3649501986 S Ii:1:004:2 -115:8 64 <
ffff89f7af1bd000 3649511912 C Ii:1:004:2 0:8 64 = 303e8000 8000a767 6b000880 0ca40698 fe570d01 00e8ff01 00a40698 fe570d01
ffff89f7af1bd000 3649511968 S Ii:1:004:2 -115:8 64 <
ffff89f7af1bd000 3649533896 C Ii:1:004:2 0:8 64 = 30408000 8000a767 6b000880 0ca6069a fe580d01 00e8ff00 00a6069a fe580d01
ffff89f7af1bd000 3649533937 S Ii:1:004:2 -115:8 64 <
ffff89f7af1bd000 3649549877 C Ii:1:004:2 0:8 64 = 30448000 8000a767 6b000880 0ca0069a fe5c0dfe ffe8ff02 00a3069a fe5d0dff
ffff89f7af1bd000 3649549913 S Ii:1:004:2 -115:8 64 <
ffff89f7af1bd000 3649565889 C Ii:1:004:2 0:8 64 = 30488000 8000a767 6b000880 0c9f0699 fe5c0d00 00e7ff01 009f0699 fe5c0d00
ffff89f7af1bd000 3649565928 S Ii:1:004:2 -115:8 64 <
ffff89f7af1bd000 3649582581 C Ii:1:004:2 0:8 64 = 304b8000 8000a767 6f000880 0ca20697 fe5d0d00 00e7ff01 00a20697 fe5d0d00
ffff89f7af1bd000 3649582621 S Ii:1:004:2 -115:8 64 <
ffff89f7af1bd000 3649597910 C Ii:1:004:2 0:8 64 = 304e8000 8000b767 73000880 0ca5069b fe5d0dff ffe7ff02 00a5069b fe5d0dff
ffff89f7af1bd000 3649597950 S Ii:1:004:2 -115:8 64 <
ffff89f7af1bd000 3649613907 C Ii:1:004:2 0:8 64 = 30518000 8000b777 78000880 0ca4069b fe5b0dff ffe7ff01 00a5069c fe5c0dff
ffff89f7af1bd000 3649613942 S Ii:1:004:2 -115:8 64 <
ffff89f7af1bd000 3649632030 C Ii:1:004:2 0:8 64 = 30548000 8000c777 7b000880 0ca40697 fe5c0dff ffe7ff02 00a40699 fe5a0dff
ffff89f7af1bd000 3649632072 S Ii:1:004:2 -115:8 64 <
ffff89f7af1bd000 3649645892 C Ii:1:004:2 0:8 64 = 30588000 8000d777 7c000880 0ca00696 fe5e0dff ffe7ff03 00a00696 fe5e0dff
ffff89f7af1bd000 3649645930 S Ii:1:004:2 -115:8 64 <
ffff89f7af1bd000 3649672823 C Ii:1:004:2 0:8 64 = 305b8000 8000e777 7e000880 0ca50698 fe5d0dff ffe7ff01 00a50698 fe5d0dff
ffff89f7af1bd000 3649672864 S Ii:1:004:2 -115:8 64 <
ffff89f7af1bd000 3649685942 C Ii:1:004:2 0:8 64 = 30608000 8000e777 7e000880 0ca4069d fe5c0dff ffe7ff00 00a4069d fe5c0dff
ffff89f7af1bd000 3649685984 S Ii:1:004:2 -115:8 64 <
ffff89f7af1bd000 3649701954 C Ii:1:004:2 0:8 64 = 30638000 8000e777 7e000880 0ca4069a fe5e0d00 00e4ff02 00a4069a fe5e0d00
ffff89f7af1bd000 3649701992 S Ii:1:004:2 -115:8 64 <
ffff89f7af1bd000 3649710885 C Ii:1:004:2 0:8 64 = 30668000 8000f707 80000880 0ca7069e fe5e0dfe ffe7ff01 00a7069e fe5e0dfe
ffff89f7af1bd000 3649710921 S Ii:1:004:2 -115:8 64 <
ffff89f7af1bd000 3649733965 C Ii:1:004:2 0:8 64 = 30688000 80000008 80000880 0ca5069d fe5d0dfe ffe9ff01 00a5069d fe5d0dfe
ffff89f7af1bd000 3649734009 S Ii:1:004:2 -115:8 64 <
ffff89f7af1bd000 3649742119 C Ii:1:004:2 0:8 64 = 306c8000 80000008 80000880 0c9c0697 fe5a0d00 00e5ff01 00a00695 fe5a0d01
ffff89f7af1bd000 3649742154 S Ii:1:004:2 -115:8 64 <
ffff89f7af1bd000 3649758820 C Ii:1:004:2 0:8 64 = 306e8000 80000008 80000880 0c9c069c fe5c0dff ffe5ff01 009c069c fe5c0dff
ffff89f7af1bd000 3649758866 S Ii:1:004:2 -115:8 64 <
ffff89f7af1bd000 3649774853 C Ii:1:004:2 0:8 64 = 30718000 80000008 80000880 0ca0069e fe5b0dfe ffe7ff01 009f069f fe5d0dff
ffff89f7af1bd000 3649774889 S Ii:1:004:2 -115:8 64 <
ffff89f7af1bd000 3649791344 C Ii:1:004:2 0:8 64 = 30748000 80000008 80000880 0c9f0699 fe5b0dff ffe8ff01 009f069c fe590dfe
ffff89f7af1bd000 3649791388 S Ii:1:004:2 -115:8 64 <
ffff89f7af1bd000 3649805873 C Ii:1:004:2 0:8 64 = 30788000 80000008 80000880 0ca30697 fe5c0dfe ffe8ff00 00a30697 fe5c0dfe
ffff89f7af1bd000 3649805910 S Ii:1:004:2 -115:8 64 <
ffff89f7af1bd000 3649821972 C Ii:1:004:2 0:8 64 = 307b8000 80000008 80000880 0ca8069b fe5c0dfe ffe9ffff ffa8069b fe5c0dfe
ffff89f7af1bd000 3649822017 S Ii:1:004:2 -115:8 64 <
ffff89f7af1bd000 3649837900 C Ii:1:004:2 0:8 64 = 307e8000 80000008 80000880 0cb30696 fe520dff ffe6ff01 00b30696 fe520dff
ffff89f7af1bd000 3649837939 S Ii:1:004:2 -115:8 64 <
ffff89f7af1bd000 3649855910 C Ii:1:004:2 0:8 64 = 30818000 80000008 80000880 0cbc06a8 fe4f0dfe ffe8ff01 00c2069a fe4a0dfe
ffff89f7af1bd000 3649855950 S Ii:1:004:2 -115:8 64 <
ffff89f7af1bd000 3649877957 C Ii:1:004:2 0:8 64 = 30848000 80000008 80000880 0c9d06bf fe640dff ffe6ff00 00a506be fe5e0dfe
ffff89f7af1bd000 3649877998 S Ii:1:004:2 -115:8 64 <
ffff89f7af1bd000 3649885985 C Ii:1:004:2 0:8 64 = 30898000 80000008 80000880 0cb2067f fe540d00 00e9ff03 00b40685 fe520d00
ffff89f7af1bd000 3649886020 S Ii:1:004:2 -115:8 64 <
ffff89f7af1bd000 3649901911 C Ii:1:004:2 0:8 64 = 308b8000 80000008 80000880 0c9e0689 fe600d00 00e8ff03 009e0689 fe600d00
ffff89f7af1bd000 3649901952 S Ii:1:004:2 -115:8 64 <
ffff89f7af1bd000 3649917970 C Ii:1:004:2 0:8 64 = 308e8000 80000008 80000880 0c8a068d fe630d00 00e5ff03 008a068d fe630d00
ffff89f7af1bd000 3649918014 S Ii:1:004:2 -115:8 64 <
ffff89f7af1bd000 3649934690 C Ii:1:004:2 0:8 64 = 30918000 80000008 80000880 0ca40684 fe5b0d01 00e7ff04 00950685 fe5d0d01
ffff89f7af1bd000 3649934752 S Ii:1:004:2 -115:8 64 <
ffff89f7af1bd000 3649952541 C Ii:1:004:2 0:8 64 = 30948000 80000008 80000880 0c9a069a fe610dff ffe7ff01 00a2068f fe5d0d00
ffff89f7af1bd000 3649952585 S Ii:1:004:2 -115:8 64 <
ffff89f7af1bd000 3649973863 C Ii:1:004:2 0:8 64 = 30988000 80000008 80000880 0c9b06a4 fe630dff ffe7ff02 009b06a4 fe630dff
ffff89f7af1bd000 3649973902 S Ii:1:004:2 -115:8 64 <
ffff89f7af1bd000 3649982025 C Ii:1:004:2 0:8 64 = 309c8000 80000008 80000880 0cb106a3 fe570d00 00e6ff02 00b106a0 fe580d00
ffff89f7af1bd000 3649982059 S Ii:1:004:2 -115:8 64 <
ffff89f7af1bd000 3650005926 C Ii:1:004:2 0:8 64 = 309e8000 80000008 80000880 0cac06a7 fe5c0dff ffe7ff01 00ac06a7 fe5c0dff
ffff89f7af1bd000 3650005964 S Ii:1:004:2 -115:8 64 <
ffff89f7af1bd000 3650014794 C Ii:1:004:2 0:8 64 = 30a38000 80000008 80000880 0ca60697 fe5c0dff ffe8ff02 00a60697 fe5c0dff
ffff89f7af1bd000 3650014831 S Ii:1:004:2 -115:8 64 <
ffff89f7af1bd000 3650038087 C Ii:1:004:2 0:8 64 = 30a48000 80000008 80000880 0ca60692 fe5c0dff ffe8ff02 00a60697 fe5c0dff
ffff89f7af1bd000 3650038127 S Ii:1:004:2 -115:8 64 <
ffff89f7af1bd000 3650047032 C Ii:1:004:2 0:8 64 = 30a98000 80000008 80000880 0c9f0699 fe630dff ffe6ff00 00a00694 fe630dfe
ffff89f7af1bd000 3650047068 S Ii:1:004:2 -115:8 64 <
ffff89f7af1bd000 3650061952 C Ii:1:004:2 0:8 64 = 30ab8000 80000008 80000880 0ca1069d fe600dfe ffe7ff00 00a1069d fe600dfe
ffff89f7af1bd000 3650061993 S Ii:1:004:2 -115:8 64 <
ffff89f7af1bd000 3650080382 C Ii:1:004:2 0:8 64 = 30ae8000 80000008 80000880 0caa069a fe5b0dfe ffe7ff01 00aa069a fe5b0dfe
ffff89f7af1bd000 3650080421 S Ii:1:004:2 -115:8 64 <
ffff89f7af1bd000 3650094757 C Ii:1:004:2 0:8 64 = 30b18000 80000008 80000880 0ca2069c fe5c0dfd ffe7ff01 00a70699 fe5c0dfd
ffff89f7af1bd000 3650094802 S Ii:1:004:2 -115:8 64 <
ffff89f7af1bd000 3650111053 C Ii:1:004:2 0:8 64 = 30b48000 80000008 80000880 0ca2069f fe5b0dff ffe8ff02 009f06a0 fe5a0dfe
ffff89f7af1bd000 3650111102 S Ii:1:004:2 -115:8 64 <
ffff89f7af1bd000 3650133954 C Ii:1:004:2 0:8 64 = 30b88000 80000008 80000880 0ca80697 fe5b0d00 00e8ff01 00a80697 fe5b0d00
ffff89f7af1bd000 3650134001 S Ii:1:004:2 -115:8 64 <
ffff89f7af1bd000 3650142103 C Ii:1:004:2 0:8 64 = 30bc8000 80000008 80000880 0ca50699 fe580dff ffe6ff02 00a60699 fe580dff
ffff89f7af1bd000 3650142137 S Ii:1:004:2 -115:8 64 <
ffff89f7af1bd000 3650159992 C Ii:1:004:2 0:8 64 = 30be8000 80000008 80000880 0ca50698 fe5b0dff ffe6ff02 00a50698 fe5b0dff
ffff89f7af1bd000 3650160036 S Ii:1:004:2 -115:8 64 <
ffff89f7af1bd000 3650174881 C Ii:1:004:2 0:8 64 = 30c18000 80000008 80000880 0ca6069a fe5d0dff ffe9ff02 00a60698 fe5c0dff
ffff89f7af1bd000 3650174918 S Ii:1:004:2 -115:8 64 <
ffff89f7af1bd000 3650191137 C Ii:1:004:2 0:8 64 = 30c48000 80000008 80000880 0ca0069a fe600dfe ffe7ff02 00a3069b fe5f0dfe
ffff89f7af1bd000 3650191188 S Ii:1:004:2 -115:8 64 <
ffff89f7af1bd000 3650207933 C Ii:1:004:2 0:8 64 = 30c88000 80000008 80000880 0ca50697 fe5d0dff ffe6ff01 00a50697 fe5d0dff
ffff89f7af1bd000 3650207973 S Ii:1:004:2 -115:8 64 <
ffff89f7af1bd000 3650221956 C Ii:1:004:2 0:8 64 = 30cb8000 80000008 80000880 0ca4069e fe5d0dfe ffe4ff01 00a4069e fe5d0dfe
ffff89f7af1bd000 3650222000 S Ii:1:004:2 -115:8 64 <
ffff89f7af1bd000 3650239372 C Ii:1:004:2 0:8 64 = 30ce8000 80000008 80000880 0ca306a0 fe5f0dff ffe8ff02 00a306a0 fe5f0dff
ffff89f7af1bd000 3650239416 S Ii:1:004:2 -115:8 64 <
ffff89f7af1bd000 3650254747 C Ii:1:004:2 0:8 64 = 30d18000 80000008 80000880 0ca40698 fe610dfe ffe7ff01 00a4069c fe600dff
ffff89f7af1bd000 3650254792 S Ii:1:004:2 -115:8 64 <
ffff89f7af1bd000 3650270053 C Ii:1:004:2 0:8 64 = 30d48000 80000008 80000880 0ca00694 fe5b0dff ffe6ff00 00a20697 fe5f0dfe
ffff89f7af1bd000 3650270094 S Ii:1:004:2 -115:8 64 <
ffff89f7af1bd000 3650286085 C Ii:1:004:2 0:8 64 = 30d88000 80000008 80000880 0ca10694 fe5a0d00 00e6ff02 00a10694 fe5a0d00
ffff89f7af1bd000 3650286125 S Ii:1:004:2 -115:8 64 <
ffff89f7af1bd000 3650302092 C Ii:1:004:2 0:8 64 = 30db8000 80000008 80000880 0c970699 fe540dff ffe5ff03 00970699 fe540dff
ffff89f7af1bd000 3650302130 S Ii:1:004:2 -115:8 64 <
ffff89f7af1bd000 3650317967 C Ii:1:004:2 0:8 64 = 30de8000 80000008 80000880 0c95069c fe600dff ffe5ff02 0095069c fe600dff
ffff89f7af1bd000 3650318006 S Ii:1:004:2 -115:8 64 <
ffff89f7af1bd000 3650334882 C Ii:1:004:2 0:8 64 = 30e18000 80000008 80000880 0cc20697 fe630d00 00e7ff02 00b2069c fe6d0d00
ffff89f7af1bd000 3650334938 S Ii:1:004:2 -115:8 64 <
ffff89f7af1bd000 3650351087 C Ii:1:004:2 0:8 64 = 30e48000 80000008 80000880 0ca606a1 fe540dff ffe8ff00 00bd0694 fe560dff
ffff89f7af1bd000 3650351125 S Ii:1:004:2 -115:8 64 <
ffff89f7af1bd000 3650367626 C Ii:1:004:2 0:8 64 = 30e88000 80000008 80000880 0c8d06b2 fe5a0dff ffe5ff01 008d06b2 fe5a0dff
ffff89f7af1bd000 3650367670 S Ii:1:004:2 -115:8 64 <
ffff89f7af1bd000 3650382853 C Ii:1:004:2 0:8 64 = 30eb8000 80000008 80000880 0cb10691 fe520d00 00e6ff02 00b10691 fe520d00
ffff89f7af1bd000 3650382890 S Ii:1:004:2 -115:8 64 <
ffff89f7af1bd000 3650397988 C Ii:1:004:2 0:8 64 = 30ee8000 80000008 80000880 0ca80696 fe5c0dfe ffe8ff02 00a80696 fe5c0dfe
ffff89f7af1bd000 3650398031 S Ii:1:004:2 -115:8 64 <
ffff89f7af1bd000 3650413941 C Ii:1:004:2 0:8 64 = 30f18000 80000008 80000880 0c9906a3 fe600dff ffe3ff02 009906a3 fe620dfe
ffff89f7af1bd000 3650413977 S Ii:1:004:2 -115:8 64 <
ffff89f7af1bd000 3650431628 C Ii:1:004:2 0:8 64 = 30f48000 80000008 80000880 0cb10690 fe500dfe ffe7ff03 00a70698 fe570dff
ffff89f7af1bd000 3650431673 S Ii:1:004:2 -115:8 64 <
ffff89f7af1bd000 3650447795 C Ii:1:004:2 0:8 64 = 30f88000 80000008 80000880 0ca2069b fe5a0dfd ffe8ff04 00a2069b fe5a0dfd
ffff89f7af1bd000 3650447835 S Ii:1:004:2 -115:8 64 <
ffff89f7af1bd000 3650462029 C Ii:1:004:2 0:8 64 = 30fb8000 80000008 80000880 0c9b06a0 fe660dff ffe7ff02 009b06a0 fe660dff
ffff89f7af1bd000 3650462072 S Ii:1:004:2 -115:8 64 <
ffff89f7af1bd000 3650477968 C Ii:1:004:2 0:8 64 = 30fe8000 80000008 80000880 0cab0695 fe5a0dfe ffe5ffff ffab0695 fe5a0dfe
ffff89f7af1bd000 3650478018 S Ii:1:004:2 -115:8 64 <
ffff89f7af1bd000 3650493866 C Ii:1:004:2 0:8 64 = 30018000 80000008 80000880 0ca0069d fe570dff ffe6ff01 00a70697 fe550dff
ffff89f7af1bd000 3650493909 S Ii:1:004:2 -115:8 64 <
ffff89f7af1bd000 3650511936 C Ii:1:004:2 0:8 64 = 30048000 80000008 80000880 0c9e06a1 fe620dfe ffe8ff03 009b06a3 fe5f0dff
ffff89f7af1bd000 3650511983 S Ii:1:004:2 -115:8 64 <
ffff89f7af1bd000 3650526116 C Ii:1:004:2 0:8 64 = 30088000 80000008 80000880 0cab068f fe580dfe ffe6ff00 00ab068f fe580dfe
ffff89f7af1bd000 3650526170 S Ii:1:004:2 -115:8 64 <
ffff89f7af1bd000 3650542742 C Ii:1:004:2 0:8 64 = 300b8000 80000008 80000880 0c9c069b fe5a0dff ffe7ff01 009c069b fe5a0dff
ffff89f7af1bd000 3650542787 S Ii:1:004:2 -115:8 64 <
ffff89f7af1bd000 3650560502 C Ii:1:004:2 0:8 64 = 300e8000 80000008 80000880 0c9f069c fe600dff ffe6ff02 009f069c fe600dff
ffff89f7af1bd000 3650560548 S Ii:1:004:2 -115:8 64 <
ffff89f7af1bd000 3650573859 C Ii:1:004:2 0:8 64 = 30118000 80000008 80000880 0cab0697 fe590dfe ffe9ff00 00a60698 fe5c0dfe
ffff89f7af1bd000 3650573903 S Ii:1:004:2 -115:8 64 <
ffff89f7af1bd000 3650590724 C Ii:1:004:2 0:8 64 = 30148000 80000008 80000880 0ca706a0 fe5a0dfe ffe5ff01 00aa069b fe590dfe
ffff89f7af1bd000 3650590772 S Ii:1:004:2 -115:8 64 <
ffff89f7af1bd000 3650605918 C Ii:1:004:2 0:8 64 = 30188000 80000008 80000880 0ca806a2 fe5a0dff ffe7ff01 00a806a2 fe5a0dff
ffff89f7af1bd000 3650605954 S Ii:1:004:2 -115:8 64 <
ffff89f7af1bd000 3650622986 C Ii:1:004:2 0:8 64 = 301a8000 80000008 80000880 0cae069c fe590d00 00e8ffff ffae069c fe590d00
ffff89f7af1bd000 3650623042 S Ii:1:004:2 -115:8 64 <
ffff89f7af1bd000 3650646081 C Ii:1:004:2 0:8 64 = 301e8000 80000008 80000880 0ca50699 fe590dfe ffe7ff00 00a50699 fe590dfe
ffff89f7af1bd000 3650646128 S Ii:1:004:2 -115:8 64 <
ffff89f7af1bd000 3650653942 C Ii:1:004:2 0:8 64 = 30228000 80000008 80000880 0ca6068f fe580d00 00e5ff03 00a6068f fe580d00
ffff89f7af1bd000 3650653985 S Ii:1:004:2 -115:8 64 <
ffff89f7af1bd000 3650670117 C Ii:1:004:2 0:8 64 = 30248000 80000008 80000880 0ca30692 fe5d0dff ffe6ff02 00a6068f fe580d00
ffff89f7af1bd000 3650670161 S Ii:1:004:2 -115:8 64 <
ffff89f7af1bd000 3650685902 C Ii:1:004:2 0:8 64 = 30278000 80000008 80000880 0ca20695 fe630dff ffe8ff03 00a20695 fe630dff
ffff89f7af1bd000 3650685917 S Ii:1:004:2 -115:8 64 <
ffff89f7af1bd000 3650702022 C Ii:1:004:2 0:8 64 = 302a8000 80000008 80000880 0ca00692 fe610dfe ffe8ff04 00a00692 fe610dfe
ffff89f7af1bd000 3650702070 S Ii:1:004:2 -115:8 64 <
ffff89f7af1bd000 3650718064 C Ii:1:004:2 0:8 64 = 302e8000 80000008 80000880 0c94069a fe5a0dfe ffe6ff02 0094069a fe5a0dfe
ffff89f7af1bd000 3650718102 S Ii:1:004:2 -115:8 64 <
ffff89f7af1bd000 3650733886 C Ii:1:004:2 0:8 64 = 30318000 80000008 80000880 0cab06a0 fe550d00 00e5ff00 009c069f fe590dff
ffff89f7af1bd000 3650733931 S Ii:1:004:2 -115:8 64 <
ffff89f7af1bd000 3650749893 C Ii:1:004:2 0:8 64 = 30348000 80000008 80000880 0cae06a7 fe5c0d00 00e8ff02 00b106a2 fe540d00
ffff89f7af1bd000 3650749937 S Ii:1:004:2 -115:8 64 <
ffff89f7af1bd000 3650767989 C Ii:1:004:2 0:8 64 = 30378000 80000008 80000880 0ca906a1 fe5e0dff ffe7ff02 00a906a7 fe610dff
ffff89f7af1bd000 3650768033 S Ii:1:004:2 -115:8 64 <
ffff89f7af1bd000 3650784442 C Ii:1:004:2 0:8 64 = 303a8000 80000008 80000880 0ca40694 fe570dff ffe8ffff ffa40694 fe570dff
ffff89f7af1bd000 3650784490 S Ii:1:004:2 -115:8 64 <
ffff89f7af1bd000 3650799528 C Ii:1:004:2 0:8 64 = 303e8000 80000008 80000880 0c9a0698 fe590dfe ffe6ff02 009a0698 fe590dfe
ffff89f7af1bd000 3650799572 S Ii:1:004:2 -115:8 64 <
ffff89f7af1bd000 3650813953 C Ii:1:004:2 0:8 64 = 30418000 80000008 80000880 0ca5068f fe5a0dfe ffe7ff02 009d0694 fe590dfd
ffff89f7af1bd000 3650813993 S Ii:1:004:2 -115:8 64 <
ffff89f7af1bd000 3650831708 C Ii:1:004:2 0:8 64 = 30448000 80000008 80000880 0ca80692 fe5a0d00 00e5ff01 00a8068e fe5a0dff
ffff89f7af1bd000 3650831753 S Ii:1:004:2 -115:8 64 <
ffff89f7af1bd000 3650853929 C Ii:1:004:2 0:8 64 = 30478000 80000008 80000880 0ca1069f fe5f0d00 00e5ff01 00a60697 fe5d0d00
ffff89f7af1bd000 3650853976 S Ii:1:004:2 -115:8 64 <
ffff89f7af1bd000 3650862037 C Ii:1:004:2 0:8 64 = 304c8000 80000008 80000880 0ca9069f fe5e0d00 00e8ff01 00a206a1 fe5e0d00
ffff89f7af1bd000 3650862074 S Ii:1:004:2 -115:8 64 <
ffff89f7af1bd000 3650886058 C Ii:1:004:2 0:8 64 = 304e8000 80000008 80000880 0cac069d fe5e0dff ffe8ff01 00ac069d fe5e0dff
ffff89f7af1bd000 3650886101 S Ii:1:004:2 -115:8 64 <
ffff89f7af1bd000 3650893929 C Ii:1:004:2 0:8 64 = 30528000 80000008 80000880 0ca60698 fe570dff ffe7ff01 00a80698 fe570dff
ffff89f7af1bd000 3650893970 S Ii:1:004:2 -115:8 64 <
ffff89f7af1bd000 3650911110 C Ii:1:004:2 0:8 64 = 30548000 80000008 80000880 0ca50697 fe590dfe ffe8ff01 00a60698 fe570dff
ffff89f7af1bd000 3650911161 S Ii:1:004:2 -115:8 64 <
ffff89f7af1bd000 3650933870 C Ii:1:004:2 0:8 64 = 30578000 80000008 80000880 0ca00697 fe5b0dfe ffe9ff02 00a40697 fe5a0dfe
ffff89f7af1bd000 3650933916 S Ii:1:004:2 -115:8 64 <
ffff89f7af1bd000 3650949885 C Ii:1:004:2 0:8 64 = 305c8000 80000008 80000880 0c9c069a fe5f0d00 00e7ff01 00980698 fe5f0dff
ffff89f7af1bd000 3650949923 S Ii:1:004:2 -115:8 64 <
ffff89f7af1bd000 3650959083 C Ii:1:004:2 0:8 64 = 305f8000 80000008 80000880 0ca8069f fe5b0dfe ffe5ff02 00a2069c fe5e0d00
ffff89f7af1bd000 3650959127 S Ii:1:004:2 -115:8 64 <
ffff89f7af1bd000 3650975437 C Ii:1:004:2 0:8 64 = 30618000 80000008 80000880 0cab06a0 fe580dfe ffe6ff02 00a8069f fe5b0dfe
ffff89f7af1bd000 3650975483 S Ii:1:004:2 -115:8 64 <
ffff89f7af1bd000 3650990041 C Ii:1:004:2 0:8 64 = 30648000 80000008 80000880 0ca8069f fe580dff ffeaff01 00aa06a0 fe560dfe
ffff89f7af1bd000 3650990085 S Ii:1:004:2 -115:8 64 <
ffff89f7af1bd000 3651007980 C Ii:1:004:2 0:8 64 = 30678000 80000008 80000880 0ca6069a fe5b0dff ffe7ff01 00a6069d fe5a0dff
ffff89f7af1bd000 3651008021 S Ii:1:004:2 -115:8 64 <
ffff89f7af1bd000 3651022487 C Ii:1:004:2 0:8 64 = 306a8000 80000008 80000880 0ca50694 fe5a0dff ffe8ff01 00a60697 fe5a0dff
ffff89f7af1bd000 3651022534 S Ii:1:004:2 -115:8 64 <
ffff89f7af1bd000 3651037856 C Ii:1:004:2 0:8 64 = 306e8000 80000008 80000880 0ca10696 fe5d0dff ffe6ff01 00a10696 fe5d0dff
ffff89f7af1bd000 3651037895 S Ii:1:004:2 -115:8 64 <
ffff89f7af1bd000 3651055640 C Ii:1:004:2 0:8 64 = 30718000 80000008 80000880 0ca20699 fe5c0d00 00e7ff03 00a10697 fe5d0dff
ffff89f7af1bd000 3651055687 S Ii:1:004:2 -115:8 64 <
ffff89f7af1bd000 3651081532 C Ii:1:004:2 0:8 64 = 30748000 80000008 80000880 0ca2069d fe5c0dff ffe6ff00 00a3069c fe5b0d00
ffff89f7af1bd000 3651081574 S Ii:1:004:2 -115:8 64 <
ffff89f7af1bd000 3651096574 C Ii:1:004:2 0:8 64 = 30798000 80000008 80000880 0ca3069b fe5b0d00 00e7ff01 00a0069a fe5a0dff
ffff89f7af1bd000 3651096618 S Ii:1:004:2 -115:8 64 <
ffff89f7af1bd000 3651109919 C Ii:1:004:2 0:8 64 = 307c8000 80000008 80000880 0ca5069d fe5b0d01 00e7ff01 00a5069c fe5b0d00
ffff89f7af1bd000 3651109964 S Ii:1:004:2 -115:8 64 <
ffff89f7af1bd000 3651128595 C Ii:1:004:2 0:8 64 = 307f8000 80000008 80000880 0ca006a1 fe5a0d01 00e8ff01 00a1069f fe5b0d01
ffff89f7af1bd000 3651128641 S Ii:1:004:2 -115:8 64 <
ffff89f7af1bd000 3651144286 C Ii:1:004:2 0:8 64 = 30828000 80000008 80000880 0ca5069c fe5a0d00 00e6ff02 00a306a0 fe5a0d00
ffff89f7af1bd000 3651144329 S Ii:1:004:2 -115:8 64 <
ffff89f7af1bd000 3651160525 C Ii:1:004:2 0:8 64 = 30868000 80000008 80000880 0ca3069a fe5f0d00 00e8ffff ffa3069a fe5f0d00
ffff89f7af1bd000 3651160570 S Ii:1:004:2 -115:8 64 <
ffff89f7af1bd000 3651173888 C Ii:1:004:2 0:8 64 = 30898000 80000008 80000880 0ca3069a fe600d00 00e7ff00 00a2069b fe600d00
ffff89f7af1bd000 3651173930 S Ii:1:004:2 -115:8 64 <
ffff89f7af1bd000 3651190031 C Ii:1:004:2 0:8 64 = 308c8000 80000008 80000880 0ca30697 fe5b0dff ffe6ff03 00a20697 fe5d0dff
ffff89f7af1bd000 3651190078 S Ii:1:004:2 -115:8 64 <
ffff89f7af1bd000 3651205920 C Ii:1:004:2 0:8 64 = 308f8000 80000008 80000880 0ca6069c fe580dff ffe5ff02 00a5069a fe590dff
ffff89f7af1bd000 3651205959 S Ii:1:004:2 -115:8 64 <
ffff89f7af1bd000 3651221887 C Ii:1:004:2 0:8 64 = 30928000 80000008 80000880 0ca8069c fe5b0d00 00e6ff02 00a8069c fe580d00
ffff89f7af1bd000 3651221931 S Ii:1:004:2 -115:8 64 <
ffff89f7af1bd000 3651239799 C Ii:1:004:2 0:8 64 = 30968000 80000008 80000880 0ca5069e fe5e0dff ffe6ff01 00a5069e fe5e0dff
ffff89f7af1bd000 3651239846 S Ii:1:004:2 -115:8 64 <
ffff89f7af1bd000 3651253840 C Ii:1:004:2 0:8 64 = 30998000 80000008 80000880 0ca2069e fe5a0dfe ffe5ff02 00a3069e fe5c0dfe
ffff89f7af1bd000 3651253885 S Ii:1:004:2 -115:8 64 <
ffff89f7af1bd000 3651270127 C Ii:1:004:2 0:8 64 = 309c8000 80000008 80000880 0ca3069b fe5b0dfe ffe7ff00 00a2069d fe5b0dff
ffff89f7af1bd000 3651270169 S Ii:1:004:2 -115:8 64 <
ffff89f7af1bd000 3651296439 C Ii:1:004:2 0:8 64 = 309f8000 80000008 80000880 0ca80697 fe5d0dff ffe6ff01 00a50698 fe5d0dfe
ffff89f7af1bd000 3651296488 S Ii:1:004:2 -115:8 64 <
ffff89f7af1bd000 3651302876 C Ii:1:004:2 0:8 64 = 30a48000 80000008 80000880 0ca00699 fe5e0dfe ffe8ff02 00a50697 fe5c0dfe
ffff89f7af1bd000 3651302914 S Ii:1:004:2 -115:8 64 <
ffff89f7af1bd000 3651325857 C Ii:1:004:2 0:8 64 = 30a68000 80000008 80000880 0c9e069a fe5e0dff ffe6ff02 009e069a fe5e0dff
ffff89f7af1bd000 3651325902 S Ii:1:004:2 -115:8 64 <
ffff89f7af1bd000 3651343557 C Ii:1:004:2 0:8 64 = 30aa8000 80000008 80000880 0ca3069d fe5d0dfe ffe8ff02 00a2069b fe5c0dfe
ffff89f7af1bd000 3651343608 S Ii:1:004:2 -115:8 64 <
ffff89f7af1bd000 3651357853 C Ii:1:004:2 0:8 64 = 30ae8000 80000008 80000880 0ca2069e fe5e0dff ffe7ff02 00a2069e fe5e0dff
ffff89f7af1bd000 3651357896 S Ii:1:004:2 -115:8 64 <
ffff89f7af1bd000 3651373845 C Ii:1:004:2 0:8 64 = 30b18000 80000008 80000880 0ca2069d fe590dfe ffe7ff00 00a3069d fe5c0dff
ffff89f7af1bd000 3651373891 S Ii:1:004:2 -115:8 64 <
ffff89f7af1bd000 3651397848 C Ii:1:004:2 0:8 64 = 30b48000 80000008 80000880 0ca2069f fe5b0dff ffe6ff01 00a2069f fe580dfe
ffff89f7af1bd000 3651397893 S Ii:1:004:2 -115:8 64 <
ffff89f7af1bd000 3651407407 C Ii:1:004:2 0:8 64 = 30b98000 80000008 80000880 0ca30699 fe5c0dff ffe6ff02 00a30698 fe5c0dff
ffff89f7af1bd000 3651407447 S Ii:1:004:2 -115:8 64 <
ffff89f7af1bd000 3651422167 C Ii:1:004:2 0:8 64 = 30ba8000 80000008 80000880 0ca3069a fe5c0dff ffe6ff01 00a30699 fe5c0dff
ffff89f7af1bd000 3651422249 S Ii:1:004:2 -115:8 64 <
ffff89f7af1bd000 3651446026 C Ii:1:004:2 0:8 64 = 30be8000 80000008 80000880 0ca5069a fe5c0dff ffe7ff00 00a5069a fe5c0dff
ffff89f7af1bd000 3651446093 S Ii:1:004:2 -115:8 64 <
ffff89f7af1bd000 3651454594 C Ii:1:004:2 0:8 64 = 30c28000 80000008 80000880 0ca5069b fe5b0dff ffe7ff03 00a3069a fe5c0dff
ffff89f7af1bd000 3651454642 S Ii:1:004:2 -115:8 64 <
ffff89f7af1bd000 3651470574 C Ii:1:004:2 0:8 64 = 30c48000 80000008 80000880 0ca6069a fe590dff ffe8ff03 00a5069b fe5b0dff
ffff89f7af1bd000 3651470615 S Ii:1:004:2 -115:8 64 <
ffff89f7af1bd000 3651485933 C Ii:1:004:2 0:8 64 = 30c78000 80000008 80000880 0ca40699 fe5c0dfe ffe7ff01 00a5069a fe5a0dfe
ffff89f7af1bd000 3651485977 S Ii:1:004:2 -115:8 64 <
ffff89f7af1bd000 3651501834 C Ii:1:004:2 0:8 64 = 30ca8000 80000008 80000880 0ca60698 fe5c0dfe ffe5ff01 00a50699 fe5d0dfe
ffff89f7af1bd000 3651501879 S Ii:1:004:2 -115:8 64 <
ffff89f7af1bd000 3651517977 C Ii:1:004:2 0:8 64 = 30ce8000 80000008 80000880 0ca30699 fe580dfe ffe8ff01 00a30699 fe580dfe
ffff89f7af1bd000 3651518020 S Ii:1:004:2 -115:8 64 <
ffff89f7af1bd000 3651533931 C Ii:1:004:2 0:8 64 = 30d18000 80000008 80000880 0ca1069c fe5e0dfe ffe6ff00 00a2069c fe5c0dfe
ffff89f7af1bd000 3651533977 S Ii:1:004:2 -115:8 64 <
ffff89f7af1bd000 3651551431 C Ii:1:004:2 0:8 64 = 30d48000 80000008 80000880 0ca3069b fe5c0d00 00e7ff01 00a2069b fe5d0dff
ffff89f7af1bd000 3651551487 S Ii:1:004:2 -115:8 64 <
ffff89f7af1bd000 3651573837 C Ii:1:004:2 0:8 64 = 30d78000 80000008 80000880 0ca5069c fe5e0dff ffe6ff02 00a4069b fe5c0d00
ffff89f7af1bd000 3651573881 S Ii:1:004:2 -115:8 64 <
ffff89f7af1bd000 3651591913 C Ii:1:004:2 0:8 64 = 30dc8000 80000008 80000880 0ca2069b fe5c0dff ffe7ff01 00a5069c fe5e0dff
ffff89f7af1bd000 3651591961 S Ii:1:004:2 -115:8 64 <
ffff89f7af1bd000 3651608443 C Ii:1:004:2 0:8 64 = 30df8000 80000008 80000880 0ca1069a fe5a0dfe ffe5ff02 00a0069a fe5b0dff
ffff89f7af1bd000 3651608483 S Ii:1:004:2 -115:8 64 <
ffff89f7af1bd000 3651621832 C Ii:1:004:2 0:8 64 = 30e28000 80000008 80000880 0ca2069a fe5b0dfe ffe7ff01 00a2069a fe5a0dfe
ffff89f7af1bd000 3651621876 S Ii:1:004:2 -115:8 64 <
ffff89f7af1bd000 3651637866 C Ii:1:004:2 0:8 64 = 30e68000 80000008 80000880 0ca60697 fe5f0dfe ffe5ff01 00a60697 fe5f0dfe
ffff89f7af1bd000 3651637908 S Ii:1:004:2 -115:8 64 <
ffff89f7af1bd000 3651653911 C Ii:1:004:2 0:8 64 = 30e98000 80000008 80000880 0ca60696 fe5d0d00 00e7ff01 00a60696 fe5f0dff
ffff89f7af1bd000 3651653973 S Ii:1:004:2 -115:8 64 <
ffff89f7af1bd000 3651669890 C Ii:1:004:2 0:8 64 = 30ec8000 80000008 80000880 0ca40699 fe5a0d00 00e5ff02 00a50697 fe5a0d00
ffff89f7af1bd000 3651669931 S Ii:1:004:2 -115:8 64 <
ffff89f7af1bd000 3651687602 C Ii:1:004:2 0:8 64 = 30ef8000 80000008 80000880 0ca2069c fe5c0dff ffe7ff02 00a3069c fe5c0d00
ffff89f7af1bd000 3651687650 S Ii:1:004:2 -115:8 64 <
ffff89f7af1bd000 3651701837 C Ii:1:004:2 0:8 64 = 30f28000 80000008 80000880 0ca1069b fe5b0dfe ffe6ff00 00a2069b fe5b0dfe
ffff89f7af1bd000 3651701882 S Ii:1:004:2 -115:8 64 <
ffff89f7af1bd000 3651719988 C Ii:1:004:2 0:8 64 = 30f68000 80000008 80000880 0ca8069b fe570dfe ffe4ff01 00a8069b fe570dfe
ffff89f7af1bd000 3651720031 S Ii:1:004:2 -115:8 64 <
ffff89f7af1bd000 3651733847 C Ii:1:004:2 0:8 64 = 30f98000 80000008 80000880 0ca8069f fe570dfe ffe7ff02 00ab069b fe550dfe
ffff89f7af1bd000 3651733892 S Ii:1:004:2 -115:8 64 <
ffff89f7af1bd000 3651749942 C Ii:1:004:2 0:8 64 = 30fc8000 80000008 80000880 0ca206a2 fe5f0dff ffe5ff00 00a406a3 fe5b0dff
ffff89f7af1bd000 3651749983 S Ii:1:004:2 -115:8 64 <
ffff89f7af1bd000 3651766799 C Ii:1:004:2 0:8 64 = 30ff8000 80000008 80000880 0ca20696 fe5e0dfe ffe7ff01 00a1069c fe600dfe
ffff89f7af1bd000 3651766841 S Ii:1:004:2 -115:8 64 <
ffff89f7af1bd000 3651782017 C Ii:1:004:2 0:8 64 = 30028000 80000008 80000880 0c9f0697 fe5e0dfe ffe7ff01 00a20694 fe5d0dfe
ffff89f7af1bd000 3651782059 S Ii:1:004:2 -115:8 64 <
ffff89f7af1bd000 3651797877 C Ii:1:004:2 0:8 64 = 30068000 80000008 80000880 0ca10698 fe5b0dff ffe7ff01 00a10698 fe5b0dff
ffff89f7af1bd000 3651797920 S Ii:1:004:2 -115:8 64 <
ffff89f7af1bd000 3651815848 C Ii:1:004:2 0:8 64 = 30098000 80000008 80000880 0ca6069a fe5c0d00 00e7ff01 00a50698 fe5b0d00
ffff89f7af1bd000 3651815886 S Ii:1:004:2 -115:8 64 <
ffff89f7af1bd000 3651837946 C Ii:1:004:2 0:8 64 = 300c8000 80000008 80000880 0ca4069c fe5c0d00 00e7ff01 00a4069c fe5d0d00
ffff89f7af1bd000 3651837994 S Ii:1:004:2 -115:8 64 <
ffff89f7af1bd000 3651853865 C Ii:1:004:2 0:8 64 = 30118000 80000008 80000880 0ca7069a fe5d0dfe ffe6ff02 00a60698 fe5c0dfe
ffff89f7af1bd000 3651853913 S Ii:1:004:2 -115:8 64 <
ffff89f7af1bd000 3651869887 C Ii:1:004:2 0:8 64 = 30148000 80000008 80000880 0ca506a1 fe5d0dfe ffe8ff00 00a6069f fe5e0dfe
ffff89f7af1bd000 3651869927 S Ii:1:004:2 -115:8 64 <
ffff89f7af1bd000 3651885977 C Ii:1:004:2 0:8 64 = 30178000 80000008 80000880 0ca3069c fe5b0dff ffe6ff02 00a4069e fe5b0dff
ffff89f7af1bd000 3651886015 S Ii:1:004:2 -115:8 64 <
ffff89f7af1bd000 3651901965 C Ii:1:004:2 0:8 64 = 301a8000 80000008 80000880 0ca40698 fe5e0dff ffe6ff02 00a4069a fe5d0dff
ffff89f7af1bd000 3651902013 S Ii:1:004:2 -115:8 64 <
ffff89f7af1bd000 3651919913 C Ii:1:004:2 0:8 64 = 301e8000 80000008 80000880 0ca30698 fe580dff ffe6ff02 00a30698 fe580dff
ffff89f7af1bd000 3651919959 S Ii:1:004:2 -115:8 64 <
ffff89f7af1bd000 3651941885 C Ii:1:004:2 0:8 64 = 30218000 80000008 80000880 0ca10697 fe590d00 00e6ff01 00a10698 fe580dff
ffff89f7af1bd000 3651941928 S Ii:1:004:2 -115:8 64 <
ffff89f7af1bd000 3651960398 C Ii:1:004:2 0:8 64 = 30268000 80000008 80000880 0ca50699 fe590dff ffe7ff01 00a50699 fe590dff
ffff89f7af1bd000 3651960440 S Ii:1:004:2 -115:8 64 <
ffff89f7af1bd000 3651974022 C Ii:1:004:2 0:8 64 = 30298000 80000008 80000880 0ca7069e fe580dff ffe7ff01 00a7069b fe580dff
ffff89f7af1bd000 3651974066 S Ii:1:004:2 -115:8 64 <
ffff89f7af1bd000 3651981921 C Ii:1:004:2 0:8 64 = 302c8000 80000008 80000880 0ca3069a fe5c0dfe ffe8ff02 00a5069e fe590dfe
ffff89f7af1bd000 3651981958 S Ii:1:004:2 -115:8 64 <
ffff89f7af1bd000 3651998021 C Ii:1:004:2 0:8 64 = 302e8000 80000008 80000880 0ca30697 fe5d0dfe ffe7ff01 00a30697 fe5d0dfe
ffff89f7af1bd000 3651998064 S Ii:1:004:2 -115:8 64 <
ffff89f7af1bd000 3652014658 C Ii:1:004:2 0:8 64 = 30318000 80000008 80000880 0ca3069c fe5e0dff ffe8ff02 00a40699 fe5e0dff
ffff89f7af1bd000 3652014698 S Ii:1:004:2 -115:8 64 <
ffff89f7af1bd000 3652030251 C Ii:1:004:2 0:8 64 = 30348000 80000008 80000880 0ca50699 fe5a0d00 00e7ff00 00a3069c fe5d0d00
ffff89f7af1bd000 3652030304 S Ii:1:004:2 -115:8 64 <
ffff89f7af1bd000 3652056722 C Ii:1:004:2 0:8 64 = 30378000 80000008 80000880 0ca5069b fe5b0d00 00e7ff01 00a60699 fe5a0d00
ffff89f7af1bd000 3652056768 S Ii:1:004:2 -115:8 64 <
ffff89f7af1bd000 3652069871 C Ii:1:004:2 0:8 64 = 303c8000 80000008 80000880 0ca3069b fe5a0dfd ffe5ff01 00a4069d fe5a0dfe
ffff89f7af1bd000 3652069911 S Ii:1:004:2 -115:8 64 <
ffff89f7af1bd000 3652079827 C Ii:1:004:2 0:8 64 = 303f8000 80000008 80000880 0ca2069c fe5b0dfe ffe7ff01 00a2069b fe5b0dfd
ffff89f7af1bd000 3652079866 S Ii:1:004:2 -115:8 64 <
ffff89f7af1bd000 3652095486 C Ii:1:004:2 0:8 64 = 30418000 80000008 80000880 0ca3069c fe5e0d00 00e7ff02 00a2069c fe5b0dfe
ffff89f7af1bd000 3652095541 S Ii:1:004:2 -115:8 64 <
ffff89f7af1bd000 3652110507 C Ii:1:004:2 0:8 64 = 30448000 80000008 80000880 0ca5069c fe5d0dff ffe5ff01 00a3069c fe5f0d00
ffff89f7af1bd000 3652110559 S Ii:1:004:2 -115:8 64 <
ffff89f7af1bd000 3652125918 C Ii:1:004:2 0:8 64 = 30478000 80000008 80000880 0ca3069a fe590dff ffe8ff01 00a4069c fe5a0dff
ffff89f7af1bd000 3652125960 S Ii:1:004:2 -115:8 64 <
ffff89f7af1bd000 3652141990 C Ii:1:004:2 0:8 64 = 304a8000 80000008 80000880 0ca60696 fe5c0dff ffe7ff02 00a50697 fe5a0dff
ffff89f7af1bd000 3652142035 S Ii:1:004:2 -115:8 64 <
ffff89f7af1bd000 3652157921 C Ii:1:004:2 0:8 64 = 304e8000 80000008 80000880 0ca2069a fe5f0dff ffe7ff01 00a2069a fe5f0dff
ffff89f7af1bd000 3652157965 S Ii:1:004:2 -115:8 64 <
ffff89f7af1bd000 3652173881 C Ii:1:004:2 0:8 64 = 30518000 80000008 80000880 0ca8069e fe5e0dfe ffe5ff00 00a5069c fe5f0dff
ffff89f7af1bd000 3652173929 S Ii:1:004:2 -115:8 64 <
ffff89f7af1bd000 3652189854 C Ii:1:004:2 0:8 64 = 30548000 80000008 80000880 0ca506a0 fe5a0dff ffe6ff01 00a7069e fe5b0dfe
ffff89f7af1bd000 3652189900 S Ii:1:004:2 -115:8 64 <
ffff89f7af1bd000 3652207306 C Ii:1:004:2 0:8 64 = 30578000 80000008 80000880 0ca5069f fe5b0dff ffe8ff01 00a406a1 fe5b0dff
ffff89f7af1bd000 3652207352 S Ii:1:004:2 -115:8 64 <
ffff89f7af1bd000 3652221868 C Ii:1:004:2 0:8 64 = 305a8000 80000008 80000880 0ca5069a fe5c0dff ffe5ff01 00a6069c fe5a0dff
ffff89f7af1bd000 3652221911 S Ii:1:004:2 -115:8 64 <
ffff89f7af1bd000 3652237932 C Ii:1:004:2 0:8 64 = 305e8000 80000008 80000880 0c9f069d fe5f0dff ffe7ff02 009f069d fe5f0dff
ffff89f7af1bd000 3652237978 S Ii:1:004:2 -115:8 64 <
ffff89f7af1bd000 3652247587 C Ii:1:004:2 0:8 64 = 30618000 80000008 80000880 0ca30696 fe5e0dff ffe7ff02 00a10699 fe5f0dff
ffff89f7af1bd000 3652247628 S Ii:1:004:2 -115:8 64 <
ffff89f7af1bd000 3652272884 C Ii:1:004:2 0:8 64 = 30628000 80000008 80000880 0ca50695 fe5b0dfe ffe7ff02 00a30696 fe5e0dff
ffff89f7af1bd000 3652272926 S Ii:1:004:2 -115:8 64 <
ffff89f7af1bd000 3652286537 C Ii:1:004:2 0:8 64 = 30678000 80000008 80000880 0ca0069e fe5a0dfe ffe6ff02 00a0069b fe590dfe
ffff89f7af1bd000 3652286579 S Ii:1:004:2 -115:8 64 <
ffff89f7af1bd000 3652301965 C Ii:1:004:2 0:8 64 = 306a8000 80000008 80000880 0ca2069e fe5b0dfe ffe7ff01 00a0069e fe5a0dfe
ffff89f7af1bd000 3652302008 S Ii:1:004:2 -115:8 64 <
ffff89f7af1bd000 3652319222 C Ii:1:004:2 0:8 64 = 306e8000 80000008 80000880 0ca4069f fe5a0dfe ffe8ff00 00a4069f fe5a0dfe
ffff89f7af1bd000 3652319280 S Ii:1:004:2 -115:8 64 <
ffff89f7af1bd000 3652335719 C Ii:1:004:2 0:8 64 = 30718000 80000008 80000880 0ca6069b fe5b0dfe ffe7ff01 00a5069c fe5a0dfe
ffff89f7af1bd000 3652335762 S Ii:1:004:2 -115:8 64 <
ffff89f7af1bd000 3652350591 C Ii:1:004:2 0:8 64 = 30748000 80000008 80000880 0ca4069a fe590dff ffe5ff01 00a5069b fe5a0dfe
ffff89f7af1bd000 3652350628 S Ii:1:004:2 -115:8 64 <
ffff89f7af1bd000 3652367416 C Ii:1:004:2 0:8 64 = 30778000 80000008 80000880 0ca30699 fe5c0dff ffe6ff02 00a40699 fe5a0dff
ffff89f7af1bd000 3652367470 S Ii:1:004:2 -115:8 64 <
ffff89f7af1bd000 3652382625 C Ii:1:004:2 0:8 64 = 307a8000 80000008 80000880 0ca0069a fe5d0dff ffe7ff01 00a1069a fe5d0dff
ffff89f7af1bd000 3652382666 S Ii:1:004:2 -115:8 64 <
ffff89f7af1bd000 3652405744 C Ii:1:004:2 0:8 64 = 307e8000 80000008 80000880 0ca3069b fe5a0dff ffe5ff01 00a3069b fe5a0dff
ffff89f7af1bd000 3652405782 S Ii:1:004:2 -115:8 64 <
ffff89f7af1bd000 3652414335 C Ii:1:004:2 0:8 64 = 30828000 80000008 80000880 0ca2069e fe5a0dff ffe7ff01 00a1069e fe580dff
ffff89f7af1bd000 3652414375 S Ii:1:004:2 -115:8 64 <
ffff89f7af1bd000 3652437795 C Ii:1:004:2 0:8 64 = 30848000 80000008 80000880 0ca5069e fe5d0dff ffe7ff01 00a2069e fe5a0dff
ffff89f7af1bd000 3652437861 S Ii:1:004:2 -115:8 64 <
ffff89f7af1bd000 3652453790 C Ii:1:004:2 0:8 64 = 30898000 80000008 80000880 0ca40698 fe5b0dfd ffe7ff03 00a5069a fe5b0dfe
ffff89f7af1bd000 3652453840 S Ii:1:004:2 -115:8 64 <
ffff89f7af1bd000 3652469816 C Ii:1:004:2 0:8 64 = 308c8000 80000008 80000880 0ca4069b fe600d00 00e7ff01 00a4069a fe5f0dff
ffff89f7af1bd000 3652469856 S Ii:1:004:2 -115:8 64 <
ffff89f7af1bd000 3652485854 C Ii:1:004:2 0:8 64 = 308f8000 80000008 80000880 0ca2069a fe5b0dff ffe7ff01 00a4069b fe5d0d00
ffff89f7af1bd000 3652485890 S Ii:1:004:2 -115:8 64 <
ffff89f7af1bd000 3652501830 C Ii:1:004:2 0:8 64 = 30928000 80000008 80000880 0c9d0696 fe5e0dff ffe6ff02 009e0697 fe5b0dfe
ffff89f7af1bd000 3652501869 S Ii:1:004:2 -115:8 64 <
ffff89f7af1bd000 3652511256 C Ii:1:004:2 0:8 64 = 30968000 80000008 80000880 0c9f0694 fe5f0d00 00e7ff01 009f0694 fe5f0d00
ffff89f7af1bd000 3652511296 S Ii:1:004:2 -115:8 64 <
ffff89f7af1bd000 3652533788 C Ii:1:004:2 0:8 64 = 30978000 80000008 80000880 0ca00694 fe5e0d00 00e6ff00 009f0694 fe5f0d00
ffff89f7af1bd000 3652533851 S Ii:1:004:2 -115:8 64 <
ffff89f7af1bd000 3652549825 C Ii:1:004:2 0:8 64 = 309c8000 80000008 80000880 0ca6069f fe590dff ffe8ff01 00a4069b fe5d0d00
ffff89f7af1bd000 3652549870 S Ii:1:004:2 -115:8 64 <
ffff89f7af1bd000 3652560135 C Ii:1:004:2 0:8 64 = 309f8000 80000008 80000880 0ca4069e fe580dff ffe6ff02 00a406a0 fe560dff
ffff89f7af1bd000 3652560184 S Ii:1:004:2 -115:8 64 <
ffff89f7af1bd000 3652581910 C Ii:1:004:2 0:8 64 = 30a18000 80000008 80000880 0ca6069c fe5c0dfe ffe6ff03 00a4069e fe580dff
ffff89f7af1bd000 3652581964 S Ii:1:004:2 -115:8 64 <
ffff89f7af1bd000 3652591162 C Ii:1:004:2 0:8 64 = 30a68000 80000008 80000880 0ca6069d fe5b0dff ffe8ff01 00a6069d fe5b0dff
ffff89f7af1bd000 3652591205 S Ii:1:004:2 -115:8 64 <
ffff89f7af1bd000 3652613734 C Ii:1:004:2 0:8 64 = 30a78000 80000008 80000880 0ca2069c fe5b0dff ffe7ff01 00a6069d fe5b0dff
ffff89f7af1bd000 3652613788 S Ii:1:004:2 -115:8 64 <
ffff89f7af1bd000 3652632517 C Ii:1:004:2 0:8 64 = 30ac8000 80000008 80000880 0ca20697 fe5d0dfe ffe6ff02 00a20698 fe5b0dfe
ffff89f7af1bd000 3652632568 S Ii:1:004:2 -115:8 64 <
ffff89f7af1bd000 3652647777 C Ii:1:004:2 0:8 64 = 30af8000 80000008 80000880 0ca3069a fe5f0d00 00e6ff01 00a20699 fe600dff
ffff89f7af1bd000 3652647817 S Ii:1:004:2 -115:8 64 <
ffff89f7af1bd000 3652661731 C Ii:1:004:2 0:8 64 = 30b28000 80000008 80000880 0ca10698 fe580d00 00e8ff01 00a20699 fe5b0d00
ffff89f7af1bd000 3652661774 S Ii:1:004:2 -115:8 64 <
ffff89f7af1bd000 3652677912 C Ii:1:004:2 0:8 64 = 30b68000 80000008 80000880 0ca20698 fe5b0dfe ffe6ff00 00a20698 fe5b0dfe
ffff89f7af1bd000 3652677951 S Ii:1:004:2 -115:8 64 <
ffff89f7af1bd000 3652693739 C Ii:1:004:2 0:8 64 = 30b98000 80000008 80000880 0ca4069c fe5c0dff ffe7ff02 00a4069a fe5d0dfe
ffff89f7af1bd000 3652693780 S Ii:1:004:2 -115:8 64 <
ffff89f7af1bd000 3652709873 C Ii:1:004:2 0:8 64 = 30bc8000 80000008 80000880 0ca6069b fe590dff ffe6ff01 00a3069c fe5a0dff
ffff89f7af1bd000 3652709921 S Ii:1:004:2 -115:8 64 <
ffff89f7af1bd000 3652726584 C Ii:1:004:2 0:8 64 = 30bf8000 80000008 80000880 0ca70699 fe5f0dff ffe7ff00 00a80699 fe5a0dff
ffff89f7af1bd000 3652726629 S Ii:1:004:2 -115:8 64 <
ffff89f7af1bd000 3652741906 C Ii:1:004:2 0:8 64 = 30c28000 80000008 80000880 0ca0069d fe5e0dff ffe6ff01 00a3069b fe600dff
ffff89f7af1bd000 3652741949 S Ii:1:004:2 -115:8 64 <
ffff89f7af1bd000 3652759642 C Ii:1:004:2 0:8 64 = 30c68000 80000008 80000880 0ca5069b fe5a0dff ffe5ff01 00a5069b fe5a0dff
ffff89f7af1bd000 3652759681 S Ii:1:004:2 -115:8 64 <
ffff89f7af1bd000 3652775464 C Ii:1:004:2 0:8 64 = 30c98000 80000008 80000880 0ca7069d fe5a0dff ffe6ff01 00a7069c fe5b0dff
ffff89f7af1bd000 3652775509 S Ii:1:004:2 -115:8 64 <
ffff89f7af1bd000 3652791714 C Ii:1:004:2 0:8 64 = 30cc8000 80000008 80000880 0ca6069b fe590dfe ffe4ff02 00a7069d fe5a0dfe
ffff89f7af1bd000 3652791763 S Ii:1:004:2 -115:8 64 <
ffff89f7af1bd000 3652816670 C Ii:1:004:2 0:8 64 = 30cf8000 80000008 80000880 0ca3069b fe5b0dff ffe7ffff ffa5069b fe5a0dfe
ffff89f7af1bd000 3652816715 S Ii:1:004:2 -115:8 64 <
ffff89f7af1bd000 3652832463 C Ii:1:004:2 0:8 64 = 30d48000 80000008 80000880 0ca4069b fe5b0dff ffe6ff02 00a4069c fe5b0dff
ffff89f7af1bd000 3652832511 S Ii:1:004:2 -115:8 64 <
ffff89f7af1bd000 3652845855 C Ii:1:004:2 0:8 64 = 30d78000 80000008 80000880 0ca6069b fe5c0dff ffe8ff02 00a5069b fe5b0d00
ffff89f7af1bd000 3652845913 S Ii:1:004:2 -115:8 64 <
ffff89f7af1bd000 3652862542 C Ii:1:004:2 0:8 64 = 30da8000 80000008 80000880 0ca2069b fe5a0dfe ffe7ff01 00a5069a fe5b0dfe
ffff89f7af1bd000 3652862586 S Ii:1:004:2 -115:8 64 <
ffff89f7af1bd000 3652881405 C Ii:1:004:2 0:8 64 = 30de8000 80000008 80000880 0ca3069d fe5c0dff ffe7ff01 00a3069d fe5c0dff
ffff89f7af1bd000 3652881451 S Ii:1:004:2 -115:8 64 <
ffff89f7af1bd000 3652895514 C Ii:1:004:2 0:8 64 = 30e18000 80000008 80000880 0ca4069c fe5d0dff ffe6ff02 00a3069c fe5f0dff
ffff89f7af1bd000 3652895559 S Ii:1:004:2 -115:8 64 <
ffff89f7af1bd000 3652912484 C Ii:1:004:2 0:8 64 = 30e48000 80000008 80000880 0ca5069d fe590dff ffe7ff00 00a4069d fe590dfe
ffff89f7af1bd000 3652912532 S Ii:1:004:2 -115:8 64 <
ffff89f7af1bd000 3652927369 C Ii:1:004:2 0:8 64 = 30e78000 80000008 80000880 0ca3069c fe5b0dff ffe6ff01 00a6069e fe5b0dff
ffff89f7af1bd000 3652927408 S Ii:1:004:2 -115:8 64 <
ffff89f7af1bd000 3652952597 C Ii:1:004:2 0:8 64 = 30ea8000 80000008 80000880 0ca40697 fe5c0dff ffe7ff02 00a20699 fe5c0dff
ffff89f7af1bd000 3652952637 S Ii:1:004:2 -115:8 64 <
ffff89f7af1bd000 3652965728 C Ii:1:004:2 0:8 64 = 30ef8000 80000008 80000880 0ca4069d fe5b0dfe ffe5ffff ffa6069c fe5b0dff
ffff89f7af1bd000 3652965766 S Ii:1:004:2 -115:8 64 <
ffff89f7af1bd000 3652982681 C Ii:1:004:2 0:8 64 = 30f28000 80000008 80000880 0ca6069b fe590dff ffe7ff02 00a5069c fe590dfe
ffff89f7af1bd000 3652982720 S Ii:1:004:2 -115:8 64 <
ffff89f7af1bd000 3652997721 C Ii:1:004:2 0:8 64 = 30f68000 80000008 80000880 0ca2069c fe5d0dfe ffe7ff04 00a2069c fe5d0dfe
ffff89f7af1bd000 3652997760 S Ii:1:004:2 -115:8 64 <
ffff89f7af1bd000 3653015568 C Ii:1:004:2 0:8 64 = 30f98000 80000008 80000880 0ca2069b fe5c0dff ffe8ff01 00a0069d fe5d0dff
ffff89f7af1bd000 3653015607 S Ii:1:004:2 -115:8 64 <
ffff89f7af1bd000 3653037732 C Ii:1:004:2 0:8 64 = 30fc8000 80000008 80000880 0ca40698 fe5c0d00 00e6ff01 00a50699 fe5b0d00
ffff89f7af1bd000 3653037773 S Ii:1:004:2 -115:8 64 <
ffff89f7af1bd000 3653046164 C Ii:1:004:2 0:8 64 = 30018000 80000008 80000880 0ca8069c fe5d0dff ffe7ff01 00a3069b fe5f0dff
ffff89f7af1bd000 3653046203 S Ii:1:004:2 -115:8 64 <
ffff89f7af1bd000 3653069902 C Ii:1:004:2 0:8 64 = 30028000 80000008 80000880 0ca8069b fe5a0dfe ffe7ff01 00a8069c fe5d0dff
ffff89f7af1bd000 3653070023 S Ii:1:004:2 -115:8 64 <
ffff89f7af1bd000 3653085707 C Ii:1:004:2 0:8 64 = 30078000 80000008 80000880 0ca60698 fe5c0dfe ffe7ff01 00a40699 fe5b0dff
ffff89f7af1bd000 3653085746 S Ii:1:004:2 -115:8 64 <
ffff89f7af1bd000 3653102367 C Ii:1:004:2 0:8 64 = 300a8000 80000008 80000880 0ca6069a fe590dfe ffe6ff02 00a60697 fe5c0dfd
ffff89f7af1bd000 3653102417 S Ii:1:004:2 -115:8 64 <
ffff89f7af1bd000 3653117876 C Ii:1:004:2 0:8 64 = 300e8000 80000008 80000880 0ca5069e fe580d00 00e8ff01 00a5069e fe580d00
ffff89f7af1bd000 3653117932 S Ii:1:004:2 -115:8 64 <
ffff89f7af1bd000 3653141722 C Ii:1:004:2 0:8 64 = 30118000 80000008 80000880 0ca60699 fe5a0dff ffe8ff01 00a5069c fe590d00
ffff89f7af1bd000 3653141761 S Ii:1:004:2 -115:8 64 <
ffff89f7af1bd000 3653159430 C Ii:1:004:2 0:8 64 = 30168000 80000008 80000880 0ca5069e fe5b0dff ffe7ff01 00a5069e fe5b0dff
ffff89f7af1bd000 3653159473 S Ii:1:004:2 -115:8 64 <
ffff89f7af1bd000 3653175333 C Ii:1:004:2 0:8 64 = 30198000 80000008 80000880 0ca5069a fe5c0dfe ffe5ff00 00a5069d fe5b0dff
ffff89f7af1bd000 3653175376 S Ii:1:004:2 -115:8 64 <
ffff89f7af1bd000 3653197756 C Ii:1:004:2 0:8 64 = 301c8000 80000008 80000880 0ca4069b fe5f0dfe ffe6ff01 00a50699 fe5d0dfd
ffff89f7af1bd000 3653197795 S Ii:1:004:2 -115:8 64 <
ffff89f7af1bd000 3653207686 C Ii:1:004:2 0:8 64 = 30218000 80000008 80000880 0ca3069a fe5a0dff ffe4ff00 00a2069e fe5d0dff
ffff89f7af1bd000 3653207723 S Ii:1:004:2 -115:8 64 <
ffff89f7af1bd000 3653222563 C Ii:1:004:2 0:8 64 = 30228000 80000008 80000880 0ca40698 fe590dff ffe5ff00 00a3069a fe5a0dff
ffff89f7af1bd000 3653222603 S Ii:1:004:2 -115:8 64 <
ffff89f7af1bd000 3653248280 C Ii:1:004:2 0:8 64 = 30268000 80000008 80000880 0ca4069a fe5b0dfe ffe7ff01 00a4069a fe5b0dfe
ffff89f7af1bd000 3653248325 S Ii:1:004:2 -115:8 64 <
ffff89f7af1bd000 3653261836 C Ii:1:004:2 0:8 64 = 302a8000 80000008 80000880 0ca2069d fe610dff ffe6ff01 00a0069e fe5f0dff
ffff89f7af1bd000 3653261896 S Ii:1:004:2 -115:8 64 <
ffff89f7af1bd000 3653277775 C Ii:1:004:2 0:8 64 = 302e8000 80000008 80000880 0ca6069d fe5f0dff ffe7ff01 00a6069d fe5f0dff
ffff89f7af1bd000 3653277830 S Ii:1:004:2 -115:8 64 <
ffff89f7af1bd000 3653293732 C Ii:1:004:2 0:8 64 = 30318000 80000008 80000880 0ca5069d fe5a0dff ffe5ff01 00a5069d fe5c0dff
ffff89f7af1bd000 3653293775 S Ii:1:004:2 -115:8 64 <
ffff89f7af1bd000 3653309649 C Ii:1:004:2 0:8 64 = 30348000 80000008 80000880 0ca8069d fe5c0dff ffe7ff00 00a7069d fe5a0dff
ffff89f7af1bd000 3653309688 S Ii:1:004:2 -115:8 64 <
ffff89f7af1bd000 3653317795 C Ii:1:004:2 0:8 64 = 30378000 80000008 80000880 0ca3069d fe5a0dff ffe7ff02 00a7069d fe5b0dff
ffff89f7af1bd000 3653317841 S Ii:1:004:2 -115:8 64 <
ffff89f7af1bd000 3653343687 C Ii:1:004:2 0:8 64 = 30398000 80000008 80000880 0ca2069e fe5a0dff ffe8ff02 00a3069d fe5a0dff
ffff89f7af1bd000 3653343728 S Ii:1:004:2 -115:8 64 <
ffff89f7af1bd000 3653351080 C Ii:1:004:2 0:8 64 = 303e8000 80000008 80000880 0ca7069b fe5b0dff ffe7ff02 00a7069b fe5b0dff
ffff89f7af1bd000 3653351118 S Ii:1:004:2 -115:8 64 <
ffff89f7af1bd000 3653373788 C Ii:1:004:2 0:8 64 = 303f8000 80000008 80000880 0ca5069d fe5a0d00 00e7ff01 00a7069b fe5b0dff
ffff89f7af1bd000 3653373831 S Ii:1:004:2 -115:8 64 <
ffff89f7af1bd000 3653382340 C Ii:1:004:2 0:8 64 = 30448000 80000008 80000880 0ca4069b fe600dfe ffe7ff01 00a3069e fe5d0dff
ffff89f7af1bd000 3653382389 S Ii:1:004:2 -115:8 64 <
ffff89f7af1bd000 3653405749 C Ii:1:004:2 0:8 64 = 30468000 80000008 80000880 0ca5069b fe600dfe ffe7ff02 00a5069b fe600dfe
ffff89f7af1bd000 3653405789 S Ii:1:004:2 -115:8 64 <
ffff89f7af1bd000 3653421774 C Ii:1:004:2 0:8 64 = 304a8000 80000008 80000880 0ca5069d fe5c0dfe ffe7ff02 00a6069d fe5d0dfe
ffff89f7af1bd000 3653421829 S Ii:1:004:2 -115:8 64 <
ffff89f7af1bd000 3653437799 C Ii:1:004:2 0:8 64 = 304e8000 80000008 80000880 0ca1069a fe5b0d00 00e7ff03 00a1069a fe5b0d00
ffff89f7af1bd000 3653437863 S Ii:1:004:2 -115:8 64 <
ffff89f7af1bd000 3653455286 C Ii:1:004:2 0:8 64 = 30518000 80000008 80000880 0ca4069a fe5b0dff ffe7ff01 00a2069a fe5b0d00
ffff89f7af1bd000 3653455356 S Ii:1:004:2 -115:8 64 <
ffff89f7af1bd000 3653471448 C Ii:1:004:2 0:8 64 = 30548000 80000008 80000880 0ca5069b fe5d0dff ffe7ff00 00a6069b fe5a0dff
ffff89f7af1bd000 3653471494 S Ii:1:004:2 -115:8 64 <
ffff89f7af1bd000 3653485811 C Ii:1:004:2 0:8 64 = 30578000 80000008 80000880 0ca4069b fe5e0dff ffe6ff01 00a3069b fe5f0dff
ffff89f7af1bd000 3653485852 S Ii:1:004:2 -115:8 64 <
ffff89f7af1bd000 3653501683 C Ii:1:004:2 0:8 64 = 305a8000 80000008 80000880 0ca6069b fe5b0dff ffe7ff01 00a6069b fe5d0dff
ffff89f7af1bd000 3653501723 S Ii:1:004:2 -115:8 64 <
ffff89f7af1bd000 3653517739 C Ii:1:004:2 0:8 64 = 305e8000 80000008 80000880 0ca5069b fe5a0dfe ffe9ff01 00a5069b fe5a0dfe
ffff89f7af1bd000 3653517781 S Ii:1:004:2 -115:8 64 <
ffff89f7af1bd000 3653533733 C Ii:1:004:2 0:8 64 = 30618000 80000008 80000880 0ca5069b fe5e0d00 00e8ff00 00a5069c fe5d0dff
ffff89f7af1bd000 3653533789 S Ii:1:004:2 -115:8 64 <
ffff89f7af1bd000 3653549729 C Ii:1:004:2 0:8 64 = 30648000 80000008 80000880 0ca60699 fe5c0dfd ffe8ff03 00a50699 fe5d0dff
ffff89f7af1bd000 3653549767 S Ii:1:004:2 -115:8 64 <
ffff89f7af1bd000 3653566708 C Ii:1:004:2 0:8 64 = 30678000 80000008 80000880 0ca6069b fe5b0dfe ffe5ff02 00a7069a fe5b0dfd
ffff89f7af1bd000 3653566750 S Ii:1:004:2 -115:8 64 <
ffff89f7af1bd000 3653581996 C Ii:1:004:2 0:8 64 = 306a8000 80000008 80000880 0ca3069b fe5c0dff ffe5ff01 00a2069b fe5b0dff
ffff89f7af1bd000 3653582040 S Ii:1:004:2 -115:8 64 <
ffff89f7af1bd000 3653599808 C Ii:1:004:2 0:8 64 = 306e8000 80000008 80000880 0ca4069a fe5c0dfe ffe7ff03 00a4069a fe5c0dfe
ffff89f7af1bd000 3653599848 S Ii:1:004:2 -115:8 64 <
ffff89f7af1bd000 3653615854 C Ii:1:004:2 0:8 64 = 30718000 80000008 80000880 0ca7069a fe580dff ffe8ff01 00a6069a fe5a0dfe
ffff89f7af1bd000 3653615885 S Ii:1:004:2 -115:8 64 <
ffff89f7af1bd000 3653637708 C Ii:1:004:2 0:8 64 = 30748000 80000008 80000880 0ca6069c fe590dfe ffe6ffff ffa7069a fe580dfe
ffff89f7af1bd000 3653637753 S Ii:1:004:2 -115:8 64 <
ffff89f7af1bd000 3653653774 C Ii:1:004:2 0:8 64 = 30798000 80000008 80000880 0ca60697 fe5b0dfe ffe7ff01 00a5069a fe5c0dfe
ffff89f7af1bd000 3653653817 S Ii:1:004:2 -115:8 64 <
ffff89f7af1bd000 3653662447 C Ii:1:004:2 0:8 64 = 307c8000 80000008 80000880 0ca60698 fe5d0dfe ffe4ff01 00a70697 fe5c0dfe
ffff89f7af1bd000 3653662478 S Ii:1:004:2 -115:8 64 <
ffff89f7af1bd000 3653677772 C Ii:1:004:2 0:8 64 = 307e8000 80000008 80000880 0ca5069a fe5c0dfe ffe4ff02 00a5069a fe5c0dfe
ffff89f7af1bd000 3653677813 S Ii:1:004:2 -115:8 64 <
ffff89f7af1bd000 3653701789 C Ii:1:004:2 0:8 64 = 30818000 80000008 80000880 0ca50698 fe590dff ffe7ff03 00a5069a fe5b0dfe
ffff89f7af1bd000 3653701834 S Ii:1:004:2 -115:8 64 <
ffff89f7af1bd000 3653717669 C Ii:1:004:2 0:8 64 = 30868000 80000008 80000880 0ca1069d fe590dfd ffe6ff01 00a1069d fe590dfd
ffff89f7af1bd000 3653717706 S Ii:1:004:2 -115:8 64 <
ffff89f7af1bd000 3653733771 C Ii:1:004:2 0:8 64 = 30898000 80000008 80000880 0ca7069e fe5b0d00 00e8ff02 00a3069d fe5b0dfe
ffff89f7af1bd000 3653733813 S Ii:1:004:2 -115:8 64 <
ffff89f7af1bd000 3653749764 C Ii:1:004:2 0:8 64 = 308c8000 80000008 80000880 0ca6069d fe5c0d00 00e6ff00 00a8069e fe5b0d01
ffff89f7af1bd000 3653749806 S Ii:1:004:2 -115:8 64 <
ffff89f7af1bd000 3653765753 C Ii:1:004:2 0:8 64 = 308f8000 80000008 80000880 0ca1069b fe5e0dff ffe7ff00 00a2069c fe5e0d00
ffff89f7af1bd000 3653765794 S Ii:1:004:2 -115:8 64 <
ffff89f7af1bd000 3653773769 C Ii:1:004:2 0:8 64 = 30928000 80000008 80000880 0ca40699 fe5b0dfe ffe7ff01 00a30699 fe5d0dfe
ffff89f7af1bd000 3653773809 S Ii:1:004:2 -115:8 64 <
ffff89f7af1bd000 3653799964 C Ii:1:004:2 0:8 64 = 30948000 80000008 80000880 0ca5069a fe5a0dff ffe7ff01 00a40699 fe5b0dfe
ffff89f7af1bd000 3653800006 S Ii:1:004:2 -115:8 64 <
ffff89f7af1bd000 3653813752 C Ii:1:004:2 0:8 64 = 30998000 80000008 80000880 0ca2069a fe5d0d01 00e6ff01 00a4069b fe5c0d00
ffff89f7af1bd000 3653813794 S Ii:1:004:2 -115:8 64 <
ffff89f7af1bd000 3653831170 C Ii:1:004:2 0:8 64 = 309c8000 80000008 80000880 0ca2069a fe5a0dff ffe6ff01 00a1069a fe5c0d00
ffff89f7af1bd000 3653831222 S Ii:1:004:2 -115:8 64 <
ffff89f7af1bd000 3653845667 C Ii:1:004:2 0:8 64 = 309f8000 80000008 80000880 0ca4069a fe590dff ffe6ff02 00a4069a fe580dfe
ffff89f7af1bd000 3653845720 S Ii:1:004:2 -115:8 64 <
ffff89f7af1bd000 3653862302 C Ii:1:004:2 0:8 64 = 30a28000 80000008 80000880 0ca7069d fe5d0d00 00e6ff02 00a5069c fe5b0dff
ffff89f7af1bd000 3653862338 S Ii:1:004:2 -115:8 64 <
ffff89f7af1bd000 3653877878 C Ii:1:004:2 0:8 64 = 30a68000 80000008 80000880 0ca70698 fe5f0dff ffe7ff02 00a70698 fe5f0dff
ffff89f7af1bd000 3653877941 S Ii:1:004:2 -115:8 64 <
ffff89f7af1bd000 3653901663 C Ii:1:004:2 0:8 64 = 30a98000 80000008 80000880 0ca10699 fe600dfe ffe6ff01 00a40698 fe600dff
ffff89f7af1bd000 3653901703 S Ii:1:004:2 -115:8 64 <
ffff89f7af1bd000 3653910151 C Ii:1:004:2 0:8 64 = 30ae8000 80000008 80000880 0ca0069b fe5d0d00 00e6ff02 00a0069b fe5d0d00
ffff89f7af1bd000 3653910185 S Ii:1:004:2 -115:8 64 <
ffff89f7af1bd000 3653933753 C Ii:1:004:2 0:8 64 = 30af8000 80000008 80000880 0ca3069b fe5b0dff ffe5ff02 00a0069b fe5d0d00
ffff89f7af1bd000 3653933794 S Ii:1:004:2 -115:8 64 <
ffff89f7af1bd000 3653950805 C Ii:1:004:2 0:8 64 = 30b48000 80000008 80000880 0ca50699 fe5b0dfe ffe7ff01 00a6069a fe5a0dfe
ffff89f7af1bd000 3653950893 S Ii:1:004:2 -115:8 64 <
ffff89f7af1bd000 3653965808 C Ii:1:004:2 0:8 64 = 30b78000 80000008 80000880 0ca6069d fe5a0dff ffe5ff00 00a5069a fe5b0dff
ffff89f7af1bd000 3653965849 S Ii:1:004:2 -115:8 64 <
ffff89f7af1bd000 3653981806 C Ii:1:004:2 0:8 64 = 30ba8000 80000008 80000880 0ca6069f fe5a0dff ffe7ff00 00a6069e fe5b0dff
ffff89f7af1bd000 3653981869 S Ii:1:004:2 -115:8 64 <
ffff89f7af1bd000 3653998038 C Ii:1:004:2 0:8 64 = 30be8000 80000008 80000880 0ca4069e fe5a0dfe ffe7ff02 00a4069e fe5a0dfe
ffff89f7af1bd000 3653998076 S Ii:1:004:2 -115:8 64 <
ffff89f7af1bd000 3654024112 C Ii:1:004:2 0:8 64 = 30c18000 80000008 80000880 0ca7069b fe5b0dfe ffe8ff00 00a6069b fe5b0dfd
ffff89f7af1bd000 3654024154 S Ii:1:004:2 -115:8 64 <
ffff89f7af1bd000 3654039371 C Ii:1:004:2 0:8 64 = 30c68000 80000008 80000880 0ca50698 fe5d0dff ffe6ff02 00a50698 fe5d0dff
ffff89f7af1bd000 3654039413 S Ii:1:004:2 -115:8 64 <
ffff89f7af1bd000 3654053758 C Ii:1:004:2 0:8 64 = 30c98000 80000008 80000880 0ca60697 fe5d0d00 00e7ff02 00a60696 fe5e0dff
ffff89f7af1bd000 3654053802 S Ii:1:004:2 -115:8 64 <
ffff89f7af1bd000 3654071400 C Ii:1:004:2 0:8 64 = 30cc8000 80000008 80000880 0ca3069d fe560d00 00e5ffff ffa3069b fe580d00
ffff89f7af1bd000 3654071447 S Ii:1:004:2 -115:8 64 <
ffff89f7af1bd000 3654087218 C Ii:1:004:2 0:8 64 = 30cf8000 80000008 80000880 0ca50699 fe5b0dfe ffe7ff02 00a4069c fe580dff
ffff89f7af1bd000 3654087270 S Ii:1:004:2 -115:8 64 <
ffff89f7af1bd000 3654102492 C Ii:1:004:2 0:8 64 = 30d28000 80000008 80000880 0ca60699 fe5d0dfe ffe6ff01 00a50698 fe5d0dfe
ffff89f7af1bd000 3654102553 S Ii:1:004:2 -115:8 64 <
ffff89f7af1bd000 3654117695 C Ii:1:004:2 0:8 64 = 30d68000 80000008 80000880 0ca3069a fe5c0dfd ffe6ffff ffa3069a fe5c0dfd
ffff89f7af1bd000 3654117742 S Ii:1:004:2 -115:8 64 <
ffff89f7af1bd000 3654135584 C Ii:1:004:2 0:8 64 = 30d98000 80000008 80000880 0ca3069d fe5b0dff ffe6ff01 00a2069c fe5b0dfe
ffff89f7af1bd000 3654135625 S Ii:1:004:2 -115:8 64 <
ffff89f7af1bd000 3654157835 C Ii:1:004:2 0:8 64 = 30dc8000 80000008 80000880 0ca7069a fe590dff ffe6ff01 00a5069c fe5a0dff
ffff89f7af1bd000 3654157877 S Ii:1:004:2 -115:8 64 <
ffff89f7af1bd000 3654168089 C Ii:1:004:2 0:8 64 = 30e18000 80000008 80000880 0ca20698 fe5e0dfe ffe6ff01 00a30698 fe5d0dff
ffff89f7af1bd000 3654168128 S Ii:1:004:2 -115:8 64 <
ffff89f7af1bd000 3654192288 C Ii:1:004:2 0:8 64 = 30e28000 80000008 80000880 0ca2069a fe5c0dfd ffe6ff01 00a20698 fe5e0dfe
ffff89f7af1bd000 3654192332 S Ii:1:004:2 -115:8 64 <
ffff89f7af1bd000 3654208025 C Ii:1:004:2 0:8 64 = 30e78000 80000008 80000880 0ca5069c fe5a0dfe ffe8ff01 00a4069b fe580dfe
ffff89f7af1bd000 3654208063 S Ii:1:004:2 -115:8 64 <
ffff89f7af1bd000 3654221748 C Ii:1:004:2 0:8 64 = 30ea8000 80000008 80000880 0ca6069e fe590d00 00e7ff03 00a7069d fe5a0dff
ffff89f7af1bd000 3654221791 S Ii:1:004:2 -115:8 64 <
ffff89f7af1bd000 3654237654 C Ii:1:004:2 0:8 64 = 30ee8000 80000008 80000880 0ca4069c fe5b0d00 00e7ff03 00a4069c fe5b0d00
ffff89f7af1bd000 3654237695 S Ii:1:004:2 -115:8 64 <
ffff89f7af1bd000 3654253647 C Ii:1:004:2 0:8 64 = 30f18000 80000008 80000880 0ca4069d fe5b0dff ffe6ff01 00a4069c fe5b0dff
ffff89f7af1bd000 3654253687 S Ii:1:004:2 -115:8 64 <
ffff89f7af1bd000 3654269761 C Ii:1:004:2 0:8 64 = 30f48000 80000008 80000880 0ca60698 fe590d00 00e8ff01 00a5069b fe590dff
ffff89f7af1bd000 3654269818 S Ii:1:004:2 -115:8 64 <
ffff89f7af1bd000 3654293767 C Ii:1:004:2 0:8 64 = 30f78000 80000008 80000880 0ca80695 fe5b0dff ffe6ff02 00a80696 fe5a0dff
ffff89f7af1bd000 3654293812 S Ii:1:004:2 -115:8 64 <
ffff89f7af1bd000 3654309816 C Ii:1:004:2 0:8 64 = 30fc8000 80000008 80000880 0ca7069a fe5d0dfe ffe7ff01 00a60699 fe5e0dfe
ffff89f7af1bd000 3654309856 S Ii:1:004:2 -115:8 64 <
ffff89f7af1bd000 3654317756 C Ii:1:004:2 0:8 64 = 30ff8000 80000008 80000880 0ca7069c fe5d0dff ffe8ff01 00a8069c fe5c0dff
ffff89f7af1bd000 3654317798 S Ii:1:004:2 -115:8 64 <
ffff89f7af1bd000 3654333814 C Ii:1:004:2 0:8 64 = 30018000 80000008 80000880 0ca5069d fe600dff ffe8ff01 00a7069c fe5d0dff
ffff89f7af1bd000 3654333851 S Ii:1:004:2 -115:8 64 <
ffff89f7af1bd000 3654360426 C Ii:1:004:2 0:8 64 = 30048000 80000008 80000880 0ca2069e fe5d0dff ffe6ff01 00a4069d fe5f0dff
ffff89f7af1bd000 3654360461 S Ii:1:004:2 -115:8 64 <
ffff89f7af1bd000 3654375308 C Ii:1:004:2 0:8 64 = 30098000 80000008 80000880 0ca50697 fe550dfe ffe9ff01 00a2069a fe560dfe
ffff89f7af1bd000 3654375356 S Ii:1:004:2 -115:8 64 <
ffff89f7af1bd000 3654389757 C Ii:1:004:2 0:8 64 = 300c8000 80000008 80000880 0ca4069b fe5d0dff ffe7ff01 00a60697 fe590dff
ffff89f7af1bd000 3654389799 S Ii:1:004:2 -115:8 64 <
ffff89f7af1bd000 3654406482 C Ii:1:004:2 0:8 64 = 300f8000 80000008 80000880 0ca106a0 fe5d0d00 00e8ff01 00a106a0 fe5e0d00
ffff89f7af1bd000 3654406534 S Ii:1:004:2 -115:8 64 <
ffff89f7af1bd000 3654421730 C Ii:1:004:2 0:8 64 = 30128000 80000008 80000880 0ca80697 fe5b0dfe ffe7ff01 00a6069b fe5b0dff
ffff89f7af1bd000 3654421771 S Ii:1:004:2 -115:8 64 <
ffff89f7af1bd000 3654439657 C Ii:1:004:2 0:8 64 = 30168000 80000008 80000880 0ca4069c fe590dff ffe7ff02 00a4069c fe590dff
ffff89f7af1bd000 3654439705 S Ii:1:004:2 -115:8 64 <
ffff89f7af1bd000 3654461645 C Ii:1:004:2 0:8 64 = 30198000 80000008 80000880 0ca50699 fe5c0dff ffe7ff00 00a2069d fe5a0dff
ffff89f7af1bd000 3654461691 S Ii:1:004:2 -115:8 64 <
ffff89f7af1bd000 3654471549 C Ii:1:004:2 0:8 64 = 301e8000 80000008 80000880 0ca30697 fe590dfe ffe8ff02 00a30697 fe590dfe
ffff89f7af1bd000 3654471587 S Ii:1:004:2 -115:8 64 <
ffff89f7af1bd000 3654493753 C Ii:1:004:2 0:8 64 = 301f8000 80000008 80000880 0ca30699 fe5b0dfe ffe6ff02 00a30697 fe590dfe
ffff89f7af1bd000 3654493799 S Ii:1:004:2 -115:8 64 <
ffff89f7af1bd000 3654509738 C Ii:1:004:2 0:8 64 = 30248000 80000008 80000880 0ca60699 fe5c0dff ffe8ff02 00a5069a fe5f0dfe
ffff89f7af1bd000 3654509783 S Ii:1:004:2 -115:8 64 <
ffff89f7af1bd000 3654525741 C Ii:1:004:2 0:8 64 = 30278000 80000008 80000880 0ca6069a fe590dfe ffe5ff02 00a60698 fe590dff
ffff89f7af1bd000 3654525787 S Ii:1:004:2 -115:8 64 <
ffff89f7af1bd000 3654542487 C Ii:1:004:2 0:8 64 = 302a8000 80000008 80000880 0ca7069d fe5a0dfe ffe7ff02 00a7069c fe5b0dfe
ffff89f7af1bd000 3654542522 S Ii:1:004:2 -115:8 64 <
ffff89f7af1bd000 3654557640 C Ii:1:004:2 0:8 64 = 302e8000 80000008 80000880 0ca5069b fe560dff ffe6ff02 00a5069b fe560dff
ffff89f7af1bd000 3654557684 S Ii:1:004:2 -115:8 64 <
ffff89f7af1bd000 3654575489 C Ii:1:004:2 0:8 64 = 30318000 80000008 80000880 0ca0069a fe5c0dff ffe7ff03 00a3069a fe590dff
ffff89f7af1bd000 3654575611 S Ii:1:004:2 -115:8 64 <
ffff89f7af1bd000 3654597730 C Ii:1:004:2 0:8 64 = 30348000 80000008 80000880 0ca20698 fe5a0dff ffe5ff03 009f069a fe5c0dff
ffff89f7af1bd000 3654597775 S Ii:1:004:2 -115:8 64 <
ffff89f7af1bd000 3654616255 C Ii:1:004:2 0:8 64 = 30398000 80000008 80000880 0ca60698 fe5b0dff ffe7ff00 00a60696 fe5b0dff
ffff89f7af1bd000 3654616298 S Ii:1:004:2 -115:8 64 <
ffff89f7af1bd000 3654631417 C Ii:1:004:2 0:8 64 = 303c8000 80000008 80000880 0ca5069c fe5c0dff ffe5ff01 00a6069a fe5a0d00
ffff89f7af1bd000 3654631432 S Ii:1:004:2 -115:8 64 <
ffff89f7af1bd000 3654645842 C Ii:1:004:2 0:8 64 = 303f8000 80000008 80000880 0ca4069a fe5d0dfe ffe7ff03 00a4069c fe5d0dfe
ffff89f7af1bd000 3654645870 S Ii:1:004:2 -115:8 64 <
ffff89f7af1bd000 3654662489 C Ii:1:004:2 0:8 64 = 30428000 80000008 80000880 0ca8069b fe5a0dff ffe8ff01 00a5069a fe5b0dff
ffff89f7af1bd000 3654662504 S Ii:1:004:2 -115:8 64 <
ffff89f7af1bd000 3654679205 C Ii:1:004:2 0:8 64 = 30468000 80000008 80000880 0ca6069d fe5d0d00 00e8ff01 00a6069d fe5d0d00
ffff89f7af1bd000 3654679239 S Ii:1:004:2 -115:8 64 <
ffff89f7af1bd000 3654701736 C Ii:1:004:2 0:8 64 = 30498000 80000008 80000880 0ca6069d fe5c0d00 00e6ff02 00a6069e fe5d0d00
ffff89f7af1bd000 3654701750 S Ii:1:004:2 -115:8 64 <
ffff89f7af1bd000 3654717725 C Ii:1:004:2 0:8 64 = 304e8000 80000008 80000880 0ca20699 fe5d0d00 00e8ff02 00a20699 fe5d0d00
ffff89f7af1bd000 3654717739 S Ii:1:004:2 -115:8 64 <
ffff89f7af1bd000 3654733789 C Ii:1:004:2 0:8 64 = 30518000 80000008 80000880 0ca3069a fe5b0d00 00e6ff02 00a20699 fe5c0d00
ffff89f7af1bd000 3654733804 S Ii:1:004:2 -115:8 64 <
ffff89f7af1bd000 3654751519 C Ii:1:004:2 0:8 64 = 30548000 80000008 80000880 0ca2069b fe5d0d00 00e7ff02 00a2069b fe5c0d00
ffff89f7af1bd000 3654751531 S Ii:1:004:2 -115:8 64 <
ffff89f7af1bd000 3654765629 C Ii:1:004:2 0:8 64 = 30578000 80000008 80000880 0ca5069a fe5a0dff ffe7ff01 00a3069a fe5b0dff
ffff89f7af1bd000 3654765645 S Ii:1:004:2 -115:8 64 <
ffff89f7af1bd000 3654781628 C Ii:1:004:2 0:8 64 = 305a8000 80000008 80000880 0ca2069d fe5d0dff ffe8ff01 00a5069b fe5c0dff
ffff89f7af1bd000 3654781645 S Ii:1:004:2 -115:8 64 <
ffff89f7af1bd000 3654797781 C Ii:1:004:2 0:8 64 = 305e8000 80000008 80000880 0ca4069a fe560dff ffe7ff02 00a4069a fe560dff
ffff89f7af1bd000 3654797796 S Ii:1:004:2 -115:8 64 <
ffff89f7af1bd000 3654815514 C Ii:1:004:2 0:8 64 = 30618000 80000008 80000880 0ca4069a fe590dff ffe6ff01 00a50699 fe560dff
ffff89f7af1bd000 3654815528 S Ii:1:004:2 -115:8 64 <
ffff89f7af1bd000 3654837621 C Ii:1:004:2 0:8 64 = 30648000 80000008 80000880 0ca8069c fe5c0dff ffe7ff01 00a5069b fe5c0dff
ffff89f7af1bd000 3654837634 S Ii:1:004:2 -115:8 64 <
ffff89f7af1bd000 3654853645 C Ii:1:004:2 0:8 64 = 30698000 80000008 80000880 0ca50698 fe5e0dff ffe7ff02 00a7069a fe5e0dfe
ffff89f7af1bd000 3654853661 S Ii:1:004:2 -115:8 64 <
ffff89f7af1bd000 3654871626 C Ii:1:004:2 0:8 64 = 306c8000 80000008 80000880 0ca30697 fe5b0d00 00e6ff00 00a30696 fe5c0d00
ffff89f7af1bd000 3654871653 S Ii:1:004:2 -115:8 64 <
ffff89f7af1bd000 3654885729 C Ii:1:004:2 0:8 64 = 306f8000 80000008 80000880 0ca30698 fe590dfe ffe5ff03 00a30697 fe5a0dff
ffff89f7af1bd000 3654885747 S Ii:1:004:2 -115:8 64 <
ffff89f7af1bd000 3654901618 C Ii:1:004:2 0:8 64 = 30728000 80000008 80000880 0ca9069b fe5a0dfe ffe8ff02 00a6069a fe590dfd
ffff89f7af1bd000 3654901630 S Ii:1:004:2 -115:8 64 <
ffff89f7af1bd000 3654911620 C Ii:1:004:2 0:8 64 = 30768000 80000008 80000880 0ca5069d fe590dff ffe5ff00 00a5069d fe590dff
ffff89f7af1bd000 3654911634 S Ii:1:004:2 -115:8 64 <
ffff89f7af1bd000 3654927524 C Ii:1:004:2 0:8 64 = 30778000 80000008 80000880 0ca3069d fe590dff ffe6ff00 00a5069d fe590dff
ffff89f7af1bd000 3654927548 S Ii:1:004:2 -115:8 64 <
ffff89f7af1bd000 3654949810 C Ii:1:004:2 0:8 64 = 307a8000 80000008 80000880 0ca7069d fe5b0dff ffe8ff02 00a5069d fe5c0dff
ffff89f7af1bd000 3654949824 S Ii:1:004:2 -115:8 64 <
ffff89f7af1bd000 3654965766 C Ii:1:004:2 0:8 64 = 307f8000 80000008 80000880 0ca2069d fe580dff ffe7ff00 00a3069d fe570dff
ffff89f7af1bd000 3654965780 S Ii:1:004:2 -115:8 64 <
ffff89f7af1bd000 3654981740 C Ii:1:004:2 0:8 64 = 30828000 80000008 80000880 0ca7069a fe570dff ffe7ff01 00a3069d fe5a0dff
ffff89f7af1bd000 3654981756 S Ii:1:004:2 -115:8 64 <
ffff89f7af1bd000 3654997716 C Ii:1:004:2 0:8 64 = 30868000 80000008 80000880 0cad0698 fe540dff ffe7ff01 00ad0698 fe540dff
ffff89f7af1bd000 3654997746 S Ii:1:004:2 -115:8 64 <
ffff89f7af1bd000 3655013946 C Ii:1:004:2 0:8 64 = 30898000 80000008 80000880 0c9d069f fe600dfe ffe6ff00 00a7069c fe590dff
ffff89f7af1bd000 3655013963 S Ii:1:004:2 -115:8 64 <
ffff89f7af1bd000 3655022520 C Ii:1:004:2 0:8 64 = 308c8000 80000008 80000880 0ca2069b fe5a0dff ffe5ff02 009b069f fe5f0dfe
ffff89f7af1bd000 3655022535 S Ii:1:004:2 -115:8 64 <
ffff89f7af1bd000 3655045714 C Ii:1:004:2 0:8 64 = 308e8000 80000008 80000880 0ca7069b fe590dff ffe7ff03 00a7069b fe590dff
ffff89f7af1bd000 3655045730 S Ii:1:004:2 -115:8 64 <
ffff89f7af1bd000 3655061695 C Ii:1:004:2 0:8 64 = 30928000 80000008 80000880 0ca1069b fe5e0dfe ffe7ff00 00a2069d fe5d0dfe
ffff89f7af1bd000 3655061713 S Ii:1:004:2 -115:8 64 <
ffff89f7af1bd000 3655077712 C Ii:1:004:2 0:8 64 = 30968000 80000008 80000880 0ca50698 fe570d00 00e9ff00 00a50698 fe570d00
ffff89f7af1bd000 3655077726 S Ii:1:004:2 -115:8 64 <
ffff89f7af1bd000 3655087404 C Ii:1:004:2 0:8 64 = 30998000 80000008 80000880 0c9f06a0 fe5a0d00 00e8ff00 00a3069d fe570d00
ffff89f7af1bd000 3655087421 S Ii:1:004:2 -115:8 64 <
ffff89f7af1bd000 3655112526 C Ii:1:004:2 0:8 64 = 309a8000 80000008 80000880 0c9c069e fe5b0d00 00e8ff01 009f06a0 fe5a0d00
ffff89f7af1bd000 3655112544 S Ii:1:004:2 -115:8 64 <
ffff89f7af1bd000 3655125677 C Ii:1:004:2 0:8 64 = 309f8000 80000008 80000880 0ca30695 fe5c0dfe ffe6ff01 009f0696 fe5d0dfe
ffff89f7af1bd000 3655125695 S Ii:1:004:2 -115:8 64 <
ffff89f7af1bd000 3655141621 C Ii:1:004:2 0:8 64 = 30a28000 80000008 80000880 0ca30696 fe5d0dff ffe8ff02 00a40696 fe5b0dfe
ffff89f7af1bd000 3655141638 S Ii:1:004:2 -115:8 64 <
ffff89f7af1bd000 3655157609 C Ii:1:004:2 0:8 64 = 30a68000 80000008 80000880 0ca00690 fe5e0dff ffe7ff01 00a00690 fe5e0dff
ffff89f7af1bd000 3655157627 S Ii:1:004:2 -115:8 64 <
ffff89f7af1bd000 3655173765 C Ii:1:004:2 0:8 64 = 30a98000 80000008 80000880 0ca6068f fe5e0dff ffe8ff02 00a4068c fe5c0dff
ffff89f7af1bd000 3655173782 S Ii:1:004:2 -115:8 64 <
ffff89f7af1bd000 3655189707 C Ii:1:004:2 0:8 64 = 30ac8000 80000008 80000880 0ca2069e fe5f0dff ffe7ff03 00a40695 fe5f0dff
ffff89f7af1bd000 3655189725 S Ii:1:004:2 -115:8 64 <
ffff89f7af1bd000 3655205717 C Ii:1:004:2 0:8 64 = 30af8000 80000008 80000880 0ca306a0 fe5c0dff ffe8ff03 00a206a2 fe5d0dff
ffff89f7af1bd000 3655205732 S Ii:1:004:2 -115:8 64 <
ffff89f7af1bd000 3655221702 C Ii:1:004:2 0:8 64 = 30b28000 80000008 80000880 0ca20692 fe580d00 00e6ff02 00a2069a fe5a0dff
ffff89f7af1bd000 3655221717 S Ii:1:004:2 -115:8 64 <
ffff89f7af1bd000 3655239441 C Ii:1:004:2 0:8 64 = 30b68000 80000008 80000880 0ca60699 fe5b0dff ffe8ff03 00a60699 fe5b0dff
ffff89f7af1bd000 3655239458 S Ii:1:004:2 -115:8 64 <
ffff89f7af1bd000 3655261725 C Ii:1:004:2 0:8 64 = 30b98000 80000008 80000880 0ca406a1 fe5c0dff ffe5ff01 00a4069e fe5c0dff
ffff89f7af1bd000 3655261740 S Ii:1:004:2 -115:8 64 <
ffff89f7af1bd000 3655271462 C Ii:1:004:2 0:8 64 = 30be8000 80000008 80000880 0ca506a3 fe560dfe ffe8ff00 00a506a3 fe560dfe
ffff89f7af1bd000 3655271481 S Ii:1:004:2 -115:8 64 <
ffff89f7af1bd000 3655293715 C Ii:1:004:2 0:8 64 = 30bf8000 80000008 80000880 0ca606a1 fe590dfd ffe8ff01 00a506a3 fe560dfe
ffff89f7af1bd000 3655293732 S Ii:1:004:2 -115:8 64 <
ffff89f7af1bd000 3655309723 C Ii:1:004:2 0:8 64 = 30c48000 80000008 80000880 0ca30698 fe580dff ffe7ff00 00a3069a fe570dfe
ffff89f7af1bd000 3655309737 S Ii:1:004:2 -115:8 64 <
ffff89f7af1bd000 3655319264 C Ii:1:004:2 0:8 64 = 30c78000 80000008 80000880 0ca60699 fe5a0dfe ffe6ff01 00a50698 fe590dff
ffff89f7af1bd000 3655319279 S Ii:1:004:2 -115:8 64 <
ffff89f7af1bd000 3655341704 C Ii:1:004:2 0:8 64 = 30c98000 80000008 80000880 0ca6069a fe5a0dfe ffe7ff01 00a60699 fe5a0dfe
ffff89f7af1bd000 3655341720 S Ii:1:004:2 -115:8 64 <
ffff89f7af1bd000 3655357670 C Ii:1:004:2 0:8 64 = 30ce8000 80000008 80000880 0ca00698 fe5b0dfe ffe7ff02 00a00698 fe5b0dfe
ffff89f7af1bd000 3655357688 S Ii:1:004:2 -115:8 64 <
ffff89f7af1bd000 3655367950 C Ii:1:004:2 0:8 64 = 30d18000 80000008 80000880 0c9f0696 fe5b0dfe ffe6ff01 009e0696 fe5c0dfe
ffff89f7af1bd000 3655367977 S Ii:1:004:2 -115:8 64 <
ffff89f7af1bd000 3655389718 C Ii:1:004:2 0:8 64 = 30d28000 80000008 80000880 0ca20698 fe590dfe ffe7ff01 009f0696 fe5b0dfe
ffff89f7af1bd000 3655389732 S Ii:1:004:2 -115:8 64 <
ffff89f7af1bd000 3655405696 C Ii:1:004:2 0:8 64 = 30d78000 80000008 80000880 0ca30696 fe5d0dff ffe6ff00 00a30699 fe5c0dfe
ffff89f7af1bd000 3655405710 S Ii:1:004:2 -115:8 64 <
ffff89f7af1bd000 3655422562 C Ii:1:004:2 0:8 64 = 30da8000 80000008 80000880 0ca70692 fe5a0dff ffe7ff01 00a50693 fe5b0dff
ffff89f7af1bd000 3655422578 S Ii:1:004:2 -115:8 64 <
ffff89f7af1bd000 3655437767 C Ii:1:004:2 0:8 64 = 30de8000 80000008 80000880 0ca3069a fe5a0dff ffe5ff02 00a3069a fe5a0dff
ffff89f7af1bd000 3655437786 S Ii:1:004:2 -115:8 64 <
ffff89f7af1bd000 3655453706 C Ii:1:004:2 0:8 64 = 30e18000 80000008 80000880 0ca306a3 fe5b0d00 00e7ff01 00a206a1 fe5b0d00
ffff89f7af1bd000 3655453725 S Ii:1:004:2 -115:8 64 <
ffff89f7af1bd000 3655471287 C Ii:1:004:2 0:8 64 = 30e48000 80000008 80000880 0ca8069f fe5a0dff ffe6ff00 00a706a1 fe5b0d00
ffff89f7af1bd000 3655471307 S Ii:1:004:2 -115:8 64 <
ffff89f7af1bd000 3655485728 C Ii:1:004:2 0:8 64 = 30e78000 80000008 80000880 0ca406a0 fe590dff ffe8ff03 00a7069f fe590dff
ffff89f7af1bd000 3655485746 S Ii:1:004:2 -115:8 64 <
ffff89f7af1bd000 3655502338 C Ii:1:004:2 0:8 64 = 30ea8000 80000008 80000880 0c9e06a1 fe5f0d00 00e6ff01 00a006a1 fe5b0d00
ffff89f7af1bd000 3655502357 S Ii:1:004:2 -115:8 64 <
ffff89f7af1bd000 3655525590 C Ii:1:004:2 0:8 64 = 30ee8000 80000008 80000880 0ca0069a fe620d01 00e5ff00 00a0069a fe620d01
ffff89f7af1bd000 3655525606 S Ii:1:004:2 -115:8 64 <
ffff89f7af1bd000 3655542568 C Ii:1:004:2 0:8 64 = 30f28000 80000008 80000880 0c9a0690 fe5f0d00 00e5ff02 009c0691 fe620d00
ffff89f7af1bd000 3655542595 S Ii:1:004:2 -115:8 64 <
ffff89f7af1bd000 3655558766 C Ii:1:004:2 0:8 64 = 30f68000 80000008 80000880 0ca00694 fe5f0dff ffe5ff00 00a00694 fe5f0dff
ffff89f7af1bd000 3655558785 S Ii:1:004:2 -115:8 64 <
ffff89f7af1bd000 3655573675 C Ii:1:004:2 0:8 64 = 30f98000 80000008 80000880 0ca3069c fe5f0dff ffe8ff00 00a10698 fe600dfe
ffff89f7af1bd000 3655573690 S Ii:1:004:2 -115:8 64 <
ffff89f7af1bd000 3655589710 C Ii:1:004:2 0:8 64 = 30fc8000 80000008 80000880 0ca7069c fe5e0dfe ffe5ff00 00a5069d fe5e0dff
ffff89f7af1bd000 3655589727 S Ii:1:004:2 -115:8 64 <
ffff89f7af1bd000 3655605681 C Ii:1:004:2 0:8 64 = 30ff8000 80000008 80000880 0caf069c fe5a0dfe ffe6fffe ffac069b fe5d0dfe
ffff89f7af1bd000 3655605695 S Ii:1:004:2 -115:8 64 <
ffff89f7af1bd000 3655621676 C Ii:1:004:2 0:8 64 = 30028000 80000008 80000880 0cab06a2 fe560dfd ffe7ff01 00ae069e fe570dfe
ffff89f7af1bd000 3655621689 S Ii:1:004:2 -115:8 64 <
ffff89f7af1bd000 3655640340 C Ii:1:004:2 0:8 64 = 30068000 80000008 80000880 0ca706a1 fe580dff ffe7ff03 00a706a1 fe580dff
ffff89f7af1bd000 3655640355 S Ii:1:004:2 -115:8 64 <
ffff89f7af1bd000 3655653683 C Ii:1:004:2 0:8 64 = 30098000 80000008 80000880 0ca6069a fe5a0dff ffe5ff00 00a7069d fe590dff
ffff89f7af1bd000 3655653697 S Ii:1:004:2 -115:8 64 <
ffff89f7af1bd000 3655669672 C Ii:1:004:2 0:8 64 = 300c8000 80000008 80000880 0ca5069c fe5f0d00 00e7ff00 00a5069a fe5c0dff
ffff89f7af1bd000 3655669690 S Ii:1:004:2 -115:8 64 <
ffff89f7af1bd000 3655687185 C Ii:1:004:2 0:8 64 = 300f8000 80000008 80000880 0c9e0696 fe5b0dff ffe7ff02 00a30699 fe5e0dff
ffff89f7af1bd000 3655687202 S Ii:1:004:2 -115:8 64 <
ffff89f7af1bd000 3655702424 C Ii:1:004:2 0:8 64 = 30128000 80000008 80000880 0ca3069a fe620d00 00e5ff01 009f0697 fe5f0dff
ffff89f7af1bd000 3655702437 S Ii:1:004:2 -115:8 64 <
ffff89f7af1bd000 3655725684 C Ii:1:004:2 0:8 64 = 30168000 80000008 80000880 0cac0695 fe5c0d01 00e8ff02 00ac0695 fe5c0d01
ffff89f7af1bd000 3655725698 S Ii:1:004:2 -115:8 64 <
ffff89f7af1bd000 3655735391 C Ii:1:004:2 0:8 64 = 301a8000 80000008 80000880 0c9d06a7 fe5a0dff ffe6ff02 00a206a0 fe5b0d00
ffff89f7af1bd000 3655735405 S Ii:1:004:2 -115:8 64 <
ffff89f7af1bd000 3655757629 C Ii:1:004:2 0:8 64 = 301c8000 80000008 80000880 0ca306a8 fe5b0dff ffe7ff01 009d06a7 fe5a0dff
ffff89f7af1bd000 3655757646 S Ii:1:004:2 -115:8 64 <
ffff89f7af1bd000 3655775354 C Ii:1:004:2 0:8 64 = 30218000 80000008 80000880 0cab0698 fe5b0dff ffe8ff02 00ae069a fe5b0dff
ffff89f7af1bd000 3655775373 S Ii:1:004:2 -115:8 64 <
ffff89f7af1bd000 3655789733 C Ii:1:004:2 0:8 64 = 30248000 80000008 80000880 0ca0069a fe5d0dff ffe6ff02 00a30699 fe5b0dff
ffff89f7af1bd000 3655789752 S Ii:1:004:2 -115:8 64 <
ffff89f7af1bd000 3655805723 C Ii:1:004:2 0:8 64 = 30278000 80000008 80000880 0ca50695 fe5b0dfe ffe5ff02 00a2069a fe5e0dfe
ffff89f7af1bd000 3655805746 S Ii:1:004:2 -115:8 64 <
ffff89f7af1bd000 3655822589 C Ii:1:004:2 0:8 64 = 302a8000 80000008 80000880 0ca30694 fe5a0dfe ffe7ff01 00a60692 fe590dfe
ffff89f7af1bd000 3655822603 S Ii:1:004:2 -115:8 64 <
ffff89f7af1bd000 3655845683 C Ii:1:004:2 0:8 64 = 302e8000 80000008 80000880 0ca0069b fe600dfe ffe6ffff ffa0069b fe600dfe
ffff89f7af1bd000 3655845702 S Ii:1:004:2 -115:8 64 <
ffff89f7af1bd000 3655862343 C Ii:1:004:2 0:8 64 = 30328000 80000008 80000880 0cab0696 fe560dfe ffe7ff00 00aa0697 fe590dfe
ffff89f7af1bd000 3655862361 S Ii:1:004:2 -115:8 64 <
ffff89f7af1bd000 3655879105 C Ii:1:004:2 0:8 64 = 30368000 80000008 80000880 0ca6069f fe5d0dfe ffe7ff01 00a6069f fe5d0dfe
ffff89f7af1bd000 3655879117 S Ii:1:004:2 -115:8 64 <
ffff89f7af1bd000 3655896044 C Ii:1:004:2 0:8 64 = 30398000 80000008 80000880 0caa069a fe5c0dfe ffe8ff01 00a7069e fe5d0dfe
ffff89f7af1bd000 3655896058 S Ii:1:004:2 -115:8 64 <
ffff89f7af1bd000 3655917678 C Ii:1:004:2 0:8 64 = 303c8000 80000008 80000880 0ca6069a fe5c0dff ffe7ff01 00aa0698 fe5b0dfe
ffff89f7af1bd000 3655917693 S Ii:1:004:2 -115:8 64 <
ffff89f7af1bd000 3655925612 C Ii:1:004:2 0:8 64 = 30418000 80000008 80000880 0ca1069c fe5b0dff ffe6ff00 009f069f fe5c0d00
ffff89f7af1bd000 3655925622 S Ii:1:004:2 -115:8 64 <
ffff89f7af1bd000 3655941810 C Ii:1:004:2 0:8 64 = 30428000 80000008 80000880 0ca50697 fe590dff ffe6ff00 00a1069c fe5b0dff
ffff89f7af1bd000 3655941817 S Ii:1:004:2 -115:8 64 <
ffff89f7af1bd000 3655957664 C Ii:1:004:2 0:8 64 = 30468000 80000008 80000880 0ca30699 fe5f0dff ffe7ff01 00a30699 fe5f0dff
ffff89f7af1bd000 3655957681 S Ii:1:004:2 -115:8 64 <
ffff89f7af1bd000 3655974348 C Ii:1:004:2 0:8 64 = 30498000 80000008 80000880 0ca5069d fe5b0d00 00e4ff02 00a2069d fe600dff
ffff89f7af1bd000 3655974356 S Ii:1:004:2 -115:8 64 <
ffff89f7af1bd000 3655990608 C Ii:1:004:2 0:8 64 = 304c8000 80000008 80000880 0caf069d fe560dff ffe5ff01 00ac069d fe560d00
ffff89f7af1bd000 3655990623 S Ii:1:004:2 -115:8 64 <
ffff89f7af1bd000 3656007380 C Ii:1:004:2 0:8 64 = 304f8000 80000008 80000880 0caa06a1 fe610dfe ffe8ff01 00ad069f fe5c0dff
ffff89f7af1bd000 3656007395 S Ii:1:004:2 -115:8 64 <
ffff89f7af1bd000 3656023349 C Ii:1:004:2 0:8 64 = 30528000 80000008 80000880 0ca2069f fe5b0dfe ffe7ff02 00a606a2 fe610dfe
ffff89f7af1bd000 3656023364 S Ii:1:004:2 -115:8 64 <
ffff89f7af1bd000 3656037658 C Ii:1:004:2 0:8 64 = 30568000 80000008 80000880 0ca70697 fe5f0dfd ffe7ff02 00a70697 fe5f0dfd
ffff89f7af1bd000 3656037669 S Ii:1:004:2 -115:8 64 <
ffff89f7af1bd000 3656063263 C Ii:1:004:2 0:8 64 = 30598000 80000008 80000880 0ca2069b fe610dfe ffe9ff01 00a70698 fe620dfe
ffff89f7af1bd000 3656063279 S Ii:1:004:2 -115:8 64 <
ffff89f7af1bd000 3656077614 C Ii:1:004:2 0:8 64 = 305e8000 80000008 80000880 0ca20695 fe5a0dff ffe9ff02 00a20695 fe5a0dff
ffff89f7af1bd000 3656077622 S Ii:1:004:2 -115:8 64 <
ffff89f7af1bd000 3656085640 C Ii:1:004:2 0:8 64 = 30618000 80000008 80000880 0ca00698 fe590dff ffe6ff01 00a00693 fe590dff
ffff89f7af1bd000 3656085649 S Ii:1:004:2 -115:8 64 <
ffff89f7af1bd000 3656102706 C Ii:1:004:2 0:8 64 = 30628000 80000008 80000880 0ca0069c fe590dff ffe6ff01 00a00698 fe590dff
ffff89f7af1bd000 3656102716 S Ii:1:004:2 -115:8 64 <
ffff89f7af1bd000 3656117633 C Ii:1:004:2 0:8 64 = 30668000 80000008 80000880 0ca50699 fe5a0d00 00e5ff03 00a50699 fe5a0d00
ffff89f7af1bd000 3656117645 S Ii:1:004:2 -115:8 64 <
ffff89f7af1bd000 3656133553 C Ii:1:004:2 0:8 64 = 30698000 80000008 80000880 0ca7069d fe580dfe ffe7ff02 00a9069a fe590dff
ffff89f7af1bd000 3656133566 S Ii:1:004:2 -115:8 64 <
ffff89f7af1bd000 3656141785 C Ii:1:004:2 0:8 64 = 306c8000 80000008 80000880 0ca6069f fe5f0dfe ffe6ff00 00a5069f fe5c0dfd
ffff89f7af1bd000 3656141792 S Ii:1:004:2 -115:8 64 <
ffff89f7af1bd000 3656157732 C Ii:1:004:2 0:8 64 = 306e8000 80000008 80000880 0caa069b fe620dff ffe7ff01 00aa069b fe620dff
ffff89f7af1bd000 3656157746 S Ii:1:004:2 -115:8 64 <
ffff89f7af1bd000 3656181601 C Ii:1:004:2 0:8 64 = 30718000 80000008 80000880 0ca50696 fe620d00 00e7ff02 00ab0699 fe630d00
ffff89f7af1bd000 3656181618 S Ii:1:004:2 -115:8 64 <
ffff89f7af1bd000 3656197639 C Ii:1:004:2 0:8 64 = 30768000 80000008 80000880 0ca1069b fe580dff ffe7ffff ffa1069b fe580dff
ffff89f7af1bd000 3656197651 S Ii:1:004:2 -115:8 64 <
ffff89f7af1bd000 3656213595 C Ii:1:004:2 0:8 64 = 30798000 80000008 80000880 0ca7069e fe5a0d00 00e6ff03 00a5069c fe580d00
ffff89f7af1bd000 3656213602 S Ii:1:004:2 -115:8 64 <
ffff89f7af1bd000 3656222514 C Ii:1:004:2 0:8 64 = 307c8000 80000008 80000880 0ca4069e fe5d0dfe ffe6ff04 00a7069f fe5c0dfe
ffff89f7af1bd000 3656222527 S Ii:1:004:2 -115:8 64 <
ffff89f7af1bd000 3656238447 C Ii:1:004:2 0:8 64 = 307e8000 80000008 80000880 0ca3069d fe5b0dfe ffe7ff02 00a3069d fe5b0dfe
ffff89f7af1bd000 3656238459 S Ii:1:004:2 -115:8 64 <
ffff89f7af1bd000 3656254751 C Ii:1:004:2 0:8 64 = 30818000 80000008 80000880 0ca30698 fe540dff ffe7ff00 00a3069b fe580dfe
ffff89f7af1bd000 3656254773 S Ii:1:004:2 -115:8 64 <
ffff89f7af1bd000 3656270827 C Ii:1:004:2 0:8 64 = 30848000 80000008 80000880 0ca60698 fe5b0dfe ffe8ff02 00a60697 fe570dfe
ffff89f7af1bd000 3656270837 S Ii:1:004:2 -115:8 64 <
ffff89f7af1bd000 3656285641 C Ii:1:004:2 0:8 64 = 30878000 80000008 80000880 0c9f069b fe5f0dff ffe6ff01 00a20699 fe5d0dfe
ffff89f7af1bd000 3656285655 S Ii:1:004:2 -115:8 64 <
ffff89f7af1bd000 3656309707 C Ii:1:004:2 0:8 64 = 308a8000 80000008 80000880 0ca3069b fe5d0dff ffe7ff01 00a0069c fe600dff
ffff89f7af1bd000 3656309720 S Ii:1:004:2 -115:8 64 <
ffff89f7af1bd000 3656318933 C Ii:1:004:2 0:8 64 = 308f8000 80000008 80000880 0ca4069b fe580dff ffe5ff02 00a5069b fe580d00
ffff89f7af1bd000 3656318954 S Ii:1:004:2 -115:8 64 <
ffff89f7af1bd000 3656342970 C Ii:1:004:2 0:8 64 = 30918000 80000008 80000880 0ca40699 fe590dfe ffe5ff02 00a4069b fe580dff
ffff89f7af1bd000 3656342983 S Ii:1:004:2 -115:8 64 <
ffff89f7af1bd000 3656357673 C Ii:1:004:2 0:8 64 = 30968000 80000008 80000880 0ca90698 fe5f0dfe ffe6ff01 00a90698 fe5f0dfe
ffff89f7af1bd000 3656357688 S Ii:1:004:2 -115:8 64 <
ffff89f7af1bd000 3656366860 C Ii:1:004:2 0:8 64 = 30998000 80000008 80000880 0ca60699 fe5b0dfd ffe7ff02 00a70697 fe5c0dfd
ffff89f7af1bd000 3656366868 S Ii:1:004:2 -115:8 64 <
ffff89f7af1bd000 3656381708 C Ii:1:004:2 0:8 64 = 309a8000 80000008 80000880 0ca30699 fe5b0dfe ffe8ff01 00a60699 fe5b0dfd
ffff89f7af1bd000 3656381719 S Ii:1:004:2 -115:8 64 <
ffff89f7af1bd000 3656397536 C Ii:1:004:2 0:8 64 = 309e8000 80000008 80000880 0ca20698 fe5c0dfe ffe6ff01 00a20698 fe5c0dfe
ffff89f7af1bd000 3656397550 S Ii:1:004:2 -115:8 64 <
ffff89f7af1bd000 3656415896 C Ii:1:004:2 0:8 64 = 30a18000 80000008 80000880 0ca50697 fe5c0dfe ffe7ff03 00a40696 fe5c0dfe
ffff89f7af1bd000 3656415914 S Ii:1:004:2 -115:8 64 <
ffff89f7af1bd000 3656437795 C Ii:1:004:2 0:8 64 = 30a48000 80000008 80000880 0ca00699 fe5a0dfe ffe6ff02 00a00698 fe5a0dfe
ffff89f7af1bd000 3656437807 S Ii:1:004:2 -115:8 64 <
ffff89f7af1bd000 3656447123 C Ii:1:004:2 0:8 64 = 30a98000 80000008 80000880 0cad069e fe5e0dff ffe9ff02 00b0069e fe610dff
ffff89f7af1bd000 3656447134 S Ii:1:004:2 -115:8 64 <
ffff89f7af1bd000 3656462413 C Ii:1:004:2 0:8 64 = 30aa8000 80000008 80000880 0ca906a1 fe5a0dfe ffe9ff02 00ad069e fe5e0dff
ffff89f7af1bd000 3656462427 S Ii:1:004:2 -115:8 64 <
ffff89f7af1bd000 3656478225 C Ii:1:004:2 0:8 64 = 30ae8000 80000008 80000880 0c9c06a7 fe510dfe ffe7ff02 009c06a7 fe510dfe
ffff89f7af1bd000 3656478240 S Ii:1:004:2 -115:8 64 <
ffff89f7af1bd000 3656493574 C Ii:1:004:2 0:8 64 = 30b18000 80000008 80000880 0ca106a1 fe5b0dfe ffe6ff01 009906a6 fe560dfe
ffff89f7af1bd000 3656493590 S Ii:1:004:2 -115:8 64 <
ffff89f7af1bd000 3656511406 C Ii:1:004:2 0:8 64 = 30b48000 80000008 80000880 0ca7068f fe5d0dfe ffe6ff00 00a80693 fe5c0dfe
ffff89f7af1bd000 3656511419 S Ii:1:004:2 -115:8 64 <
ffff89f7af1bd000 3656533639 C Ii:1:004:2 0:8 64 = 30b78000 80000008 80000880 0c940698 fe660dfe ffe7ff01 009e0693 fe620dfe
ffff89f7af1bd000 3656533656 S Ii:1:004:2 -115:8 64 <
ffff89f7af1bd000 3656541741 C Ii:1:004:2 0:8 64 = 30bc8000 80000008 80000880 0ca9068b fe560dfc ffe8ff01 00a4068d fe5c0dfd
ffff89f7af1bd000 3656541751 S Ii:1:004:2 -115:8 64 <
ffff89f7af1bd000 3656559696 C Ii:1:004:2 0:8 64 = 30be8000 80000008 80000880 0ca20696 fe580dfd ffe9ff01 00a20696 fe580dfd
ffff89f7af1bd000 3656559711 S Ii:1:004:2 -115:8 64 <
ffff89f7af1bd000 3656581717 C Ii:1:004:2 0:8 64 = 30c18000 80000008 80000880 0ca206a8 fe630d00 00e7ff03 009e06a5 fe600dff
ffff89f7af1bd000 3656581731 S Ii:1:004:2 -115:8 64 <
ffff89f7af1bd000 3656598859 C Ii:1:004:2 0:8 64 = 30c68000 80000008 80000880 0cad06a2 fe550d00 00e8ff01 00ad06a2 fe550d00
ffff89f7af1bd000 3656598876 S Ii:1:004:2 -115:8 64 <
ffff89f7af1bd000 3656614531 C Ii:1:004:2 0:8 64 = 30c98000 80000008 80000880 0caa06aa fe5c0dfe ffe8ff02 00aa06a8 fe590dff
ffff89f7af1bd000 3656614539 S Ii:1:004:2 -115:8 64 <
ffff89f7af1bd000 3656631636 C Ii:1:004:2 0:8 64 = 30cc8000 80000008 80000880 0ca7069b fe5b0dfe ffe7ff01 00aa06a4 fe5d0dfe
ffff89f7af1bd000 3656631648 S Ii:1:004:2 -115:8 64 <
ffff89f7af1bd000 3656645638 C Ii:1:004:2 0:8 64 = 30cf8000 80000008 80000880 0c9b0690 fe5c0dff ffe7ff01 00a00692 fe590dff
ffff89f7af1bd000 3656645648 S Ii:1:004:2 -115:8 64 <
ffff89f7af1bd000 3656662558 C Ii:1:004:2 0:8 64 = 30d28000 80000008 80000880 0c970689 fe5f0d01 00e7ff01 00960690 fe5e0d00
ffff89f7af1bd000 3656662570 S Ii:1:004:2 -115:8 64 <
ffff89f7af1bd000 3656680574 C Ii:1:004:2 0:8 64 = 30d68000 80000008 80000880 0caa068b fe5b0d00 00e6ff00 00aa068b fe5b0d00
ffff89f7af1bd000 3656680587 S Ii:1:004:2 -115:8 64 <
ffff89f7af1bd000 3656693533 C Ii:1:004:2 0:8 64 = 30d98000 80000008 80000880 0ca506a2 fe5a0dfe ffe7ff00 00a90694 fe5a0dff
ffff89f7af1bd000 3656693545 S Ii:1:004:2 -115:8 64 <
ffff89f7af1bd000 3656709595 C Ii:1:004:2 0:8 64 = 30dc8000 80000008 80000880 0cac06ae fe580dff ffe5ff01 00a806ac fe590dfe
ffff89f7af1bd000 3656709607 S Ii:1:004:2 -115:8 64 <
ffff89f7af1bd000 3656725702 C Ii:1:004:2 0:8 64 = 30df8000 80000008 80000880 0cb006ac fe560dfd ffe8ff01 00b006ac fe550dfe
ffff89f7af1bd000 3656725720 S Ii:1:004:2 -115:8 64 <
ffff89f7af1bd000 3656735415 C Ii:1:004:2 0:8 64 = 30e28000 80000008 80000880 0ca506a1 fe5f0dfe ffe7ff01 00a906a9 fe590dfd
ffff89f7af1bd000 3656735424 S Ii:1:004:2 -115:8 64 <
ffff89f7af1bd000 3656751284 C Ii:1:004:2 0:8 64 = 30e48000 80000008 80000880 0ca40698 fe5f0dff ffe8ff02 00a506a1 fe5f0dfe
ffff89f7af1bd000 3656751302 S Ii:1:004:2 -115:8 64 <
ffff89f7af1bd000 3656776597 C Ii:1:004:2 0:8 64 = 30e78000 80000008 80000880 0ca0068a fe5c0dff ffe6ff02 00a3068d fe5d0dff
ffff89f7af1bd000 3656776612 S Ii:1:004:2 -115:8 64 <
ffff89f7af1bd000 3656789741 C Ii:1:004:2 0:8 64 = 30ec8000 80000008 80000880 0c99068e fe620dfe ffe7ff02 0098068e fe640dfe
ffff89f7af1bd000 3656789752 S Ii:1:004:2 -115:8 64 <
ffff89f7af1bd000 3656797655 C Ii:1:004:2 0:8 64 = 30ef8000 80000008 80000880 0ca10692 fe5e0dff ffe6ff02 009f0690 fe5f0dff
ffff89f7af1bd000 3656797664 S Ii:1:004:2 -115:8 64 <
ffff89f7af1bd000 3656814372 C Ii:1:004:2 0:8 64 = 30f18000 80000008 80000880 0ca10699 fe5e0dff ffe5ff02 00a10692 fe5e0dff
ffff89f7af1bd000 3656814383 S Ii:1:004:2 -115:8 64 <
ffff89f7af1bd000 3656837736 C Ii:1:004:2 0:8 64 = 30f48000 80000008 80000880 0ca706a9 fe5b0dff ffe7ff01 00a106a1 fe5d0dff
ffff89f7af1bd000 3656837748 S Ii:1:004:2 -115:8 64 <
ffff89f7af1bd000 3656845533 C Ii:1:004:2 0:8 64 = 30f98000 80000008 80000880 0cb206a3 fe5a0dfd ffe7ff00 00b206a8 fe590dfe
ffff89f7af1bd000 3656845541 S Ii:1:004:2 -115:8 64 <
ffff89f7af1bd000 3656861742 C Ii:1:004:2 0:8 64 = 30fa8000 80000008 80000880 0cac06a1 fe5b0dfd ffe8ffff ffb206a3 fe5a0dfd
ffff89f7af1bd000 3656861757 S Ii:1:004:2 -115:8 64 <
ffff89f7af1bd000 3656879529 C Ii:1:004:2 0:8 64 = 30fe8000 80000008 80000880 0c9d0698 fe5c0dfe ffe7ff00 009d0698 fe5c0dfe
ffff89f7af1bd000 3656879542 S Ii:1:004:2 -115:8 64 <
ffff89f7af1bd000 3656893768 C Ii:1:004:2 0:8 64 = 30018000 80000008 80000880 0c98068e fe5d0dff ffe7ff02 00980693 fe5d0dff
ffff89f7af1bd000 3656893783 S Ii:1:004:2 -115:8 64 <
ffff89f7af1bd000 3656909731 C Ii:1:004:2 0:8 64 = 30048000 80000008 80000880 0c9b0692 fe5f0d00 00e5ff01 009a068e fe5e0dff
ffff89f7af1bd000 3656909739 S Ii:1:004:2 -115:8 64 <
ffff89f7af1bd000 3656926699 C Ii:1:004:2 0:8 64 = 30078000 80000008 80000880 0c9c0699 fe620dff ffe4ff02 009b0697 fe620dff
ffff89f7af1bd000 3656926717 S Ii:1:004:2 -115:8 64 <
ffff89f7af1bd000 3656941616 C Ii:1:004:2 0:8 64 = 300a8000 80000008 80000880 0ca8069d fe5a0dff ffe7ff01 00a3069a fe5e0dff
ffff89f7af1bd000 3656941623 S Ii:1:004:2 -115:8 64 <
ffff89f7af1bd000 3656957642 C Ii:1:004:2 0:8 64 = 300e8000 80000008 80000880 0ca006ad fe580dff ffe2ffff ffa006ad fe580dff
ffff89f7af1bd000 3656957655 S Ii:1:004:2 -115:8 64 <
ffff89f7af1bd000 3656973755 C Ii:1:004:2 0:8 64 = 30118000 80000008 80000880 0cb106ac fe5e0dff ffe3ff00 00a106b0 fe5c0dff
ffff89f7af1bd000 3656973764 S Ii:1:004:2 -115:8 64 <
ffff89f7af1bd000 3656997631 C Ii:1:004:2 0:8 64 = 30148000 80000008 80000880 0cbd06a0 fe570dfe ffe9ff00 00bc06a6 fe5c0dff
ffff89f7af1bd000 3656997643 S Ii:1:004:2 -115:8 64 <
ffff89f7af1bd000 3657005562 C Ii:1:004:2 0:8 64 = 30198000 80000008 80000880 0c99069d fe590dff ffe7ff01 00a106a0 fe580dfe
ffff89f7af1bd000 3657005572 S Ii:1:004:2 -115:8 64 <
ffff89f7af1bd000 3657022276 C Ii:1:004:2 0:8 64 = 301a8000 80000008 80000880 0c9f0696 fe5a0d00 00e7ff01 0099069d fe590dff
ffff89f7af1bd000 3657022288 S Ii:1:004:2 -115:8 64 <
ffff89f7af1bd000 3657037543 C Ii:1:004:2 0:8 64 = 301e8000 80000008 80000880 0cb0068a fe5b0dff ffe5ff02 00b0068a fe5b0dff
ffff89f7af1bd000 3657037556 S Ii:1:004:2 -115:8 64 <
ffff89f7af1bd000 3657053512 C Ii:1:004:2 0:8 64 = 30218000 80000008 80000880 0c9a0697 fe5a0d00 00e6ff02 00a3068f fe5a0dff
ffff89f7af1bd000 3657053525 S Ii:1:004:2 -115:8 64 <
ffff89f7af1bd000 3657071269 C Ii:1:004:2 0:8 64 = 30248000 80000008 80000880 0ca106a1 fe5c0d00 00e6ff02 009c06a0 fe5b0d00
ffff89f7af1bd000 3657071286 S Ii:1:004:2 -115:8 64 <
ffff89f7af1bd000 3657087537 C Ii:1:004:2 0:8 64 = 30278000 80000008 80000880 0ca40697 fe5b0dff ffe7ff03 00a2069d fe5b0d00
ffff89f7af1bd000 3657087552 S Ii:1:004:2 -115:8 64 <
ffff89f7af1bd000 3657112124 C Ii:1:004:2 0:8 64 = 302a8000 80000008 80000880 0c9d069d fe630dff ffe6ff01 00a30697 fe5e0dff
ffff89f7af1bd000 3657112139 S Ii:1:004:2 -115:8 64 <
ffff89f7af1bd000 3657128605 C Ii:1:004:2 0:8 64 = 302f8000 80000008 80000880 0ca60692 fe540dff ffe5ff02 009b069c fe5c0dff
ffff89f7af1bd000 3657128620 S Ii:1:004:2 -115:8 64 <
ffff89f7af1bd000 3657142366 C Ii:1:004:2 0:8 64 = 30328000 80000008 80000880 0ca70694 fe570dfd ffe8ff01 00ac068e fe510dfe
ffff89f7af1bd000 3657142374 S Ii:1:004:2 -115:8 64 <
ffff89f7af1bd000 3657158970 C Ii:1:004:2 0:8 64 = 30368000 80000008 80000880 0ca006a1 fe680dfe ffe7ff03 00a006a1 fe680dfe
ffff89f7af1bd000 3657158982 S Ii:1:004:2 -115:8 64 <
ffff89f7af1bd000 3657173537 C Ii:1:004:2 0:8 64 = 30398000 80000008 80000880 0ca70692 fe590dff ffe7ff02 00a50699 fe630dff
ffff89f7af1bd000 3657173551 S Ii:1:004:2 -115:8 64 <
ffff89f7af1bd000 3657191309 C Ii:1:004:2 0:8 64 = 303c8000 80000008 80000880 0c9c069c fe560dff ffe4ff01 00a10693 fe530d00
ffff89f7af1bd000 3657191327 S Ii:1:004:2 -115:8 64 <
ffff89f7af1bd000 3657207116 C Ii:1:004:2 0:8 64 = 303f8000 80000008 80000880 0ca6069c fe5e0d00 00e5ff00 009b06a1 fe5b0d00
ffff89f7af1bd000 3657207128 S Ii:1:004:2 -115:8 64 <
ffff89f7af1bd000 3657222331 C Ii:1:004:2 0:8 64 = 30428000 80000008 80000880 0ca60696 fe5c0dfe ffe7ff00 00ab0696 fe5d0dff
ffff89f7af1bd000 3657222344 S Ii:1:004:2 -115:8 64 <
ffff89f7af1bd000 3657239418 C Ii:1:004:2 0:8 64 = 30468000 80000008 80000880 0c9806a2 fe5f0dfe ffe4ff02 009806a2 fe5f0dfe
ffff89f7af1bd000 3657239427 S Ii:1:004:2 -115:8 64 <
ffff89f7af1bd000 3657254703 C Ii:1:004:2 0:8 64 = 30498000 80000008 80000880 0ca90696 fe5c0d00 00e6ff02 00a0069d fe5e0dff
ffff89f7af1bd000 3657254717 S Ii:1:004:2 -115:8 64 <
ffff89f7af1bd000 3657271621 C Ii:1:004:2 0:8 64 = 304c8000 80000008 80000880 0cb10698 fe5c0d00 00e8ff00 00b10694 fe5a0d00
ffff89f7af1bd000 3657271633 S Ii:1:004:2 -115:8 64 <
ffff89f7af1bd000 3657287475 C Ii:1:004:2 0:8 64 = 304f8000 80000008 80000880 0ca806a0 fe5b0d00 00e6ff03 00ab069e fe5e0d00
ffff89f7af1bd000 3657287490 S Ii:1:004:2 -115:8 64 <
ffff89f7af1bd000 3657301683 C Ii:1:004:2 0:8 64 = 30528000 80000008 80000880 0caf069d fe510d00 00e6ff03 00ab069e fe560d00
ffff89f7af1bd000 3657301695 S Ii:1:004:2 -115:8 64 <
ffff89f7af1bd000 3657328141 C Ii:1:004:2 0:8 64 = 30568000 80000008 80000880 0ca606a6 fe590dfe ffe7ff01 00a606a6 fe590dfe
ffff89f7af1bd000 3657328154 S Ii:1:004:2 -115:8 64 <
ffff89f7af1bd000 3657342336 C Ii:1:004:2 0:8 64 = 305a8000 80000008 80000880 0c9f069a fe620d02 00e7ff02 009c06a2 fe640d01
ffff89f7af1bd000 3657342347 S Ii:1:004:2 -115:8 64 <
ffff89f7af1bd000 3657357581 C Ii:1:004:2 0:8 64 = 305e8000 80000008 80000880 0c9b0692 fe5e0d00 00e7ff02 009b0692 fe5e0d00
ffff89f7af1bd000 3657357593 S Ii:1:004:2 -115:8 64 <
ffff89f7af1bd000 3657373581 C Ii:1:004:2 0:8 64 = 30618000 80000008 80000880 0c910694 fe5f0dff ffe7ff01 00940692 fe5e0dff
ffff89f7af1bd000 3657373593 S Ii:1:004:2 -115:8 64 <
ffff89f7af1bd000 3657389537 C Ii:1:004:2 0:8 64 = 30648000 80000008 80000880 0ca20691 fe590dff ffe7ffff ff980694 fe5c0dff
ffff89f7af1bd000 3657389552 S Ii:1:004:2 -115:8 64 <
ffff89f7af1bd000 3657406177 C Ii:1:004:2 0:8 64 = 30678000 80000008 80000880 0caa0694 fe590dff ffe6ff00 00a90690 fe580dff
ffff89f7af1bd000 3657406192 S Ii:1:004:2 -115:8 64 <
ffff89f7af1bd000 3657422456 C Ii:1:004:2 0:8 64 = 306a8000 80000008 80000880 0ca8069f fe5a0d00 00e7ff01 00a8069b fe5b0d00
ffff89f7af1bd000 3657422482 S Ii:1:004:2 -115:8 64 <
ffff89f7af1bd000 3657438724 C Ii:1:004:2 0:8 64 = 306e8000 80000008 80000880 0cb306a4 fe550dff ffe6ff00 00b306a4 fe550dff
ffff89f7af1bd000 3657438732 S Ii:1:004:2 -115:8 64 <
ffff89f7af1bd000 3657455199 C Ii:1:004:2 0:8 64 = 30718000 80000008 80000880 0cb006a4 fe5a0dff ffe4ff00 00b406a5 fe570dff
ffff89f7af1bd000 3657455212 S Ii:1:004:2 -115:8 64 <
ffff89f7af1bd000 3657471499 C Ii:1:004:2 0:8 64 = 30748000 80000008 80000880 0ca4069d fe5b0dff ffe7ff02 00aa06a1 fe5b0dff
ffff89f7af1bd000 3657471510 S Ii:1:004:2 -115:8 64 <
ffff89f7af1bd000 3657485500 C Ii:1:004:2 0:8 64 = 30778000 80000008 80000880 0c9f0695 fe5f0dff ffe6ff03 00a00698 fe5d0dff
ffff89f7af1bd000 3657485513 S Ii:1:004:2 -115:8 64 <
ffff89f7af1bd000 3657501604 C Ii:1:004:2 0:8 64 = 307a8000 80000008 80000880 0c9e0693 fe600dfe ffe7ff01 009e0693 fe610dfe
ffff89f7af1bd000 3657501615 S Ii:1:004:2 -115:8 64 <
ffff89f7af1bd000 3657518373 C Ii:1:004:2 0:8 64 = 307e8000 80000008 80000880 0c9f0696 fe570d00 00e5ff01 009f0696 fe570d00
ffff89f7af1bd000 3657518387 S Ii:1:004:2 -115:8 64 <
ffff89f7af1bd000 3657535250 C Ii:1:004:2 0:8 64 = 30818000 80000008 80000880 0ca5069b fe5a0d00 00e6ff00 00a00698 fe570d01
ffff89f7af1bd000 3657535263 S Ii:1:004:2 -115:8 64 <
ffff89f7af1bd000 3657557519 C Ii:1:004:2 0:8 64 = 30848000 80000008 80000880 0ca506a1 fe5e0dfe ffe5ff01 00a7069e fe5c0dfe
ffff89f7af1bd000 3657557533 S Ii:1:004:2 -115:8 64 <
ffff89f7af1bd000 3657565594 C Ii:1:004:2 0:8 64 = 30898000 80000008 80000880 0ca6069f fe600dff ffe7ff01 00a606a1 fe600dff
ffff89f7af1bd000 3657565615 S Ii:1:004:2 -115:8 64 <
ffff89f7af1bd000 3657581780 C Ii:1:004:2 0:8 64 = 308a8000 80000008 80000880 0ca4069c fe5e0dfe ffe7ff00 00a6069f fe600dff
ffff89f7af1bd000 3657581794 S Ii:1:004:2 -115:8 64 <
ffff89f7af1bd000 3657605574 C Ii:1:004:2 0:8 64 = 308e8000 80000008 80000880 0ca10697 fe5d0d00 00e6ff01 00a10697 fe5d0d00
ffff89f7af1bd000 3657605587 S Ii:1:004:2 -115:8 64 <
ffff89f7af1bd000 3657624037 C Ii:1:004:2 0:8 64 = 30928000 80000008 80000880 0ca30697 fe600d00 00e7ff00 009e0696 fe620d01
ffff89f7af1bd000 3657624051 S Ii:1:004:2 -115:8 64 <
ffff89f7af1bd000 3657637639 C Ii:1:004:2 0:8 64 = 30968000 80000008 80000880 0ca40699 fe590dff ffe5ff01 00a40699 fe590dff
ffff89f7af1bd000 3657637651 S Ii:1:004:2 -115:8 64 <
ffff89f7af1bd000 3657645532 C Ii:1:004:2 0:8 64 = 30998000 80000008 80000880 0ca6069c fe5c0d00 00e7ff02 00a5069b fe5b0dff
ffff89f7af1bd000 3657645544 S Ii:1:004:2 -115:8 64 <
ffff89f7af1bd000 3657662014 C Ii:1:004:2 0:8 64 = 309a8000 80000008 80000880 0ca7069d fe5c0dff ffe8ff02 00a6069c fe5c0d00
ffff89f7af1bd000 3657662026 S Ii:1:004:2 -115:8 64 <
ffff89f7af1bd000 3657685476 C Ii:1:004:2 0:8 64 = 309e8000 80000008 80000880 0cab06a0 fe5a0dff ffe7ff01 00ab06a0 fe5a0dff
ffff89f7af1bd000 3657685489 S Ii:1:004:2 -115:8 64 <
ffff89f7af1bd000 3657701677 C Ii:1:004:2 0:8 64 = 30a28000 80000008 80000880 0ca40699 fe5e0dff ffe7ff01 00a8069c fe5c0dff
ffff89f7af1bd000 3657701689 S Ii:1:004:2 -115:8 64 <
ffff89f7af1bd000 3657717520 C Ii:1:004:2 0:8 64 = 30a68000 80000008 80000880 0ca00698 fe590dff ffe8ff03 00a00698 fe590dff
ffff89f7af1bd000 3657717535 S Ii:1:004:2 -115:8 64 <
ffff89f7af1bd000 3657733470 C Ii:1:004:2 0:8 64 = 30a98000 80000008 80000880 0c9c0698 fe5a0dfe ffe5ff01 009e0698 fe590dfe
ffff89f7af1bd000 3657733482 S Ii:1:004:2 -115:8 64 <
ffff89f7af1bd000 3657749621 C Ii:1:004:2 0:8 64 = 30ac8000 80000008 80000880 0c9d069c fe5c0d00 00e6ff00 009b0698 fe5c0dff
ffff89f7af1bd000 3657749644 S Ii:1:004:2 -115:8 64 <
ffff89f7af1bd000 3657757609 C Ii:1:004:2 0:8 64 = 30af8000 80000008 80000880 0ca606a0 fe5a0d00 00e6ff02 00a3069f fe5c0d00
ffff89f7af1bd000 3657757629 S Ii:1:004:2 -115:8 64 <
ffff89f7af1bd000 3657773500 C Ii:1:004:2 0:8 64 = 30b18000 80000008 80000880 0ca6069f fe5a0dff ffe5ff03 00a606a0 fe5a0d00
ffff89f7af1bd000 3657773513 S Ii:1:004:2 -115:8 64 <
ffff89f7af1bd000 3657790982 C Ii:1:004:2 0:8 64 = 30b48000 80000008 80000880 0ca4069e fe5c0dfe ffe4ff01 00a4069e fe5a0dff
ffff89f7af1bd000 3657791004 S Ii:1:004:2 -115:8 64 <
ffff89f7af1bd000 3657813489 C Ii:1:004:2 0:8 64 = 30b78000 80000008 80000880 0ca7069c fe600dff ffe7ff01 00a6069e fe5e0dff
ffff89f7af1bd000 3657813503 S Ii:1:004:2 -115:8 64 <
ffff89f7af1bd000 3657822095 C Ii:1:004:2 0:8 64 = 30bc8000 80000008 80000880 0ca40699 fe5a0dfd ffe7ff01 00a5069b fe5b0dfe
ffff89f7af1bd000 3657822106 S Ii:1:004:2 -115:8 64 <
ffff89f7af1bd000 3657845466 C Ii:1:004:2 0:8 64 = 30be8000 80000008 80000880 0ca40696 fe5d0dfd ffe7ff00 00a40696 fe5d0dfd
ffff89f7af1bd000 3657845476 S Ii:1:004:2 -115:8 64 <
ffff89f7af1bd000 3657854481 C Ii:1:004:2 0:8 64 = 30c28000 80000008 80000880 0ca30698 fe5f0d00 00e6ff02 00a30696 fe600dff
ffff89f7af1bd000 3657854493 S Ii:1:004:2 -115:8 64 <
ffff89f7af1bd000 3657877515 C Ii:1:004:2 0:8 64 = 30c48000 80000008 80000880 0ca10699 fe5f0d00 00e7ff02 00a30698 fe5f0d00
ffff89f7af1bd000 3657877526 S Ii:1:004:2 -115:8 64 <
ffff89f7af1bd000 3657893466 C Ii:1:004:2 0:8 64 = 30c98000 80000008 80000880 0ca5069b fe5d0dff ffe7ff01 00a1069a fe5f0dff
ffff89f7af1bd000 3657893478 S Ii:1:004:2 -115:8 64 <
ffff89f7af1bd000 3657901830 C Ii:1:004:2 0:8 64 = 30cc8000 80000008 80000880 0ca8069b fe590d00 00e6ff01 00a8069b fe5a0dff
ffff89f7af1bd000 3657901840 S Ii:1:004:2 -115:8 64 <
ffff89f7af1bd000 3657925583 C Ii:1:004:2 0:8 64 = 30ce8000 80000008 80000880 0ca8069c fe5a0d00 00e6ff02 00a8069c fe5a0d00
ffff89f7af1bd000 3657925597 S Ii:1:004:2 -115:8 64 <
ffff89f7af1bd000 3657933472 C Ii:1:004:2 0:8 64 = 30d28000 80000008 80000880 0ca4069a fe5b0dfe ffe8ff00 00a5069b fe5c0dfe
ffff89f7af1bd000 3657933482 S Ii:1:004:2 -115:8 64 <
ffff89f7af1bd000 3657949608 C Ii:1:004:2 0:8 64 = 30d48000 80000008 80000880 0ca30699 fe5a0dfe ffe8ff00 00a4069a fe5b0dfe
ffff89f7af1bd000 3657949617 S Ii:1:004:2 -115:8 64 <
ffff89f7af1bd000 3657973451 C Ii:1:004:2 0:8 64 = 30d78000 80000008 80000880 0ca20697 fe5d0dff ffe7ff01 00a20697 fe5c0dff
ffff89f7af1bd000 3657973463 S Ii:1:004:2 -115:8 64 <
ffff89f7af1bd000 3657989578 C Ii:1:004:2 0:8 64 = 30dc8000 80000008 80000880 0ca3069a fe5b0dff ffe6ff02 00a20699 fe5a0dff
ffff89f7af1bd000 3657989590 S Ii:1:004:2 -115:8 64 <
ffff89f7af1bd000 3657999234 C Ii:1:004:2 0:8 64 = 30df8000 80000008 80000880 0ca3069b fe5c0dff ffe8ff00 00a3069c fe5c0dff
ffff89f7af1bd000 3657999245 S Ii:1:004:2 -115:8 64 <
ffff89f7af1bd000 3658021602 C Ii:1:004:2 0:8 64 = 30e18000 80000008 80000880 0ca3069b fe5e0d00 00e8ff01 00a3069b fe5c0dff
ffff89f7af1bd000 3658021615 S Ii:1:004:2 -115:8 64 <
ffff89f7af1bd000 3658031315 C Ii:1:004:2 0:8 64 = 30e68000 80000008 80000880 0ca8069c fe5a0dfe ffe5ff02 00a8069c fe5a0dfe
ffff89f7af1bd000 3658031326 S Ii:1:004:2 -115:8 64 <
ffff89f7af1bd000 3658053535 C Ii:1:004:2 0:8 64 = 30e78000 80000008 80000880 0ca8069b fe5b0dfe ffe6ff01 00a8069c fe5a0dfe
ffff89f7af1bd000 3658053547 S Ii:1:004:2 -115:8 64 <
ffff89f7af1bd000 3658072276 C Ii:1:004:2 0:8 64 = 30ec8000 80000008 80000880 0ca3069d fe5d0dfe ffe6ff02 00a2069d fe5e0dfe
ffff89f7af1bd000 3658072289 S Ii:1:004:2 -115:8 64 <
ffff89f7af1bd000 3658085552 C Ii:1:004:2 0:8 64 = 30ef8000 80000008 80000880 0ca60699 fe5d0dfe ffe8ff02 00a6069b fe5e0dfe
ffff89f7af1bd000 3658085595 S Ii:1:004:2 -115:8 64 <
ffff89f7af1bd000 3658101507 C Ii:1:004:2 0:8 64 = 30f28000 80000008 80000880 0c9f0696 fe5b0dff ffe5ff01 00a30696 fe5d0dfe
ffff89f7af1bd000 3658101553 S Ii:1:004:2 -115:8 64 <
ffff89f7af1bd000 3658119756 C Ii:1:004:2 0:8 64 = 30f68000 80000008 80000880 0ca10697 fe580d00 00e7ff02 00a10697 fe580d00
ffff89f7af1bd000 3658119798 S Ii:1:004:2 -115:8 64 <
ffff89f7af1bd000 3658134430 C Ii:1:004:2 0:8 64 = 30f98000 80000008 80000880 0c9f069a fe5c0d00 00e7ff01 00a10698 fe590d00
ffff89f7af1bd000 3658134468 S Ii:1:004:2 -115:8 64 <
ffff89f7af1bd000 3658149559 C Ii:1:004:2 0:8 64 = 30fc8000 80000008 80000880 0ca2069a fe5d0d00 00e6ff00 009e069b fe5e0d00
ffff89f7af1bd000 3658149599 S Ii:1:004:2 -115:8 64 <
ffff89f7af1bd000 3658165558 C Ii:1:004:2 0:8 64 = 30ff8000 80000008 80000880 0cab069a fe580dfe ffe6ff02 00a70699 fe590dff
ffff89f7af1bd000 3658165594 S Ii:1:004:2 -115:8 64 <
ffff89f7af1bd000 3658182483 C Ii:1:004:2 0:8 64 = 30028000 80000008 80000880 0ca406a0 fe5b0dff ffe5ff02 00a8069e fe5a0dfe
ffff89f7af1bd000 3658182521 S Ii:1:004:2 -115:8 64 <
ffff89f7af1bd000 3658199045 C Ii:1:004:2 0:8 64 = 30068000 80000008 80000880 0ca5069d fe5a0d01 00e8ffff ffa5069d fe5a0d01
ffff89f7af1bd000 3658199088 S Ii:1:004:2 -115:8 64 <
ffff89f7af1bd000 3658223522 C Ii:1:004:2 0:8 64 = 30098000 80000008 80000880 0ca50697 fe570dff ffe6ff00 00a60699 fe580d00
ffff89f7af1bd000 3658223569 S Ii:1:004:2 -115:8 64 <
ffff89f7af1bd000 3658231346 C Ii:1:004:2 0:8 64 = 300e8000 80000008 80000880 0c9e0696 fe5b0dff ffe8ff01 009e0696 fe5b0dff
ffff89f7af1bd000 3658231386 S Ii:1:004:2 -115:8 64 <
ffff89f7af1bd000 3658245516 C Ii:1:004:2 0:8 64 = 300f8000 80000008 80000880 0ca30696 fe5a0d00 00e7ff02 009e0696 fe5b0dff
ffff89f7af1bd000 3658245562 S Ii:1:004:2 -115:8 64 <
ffff89f7af1bd000 3658269564 C Ii:1:004:2 0:8 64 = 30128000 80000008 80000880 0ca30696 fe5b0dff ffe7ff02 00a50696 fe590dff
ffff89f7af1bd000 3658269604 S Ii:1:004:2 -115:8 64 <
ffff89f7af1bd000 3658277884 C Ii:1:004:2 0:8 64 = 30178000 80000008 80000880 0ca30699 fe5e0dff ffe6ff02 00a00698 fe5e0dfe
ffff89f7af1bd000 3658277926 S Ii:1:004:2 -115:8 64 <
ffff89f7af1bd000 3658301656 C Ii:1:004:2 0:8 64 = 30198000 80000008 80000880 0ca6069c fe5d0dff ffe7ff02 00a30699 fe5e0dff
ffff89f7af1bd000 3658301699 S Ii:1:004:2 -115:8 64 <
ffff89f7af1bd000 3658320045 C Ii:1:004:2 0:8 64 = 301e8000 80000008 80000880 0ca8069c fe5b0dfe ffe7ff01 00a8069c fe5b0dfe
ffff89f7af1bd000 3658320082 S Ii:1:004:2 -115:8 64 <
ffff89f7af1bd000 3658335180 C Ii:1:004:2 0:8 64 = 30218000 80000008 80000880 0caa069e fe5b0dfe ffe7ff00 00ab069c fe5b0dfe
ffff89f7af1bd000 3658335221 S Ii:1:004:2 -115:8 64 <
ffff89f7af1bd000 3658349726 C Ii:1:004:2 0:8 64 = 30248000 80000008 80000880 0ca506a2 fe570dfe ffe7ff01 00a606a1 fe5a0dfe
ffff89f7af1bd000 3658349765 S Ii:1:004:2 -115:8 64 <
ffff89f7af1bd000 3658359205 C Ii:1:004:2 0:8 64 = 30278000 80000008 80000880 0ca5069e fe5b0dfe ffe6ff02 00a406a0 fe560dfe
ffff89f7af1bd000 3658359243 S Ii:1:004:2 -115:8 64 <
ffff89f7af1bd000 3658373579 C Ii:1:004:2 0:8 64 = 30298000 80000008 80000880 0ca4069b fe5e0dfe ffe7ff02 00a5069e fe5b0dfe
ffff89f7af1bd000 3658373615 S Ii:1:004:2 -115:8 64 <
ffff89f7af1bd000 3658390599 C Ii:1:004:2 0:8 64 = 302c8000 80000008 80000880 0ca10697 fe5d0dff ffe6ff03 00a20698 fe5f0dff
ffff89f7af1bd000 3658390644 S Ii:1:004:2 -115:8 64 <
ffff89f7af1bd000 3658405653 C Ii:1:004:2 0:8 64 = 302f8000 80000008 80000880 0ca2069b fe5d0dfe ffe8ff01 00a10698 fe5d0dff
ffff89f7af1bd000 3658405689 S Ii:1:004:2 -115:8 64 <
ffff89f7af1bd000 3658422487 C Ii:1:004:2 0:8 64 = 30328000 80000008 80000880 0ca50698 fe5a0dfe ffe8ffff ffa3069b fe5b0dfe
ffff89f7af1bd000 3658422542 S Ii:1:004:2 -115:8 64 <
